press,title,naver_news_text,naver_news_url,body,press_html,title_html,body_html,label
한경비즈니스,“참담한 심정”상법개정안에 들고 일어난 경제계,네이버뉴스,https://n.news.naver.com/mnews/article/050/0000094316?sid=101,,한경비즈니스,“참담한 심정” 상법개정안에 들고 일어난 경제계,"남산에서 바라본 서울 시내 스케치.2024.05.31 최혁 기자
당정이 상법개정안 통과에 강한 드라이브를 걸고 있는 가운데 한국경제인협회, 한국경영자총협회, 대한상공회의소 등 경제 8단체가 상법 개정안 관련 국회의 현명한 판단을 바란다는 공동 입장문을 냈다.
30일 경제 8단체는 “경제계는 작금의 엄중한 경제 상황에도 불구하고 상법 및 노조법 개정안이 국회에서 급물살을 타는 것에 대해 깊은 우려를 넘어 참담한 심정을 금할 수 없다”며 “미증유의 복합위기에 놓여있는 우리 경제는 올해 0.8% 성장에 그칠 것으로 전망되는 등 초저성장 국면이 지속되고 있다”고 지적했다.
이어 “이런 상황에서 며칠 앞으로 다가온 대미 통상 협상 결과는 한국경제의 미래를 결정할 중요한 분수령이 될 것”이라며 “우리 기업의 평균 영업이익률이 5% 내외인 상황에서 한미 관세 협상이 난항을 겪는다면 국내에서 상품을 생산해 미국으로 수출하는 길이 사실상 막히게 된다”고 우려했다.
특히 경제계는 관세협상이 어려워질 경우 우리나라 최대 수출 시장을 잃는 것이며 이에 맞춰 경제 정책 및 기업 경영 전략을 새롭게 수립해야 하는 중대한 상황을 맞이하게 될 것이라고 경고했다.
경제 8단체는 “지난 22일 이사의 충실의무 확대 등을 담은 상법 개정안이 공포된 지 채 1주일도 지나지 않아 추가 상법 개정안이 법안소위에서 처리됐고 노조법 개정안 역시 하루 만에 법안소위와 전체 회의를 연달아 통과했다”며 “정부와 국회, 기업이 위기 극복을 위해 하나로 뭉쳐야 하는 중차대한 시점에 국회가 기업활동을 옥죄는 규제 입법을 연이어 쏟아내는 것은 기업들에게 극도의 혼란을 초래할 수 있다”고 밝혔다.
또 “상법 추가 개정은 사업재편 반대, 주요 자산 매각 등 해외 투기자본의 무리한 요구로 이어져 주력산업의 구조조정과 새로운 성장동력 확충을 어렵게 할 수 있다”며 “노조법 개정안 역시 사용자 범위가 확대되고 기업 고유의 경영활동까지도 쟁의 대상에 포함돼 파업 만능주의를 조장하고 노사관계 안정성도 훼손되는 등 심각한 부작용이 우려된다”고 비판했다.
한편 경제 8단체 중 대기업 단체인 한국경제인협회는 풍산그룹의 류진 회장이 이끌고 있으며 한국경영자총협회는 CJ그룹 손경식 회장이 수장이다. 대한상공회의소는 SK그룹 최태원 회장 이끌고 있다.",상법개정안
데일리한국,"대전상의 등 경제단체, '노란봉투법 및상법개정안' 재검토 요청",,,,,,,상법개정안
블로터,"[상법개정안로펌 맛집] 화우, TF팀·전문가팀 '투트랙' 전방위 자문 [넘...",네이버뉴스,https://n.news.naver.com/mnews/article/293/0000070451?sid=101,,블로터,"[상법개정안 로펌 맛집] 화우, TF팀·전문가팀 '투트랙' 전방위 자문 [넘버스]","로펌들의 상법개정안 태스크포스를 소개합니다.
(왼쪽 위부터 시계 방향으로) 윤영균, 이성주, 황재호, 홍경호, 김형록, 안상현, 이수열 변호사 /사진=법무법인 화우
법무법인 화우는 새 정부 출범과 동시에 새정부정책 태스크포스(TF)를 가동하고 있다. 법률 동향과 경영환경을 분석하고 기업고객들이 선제 대응할 수 있는 실질적인 전략을 제공하는 데 중점을 두고 있다. 내부 전문가그룹에 TF와 유기적으로 협업할 전담팀도 구성해 대응역량을 강화하는 투트랙 전략으로 자문의 신속성과 전문성을 높였다.
TF에는 자문과 송무, 형사, 공정거래 등 다양한 분야의 파트너변호사 20여명이 포진하고 있다. TF를 총괄하는 강영호(연수원 30기) 경영담당 변호사와 한상구(23기), 김철호(28기), 안상현(30기), 이수열(30기), 홍경호(30기), 김형록(31기), 김상만(34기), 황재호(34기), 윤영균(35기), 김치열(변호사시험 3회), 이성주(변시 5회) 변호사 등이 핵심 인력이다.
화우는 TF를 중심으로 자문, 송무, 공정거래 등 각 그룹 변호사들이 전담팀을 별도로 구성해 전방위적 자문에 나선다. 화우는 ""이번 개정상법은 기존의 대주주 중심이었던 기업 경영의 패러다임 전반에 영향을 미칠 것""이라며 ""회사법 전문가를 중심으로 다양한 분야의 전문지식과 풍부한 경험을 갖춘 변호사들의 긴밀한 협력이 필수적이라고 판단해 자원을 아끼지 않고 투입하고 있다""고 강조했다.
TF는 이사의 충실 의무를 확대하는 내용의 상법개정안이 처리됨에 따라 향후 증가할 수 있는 민·형사상 책임 리스크를 완화하는 전략을 제공하는 데 주력하고 있다. 화우는 ""개정상법의 영향으로 이사 개인에 대한 손해배상 청구와 업무상 배임죄의 고소·고발이 급증할 것으로 예상되는 만큼 이사회 의사결정 과정의 실질적인 변화와 독립성, 투명성 강화가 무엇보다 중요하다""며 ""실무에 최적화된 해법을 제시할 수 있도록 노력하고 있다""고 밝혔다.
이를 위해 TF는 기업고객 맞춤형 솔루션을 자문 원칙으로 한다. 개정상법의 취지를 반영한 기업별 경영체제 점검 및 보완, 이사회 운영 과정의 고도화, 자기주식 관련 조연에 나선다. 실제로 국내 주요 대기업을 대상으로 다수의 자문에 응했으며 현재 경영전략 변경 등의 프로젝트를 진행하고 있다.
이와 더불어 TF는 상법 추가 개정에 대비한 대규모 상장회사 지원 시스템을 구축하고 있다. 관련 설명회와 세미나도 이어갈 예정이다.
TF는 ""개정상법의 지향점은 주주권익 보호에 있다고 본다""며 ""기업 입장에서는 부담으로 느껴질 수 있지만, 궁극적으로는 주주와의 신뢰를 바탕으로 지속가능한 성장을 도모할 수 있는 제도적 전환점이 될 수 있도록 화우가 적극 지원하겠다""고 전했다.",상법개정안
국제신문,"국힘 “李 주가폭락 발언, 反기업 본색” 민주 “상법개정은 親시장”...",네이버뉴스,https://n.news.naver.com/mnews/article/658/0000115292?sid=100,,국제신문,"국힘 “李 주가폭락 발언, 反기업 본색” 민주 “상법 개정은 親시장”(종합)","법인세율·노란봉투법도 신경전
- 野, 與 강행 땐 필리버스터 예고
여당이 윤석열 정권 당시 1%포인트 인하했던 법인세 최고세율을 2022년 수준(25%)으로 복원시키고 상법개정안 노란봉투법(노조법 2.3조 개정안) 등 법안 처리에 속도를 내면서 ‘반시장·반기업’ 공방이 커지고 있다.
더불어민주당 김병기 당대표 직무대행 겸 원내대표가 30일 국회에서 열린 최고위원회의에서 발언하고 있다.  김정록 기자
국민의힘은 정부여당의 이 같은 움직임에 “기업 때려잡기 증세” “반기업 입법 독재” “민주노총 청구서 결제”라고 맹비난한다. 이재명 대통령이 산업재해를 반복적으로 발생시킨 기업에 대해 “주가가 폭락하도록”이라고 발언한 것에 대해서도 “반기업 본색”이라며 공세를 펼쳤다.
이준우 대변인은 30일 “대통령이 나서서 기업의 주가를 ‘인위적으로 폭락’시키는 방법을 언급한 것은 해당 기업에 대한 생존 위협이자 근로자와 주주의 권리를 위협하는 위험천만한 발언”이라고 비판했다.
이에 대해 더불어민주당 김병기 당대표 직무대행 겸 원내대표는 이날 최고위원회의에서 “국민의힘은 조세 정상화를 ‘반기업 정책’이라고 비난했다. 그렇게 비난할 자격이 있는지, 되레 묻고 싶다”며 “국민의힘은 국가 재정 위기, 세수 파탄의 주범이다. 윤석열 정부가 남긴 천문학적인 빚과 이자를 어떻게 책임질 건가”라고 반문했다.
이언주 최고위원은 야당을 향해 “반시장의 뜻도 모르는 것은 무식의 소치다. 공부 좀 하라”고 일침을 가했다. 그는 “상법 개정은 반시장이 아니라 친시장 입법이다. 코스피 5000 시대, 자본시장 활성화와 선진화를 위한 정지 작업”이라며 “코스피가 (상법) 개정안 소식에 3230으로 4년 만에 최고치를 기록했다. 시장은 거짓말을 하지 않는다”고 강조했다. 그러면서 국민의힘이  ‘불공정한 일부 대주주’를 ‘시장’으로 언급하는 것 아닌지도 따져 물었다. 그는 노란봉투법에 대해서도 “노조 활동에 대해 과잉 대응을 해 온 측면이 있다는 것을 기업도 어느 정도 인정하면서 사회적으로 합의가 되어 가던 상황이었는데 뜬금없이 정치 공세를 계속하고 있는 국민의힘은 시대착오적 정당이 되어 가는 것 같다”고 꼬집었다.
국민의힘은 민주당의 입법 추진을 ‘폭주’로 규정하고 필리버스터(무제한 토론)로 맞설 계획이다.",상법개정안
경향신문,“기업 형사적 책임 완화”…‘상법·노란봉투법’ 뿔난 재계에 ‘당근...,네이버뉴스,https://n.news.naver.com/mnews/article/032/0003386400?sid=100,,경향신문,“기업 형사적 책임 완화”…‘상법·노란봉투법’ 뿔난 재계에 ‘당근’,"이 대통령 ‘경제형벌 합리화 TF’ 지시 이유는
“관행적 형사처벌 조항” 이재명 대통령이 30일 용산 대통령실에서 열린 비상경제점검 TF 3차 회의에서 모두발언을 하고 있다. 대통령실사진기자단
“고소·고발로 위축 않게”…경영 ‘불확실성 제거’ 제시
배임죄, 성립 요건 까다로워 “폐지 시기상조” 우려도
이재명 대통령이 30일 정부 내 ‘경제형벌 합리화 태스크포스(TF)’ 가동과 배임죄 재검토를 지시한 것은 ‘재계 달래기’로 풀이된다. 재계가 반대하는 상법과 노조법 개정, 법인세율 인상 등을 추진하는 한편으로 재계의 숙원인 규제 완화와 배임죄 부담 경감을 제시하는 ‘강온 전략’이라는 분석이 나온다.
이 대통령은 이날 서울 용산 대통령실에서 열린 비상경제점검 TF 회의에서 “배임죄가 남용되면서 기업 활동을 위축시키고 있는 점에 대해 다시 한번 제도적 개선을 모색해야 할 때가 된 것 같다”고 말했다. 이 대통령은 “과도한 경제형벌로 기업의 경영 활동이 위축되지 않도록 정부 내 경제형벌 합리화 TF를 곧바로 가동하겠다”고 밝혔다.
김용범 대통령실 정책실장은 TF 출범 배경에 대해 “(기업 관련 법령에) 별 경중 없이 관행적으로 형사처벌 조항이 들어 있는 경우가 많다”며 “기업인이 고소·고발되면 심리적 압박감을 크게 느끼게 되고 기업의 불확실성이 이어진다”고 설명했다.
이 대통령의 이번 조치는 재계가 반대하는 각종 입법 드라이브에 대한 일종의 ‘보상’ 성격으로 풀이된다. 앞서 더불어민주당은 이사의 충실 의무 대상을 ‘회사와 주주’로 확대하는 상법 개정안을 통과시켰다. 나아가 재계가 비판해온 집중투표제와 감사위원 분리 선출 확대 등을 골자로 하는 2차 개정까지 몰아붙이는 중이다.
또한 원청의 사용자 책임을 강화하고 노조에 대한 손해배상 청구 남용을 막는 ‘노조법 2·3조 개정안’(노란봉투법)도 추진하고 있다. 윤석열 정부가 24%로 인하했던 법인세 최고세율은 다시 25%로 오를 것으로 보인다. 모두 재계가 강력 반발해온 사안이다.
특히 이날 배임죄 재검토 지시는 최근 공포된 상법 개정안과 맞물려 있다. 재계는 개정 상법으로 ‘일반 주주의 소송이 남발되면 경영권이 위협받을 수 있다’고 반발해왔다.
이에 국회에는 상법상 특별배임죄를 삭제하고, 형법상 배임죄에 ‘경영 판단 면죄 원칙’을 명시하는 법안이 계류 중이다. 상법 개정으로 일반 주주의 권익을 강화한 대신 경영진의 형사처벌 부담을 덜어주겠다는 취지다.
이 대통령이 기업의 ‘경제적 책임’을 강화하고 ‘형사적 책임’은 완화하는 기조를 언급한 것은 이뿐만이 아니다. 전날 국무회의에선 반복적인 산재 사망사고에 대한 징벌적 손해배상제도 도입 검토를 지시했다. 그러면서도 이 대통령은 중대재해처벌법에 대해선 “형사처벌은 별로 의미가 없을 것 같다”고 선을 그었다. 형사처벌보다는 경제적 제재에 초점을 두는 것이 중대재해 예방에 더 효과적일 수 있다는 취지로 풀이된다.
이 대통령이 이날 배임죄에도 “경제적·재정적 제재 외에 추가로 형사제재까지 가하는 것이 국제적 표준에 과연 맞느냐”고 반문한 것 역시 같은 맥락이다.
다만 배임죄 폐지는 시기상조라는 우려가 적지 않다. 배임죄는 고의성 등 성립 요건이 까다로워 입증하기 쉽지 않기 때문이다. 배임으로 손해를 본 당사자들이 재판 전 증거를 확보할 수 있도록 하는 ‘디스커버리 제도’ 같은 보완장치가 필요하다는 지적이 나온다.
디스커버리 제도는 소송 전 당사자 간 증거와 정보를 서로 공개해 쟁점을 명확히 하는 절차로, 개인이 대기업 등을 상대로 소송할 때 증거 불균형 문제를 해소하는 방안으로 꼽힌다.
김남근 민주당 의원은 지난 28일 국회 간담회에서 “(기업인 대상 형사처벌 대신) 민사 중심 구조가 제대로 작동하려면 원고가 기업 내부정보에 대한 증거를 확보할 수 있어야 한다”며 “기업의 영업비밀 침해 등 부작용 우려도 있으므로 ‘한국형 디스커버리 제도’를 신중히 설계하고 도입하는 방안도 검토해야 한다”고 말했다.",상법개정안
