press,title,naver_news_text,naver_news_url,body,press_html,title_html,body_html,label
오마이뉴스,주주자본주의는 악?상법개정안에 대한 '오해' [소셜 코리아],네이버뉴스,https://n.news.naver.com/mnews/article/047/0002482808?sid=101,,오마이뉴스,주주자본주의는 악? 상법개정안에 대한 '오해' [소셜 코리아],"[소셜 코리아 쟁점 토론] 상법개정, '총수 자본주의'에서 '주주권 보호'로 가는 신호탄
한국의 공론장은 다이내믹합니다. 매체도 많고, 의제도 다양하며 논의가 이뤄지는 속도도 빠릅니다. 하지만 많은 논의가 대안 모색 없이 종결됩니다. 소셜 코리아(https://socialkorea.org)는 이런 상황을 바꿔 '대안 담론'을 주류화하고자 합니다. 구체적으로는 ▲근거에 기반한 문제 지적과 분석 ▲문제를 다루는 현 정책에 대한 날카로운 비판을 거쳐 ▲실현 가능한 정의로운 대안을 제시하고자 합니다. 소셜 코리아는 재단법인 공공상생연대기금이 상생과 연대의 담론을 확산하고자 당대의 지성과 시민들이 함께 만들어가는 열린 플랫폼입니다. 기사에 대한 의견 또는 기고 제안은 social.corea@gmail.com으로 보내주시기 바랍니다. <기자말>
상법 개정안이 지난 3일 여야 합의로 통과되면서, 기업 지배구조의 선진화에 대한 기대감이 높아지고 있습니다. '역사적인 사건'이라는 평가 속에 종합주가지수도 상승세를 보이고 있습니다. 소액주주들은 두 팔 벌려 환영하는 반면, 기업 쪽에서는 부정적인 기류도 적지 않습니다. 주주의 이익을 앞세우다 보면 기업의 혁신 의지가 위축될 수 있다는 우려도 제기됩니다.
열린 공론장을 지향하는 <소셜 코리아>는 상법 개정안에 대한 다양한 시각을 게재하고 있습니다. 첫 번째로, 주주 권리 강화가 자칫 '책임 없는 권리'의 덫이 될 수 있다며, 주주자본주의를 넘어 이해관계자 중심의 책임자본주의로 나아가야 한다는 정승일 복지국가소사이어티 정책위원의 기고문을 실었습니다. 두 번째로 '주주자본주의는 악, 이해관계자 자본주의는 선'이라는 것은 기실 신화에 불과하며, 현실은 이 두 가지가 혼재해 있다는 이창민 한양대 경영대학 교수의 반론을 게재합니다. 이 교수는 상법 개정은 총수 자본주의를 바꿔야 한다는 1400만 개미 투자자의 목소리가 성과로 이어진 것이라며 긍정적으로 바라봅니다. <소셜 코리아>는 상법 개정에 대한 다른 의견도 적극 환영합니다.(편집자주)
▲
여야가 합의한 상법개정안이 지난 3일 국회 본회의에서 통과되고 있다
ⓒ 연합뉴스
2025년 7월 통과된 상법개정안에는 기업 지배구조의 투명성과 주주권리 보호 강화에 대한 이재명 정부의 의지가 담겨있다. 주요 내용은 다음과 같다. 첫째, 이사의 충실의무를 '전체 주주의 이익을 고려'하도록 명확히 했다. 둘째, 상장회사가 감사위원을 이사회와 분리 선출 시, 최대주주와 그 특수관계인의 의결권을 모두 합쳐 3%로 제한했다. 셋째, 자산 2조 원 이상 기업은 하이브리드 주주총회를 의무화해 주주들이 온라인으로도 참여할 수 있게 됐다. 넷째, '사외이사'라는 명칭을 '독립이사'로 변경하고 최소 비율을 33% 이상으로 상향 조정했다.
전체적으로 주주 친화적 제도 개선으로 평가되는 이번 개정안에 대해, 재계는 물론 일부 진보 진영에서도 비판의 목소리가 제기되고 있다. 기업 지배구조에 대해 '주주자본주의냐, 이해관계자 자본주의냐'라는 오랜 논쟁도 재현되는 모양새다. 하지만 지금은 관념적인 대립을 넘어, 실질적인 제도 개선이 필요한 시점이다. 이 글에서는 이번 개정안을 둘러싼 비판 중에서도 의미 있는 몇 가지 쟁점을 중심으로 살펴보고자 한다.
한 국가 내에서도 주주자본주의와 이해관계자 자본주의가 혼재되어 있다
쟁점을 따지기에 앞서 기업지배구조의 현실에 대해 잘못 알려진 오해부터 정리해 보자. 최근의 기업지배구조 원칙들을 보면, 주주자본주의와 이해관계자 자본주의로 명확히 구분하기가 어렵다.
예를 들어, OECD의 '기업지배구조 원칙(OECD Principles of Corporate Governance, 2023)'은 기업지배구조의 목적을 투명하고 공정한 시장 조성, 그리고 효율적인 자원 배분의 촉진으로 제시한다. 이 원칙은 주주권, 특히 소수주주에 대한 공정한 대우를 강조한다. 하지만 주주의 이해만을 앞세우지 않는다. 이해관계자의 권리를 인정하고, 기업과 이해관계자 간의 적극적인 협력을 통해 부를 창출하고, 일자리를 확대하며, 재정적으로 건전한 기업의 지속가능성을 추구해야 한다는 내용도 분명히 포함되어 있다.
그렇다면 각국의 실제 기업지배구조는 어떨까? OECD의 '기업지배구조 현황보고서(Corporate Governance Factbook, 2023)'에 따르면, 소수주주 보호 강화, 이사회 독립성 제고, ESG 정보 공시 확대와 지속가능경영 요구 증가는 지역을 불문하고 공통으로 나타난다. 이 중 소수주주 보호가 주주자본주의의 핵심 요소인 반면, ESG 공시와 지속가능경영은 이해관계자 자본주의적 요소에 해당한다. 현실적으로는 한 국가 내에서도 두 모델이 혼재된 형태가 일반적이라는 것이다.
이해관계자 자본주의에 가깝다고 알려진 유럽의 기업들도 최근 들어 자사주 매입 확대, 자기자본이익률(ROE)과 주가 중심의 경영성과 평가, 경영진 인센티브 강화 등 미국식 주주자본주의의 요소들을 상당히 수용하고 있다. 오히려 제도를 상세하게 들여다보면 주주중심제도가 우위를 점하고 있는 셈이다.
한국은 그냥 '총수자본주의'일 뿐이다
일각에서는 상법 개정 등 최근 일련의 흐름을 '주주권 강화의 일방통행'으로 우려하지만, 이는 현실을 외면한 기우에 가깝다. 한국은 총수 일가의 전횡으로 인해 '오너 리스크'라는 말이 일상화된 나라다. 기업지배구조 지표는 아시아에서도 최하위권이며, 주주환원율은 OECD 국가 중 가장 낮은 수준이다. 투자자 보호 측면에서 볼 때 선진시장에 견줘 최소 20년 이상의 격차가 벌어지고 있다. 상황이 이럴진대 이번 상법 개정만으로 한국이 '주주환원율이 90%가 넘는 미국처럼 되는 것 아니냐'는 우려는 과도한 비약에 가깝다.
▲
이재명 대통령이 지난 3일 청와대 영빈관에서 열린 '대통령의 30일, 언론이 묻고 국민에게 답하다' 기자회견에서 취재진 질문에 답하고 있다. 상법개정 등 민생, 경제에 대한 적극적 행보가 취임 초기 높은 지지율로 나타나고 있다.
ⓒ 연합뉴스
이재명 정부는 주주권 강화 일변도의 정책으로 가고 있는 것일까? 한국의 주주권 강화는 IMF 외환위기 이후 20년이 넘는 기간 동안 조금씩 진전되어왔다. 이번 상법 개정은 1400만 개미 투자자의 자본시장에 대한 요구와 압박이 실질적 성과로 이어진 것으로 봐야 한다.
이재명 정부의 기업 정책 공약을 보면 ESG 경영 강화가 명확히 담겨있다. 윤석열 정부에서는 진전을 보지 못했던 ESG 기업 경영 지원, 국민펀드를 통한 탄소 감축·재생에너지 투자 확대, 공적 연기금의 스튜어드십 코드 내실화, ESG 공시·측정·평가 인프라 구축, 지속가능경영 보고서의 공시, 그리고 'Say on Climate'(기업의 기후변화 대응 정책과 관련해 주주에게 발언권 및 의결권을 부여하는 제도)의 단계적 도입 등이 포함돼 있다. 이러한 ESG 관련 정책들이 재계의 저항을 넘을 수 있도록 논의를 시작하는 것이야말로 이해관계자 중심 자본주의를 강화하는 길이다.
참고로, 미국에서 이해관계자 자본주의의 상징으로 간주되어온 엘리자베스 워런의 '책임 자본주의 법안(Accountable Capitalism Act)'은 2018년 발의 이후 민주당이 집권한 시기에도 단 한 발짝의 진전도 이루지 못했다. 게다가 트럼프 집권 2기에는 ESG 투자 자체를 둘러싸고 반발이 거세지고 있다. 재계는 주주자본주의든 이해관계자 자본주의든 모두 반기지 않고 있는 셈이다.
투자 감소, 정말 주주자본주의 때문일까?
일각에서는 과도한 주주권 강화가 기업의 장기 성장을 가로막는다고 주장한다. 예컨대 미국 기업들이 이윤의 90%를 주주에게 환원해 장기 투자가 위축되고, 단기 수익을 중시하는 주주의 압박으로 인해, 신사업 진출 등 미래 지향적인 결정이 좌초된다는 것이다. 실제로 미국 대기업들이 수익 대비 설비투자를 줄이고 있다는 실증 분석이 나오고 있으며 그 원인을 두고 견해가 엇갈리기도 한다.
하지만 시야를 미국에 국한하지 않고 넓게 바라볼 필요가 있다. 우선 21세기 들어 생산성과 경제성장률이 둔화하고 있는 것은 선진국 전반의 공통된 현상이며 유형·무형 자산에 대한 기업의 투자 감소가 주요 원인 중 하나로 꼽히고 있다. 즉, 기업 투자 축소는 매우 중요한 문제지만, 이를 주주자본주의의 결과로 단정하기는 어렵다.
미국뿐 아니라 한국 대기업들도 같은 시기 수익 대비 설비투자가 감소했다. 한국은 미국처럼 주주환원율이 높지도 않다. 이처럼 OECD 국가 중 주주환원율이 가장 낮은 수준에 속하는 한국에서도 유사한 현상이 나타난다는 것은, 투자 위축의 원인을 단순히 주주 중심 경영으로 돌리기 어렵다는 것을 의미한다.
또한 미국의 일부 기업들이 주주환원에 집중하다 투자 소홀로 실패했다고 해서, 그것이 곧 주주자본주의의 구조적 결함이라는 식의 일반화도 위험하다. 이것이 설득력을 지니려면 이해관계자 자본주의를 표방하는 유럽 기업이 일군 성과와 비교 분석이 전제되어야 한다.
▲
미국은 주주환원율이 높음에도 불구하고 유럽에 견줘 엔비디아와 같은 혁신 기업들이 많다.
ⓒ 셔터스톡
시장에 조금이라도 관심이 있는 사람들은 구글, 애플, 엔비디아 같은 미국의 첨단 빅테크 기업들을 안다. 하지만 유럽의 10대 기업에 대해 대답할 수 있는 이는 드물다. 첨단 산업에서 유럽이 두각을 드러내지 못하는 이유를 몇 가지로 단정 짓기는 어렵지만, 이해관계자 자본주의가 투자, 혁신과 장기 성장에 유리한 '책임 있는 자본주의'라는 주장은 비판을 피해가기 어렵다. 본격적인 주주자본주의가 미국에 자리 잡은 1980년대 이후, 미국은 수많은 혁신 기업을 키워냈다. 미국 기업도 여러 약점을 가지고 있지만, 유럽 기업이 잘한다고 말하기 어려운 현실 또한 직시해야 한다.
마지막으로 짚어야 할 점은, 이번 상법 개정이 단지 배당 확대만을 위한 제도라는 오해다. 개정안의 핵심은 이사회와 주주총회의 개혁을 통해 기업의사결정의 투명성과 정당성, 그리고 효율성을 높이자는 것이다. 왜 한국 재벌들은 배당도 하지 않고, 설비투자도 꺼리면서 계열사를 쪼개고 합치는 '레고 놀이'에만 집착하는가? 그 이면에는 총수 일가의 전횡이 있으며, 이를 견제할 제도적 장치 없이는 기업의 미래지향적 의사결정도 기대하기 어렵다.
사회적 대타협? 윤석열 정부를 보라
한국 사회에서 기업지배구조 개선 논의가 나올 때마다 반복되는 주장이 있다. 바로 '사회적 대타협론'이다. 재벌의 경영권을 완전히 해체하거나, 주주의 권한을 과도하게 확대하기보다는 양자 간 균형점을 찾아야 한다는 문제의식의 발로다. 주주권 보호를 주장하는 누구도 '균형'을 반대하지 않는다. 개혁은 총수와 일반 주주 간의 절충 속에서 이뤄질 수밖에 없기 때문이다.
오늘날 지배구조 개선을 주장하는 목소리들은 재벌 해체가 아니라, 모두가 조금씩 양보하며 제도를 고쳐보자는 실용적인 접근에 가깝다. 예컨대 이번 상법 개정안의 핵심 중 하나인 '3% 의결권 제한'은 감사위원 선임 시 최소한 한 명이라도 독립적인 인물이 이사회에 들어갈 수 있도록 하자는 조처다. 모든 이사가 총수와 가깝다면, 그러한 기업일수록 배당도 인색하고, 투자에도 소극적이거나 아예 문어발 투자로 기업을 위기에 빠뜨릴 수 있다는 것을 누구나 알고 있다.
또 다른 대타협론은 이렇게 요약된다. 재벌이 고용과 투자를 책임지고, 그 대가로 총수 일가에 일정한 편의를 제공하자는 이른바 '주고받기론'이다. 그러나 이 논리는 현실에서 반복적으로 무력함을 드러내 왔다. 윤석열 정부 출범 직후, 삼성과 현대차를 비롯해 주요 대기업이 약 1100조 원 규모의 투자 계획을 발표했다. 하지만 윤석열 정부에서는 기업지배구조 개선이 단 한 걸음도 진전되지 않았고, 총수의 사익 추구는 계속됐다. 약속했던 1100조 원의 투자는 어떻게 되었을까? 기업들은 기존 인수·합병 계획 등을 끌어모아 숫자를 맞추거나, 경기 악화를 이유로 투자를 연기했다고 변명할 것이다. 결국 총수는 '주고받은' 것이 아니라, '받기만 한' 셈이다.
물론 정부와 재계는 국가 경제를 위해 함께 머리를 맞대야 한다. 현재의 경제 상황에서 새로운 산업정책 또한 절실하다. 정부는 기업에 필요한 것을 지원하고, 재계는 이에 상응하는 책임을 지는 상호 협력은 바람직하다. 하지만 그것은 어디까지나 '기업'이 필요한 것을 정부가 지원하는 방식이어야 한다. '총수'가 원하는 것을 정부가 챙겨주는 방식은 부적절할 뿐만 아니라 실효성도 없다.
▲
이창민 / 한양대 경영대학 교수
ⓒ 이창민
필자 소개 : 이 글을 쓴 이창민 한양대학교 경영대학 교수는 미국 인디애나대(Indiana University at Bloomington)에서 경제학 석사, 박사 학위를 받았습니다. 현재 경제개혁연구소 부소장을 맡고 있고 주요 연구 분야는 금융, 기업재무, 지배구조, 규제 및 정치경제입니다.
덧붙이는 글 |
이 글은 <소셜 코리아>(https://socialkorea.org)에도 게재됐습니다. <소셜 코리아> 연재 글과 다양한 소식을 매주 받아보시려면 뉴스레터를 신청해주세요. 구독신청 : https://socialkorea.stibee.com/subscribe",상법개정안
조선비즈,"초강력상법속도 내던 李, 배임죄 완화 꺼낸 이유",네이버뉴스,https://n.news.naver.com/mnews/article/366/0001096773?sid=100,,조선비즈,"초강력 상법 속도 내던 李, 배임죄 완화 꺼낸 이유","與, 집중투표제 의무화·감사위원 분리선출 추진
李 비상경제회의서 ‘외국인 투자자’ 사례 언급
상법·노봉법·법인세 원복 ‘反기업' 비판 상쇄 카드
30일 이재명 대통령이 예고한 ‘배임죄 완화’는 여권발(發) 초강력 상법 개정의 ‘보완적 성격’이 짙다. 국회가 집중투표제 의무화·감사위원 분리선출을 골자로 한 상법 개정과 노란봉투법을 추진하면서 재계의 부담이 커진 가운데, 경영상 판단은 처벌하지 않도록 명시하는 수준 이상으로 법을 바꾸겠다는 것이다. 법인세 25% 원복과 맞물려 ‘반(反)기업’이란 비판을 상쇄하려는 조치이기도 하다.
김용범 정책실장이 30일 서울 용산구 대통령실 청사에서 비상경제점검TF 관련 브리핑을 하고 있다. /뉴스1
김용범 대통령실 정책실장은 이날 제3차 비상경제점검TF 회의 결과 브리핑에서 “국회에서 2차 상법 개정안이 법사위를 통과하는 과정에 기업인 등에서 여러 의견이 나오고 있다”면서 “자연스럽게 배임죄(에 대한 우려)에 관한 이야기가 많이 나온다. 그런 논의가 모아져서 사회적으로 공론화 되고, 제도 개선으로 이뤄지면 좋겠다는 생각을 (대통령이) 하고 계신다”라고 했다.
고강도 상법 개정에 대한 기업의 우려를 ‘상쇄’할 장치가 필요하다는 의미다. 그러면서 “대통령이 최근 여러 경제인과 만나며 들은 외국인 투자자 이야기를 인용했다”라고 전했다. 실제 이 대통령은 회의에서 “우리 생각보다 배임죄에 대한 외국인 투자자의 공포가 특히 크다”면서 “외국인에게 한국 법인 맡아달라 하면 손사래 친다. 한국 노조가 어떻고 이런 이야기가 많이 알려져있지만, 상당수는 ‘한국에서 사업하다 잘못하면 감옥간다’는게 투자를 꺼리는 원인”이라고 했다.
현행 배임죄가 남용돼 기업의 경영활동을 위축시킨다는 말도 나왔다. 대기업 등 재계가 견지해 온 논리다. 배임죄 완화는 이 대통령이 민주당 대표 시절부터 언급했던 의제다. 당내에선 “진영의 정체성 기반을 흔든다”는 불만이 적잖이 나왔다. 상법 개정 취지와 맞지 않는다는 지적도 많았다. 이미 관련 대법원 판례가 있어서, 법을 바꾸지 않아도 과한 처벌을 받지 않는다는 것이다. 그러나 대선 이후 이 대통령이 ‘친기업 기조’에 속도를 내면서, 민주당 의원들도 발맞춘 형법·상법 개정안을 잇따라 발의했다.
이 대통령과 재계의 이런 소통은 당대표 재임 당시부터 있었다. 이 대통령은 지난해 11월 한국경영자총협회와 면담을 하면서 ‘배임죄 완화’ 의지를 피력해 주목을 받았다. 당초 면담은 상법 개정 정당성을 설득하고, 기업 협조를 구하기 위해 마련됐다. 당시 손경식 경총 회장이 ‘주주에 대한 충실 의무’ 조항에 따른 경영 활동 위축 우려 및 완충지대 필요성을 거론하자, 이 대통령은 “경영상 판단에 과도한 책임을 부과하는 건 개선해야 한다”는 취지로 화답했다고 한다.
“불필요한 관행적 형벌 조항 줄여라” TF 구성
대통령실은 향후 ‘경제형벌 합리화 TF’를 꾸려 법 개정 작업에 속도를 내기로 했다. 기구 명칭부터 현행 경제 범죄 형사처벌이 과하다는 대통령 의중이 담긴 셈이다. 기획재정부 1차관·법무부 차관이 공동단장을 맡는다. 현행법에 명시된 경제 분야 관련 형사처벌 조항을 축소하는 게 골자다. 이 대통령이 언급한 수치는 ‘1년 내 30% 정비’다.
다만 김 실장은 “기계적으로 30%대로 줄이라는 의미보다는, 각 부처에서 경제 관련 처벌 조항을 전반적으로 조사해서 관행적으로 들어간 조항을 일부 줄이자는 것”이라고 했다. 또 “별로 중요치 않은 사안까지 형사처벌 조항으로 고소·고발을 당하면, 검찰 등에서 처리되는 데까지 너무 오랜 기간이 걸린다”면서 “(기업인) 당사자는 심리적 압박감을 크게 받고 기업 활동의 불확실성도 계속 이어진다. 저도 금융위에서 오래 일하면서 그런 문제의식을 갖고 있었다”라고 했다.",상법개정안
아시아경제,"""재계, 가업 뺏긴다며상법개정 극도로 거부""",네이버뉴스,https://n.news.naver.com/mnews/article/277/0005630413?sid=101,,아시아경제,"""재계, 가업 뺏긴다며 상법 개정 극도로 거부""","한국기업거버넌스포럼 상법 보완입법 간담회
한국기업거버넌스포럼이 30일 서울 영등포구에서 개최한 '해외 및 국내 장기투자자들이 보는 상법 보완입법 간담회'에서 참가자들이 발언을 하고 있다.
""상법 개정안으로 한국 자본 시장에 드디어 변화의 바람이 부는데 기업들은 전혀 아무것도 기여한 바 없습니다. 특히 재벌들은 상상 이상으로 극도로 거부하고 있습니다.""
한국기업거버넌스포럼이 30일 서울 영등포구에서 개최한 '해외 및 국내 장기투자자들이 보는 상법 보완입법 간담회'에서 참석자들은 한결같은 마음으로 재계와 기업들을 비판했다.
이날 간담회에는 오기형 더불어민주당 코스피5000 특별위원회 위원장과 이용우 전 의원, 이남우 한국기업거버넌스포럼 회장, 최준철 VIP자산운용 대표, 김수현 DS투자증권 리서치센터장 등이 참석해 사전 질문 없이 자유롭게 의견을 개진했다.
""상법 개정안 통과, 야구로 치면 1회 말""
참가자들의 비판의 골자는 모두 같은 맥락이었다. 상법 개정안 통과로 자본 시장이 변화의 첫걸음을 디뎠지만, 여전히 갈 길이 멀다는 입장이다. 야구로 치면 이제 막 1회 말, 2회 정도인 수준이라고 강조했다.
이남우 한국거버넌스포럼 회장은 ""이번 정부가 다른 모습을 보인다는 기대감도 있지만, 외국 투자자는 잘 모른다""며 ""그동안 20~30년 동안 매번 속으며 '투 머치 코리아, 유 루즈 유어 커리어(한국 주식을 너무 많이 담으면, 직장을 잃는다)'는 오명까지 있을 정도""라고 꼬집었다.
물론 긍정적인 면모도 있다고 평가했다. 기존 사외이사 명칭을 독립이사로 바꾸고, 형사적 배임죄를 민사의 영역으로 가져온 것을 긍정적으로 평가했다. 다만 2차 개정에서 빠진 자사주 소각은 반드시 필요하다고 주장했다.
박유경 네덜란드연금자산운용(APG) 신흥국주식부문 대표는 시장 참여자들이 강한 목소리를 내야 한다고 강조했다. 특히 자산운용사들을 정면으로 비판했다. 박 대표는 ""상법 개정안이 논의되기 시작할 때 국내 자산운용사들도 적극 목소리를 내달라고 요구하며 만나려 들었지만 거의 모든 운용사가 외면하고, 금융투자협회도 침묵했다""며 ""자산운용사들은 경영진이 아니라 주주인데도 연금 같은 사업을 뺏기기 싫어서 기업들 눈치를 본다""고 일침을 가했다.
김수현 DS증권 리서치센터장도 ""상법 개정 후 시나리오라는 주제로 자료를 내고 기업 등에 세미나를 하러 다니는데, 어떻게든 상법 개정안 속 집중투표제를 우회하거나, 리스크를 지면서 처벌을 받더라도 재벌 오너에게 잘 보이겠다는 시각이 많다""며 ""주주환원을 열심히 하겠다는 그룹 총수들도 주가 상승에 관심이 없고 지주사 주식은 그저 경영권 승계 도구로만 바라본다""고 거들었다.
재벌 횡포 막으려면 집중투표제, 자사주 소각 의무화 등 필요
이들은 결국 시장에 무서운 감시자가 많아야 하고, 목소리를 내는 주체가 늘어나야 한다고 설파했다. 소액 주주도 의결권을 모아서 행사해 이사를 선임할 수 있는 집중투표제 같은 수단이 필요하다는 입장이다. 최준철 VIP자산운용 공동대표는 ""기업들이 집중투표제 반발하는 이유가 선진국이 안 하기 때문이라는데, 미국은 그런 제도가 필요 없는 상황""이라며 ""일단 회사 지분이 분산돼 있고, 혹여 일론 머스크 테슬라 최고경영자(CEO)처럼 대주주 지분이 높더라도 모든 이사가 명확히 회사와 주주를 위해 일하기 때문""이라고 설명했다.
또한 재계의 자사주 소각에 대한 극렬한 거부 반응도 소개했다. 최 대표는 ""회삿돈으로 산 자사주를 자신의 재산으로, 경영권 방어를 위해 쓴다는 개념 자체가 글로벌 스탠더드에 한참 떨어졌다""며 ""자사주는 당연히 소각해야 하고, 그러면 재벌의 지분율도 올라갈 수 있다는 점을 이제는 받아들여야 한다""고 말했다.
오 의원은 정부와 여당이 의지를 잃지 않고 자본시장 정상화를 위한 법안을 도입하겠다고 다짐했다. 그는 ""생각보다 느리다는 질타도 있고, 왜 이걸 안 하냐는 질타도 있지만 전체적인 대내외 설득의 과정을 거쳐야 한다""며 ""상상 이상으로 다양한 형태로 곳곳에서 압력이 들어온다""며 ""사회적 공감대가 이뤄진다면 단독으로도 처리할 수 있다""고 밝혔다.",상법개정안
