press,title,naver_news_text,naver_news_url,body,press_html,title_html,body_html,label
한겨레,미 연준의금리 인하와 시장금리 반등,네이버뉴스,https://n.news.naver.com/mnews/article/028/0002770777?sid=101,,한겨레,미 연준의 금리 인하와 시장금리 반등,"공동락의 경제스토리
지난 13일(현지시각) 뉴욕상업거래소(NYMEX)에서 한 직원이 모니터를 보고 있다. AFP 연합뉴스
중앙은행은 기준금리의 변경을 통해 시장금리에 영향을 미친다. 기준금리를 인상해 시장금리 상승을 이끌고 반대로 인하를 통해 금리 하락을 유도한다. 물론 그 기저에는 기준금리 변경을 통해 경제 주체들의 행동 변화를 이끌고, 궁극적으로 경기나 물가 등 매크로 여건에 변화를 준다는 목적이 담겨 있다. 따라서 기준금리 인상이나 인하를 통해 시장금리가 제대로 상승하거나 하락하느냐 여부는 통화정책의 파급 경로가 제대로 작동하고 있느냐와 직결되는 문제다.
미 연방준비제도(Fed)가 9월 연방공개시장위원회(FOMC)를 통해 기준금리 인하를 재개했다. 지난해 9월부터 시작해 3차례 연속 금리를 인하한 이후 올 들어 꾸준히 기준금리를 동결하다가 모처럼 다시 인하에 돌입했다. 또 금리 결정과 함께 발표된 점도표에서 올해 남은 기간에도 추가 인하가 가능하다는 전망을 시사했다. 명백한 인하 사이클의 재개다.
이쯤 되면 시장금리는 단지 이번 기준금리 인하뿐만 아니라 향후 추가 인하에 대한 기대를 반영하며 낮아지기 마련이다. 그런데 이번 미국 기준금리 인하는 일반적인 ‘기준금리 인하→시장금리 하락’ 경로와는 사뭇 다른 방향으로 전개되고 있다. 에프오엠시에서의 기준금리 결정과 달리 반대로 시장금리가 상승하고 있다. 특히 이러한 동향은 지난해 인하 개시 이후 오히려 시장금리가 수개월간 반대로 상승했던 국면과 중첩되며 묘한 불안감을 자극하고 있다. 당시 연준은 금리를 인하하면서도 인플레이션에 대한 경계를 늦추지 않았고, 국채 시장에서는 수급 불안이 상존하고 있었다.
물론 향후 누적적으로 몇 차례 더 인하 조치들이 쌓이면 시장금리는 하락세로 방향을 잡을 수도 있겠으나, 기준금리 인하 재개가 막 이뤄진 직후에 나타나고 있는 시장금리의 반등은 그 자체로 부담스럽다.
제롬 파월 연준 의장은 이번에 기준금리를 인하한 직접적인 이유로 고용과 물가 간의 ‘균형 변화’를 꼽았다. 그리고 이를 자세히 설명하는 과정에서 고용시장의 하방 위험이 증가함에 따라 금리를 인하했지만 실업률은 “비교적 낮은 수준”인 반면 인플레이션은 “다소 높은 수준”이라고 강조했다.
흔히 금리를 인하하는 근거로 중앙은행들이 제시하는 ‘고용은 나쁘고, 물가는 안정적’이란 접근과는 온도 차이를 둔 발언이다. 그 결과 금융시장에서는 이번 인하의 성격을 ‘뜨뜻미지근한 인하’로 규정했고, 실제 시장금리는 기준금리의 움직임과는 다르게 반등하는 현상이 발생했다.
정책 당국의 행보는 단순히 행위 자체뿐만 아니라 당국자의 발언이나 배경 설명 등을 통해서도 동시에 시장에 영향을 미친다. 즉 지금과 같이 인하라는 행위에도 연준은 향후 기준금리를 매우 조심스럽게, 점진적으로 내릴 것이라는 의사를 고용과 물가 간의 균형 변화로 표현했고, 이에 시장금리는 하락이 아닌 상승으로 반응했다.
고용시장의 변화는 분명히 9개월 만에 인하 재개라는 연준의 행동 변화를 이끌었다. 그러나 여전히 연준의 마음 속에는 인플레이션에 대한 우려가 상당한 비중을 차지고 있는 모습이다.
공동락 대신증권 이코노미스트&채권 애널리스트",금리인하
한겨레,"한은 ""글로벌 IB 10곳 중 9곳, 美 연내 2회인하""",네이버뉴스,https://n.news.naver.com/mnews/article/028/0002770777?sid=101,,한겨레,미 연준의 금리 인하와 시장금리 반등,"공동락의 경제스토리
지난 13일(현지시각) 뉴욕상업거래소(NYMEX)에서 한 직원이 모니터를 보고 있다. AFP 연합뉴스
중앙은행은 기준금리의 변경을 통해 시장금리에 영향을 미친다. 기준금리를 인상해 시장금리 상승을 이끌고 반대로 인하를 통해 금리 하락을 유도한다. 물론 그 기저에는 기준금리 변경을 통해 경제 주체들의 행동 변화를 이끌고, 궁극적으로 경기나 물가 등 매크로 여건에 변화를 준다는 목적이 담겨 있다. 따라서 기준금리 인상이나 인하를 통해 시장금리가 제대로 상승하거나 하락하느냐 여부는 통화정책의 파급 경로가 제대로 작동하고 있느냐와 직결되는 문제다.
미 연방준비제도(Fed)가 9월 연방공개시장위원회(FOMC)를 통해 기준금리 인하를 재개했다. 지난해 9월부터 시작해 3차례 연속 금리를 인하한 이후 올 들어 꾸준히 기준금리를 동결하다가 모처럼 다시 인하에 돌입했다. 또 금리 결정과 함께 발표된 점도표에서 올해 남은 기간에도 추가 인하가 가능하다는 전망을 시사했다. 명백한 인하 사이클의 재개다.
이쯤 되면 시장금리는 단지 이번 기준금리 인하뿐만 아니라 향후 추가 인하에 대한 기대를 반영하며 낮아지기 마련이다. 그런데 이번 미국 기준금리 인하는 일반적인 ‘기준금리 인하→시장금리 하락’ 경로와는 사뭇 다른 방향으로 전개되고 있다. 에프오엠시에서의 기준금리 결정과 달리 반대로 시장금리가 상승하고 있다. 특히 이러한 동향은 지난해 인하 개시 이후 오히려 시장금리가 수개월간 반대로 상승했던 국면과 중첩되며 묘한 불안감을 자극하고 있다. 당시 연준은 금리를 인하하면서도 인플레이션에 대한 경계를 늦추지 않았고, 국채 시장에서는 수급 불안이 상존하고 있었다.
물론 향후 누적적으로 몇 차례 더 인하 조치들이 쌓이면 시장금리는 하락세로 방향을 잡을 수도 있겠으나, 기준금리 인하 재개가 막 이뤄진 직후에 나타나고 있는 시장금리의 반등은 그 자체로 부담스럽다.
제롬 파월 연준 의장은 이번에 기준금리를 인하한 직접적인 이유로 고용과 물가 간의 ‘균형 변화’를 꼽았다. 그리고 이를 자세히 설명하는 과정에서 고용시장의 하방 위험이 증가함에 따라 금리를 인하했지만 실업률은 “비교적 낮은 수준”인 반면 인플레이션은 “다소 높은 수준”이라고 강조했다.
흔히 금리를 인하하는 근거로 중앙은행들이 제시하는 ‘고용은 나쁘고, 물가는 안정적’이란 접근과는 온도 차이를 둔 발언이다. 그 결과 금융시장에서는 이번 인하의 성격을 ‘뜨뜻미지근한 인하’로 규정했고, 실제 시장금리는 기준금리의 움직임과는 다르게 반등하는 현상이 발생했다.
정책 당국의 행보는 단순히 행위 자체뿐만 아니라 당국자의 발언이나 배경 설명 등을 통해서도 동시에 시장에 영향을 미친다. 즉 지금과 같이 인하라는 행위에도 연준은 향후 기준금리를 매우 조심스럽게, 점진적으로 내릴 것이라는 의사를 고용과 물가 간의 균형 변화로 표현했고, 이에 시장금리는 하락이 아닌 상승으로 반응했다.
고용시장의 변화는 분명히 9개월 만에 인하 재개라는 연준의 행동 변화를 이끌었다. 그러나 여전히 연준의 마음 속에는 인플레이션에 대한 우려가 상당한 비중을 차지고 있는 모습이다.
공동락 대신증권 이코노미스트&채권 애널리스트",금리인하
헤럴드경제,“은행 이익 최대 10% 줄어들 것” 대출금리 인하법 국회통과 임박,네이버뉴스,https://n.news.naver.com/mnews/article/016/0002541442?sid=101,,헤럴드경제,“은행 이익 최대 10% 줄어들 것” 대출금리 인하법 국회통과 임박,"법사위 가는 대출 가산금리 손질법
교육세 반영 금지 수정의견 나와
은행권 “처벌이라도 삭제” 건의
은행이 대출금리를 산정할 때 법정 출연금 등을 반영하지 못하도록 하는 은행법 개정안이 14일 국회 법제사법위원회에 자동 회부됐다. 여당이 법사위 의결을 사실상 주도하고 있는 데다 본회의 정족수도 충분히 확보하고 있어 연내에는 국회 문턱을 넘을 것으로 보인다. 은행권은 경영상 부담을 토로하고 있으나 입법을 막기는 어렵다고 보고 모범규준 개정 등 대응을 준비 중이다.
정치권에 따르면 더불어민주당이 지난 4월 신속처리안건(패스트트랙)으로 지정한 은행법 개정안이 지난 13일을 기점으로 상임위원회 최장 심사기간인 180일이 도래하면서 법사위로 넘어갔다.
민병덕 민주당 의원이 발의한 이 개정안은 대출금리에 지급준비금과 예금보험료, 서민금융진흥원 출연금 등을 반영하지 못하도록 하는 것을 골자로 한다. 기술보증기금·신용보증기금 등 출연금은 50% 이내 범위에서 대통령령 비율 이상 반영하지 못하도록 했다.
은행 대출금리는 코픽스(COFIX·자금조달지수)나 금융채 등 지표금리(기준금리)에 가산금리를 더한 뒤 우대금리(가감조정금리)를 빼는 방식으로 정해진다. 가산금리에는 업무원가, 법적비용, 위험프리미엄, 기대수익률 등이 포함되는데 여기서 법적비용인 출연금 등을 제외함으로써 은행이 비용 부담을 대출 차주에게 과도하게 전가하는 것을 막겠다는 것이다.
은행으로서는 법적비용을 가산금리에 반영할 수 없게 되면 그만큼 수익이 줄어든다. 시장에선 세전이익이 많게는 10% 감소할 것으로 추산한다.
국민의힘이 시장 논리에 어긋난다는 이유로 은행법 개정을 반대하고 있으나 민주당이 이재명 대통령의 공약이기도 한 은행법 개정에 단호한 입장을 견지하고 있어 시장에서는 본회의 통과를 이미 기정사실로 하는 분위기다.
민주당도 반도체산업특별법 등 다른 패스트트랙 법안과 함께 오는 15일 본회의 즉각 상정을 준비해 왔다. 전날 여야가 상호 합의한 법안을 중심으로 26일 본회의를 열기로 뜻을 모으면서 일단 은행법 통과가 미뤄졌으나 이른 시일 내 본회의 의결을 마치겠다는 계획이다.
이런 가운데 민주당 내에서는 증액 예정인 교육세에 대한 소비자 전가 우려를 반영해 교육세 반영 금지 부분을 포함해 개정안을 수정해야 한다는 목소리가 나오고 있어 본회의에 앞서 교육세 관련 내용이 추가될 여지도 있다.
정부는 현재 0.5%인 금융·보험업 수익금에 대한 교육세를 1조원 초과 구간에 한해 1.0%로 올리는 방안을 추진 중이다. 은행으로서는 교육세가 늘어나는 상황에서 가산금리 반영도 막히면 부담이 더욱 커질 것으로 보인다.
다만 이에 대해선 민주당 내에서도 이견이 있는 것으로 전해진다. 교육세 반영 금지 조항은 은행권 저항 등을 고려해 순차적으로 확대해야 한다는 의견을 반영해 최종안 도출 과정에서 조정된 바 있다.
은행권은 이번 가산금리 손질이 은행의 자율성을 제약하고 수익성을 떨어뜨린다고 우려하면서 특히 벌칙 조항만이라도 삭제해 달라는 의견을 국회 측에 지속해 전달하고 있다. 개정안에는 법적비용을 대출금리에 반영한 은행 임직원은 1년 이하 징역 또는 3000만원 이하 벌금형 제재를 받도록 하는 형사처벌 규정이 담겨 있다.
은행연합회에서는 향후 은행법 개정에 맞춰 은행권 자율규제인 대출금리체계 관련 모범규준을 개정할 수 있도록 준비하고 있다. 은행권 한 관계자는 “은행의 자율성을 통제하는 과도한 규제로 정부의 최근 포용금융 관련 대규모 출연 압박과 함께 건전성 부담으로 이어질 여지가 있다”면서 “본회의 전까지 지속해 입장을 전달할 계획”이라고 전했다. 김은희 기자",금리인하
뉴데일리,"한은금리인하고심 … 집값, 고환율에 10월 동결 '무게'",,,,,,,금리인하
연합인포맥스,"RBA 의사록 ""즉각적 기준금리 인하필요성 없어""(상보)",,,,,,,금리인하
연합인포맥스,"RBA 의사록 ""즉각적 기준금리 인하필요성 없어""",,,,,,,금리인하
뉴스핌,한은 '이례적' 환율 구두개입…내주금리인하힘들 듯,,,,,,,금리인하
이투데이,[뉴욕금값] 연준금리 인하기대감에 상승…사상 첫 4100달러 돌파,,,,,,,금리인하
