press,title,naver_news_text,naver_news_url,body,press_html,title_html,body_html,label
이데일리,"美 대법원, 트럼프관세소송 패스트트랙 결정…11월 첫 변론",네이버뉴스,https://n.news.naver.com/mnews/article/018/0006111570?sid=101,,이데일리,"'트럼프 관세’ 운명, 연내 판가름…美대법원 11월 신속 심리","상호관세 철회 여부 연내 결정 가능성
IEEPA 권한 둘러싼 해석이 쟁점
베선트, 대법원 청원서 ""관세 철회는 재앙적 결과""
[이데일리 임유경 기자] 도널드 트럼프 미국 대통령이 전 세계 부과한 상호관세의 위법성 여부가 이르면 연내 미 연방대법원에서 최종 결론 날 전망이다.
미 대법원은 9일(현지시간) 트럼프 행정부의 신속 심리 요청을 받아들여, 사건을 오는 11월 첫째 주 변론 일정에 배정할 예정이라고 밝혔다. 이 같은 일정이면 연말 전에 판결이 내려질 수 있다.
도널드 트럼프 미국 대통령(사진=AFP)
연방 항소법원은 지난달 29일 트럼프 행정부가 국제비상경제권한법(IEEPA)을 근거로 교역국에 부과한 상호관세 대부분이 불법이라고 판결했다. IEEPA는 대통령이 비상사태에 외국의 위협에 대응해 경제 제재를 취할 수 있도록 권한을 부여한 법이다. 항소법원은 미국 헌법은 대통령이 아닌 의회에 세금과 관세에 관한 권한을 부여하고 있으며, IEEPA에 따라 대통령이 일방적인 관세 권한을 갖지 않는다고 봤다.
이에 트럼프 행정부는 상고했으며, 이 소송이 다른 나라와의 무역 협상에 부정적인 영향을 주고 있어 신속한 판결을 내려달라고 대법원에 요청했다.
이번 소송에 영향을 받는 관세 조치는 트럼프 대통령이 지난 4월 거의 모든 수입품에 대해 부과한 10%의 기본관세와 국가별 차등관세 부과 조치 등이다. 또 지난 2월 중국, 캐나다, 멕시코에 펜타닐 유입 문제 등을 이유로 부과한 보복관세도 해당한다. 다만 대법원 심리가 진행되는 동안 2심 판결은 효력이 정지되기 때문에 관세는 유지된다.
트럼프 행정부는 사법부 최종 판결에 따라 관세가 철회될 경우 국가적으로 심각한 결과를 초래할 수 있다며 대법원을 압박하고 있다.
스콧 베선트 미 재무장관은 대법원에 제출한 청원서에서 “내년 여름까지 7500억~1조 달러 규모의 관세를 징수할 것으로 예상된다”며 “관세를 철회하라는 판결이 나오면 그 결과는 재앙적일 수 있다”고 주장했다. 또 “또한 이미 체결된 무역 협정을 되돌리고 관련 투자와 구매를 환불해야 하는 상황이 발생하면 미국 경제가 큰 타격을 입을 것”이라고 덧붙였다.",관세부과
파이낸셜뉴스,트럼프 '상호관세' 운명 쥔 소송전…연내 최종 판결 나올 듯,네이버뉴스,https://n.news.naver.com/mnews/article/014/0005404442?sid=101,,파이낸셜뉴스,"美 대법원, 트럼프 관세소송 패스트트랙 결정…11월 첫 변론","美 정부의 신속 처리 요청 수용
위헌 판결시 관세 정책 타격 예상되지만 IEEPA 外 부과 수단 다양
미국 연방대법원.연합뉴스
[파이낸셜뉴스] 미 일간 월스트리트저널(WSJ)은 도널드 트럼프 미국 대통령이 세계 각국에 부과한 상호관세의 위법성에 대한 미국 사법부의 최종 판결이 이르면 연내에 나올 것이라고 관측했다. 9일(현지시간) 연방대법원이 상호관세 소송을 심리하기로 했으며, 트럼프 정부가 요청한 대로 이 사건을 신속 처리하겠다고 밝혔기 때문이다. 이에 따라, 트럼프 정부와 이 소송을 제기한 원고는 오는 19일까지 서면 진술서를 제출해야 하고, 첫 구두 변론은 오는 11월 첫 주에 열릴 예정이다.
이 소송은 트럼프 대통령이 국제비상경제권한법(IEEPA)을 근거로 광범위한 관세를 부과할 수 있느냐가 쟁점이다. 1977년 제정된 IEEPA는 주로 적국에 대한 제재나 자산 동결에 활용됐으며, IEEPA를 활용해 관세를 부과한 것은 트럼프 대통령이 처음이기 때문이다.
앞서 2심 법원은 지난달 29일 ""IEEPA가 대통령에게 수입을 규제할 권한을 부여하지만, 그 권한에 행정명령으로 관세를 부과할 권한까지 포함하지는 않는다""고 판결했다.
이에 트럼프 정부는 상고했으며, 이 소송이 다른 나라와의 무역 협상에 부정적인 영향을 주고 있어 신속한 결정이 필요하다는 이유로 오는 11월 첫 주에 구두변론을 진행해달라고 대법원에 요청했다.
대법원 심리가 진행되는 동안 2심 판결은 효력이 정지되기 때문에 관세는 유지된다.
상호관세 부과에 서명하는 도널드 트럼프 미국 대통령.연합뉴스
한편 이번 소송은 트럼프 대통령이 IEEPA를 근거로 부과한 관세에만 영향을 미친다. 한국 등 세계 각국에 차등 세율로 부과한 상호관세, 미국으로의 마약 밀반입 방치를 이유로 중국·캐나다·멕시코에 부과한 관세 등이 여기에 해당한다.
대법원이 이들 관세를 위헌으로 판결할 경우, 트럼프 대통령의 공격적인 관세 정책이 일정 부분 후퇴할 수밖에 없을 것으로 예상된다.
특히 한국이 상호관세를 낮추기 위해 미국과 큰 틀에서 타결한 무역 합의에 미칠 영향이 주목된다. 앞서 한국은 지난 7월 30일 3500억달러(약 486조원) 규모의 대미 투자와 1000억달러 상당의 미국산 에너지 구매 등을 조건으로 미국이 한국에 부과한 상호관세율을 기존 25%에서 15%로 낮추는 데 합의한 바 있다.
다만 IEEPA가 아니더라도 트럼프 대통령이 관세를 부과할 수단은 다양하다.
무역확장법 232조를 근거로 자동차와 철강 등에 부과한 품목관세는 이번 소송과 무관하며, 무역법 301조와 122조, 관세법 338조도 트럼프 대통령이 동원할 수 있는 관세 부과 수단으로 거론된다.",관세부과
뉴시스,"트럼프, EU에 '中·印에 최대 100%관세 부과' 요청…러 압박 강화 시도",네이버뉴스,https://n.news.naver.com/mnews/article/003/0013472014?sid=104,,뉴시스,"트럼프, EU에 '中·印에 최대 100% 관세 부과' 요청…러 압박 강화 시도","러-우 전쟁 종식 위한 美-EU 공동 대응 협력 논의
美 ""中·印, 러시아산 석유 구매 중단할 때까지 강력 관세 유지해야""
[뉴욕=AP/뉴시스] 9일(현지 시간) 파이낸셜타임스(FT)에 따르면 트럼프 대통령은 워싱턴에서 열린 미국과 EU 고위 관리들 간 회의에 전화를 걸어 중국과 인도에 대해 최대 100% 관세를 부과하자고 제안했다. 사진은 도널드 트럼프 미국 대통령이 7일(현지 시간) 뉴욕에서 열린 US오픈 테니스대회에 참석한 모습. 2025.09.10.
[서울=뉴시스]박미선 기자 = 도널드 트럼프 미국 대통령이 인도와 중국에 대해 최대 100%의 관세를 부과할 것을 EU(유럽연합)에 요청했다. 이는 러시아-우크라이나 전쟁 종식을 위한 미국과 EU의 공동 대응 방안을 강화하려는 움직임이다.
9일(현지 시간) 파이낸셜타임스(FT)에 따르면 트럼프 대통령은 워싱턴에서 열린 미국과 EU 고위 관리들 간 회의에 전화를 걸어 이 같은 제안을 했다. 이번 회의는 러시아에 대한 경제적 압박을 강화하는 방안을 논의하기 위해 마련됐으며, EU 제재 책임자 데이비드 오설리반을 비롯한 EU 고위 관계자들과 미국 재무부 고위 관계자들이 참석했다.
한 미국 고위 관계자는 ""미국은 EU가 중국과 인도에 부과하는 관세를 '거울 조치'로 따라할 준비가 돼 있다""며 두 나라에 대한 세금을 추가로 올릴 가능성까지 시사했다.
또 다른 미국 고위 관계자는 ""트럼프 대통령은 '우리 모두 극적인 관세를 부과하고, 중국이 러시아산 석유 구매를 중단할 때까지 이를 유지하자'고 말했다""고 전했다.
이번 제안은 지난주 중국 전승절 80주년 기념식과 맞물려 시진핑 중국 국가주석, 나렌드라 모디 인도 총리, 블라디미르 푸틴 러시아 대통령이 정상회담을 가진 뒤 나온 것이다. 당시 트럼프 대통령은 자신의 소셜미디어 트루스소셜에 3개국 정상이 함께 걸어가는 사진을 올리며 ""우리는 인도와 러시아를 가장 깊고 어두운 중국에 빼앗긴 것 같다""고 평가했다.
미국은 지난달 말 인도가 러시아산 석유를 구매하는 것에 대응해 50%의 관세를 부과하며 양국 간 긴장이 고조됐다. 다만 트럼프 대통령은 인도와의 무역 협상을 계속 진행 중이고, ""성공적인 결론""을 기대한다고 밝혔다.
미국은 인도와 달리 러시아산 석유를 구매하는 중국에 대해선 특별한 추가 제재를 하지 않았다. 지난 4월 관세 전쟁을 선포하며 부과했던 고율의 관세를 일부 완화한 상태다.
FT에 따르면 유럽 국가들은 러시아산 석유 및 가스 구매를 둘러싼 중국과 인도에 대한 2차 제재를 논하고 있지만, 두 나라와의 무역 관계를 고려할 때 선뜻 나서지 못하고 있다.
한 미국 고위 관계자는 ""유럽인들이 전쟁을 끝낼 정치적 의지를 갖고 있느냐가 관건""이라며 ""이 모든 조치는 분명 비용이 따를 것이다. 이를 실행하려면 유럽 파트너들과, 이상적으로는 모든 동맹국들이 함께 해야 하며 고통도 함께 나눠야 한다""고 말했다．",관세부과
뉴시스,"""트럼프, EU에 '中·인도 100%관세 부과' 촉구"" -FT",네이버뉴스,https://n.news.naver.com/mnews/article/003/0013472014?sid=104,,뉴시스,"트럼프, EU에 '中·印에 최대 100% 관세 부과' 요청…러 압박 강화 시도","러-우 전쟁 종식 위한 美-EU 공동 대응 협력 논의
美 ""中·印, 러시아산 석유 구매 중단할 때까지 강력 관세 유지해야""
[뉴욕=AP/뉴시스] 9일(현지 시간) 파이낸셜타임스(FT)에 따르면 트럼프 대통령은 워싱턴에서 열린 미국과 EU 고위 관리들 간 회의에 전화를 걸어 중국과 인도에 대해 최대 100% 관세를 부과하자고 제안했다. 사진은 도널드 트럼프 미국 대통령이 7일(현지 시간) 뉴욕에서 열린 US오픈 테니스대회에 참석한 모습. 2025.09.10.
[서울=뉴시스]박미선 기자 = 도널드 트럼프 미국 대통령이 인도와 중국에 대해 최대 100%의 관세를 부과할 것을 EU(유럽연합)에 요청했다. 이는 러시아-우크라이나 전쟁 종식을 위한 미국과 EU의 공동 대응 방안을 강화하려는 움직임이다.
9일(현지 시간) 파이낸셜타임스(FT)에 따르면 트럼프 대통령은 워싱턴에서 열린 미국과 EU 고위 관리들 간 회의에 전화를 걸어 이 같은 제안을 했다. 이번 회의는 러시아에 대한 경제적 압박을 강화하는 방안을 논의하기 위해 마련됐으며, EU 제재 책임자 데이비드 오설리반을 비롯한 EU 고위 관계자들과 미국 재무부 고위 관계자들이 참석했다.
한 미국 고위 관계자는 ""미국은 EU가 중국과 인도에 부과하는 관세를 '거울 조치'로 따라할 준비가 돼 있다""며 두 나라에 대한 세금을 추가로 올릴 가능성까지 시사했다.
또 다른 미국 고위 관계자는 ""트럼프 대통령은 '우리 모두 극적인 관세를 부과하고, 중국이 러시아산 석유 구매를 중단할 때까지 이를 유지하자'고 말했다""고 전했다.
이번 제안은 지난주 중국 전승절 80주년 기념식과 맞물려 시진핑 중국 국가주석, 나렌드라 모디 인도 총리, 블라디미르 푸틴 러시아 대통령이 정상회담을 가진 뒤 나온 것이다. 당시 트럼프 대통령은 자신의 소셜미디어 트루스소셜에 3개국 정상이 함께 걸어가는 사진을 올리며 ""우리는 인도와 러시아를 가장 깊고 어두운 중국에 빼앗긴 것 같다""고 평가했다.
미국은 지난달 말 인도가 러시아산 석유를 구매하는 것에 대응해 50%의 관세를 부과하며 양국 간 긴장이 고조됐다. 다만 트럼프 대통령은 인도와의 무역 협상을 계속 진행 중이고, ""성공적인 결론""을 기대한다고 밝혔다.
미국은 인도와 달리 러시아산 석유를 구매하는 중국에 대해선 특별한 추가 제재를 하지 않았다. 지난 4월 관세 전쟁을 선포하며 부과했던 고율의 관세를 일부 완화한 상태다.
FT에 따르면 유럽 국가들은 러시아산 석유 및 가스 구매를 둘러싼 중국과 인도에 대한 2차 제재를 논하고 있지만, 두 나라와의 무역 관계를 고려할 때 선뜻 나서지 못하고 있다.
한 미국 고위 관계자는 ""유럽인들이 전쟁을 끝낼 정치적 의지를 갖고 있느냐가 관건""이라며 ""이 모든 조치는 분명 비용이 따를 것이다. 이를 실행하려면 유럽 파트너들과, 이상적으로는 모든 동맹국들이 함께 해야 하며 고통도 함께 나눠야 한다""고 말했다．",관세부과
조세일보,트럼프 “EU에 對중국∙인도 100%관세 부과” 요구…푸틴 겨냥 초강수,네이버뉴스,https://n.news.naver.com/mnews/article/123/0002367760?sid=104,,조세일보,"""트럼프, EU에 '中·인도 100% 관세 부과' 촉구"" -FT","◆…도널드 트럼프 미국 대통령 <사진=로이터>
도널드 트럼프 미국 대통령이 유럽연합(EU)에 중국과 인도에 대해 100% 관세를 부과할 것을 촉구했다고 파이낸셜타임스(FT)가 9일(현지시간) 보도했다.
FT는 이날, 트럼프 대통령의 이번 제안이 블라디미르 푸틴 러시아 대통령을 압박하기 위한 전략의 일환이라고 전했다. 러시아의 전쟁 자금줄인 원유 수출을 차단하겠다는 방침이다.
트럼프 대통령은 재임 이후 우크라이나 종전 중재에 힘써왔지만, 최근 러시아의 공세가 계속되자 공개적으로 불만을 나타내고 있다. 이번 주 초에는 러시아에 대한 제재 2단계에 돌입할 것이라며 EU와 공조한 경제적 압박을 경고한 바 있다.
앞서 로이터통신은 백악관 관계자를 인용해, 트럼프 대통령이 4일(현지시간) 프랑스 에마뉘엘 마크롱 대통령이 주도하는 '자발적 연합' 국가들과 통화에서 EU에 러시아산 원유 구매를 중단할 것을 촉구하고, 러시아 전쟁을 지원하는 중국에도 경제적 압박을 가해야 한다고 요구했다고 보도했다.
관계자는 트럼프 대통령이 통화에서 ""전쟁 자금을 조달하는 러시아산 석유 구매를 유럽이 즉시 중단해야 한다""며 ""러시아 전쟁을 지원하는 중국에도 경제적 압박을 가해야 한다""고 강조했다고 전했다.
트럼프 행정부는 최근 우크라이나 전쟁과 관련한 대러 제재를 위해 중국과 인도에도 이 같은 압박을 가하고 있으며 지난달에는 원유 구매를 지속한다는 이유로 인도에 25% 추가 관세를 부과한 바 있다. 다만, 인도는 경제성을 이유로 러시아산 원유 구매를 계속하겠다는 입장을 고수하는 한편, 중국·러시아와의 밀착을 과시하고 있다. 인도는 세계 3위의 원유 소비국이자 중국에 이은 최대 러시아 원유 수입국이다.",관세부과
헤럴드경제,"트럼프, 푸틴 압박 위해 EU에 中·印 100%관세 부과요청",네이버뉴스,https://n.news.naver.com/mnews/article/016/0002526674?sid=104,,헤럴드경제,트럼프 “EU에 對중국∙인도 100% 관세 부과” 요구…푸틴 겨냥 초강수,"“유럽 동참시 美 즉시 관세 부과”
‘그림자 함대·에너지 수익’ 겨냥
도널드 트럼프 미국 대통령 [EPA]
[헤럴드경제=정목희 기자] 도널드 트럼프 미국 대통령이 유럽연합(EU)에 중국과 인도산 수입품에 최대 100%의 관세를 부과할 것을 요구했다고 파이낸셜타임스(FT) 등이 9일(현지시간) 보도했다. 복수의 소식통에 따르면 이는 러시아의 우크라이나 전쟁 종식을 압박하기 위한 공동 대응 차원에서 나왔다.
트럼프 대통령은 이날 워싱턴에서 열린 미·EU 고위급 화상회의에서 직접 이 같은 내용을 전달했다. 회의는 러시아에 대한 경제적 압박 수위를 높일 방안을 논의하기 위해 마련됐다.
이 사안에 정통한 미국 관리에 따르면 트럼프 대통령은 “우리는 당장 실행할 준비가 돼 있다”며 “유럽 파트너들이 동참할 경우에만 이 조치를 취할 것”이라고 밝혔다. 또 다른 미 정부 관계자는 “EU가 중국과 인도에 관세를 부과하면 미국도 동일한 조치를 취할 준비가 돼 있다”며 이는 사실상 양국 수입품에 대한 미국의 추가 관세 인상을 의미한다고 설명했다.
미·EU 당국자들은 회의에서 이와 함께 러시아의 ‘그림자 함대’에 대한 추가 제재, 은행·금융 부문 및 주요 석유기업에 대한 제재 강화 방안도 논의한 것으로 전해졌다. 다만 EU 차원의 제재는 회원국 만장일치가 필요하다. 헝가리를 비롯한 일부 국가는 과거 러시아 에너지 부문을 겨냥한 강력한 제재에 반대해왔다.
트럼프 대통령의 이번 제안은 백악관 내부에서 평화 협상 진전이 지지부진하다는 불만이 커지고, 러시아의 우크라이나 공습이 갈수록 격화되는 상황 속에서 나왔다.
앞서 한 미 고위 관리는 “대통령은 오늘 아침 회의에서 ‘모든 나라가 극적인 수준의 관세를 부과하고, 중국이 러시아산 석유 구매를 중단할 때까지 이를 유지하는 것이 가장 분명한 접근법’이라고 말했다”며 “사실 그 석유가 갈 곳은 많지 않다”고 전했다.
EU 대표단은 이번 주 워싱턴DC를 방문해 미국 측과 추가 공동 조치를 논의하고 있으며, 전쟁 종식과 협상 개시를 위한 압박 수위를 높이고 있다.
회의에 참석한 율리야 스비리덴코 우크라이나 총리는 소셜미디어(SNS)를 통해 “그림자 유조선, 대형 석유기업, 정유소, 무역업체 등 러시아 전쟁을 뒷받침하는 모든 요소를 제재해야 한다”고 촉구했다.
현재 EU는 19번째 대러 제재 패키지를 논의 중이다. 러시아는 이미 미국과 유럽의 강력한 제재를 받고 있지만, 중국과 제3국을 통해 제한 품목을 조달하고 중국·인도 등지에서 원유와 가스의 새로운 구매처를 확보하면서 제재 효과를 일정 부분 상쇄해왔다. 그러나 러시아 경제가 점차 압박 신호를 보이는 가운데, 공급망과 주요 수익원을 직접 겨냥한 추가 조치는 푸틴 정권의 전쟁 수행 능력과 재정을 한층 더 옥죄게 될 것이라고 블룸버그는 분석했다.",관세부과
뉴스1,"트럼프, EU에 중국·인도 100%관세물려 푸틴 압박하라 요구",네이버뉴스,https://n.news.naver.com/mnews/article/421/0008476324?sid=104,,뉴스1,"트럼프, 푸틴 압박 위해 EU에 中·印 100% 관세 부과 요청","FT ""러시아산 원유 구매 막자며 이같이 요청""
도널드 트럼프 미국 대통령. 2025.09.07. ⓒ 로이터=뉴스1 ⓒ News1 류정민 특파원
(서울=뉴스1) 권영미 기자 = 도널드 트럼프 미국 대통령이 러시아의 우크라이나 침공을 끝내기 위한 압박 수단으로 유럽연합(EU)에 인도와 중국에 최대 100%의 관세를 부과할 것을 요청했다고 복수의 미국 정부 관계자들이 밝혔다.
9일(현지시간) 파이낸셜타임스(FT)에 따르면 이날 트럼프 대통령은 워싱턴에서 열린 미·EU 고위급 회의에 전화로 참여해 러시아에 대한 경제적 압박을 강화하는 방안을 논의하던 중, 이 같은 요구를 제시한 것으로 전해졌다.
한 미국 정부 관계자는 “우리는 준비가 돼 있다. 당장이라도 시작할 수 있다. 하지만 유럽 파트너들이 함께 나서야만 한다”고 말했다.
또 다른 관계자는 “EU가 중국과 인도에 관세를 부과한다면 미국도 동일한 수준의 관세를 적용할 준비가 돼 있다”며, 양국 수입품에 대한 미국의 관세가 추가로 인상될 가능성을 시사했다.
이번 제안은 백악관 내부에서 평화 협상 난항과 러시아의 공습 강화에 대한 불만이 고조되는 가운데 나왔다.
관계자는 “대통령은 오늘 아침 회의에 참여해 ‘중국이 러시아산 석유 구매를 중단할 때까지 강력한 관세를 부과하고 유지하자. 그 석유가 갈 수 있는 곳은 많지 않다’는 입장을 밝혔다”고 전했다.",관세부과
뉴스1,2분기 기업관세직격탄…매출 줄고 이익률 1%p '뚝',네이버뉴스,https://n.news.naver.com/mnews/article/421/0008477380?sid=101,,뉴스1,2분기 기업 관세 직격탄…매출 줄고 이익률 1%p '뚝',"석유화학·자동차 부진에 제조업 매출 1.7%↓…반도체도 기저에 둔화
영업이익률 5.1%로 1년새 1.1%p↓…대기업 부진, 중기만 소폭 개선
도널드 트럼프 미국 대통령 ⓒ AFP=뉴스1
(서울=뉴스1) 김혜지 기자 = 올해 2분기 한국 기업들의 매출 증가율이 2년 만에 마이너스로 전환했다. 트럼프 행정부의 고율 관세 부과가 본격화하면서 자동차와 운송장비 업종이 직격탄을 맞았고, 석유화학과 기계·전기전자 업종도 부진을 면치 못했다.
영업이익률 등 기업 수익성도 동반 하락하며 대기업 위주의 수익 둔화가 뚜렷해졌다.
한국은행이 10일 발표한 '2025년 2분기 기업경영분석 결과'에 따르면 외부감사 대상 법인기업 2만 6000여곳의 매출액은 전년 동기 대비 0.7% 감소했다. 지난 1분기 2.4%에서 석 달 만에 마이너스로 돌아선 것이다.
기업 매출액 증가율이 이같이 낮아진 것은 지난 2023년 4분기(-1.3%) 이후 1년 6개월 만의 일이다. 매출 역성장 자체도 1년 6개월 만에 처음이었다.
업종별로 보면 제조업 매출 증가율은 1분기 2.8%에서 2분기 -1.7%로 급락했다.
특히 석유화학이 -1.9%에서 -7.8%로 낙폭을 키웠는데, 유가 하락과 설비 가동률 저하로 수출액이 줄어든 영향이었다. 기계·전기전자도 5.9%에서 2.2%로 둔화했으며, 이는 인공지능(AI) 투자 확대 덕에 고부가가치 반도체 수출은 호조였으나 지난해 같은 기간의 20%대 고성장에 따른 기저 부담이 크게 작용했다.
비제조업 매출도 1분기 1.9%에서 2분기 0.3%로 증가 폭이 축소됐다. 도소매업은 철강 트레이딩과 에너지 관련 수입 감소로 5.0%에서 2.0%로 둔화했고, 운수업은 운임 하락과 소액 면세 폐지 등에 5.6%에서 -0.5% 감소세로 돌아섰다.
매출 부진은 수익성에도 직결됐다. 전체 매출액 영업이익률은 1년 전(6.2%)보다 1.1%포인트(p) 떨어진 5.1%를 기록했다. 세전순이익률 역시 같은 기간 6.7%에서 5.3%로 낮아졌다.
제조업 영업이익률은 7.1%에서 5.1%로 하락했다. 자동차·운송장비는 트럼프 관세와 판촉 경쟁 탓에 7.6%에서 2.7%로 급락했고, 기계·전기전자는 재고자산평가손실 인식으로 10.2%에서 7.4%로 하락했다. 반면 전기가스업은 연료가격 안정으로 3.2%에서 5.0%로 높아지며 선방했다.
기업 규모별로는 대기업의 수익성 악화가 뚜렷했다. 대기업 영업이익률은 6.6%에서 5.1%로 떨어졌고, 중소기업은 전문 서비스업을 중심으로 4.4%에서 5.0%로 소폭 개선됐다.
안정성 지표의 경우 부채를 자본으로 나눈 값인 부채비율은 89.8%로 전분기(89.9%)와 유사했지만, 총자본 중 이자가 발생하는 외부조달 차입금이 차지하는 비중을 뜻하는 차입금의존도는 25.0%에서 26.6%로 높아졌다. 차입금의존도가 2015년 2분기(26.9%) 이후 10년 만에 최고치를 경신했다.
3분기 기업 실적은 관세 부과로 인한 부정적 영향이 예상됐다. 문상윤 한은 기업통계팀장은 ""관세 불확실성이 협상 타결로 완화됐지만 여전히 높은 수준을 이어가고 있고, 이로 인해 부정적인 영향이 예상된다""며 ""반도체의 기저효과는 해소될 것""이라고 말했다.",관세부과
