press,title,naver_news_text,naver_news_url,body,press_html,title_html,body_html,label
뉴시스,"팀 쿡 ""아이폰 17 가격 인상, 트럼프발관세때문 아냐""",네이버뉴스,https://n.news.naver.com/mnews/article/003/0013494014?sid=104,,뉴시스,"팀 쿡 ""아이폰 17 가격 인상, 트럼프발 관세 때문 아냐""","아이폰 17 글로벌 출시일 맞춰 이례적 언급
[서울=뉴시스] 쿡 CEO는 19일(현지 시간) CNBC와의 인터뷰에서 ""가격에 관세 인상이 반영된 것은 전혀 없다""고 강조했다. 사진은 19일 서울 중구 명동 애플스토어에서 고객들이 애플 신제품 아이폰17 시리즈를 살펴보고 있다. 2025.09.20.
[서울=뉴시스]박미선 기자 = 팀 쿡 애플 CEO(최고경영자)가 최근 출시된 아이폰 모델 가격 인상이 도널드 트럼프 미국 대통령의 관세 정책과는 관련이 없다고 밝혔다.
쿡 CEO는 19일(현지 시간) CNBC와의 인터뷰에서 ""가격에 관세 인상이 반영된 것은 전혀 없다""고 강조했다. 이날은 아이폰 최신 모델이 전 세계 매장에 출시된 날로, 쿡 CEO가 아이폰 가격과 관세를 직접 언급한 것은 극히 드문 사례다.
애플은 이달 초 아이폰 17 라인업을 공개했는데, 이는 트럼프발 관세 정책 이후 처음으로 출시되는 모델로 가격 변동 여부에 관심이 집중됐다.
애플은 구체적인 배경을 밝히지 않은 채, 아이폰 17 프로 가격을 기존 모델보다 100달러(약 10%) 올려 1100달러로 책정했다. 반면 기본 모델인 아이폰 17과 최상위 모델인 프로 맥스 가격은 그대로 유지했다.
애플은 관세 부담을 피하기 위해 아이폰을 미국으로 들여올 때 중국 대신 인도와 베트남 등 낮은 관세율이 적용되는 국가들로 공급망을 전환했다. 또 트럼프 대통령의 제조업 부활 정책에 맞춰 미국 내 제조 및 공급망 강화를 위해 최소 6000억 달러를 투자하겠다고 약속했다.
그러나 아이폰 17 모델은 여전히 중국과 인도의 애플 생산 거점에서 제조될 것으로 보여, 트럼프발 관세 부과 대상에 포함될 가능성이 크다.
쿡 CEO는 지난 6월 분기 실적 발표에서 관세 비용으로 약 8억 달러의 손실을 입었다고 밝힌 바 있다.
애널리스트들은 미국으로 수입되는 아이폰에 부과되는 관세로 인해 추가 비용이 발생했으며, 애플이 수익성을 확보하기 위해 가격 인상에 나선 것으로 보고 있다.
한편 애플은 느린 AI(인공지능) 도입 속도와 중국 등 해외 시장에서의 경쟁 심화에 대한 우려에도 직면해 있다. 쿡 CEO는 이날 인터뷰에서 ""우리는 전화기 어디에나 AI를 가지고 있다""면서도 ""다만 우리는 그것을 그렇게 부르지 않을 뿐""이라고 말했다．",관세부과
뉴시스,"팀 쿡 CEO ""최신 아이폰 가격 인상에관세반영 안 됐다""",네이버뉴스,https://n.news.naver.com/mnews/article/003/0013494014?sid=104,,뉴시스,"팀 쿡 ""아이폰 17 가격 인상, 트럼프발 관세 때문 아냐""","아이폰 17 글로벌 출시일 맞춰 이례적 언급
[서울=뉴시스] 쿡 CEO는 19일(현지 시간) CNBC와의 인터뷰에서 ""가격에 관세 인상이 반영된 것은 전혀 없다""고 강조했다. 사진은 19일 서울 중구 명동 애플스토어에서 고객들이 애플 신제품 아이폰17 시리즈를 살펴보고 있다. 2025.09.20.
[서울=뉴시스]박미선 기자 = 팀 쿡 애플 CEO(최고경영자)가 최근 출시된 아이폰 모델 가격 인상이 도널드 트럼프 미국 대통령의 관세 정책과는 관련이 없다고 밝혔다.
쿡 CEO는 19일(현지 시간) CNBC와의 인터뷰에서 ""가격에 관세 인상이 반영된 것은 전혀 없다""고 강조했다. 이날은 아이폰 최신 모델이 전 세계 매장에 출시된 날로, 쿡 CEO가 아이폰 가격과 관세를 직접 언급한 것은 극히 드문 사례다.
애플은 이달 초 아이폰 17 라인업을 공개했는데, 이는 트럼프발 관세 정책 이후 처음으로 출시되는 모델로 가격 변동 여부에 관심이 집중됐다.
애플은 구체적인 배경을 밝히지 않은 채, 아이폰 17 프로 가격을 기존 모델보다 100달러(약 10%) 올려 1100달러로 책정했다. 반면 기본 모델인 아이폰 17과 최상위 모델인 프로 맥스 가격은 그대로 유지했다.
애플은 관세 부담을 피하기 위해 아이폰을 미국으로 들여올 때 중국 대신 인도와 베트남 등 낮은 관세율이 적용되는 국가들로 공급망을 전환했다. 또 트럼프 대통령의 제조업 부활 정책에 맞춰 미국 내 제조 및 공급망 강화를 위해 최소 6000억 달러를 투자하겠다고 약속했다.
그러나 아이폰 17 모델은 여전히 중국과 인도의 애플 생산 거점에서 제조될 것으로 보여, 트럼프발 관세 부과 대상에 포함될 가능성이 크다.
쿡 CEO는 지난 6월 분기 실적 발표에서 관세 비용으로 약 8억 달러의 손실을 입었다고 밝힌 바 있다.
애널리스트들은 미국으로 수입되는 아이폰에 부과되는 관세로 인해 추가 비용이 발생했으며, 애플이 수익성을 확보하기 위해 가격 인상에 나선 것으로 보고 있다.
한편 애플은 느린 AI(인공지능) 도입 속도와 중국 등 해외 시장에서의 경쟁 심화에 대한 우려에도 직면해 있다. 쿡 CEO는 이날 인터뷰에서 ""우리는 전화기 어디에나 AI를 가지고 있다""면서도 ""다만 우리는 그것을 그렇게 부르지 않을 뿐""이라고 말했다．",관세부과
연합뉴스,"애플 CEO ""최신 아이폰 가격 인상에관세는 반영 안 해""",네이버뉴스,https://n.news.naver.com/mnews/article/001/0015637849?sid=104,,연합뉴스,"팀 쿡 CEO ""최신 아이폰 가격 인상에 관세 반영 안 됐다""","미 CNBC 인터뷰서 언급…""AI, 제품 모든 곳에 적용""
19일(현지시간) 뉴욕 애플스토어에 나와 아이폰17 모델 출시를 축하하는 팀 쿡 CEO
[AFP=연합뉴스. 재판매 및 DB 금지]
(로스앤젤레스=연합뉴스) 임미나 특파원 = 팀 쿡 애플 최고경영자(CEO)가 최신 아이폰 모델 가격 인상이 도널드 트럼프 행정부가 부과한 고율 관세와는 관련이 없다고 밝혔다.
19일(현지시간) 미 CNBC 방송에 따르면 쿡 CEO는 이날 최신 아이폰 모델 출시를 기념해 뉴욕 애플 매장에 나와 이 매체와 한 인터뷰에서 ""분명히 말하자면, (아이폰) 가격에는 관세로 인한 인상이 전혀 없다""고 말했다.
CNBC는 쿡 CEO가 아이폰 가격과 관련해 관세 문제를 단호하게 언급한 최신 사례라고 전했다.
애플은 이번에 아이폰 새 모델을 출시하면서 각 모델의 저용량(128GB) 모델을 없애 사실상 가격 인상 효과를 냈다.
아이폰17 기본 모델은 799달러(256GB), 프로는 1천99달러(256GB), 프로맥스는 1천199달러(256GB)부터 각각 시작한다. 플러스 모델을 대체하는 역대 가장 얇은 '아이폰 에어'는 999달러(256GB)로 책정돼 기존 플러스 모델(128GB)보다 가격이 100달러 높아졌다.
뉴욕 애플스토어에 진열된 아이폰17 시리즈
[로이터=연합뉴스. 재판매 및 DB 금지]
애플은 지난 수년간 제품의 대부분을 중국에서 생산해왔으나, 관세를 피하기 위해 근래 공급망을 전환해 인도와 베트남 등 관세가 더 낮은 국가에서 미국으로 수입하고 있다.
CNBC에 따르면 쿡 CEO는 지난 6월로 끝난 분기에 애플이 관세 관련 비용으로 8억달러(약 1조1천190억원)의 손해를 봤다고 밝혔다.
쿡 CEO는 또 애플이 인공지능(AI) 도입을 느리게 하고 있다는 지적에 대해 ""우리는 아이폰의 모든 곳에 AI를 적용하고 있다""며 ""단지 그렇게 (AI라고) 부르지 않을 뿐""이라고 말했다.
mina@yna.co.kr",관세부과
TV조선,"저렴이 없앤 아이폰17...팀 쿡 CEO ""트럼프관세와는 상관 없어""",네이버뉴스,https://n.news.naver.com/mnews/article/448/0000558349?sid=104,,TV조선,"애플 CEO ""최신 아이폰 가격 인상에 관세는 반영 안 해""","팀 쿡 애플 CEO /AFP=연합뉴스
팀 쿡 애플 CEO가 최신 아이폰 모델 가격 인상은 도널드 트럼프 행정부가 부과한 고율 관세와는 관련이 없다고 밝혔다.
쿡 CEO는 19일(현지시간) 뉴욕 애플 매장에서 가진 CNBC와의 인터뷰에서 ""(아이폰) 가격에는 관세로 인한 인상이 전혀 없다""고 말했다.
애플은 이번에 아이폰 새 모델을 출시하면서 각 모델의 저용량(128GB) 모델을 없애면서 사실상 가격 인상 효과를 냈다.
아이폰17 기본 모델은 799달러(256GB), 프로는 1,099달러(256GB), 프로맥스는 1,199달러(256GB)부터 시작한다.
플러스 모델을 대체하는 역대 가장 얇은 '아이폰 에어'는 999달러(256GB)로, 기존 플러스 모델(128GB)보다 가격이 100달러 올라갔다.
애플은 관세를 피하기 위해 중국이 아닌 인도와 베트남 등 관세가 더 낮은 국가에서 미국으로 수입하고 있다.
CNBC에 따르면 쿡 CEO는 지난 2/4분기에 애플이 관세 관련 비용으로 8억 달러(약 1조1,190억 원)의 손해를 봤다고 전했다.",관세부과
이코노미스트,"애플 CEO ""아이폰 모든 곳에 AI 적용… 가격에관세반영 안돼""",네이버뉴스,https://n.news.naver.com/mnews/article/243/0000085139?sid=101,,이코노미스트,"저렴이 없앤 아이폰17...팀 쿡 CEO ""트럼프 관세와는 상관 없어""","미 CNBC 인터뷰서 설명 나선 팀 쿡 CEO
AI 지적에는 ""모든 곳에 적용하고 있다""
뉴욕 애플스토어에 진열된 아이폰17 시리즈. [사진 로이터=연합뉴스]
[이코노미스트 라예진 기자] 팀 쿡 애플 최고경영자(CEO)가 최신 아이폰 모델 가격 인상에 대해 입을 열었다.
19일(현지시간) 미 CNBC 방송에 따르면 쿡 CEO는 이날 최신 아이폰 모델 출시를 기념해 뉴욕 애플 매장에 나와 인터뷰를 진행하며 ""분명히 말하자면, (아이폰) 가격에는 관세로 인한 인상이 전혀 없다""고 말했다. 즉 도널드 트럼프 행정부가 최근 부과한 고율 관세와는 전혀 관련이 없다는 설명이다.
이는 쿡 CEO가 아이폰 가격과 관련해 관세 문제를 단호하게 언급한 최신 사례로 더욱 주목을 받고 있다.
애플은 이번에 아이폰17 시리즈를 새롭게 출시하면서 각 모델의 저용량(128GB) 모델을 없애며 사실상 가격 인상 효과를 냈다. 아이폰17 기본 모델은 799달러(256GB), 프로는 1099달러(256GB), 프로맥스는 1199달러(256GB)부터 각각 시작한다.
특히 플러스 모델을 대체하는 역대 가장 얇은 '아이폰 에어'는 999달러(256GB)로 책정돼 기존 플러스 모델(128GB)보다 가격이 100달러 높아졌다.
한편 CNBC에 따르면 쿡 CEO는 지난 6월로 끝난 분기에 애플이 관세 관련 비용으로 8억달러(약 1조1190억원)의 손해를 봤다고 밝혔다. 이에 애플은 지난 수년간 제품의 대부분을 중국에서 생산해왔으나, 관세를 피하기 위해 근래 공급망을 전환해 인도와 베트남 등 관세가 더 낮은 국가에서 미국으로 수입하고 있다.
또 인공지능(AI) 기능 도입에 대해서도 언급했다. 쿡 CEO는 이번 신제품 출시와 함께 애플이 AI 도입을 느리게 하고 있다는 지적에 대해 ""우리는 아이폰의 모든 곳에 AI를 적용하고 있다""며 ""단지 그렇게 (AI라고) 부르지 않을 뿐""이라고 말했다.",관세부과
주간조선,"한미관세협상, 잘못 끼워진 3개의 단추",네이버뉴스,https://n.news.naver.com/mnews/article/053/0000052429?sid=104,,주간조선,"한미 관세협상, 잘못 끼워진 3개의 단추","김정관 산업통상자원부 장관이 지난 8월 25일(현지시간) 미국 워싱턴 DC 월라드 인터콘티넨탈호텔에서 열린‘한·미 제조업 파트너십 MOU 체결식’에서 하워드 러트닉 미 상무부 장관과 대화하고 있다. photo 뉴시스
1993년 제작된 '마제파(Mazeppa)'란 영화를 봤다. 말(馬) 그림에 미친 프랑스 화가를 다룬 작품이다. 마제파를 보다가 대학시절 접했던 서울 프랑스문화원에서의 영화 하나가 떠올랐다. 말에 관한 프랑스 특유의 세계관이 녹아든 18세기 초 배경의 작품이었다. 영화는 프랑스어로 '르크러(Reculer)', 즉 역보(逆步)라 표현하는 '말 뒷걸음 경주'를 그렸다. 앞으로 빠르게 치고 달려나가는 것이 아니라, 뒷걸음으로 승부를 내는 느림보 경주다. 프랑스문화원에서 난생처음 본 르크러는 문화적 충격, 그 자체였다. 최대한 느리게, 반드시 일직선으로 뒷걸음쳐야 하고, 1㎜라도 전진하거나 1초 이상 정지할 경우 실격이다. 10m 거리를 10분간 역보하면서, 말과 기수 모두 탈진한 상태에서 끝난 영화다.
앞으로, 빨리, 멀리 달리는 것이 말의 본능이자 기능이다. 그러나 프랑스인은 그런 동물을 거꾸로 걷게 하면서, 짧은 거리를 최대한 느리게 직선으로 움직이도록 만든다. 말의 몸뿐 아니라 마음과 영혼조차 통제해야 가능한 일이다. 기수도 말의 행보에 맞춰, 마치 문어처럼 전신을 비틀어야만 한다.
""시한에 쫓긴다고 해서 우리 기업들이 크게 손해를 볼 수 있는 합의안에 서명할 수는 없다. 기업의 손해를 강요하지 않겠다는 이재명 대통령의 의지는 확고하다.""
지난 9월 16일 서울 대통령실에서 터져나온 폭탄발언이다. 뉴스를 접하는 순간, 거꾸로 걷는 백마가 떠올랐다. 필자 판단이지만, 관세협상을 둘러싼 미국의 '느리지만 분명한' 움직임은 프랑스 르크러에 비견될 수 있다. 100㎞ 고속으로 달리던 도중 갑자기 역행해서 달팽이 걸음으로 대하는 말 경주다. 한국은 빨리 달리기는 하는데, 상황이 달라질 경우에 대비한 브레이크도 없고, 역행할 수 있다는 생각도 없어 보인다. 통도 크고 시원스럽기는 한데, 멈추는 순간 수직 추락이다.
대통령실의 폭탄발언은 관세협상 문서화 논의가 본격화되면서 나온 것이다. 이재명 정부는 미국 측 문서에 동의할 경우 '당장' 엄청난 외화가 필요하다면서 '달러와 원화의 무제한 스와프' 허용을 요청했다고 한다. 한국 보도에 따르면, 미국 측은 이를 거부했다. 더불어 문서화와 함께 약속된 투자금이 오지 않을 경우 25% 관세가 계속 적용될 것이라고 경고했다고 한다. 도널드 트럼프 대통령은 ""반도체의 경우 더 많은 관세가 붙을 수 있다""고까지 말한다. 불과 2주 전까지만 해도 한·미 협상 결과에 박수를 보내던 우리 정부가 9월 15일을 기점으로 태도가 달라졌다. 왜일까? 도대체 어떤 이유로 상황이 급변한 것일까? 출발점부터 단추가 어긋난 상태이기 때문에, 필연적으로 나타난 너무도 '당연한 결과'일 뿐이다. 현재진행형으로 이뤄지고 있는, 크게 3가지 차원의 '어긋난 단추'에 주목해보자.
경기 평택시 포승읍 평택항 자동차 전용부두에 수출용 차량이 세워져 있다. photo 뉴시스
9월 15일 기점으로 달라진 태도
첫째, 정치가와 관료의 역할이다. 한·미 관세협상에서 직접 현장에 나서는 한국 측 교섭자는 관료다. 경제·외교·안보 관련 최고 관료가 워싱턴을 오가며 미국 측 요구에 총력전으로 대응하고 있다. 정치가, 다시 말해 이 대통령을 포함한 대통령실 내부의 정책결정자는 협상창구에 가지 않는다. 한국인이 보면 당연한 풍경이지만, 미국과 협상 중인 다른 나라와 비교하면 이상하다는 걸 알 수 있다. 현장에서 곧바로 결정할 수 있는 최고권력 정치가가 협상의 주역이다. 최고권력이 오는 만큼 미국도 트럼프가 직접 대응한다. 지난 8월 25일 이 대통령의 미국 방문에서 보듯, 한국 정상이 가면 트럼프가 대응하는 식이다. 임명제 월급쟁이 관료는 정치가의 지시를 받는다. 관료가 협상테이블에 앉을 경우 의사결정 과정도 늦어지고 복잡해진다. 좋게 말하면 섬세한 협상이 될 수 있지만, 미국 장관이 취임 한두 달에 불과한 한국 관료들을 어떻게 대할지 눈에 선하다.
현재 미국은 한·미 협상의 모델로 일본을 거론하고 있다. 좋든 싫든 여러 면에서 미·일 협상과정과 결과가 한·미 협상에도 적용되고 있다. 한국도 일본 모델을 참고로 하면서, 한·미 정상회담에 앞서 이시바 시게루 총리와 만나 조언을 구했다고 한다.
그러나 한꺼풀만 벗기면 '일본=한·미 협상 모델'이 될 수 없다는 것을 알 수 있다. 일본은 정치가가 직접 나서 협상을 진행했고, 결과를 도출해냈기 때문이다. 주인공은 이시바 본인은 물론, 이시바 최측근으로 통하는 아카자와 료세이 경제재정정책 담당상이다. 9월 초 기준으로 아카자와는 총 10차례 워싱턴을 방문해 미·일 관세협상 전체를 이끌어냈다. 아카자와는 원래 운수성 출신 관료다. 2005년 자민당 정치가로 나선 뒤 지금까지 7선 중의원으로 일하고 있다. 관료 재임 당시 이미 미·일 협상을 경험한 베테랑이자 이시바의 오른팔로 미국과 협상에 임한 정치가다. 비상시 곧바로 이시바에게 전화를 걸 만한 정치가다.
한국은 어떨까? 정치가가 아닌 관료가 자리를 지키고, 그나마 이 대통령에게 곧바로 전화를 걸 만한 위치에 있을지 의문이다. '일본=한·미 협상 모델'이라 말하지만, 정작 링 위의 선수들을 보면 참고가 될 여지가 거의 없다.
결과만 공개, 과정은 불투명
둘째는 투명성과 공개성이다. 필자를 비롯해 한국인 대부분은 '대통령실의 워싱턴에 대한 폭탄발언'을 황당하게 생각할 듯하다. 트럼프를 예측 불가능 인물이라 말하지만, 거꾸로 트럼프가 보면 이재명 정부의 자세가 한층 더 예측하기 어려울 듯하다. 8월 25일 협상 이후 갑자기 돌변해서 '국익을 위해 사인을 할 수 없다'라고 말한다. 한·미 정상회담 당시 합의는 국익이 아니란 말인지, 트럼프가 합의된 내용을 뒤엎었다는 말인지 종잡기 어려운 변신이다.
문제는 협상 내용이나 과정에 관한 투명성이다. 도대체 무슨 말이 오가고 있고, 어떤 약속이 있었는지에 대한 정보 자체가 극히 제한돼 있다. 이재명 정부를 응원하고 싶어도 뭘, 어떻게 해야 할지에 대한 판단 근거 자체가 없다. 누구보다도 '소통 정치'를 강조하는 것이 이재명 정부다. 전국 방방곡곡을 돌면서 행해지고 있는, 이른바 이 대통령의 '타운홀 미팅'은 소통 정치의 본보기라 할 수 있다. 그러나 한·미 관세협상에 관한 내용으로 들어가면 숨이 '꽉' 막힌다. 한국이 참고할 일본 모델이라고 하지만, 아카자와가 벌이는 식의 개방형 기자회견 자체가 없다.
10차례 미·일 협상에 나선 아카자와를 보자. 출국 전 기자회견, 워싱턴에서 회담이 끝난 뒤 현지 기자회견, 입국 뒤 행하는 기자회견 등 통상 세 번의 발표가 기본이다. 하고 싶은 말만 하는 것이 아니라, 기자들의 질문에 대한 답이 일본인 모두에게 공표된다. 밝히고 싶지 않거나, 비밀로 할 사안에 대해서는 답변 도중 상황을 얘기하면서 건너뛴다. 따라서 미·일 협상 과정이나 내용에 대해 일본인 모두 비교적 상세히 알고 있다.
한국은 어떨까? 매일 추적하면서 살펴도 어떤 일이 벌어지는지 알 수 없다. 이런 방식은 상황을 한층 더 악화시킬 뿐이고, 트럼프는 그 같은 한국의 허점을 집요하게 파고들 것이다.
셋째 투자액 문제다. 먼저 일본을 보자. 일본이 대규모 투자와 미국산 제품 구입을 제시한 가장 큰 이유는 농산물 관세 문제에 있다. 헷갈리기 쉬운데, 농산물 완전개방과 농산물 수입확대는 전혀 다른 개념이다. 농산물 완전개방은 양적인 차원만이 아니라, 농산물 관련 '관세 철폐'로 연결된다. 한국, 일본 두 나라는 미국산 농산물에 대한 수입쿼터와 관세를 부과하고 있다. 품목에 따라 다르지만, 쌀·소고기 같은 것은 수입량을 제한하고 관세도 부과하고 있다.
원래 트럼프는 농산물 완전개방을 요구했다. 관세도 없애고 수입량도 늘리라는 의미다. 일본 자민당은 지방과 농촌 지지에 기초하고 있다. 트럼프 요구를 들어줄 경우 무관세 입법을 추진해야만 한다. 국회에서 농산물 무관세 입법을 통과시켜야 하고, 그 과정에서의 야당의 비난이끓어오를 것이다. 자민당 자체가 갈라지면서 국민적 신뢰도 땅에 떨어질 것이 분명하다. 무려 6500억달러를 트럼프에게 바친 이유도 거기에 있다. 국회 동의를 필요로 하는 입법 제정을 피하면서 수입량만 늘리겠다는 약속에 대한 반대급부로 6500억달러를 투자하겠다고 약속한 것이다. 일본은 미·일 간 합의문서를 통해 미국산 쌀을 대폭 수입하기로 약속했다. 그러나 종래 받던 쌀에 대한 관세는 그대로 둔 수입이다.
갑작스럽게 튀어나온 국회 비준
한국은 어떨까? 일본 모델을 그대로 따라가면서 '3500억달러 + α'를 약속했다. 트럼프는 합의된 미·일 문서를 모델로 한국에 대한 미국산 농산물 개방을 요구한다. 그러나 지난 9월 16일 김민석 국무총리는 ""3500억달러 대미투자가 한국 국회 동의를 필요로 할 수 있다""고 말한다. 이재명 정부는 농산물 개방뿐만 아니라 대미 투자 전체를 국회 입법화 대상이라 말하면서 트럼프 공세에 맞선다. 일본은 그 같은 과정을 피하기 위해 6500억달러를 바쳤지만, 한국은 일본 모델에 근거해 거금을 제공하면서도 국회 동의에 매달리는 '다리가 꼬인 스텝'이 드러난 것이다.
이 시점에서 필자는 국회 동의를 염두에 뒀다면 왜 그 같은 거액을 투자하기로 덜컥 합의했는지가 궁금하다. 이재명 정부가 처음부터 국회 입법화를 필요로 한다는 점을 강조했을 경우, 한·미 관세협상 내용 자체가 달라졌을 것이다. 당초 일본 모델로 가다가 문서화 얘기가 나오자 '한국 독자 모델'로 급변한 식이다.
필자는 한국 정부의 협상 성공을 기원한다. 그러나 협상 과정을 보면 이미 백전백패로 흘러가고 있다. 이재명 정부의 대미 투자는 '국회 패스'를 전제로 한 양국 정부 사이 '딜'에 기초한 것이다. 그러나 문서화 문제가 나오면서 갑자기 국회 통과를 조건으로 달고 있다. 러트릭 미 상무부 장관이 한국 관료와 만난 뒤 '문서화 아니면 관세'로 나간 것은 당연한 결과다. 일본 경제계 분석에 따르면 25% 관세가 그대로 이어질 경우 하루 1억달러, 1년 365억달러의 관세가 한국 측에 떨어질 것으로 본다. 관세가 올라갈 경우 미국 내 한국제 물건의 가격도 왕창 올라간다. 15% 관세로 나아가는 일본제 자동차·반도체·철강 제품보다 더 비싸진다. 기묘하게도 '수천억 달러를 내느니 25% 관세로 버티자'는 주장이 흘러나오고 있다. 마치 1907년 국채보상운동에 준할 발상이지만, 고관세가 될 경우 미국 내 판매 자체가 어려워진다는 점은 간과하고 있다. 더불어 인도의 경우에서 보듯, 트럼프가 이런저런 이유를 붙여 25%가 아닌 50% 관세 인상으로 나아갈 수도 있다.
현재 전 세계 군사안보 관계자들의 눈은 워싱턴으로 집중되고 있다. 10월 초 발표될 미국 국가방위전략(NDS) 때문이다. 4년마다 발표되는 미국 군사안보 청사진으로 주한미군 문제도 담길 전망이다. 필자 판단이지만 관세협상이 진도 7 지진이라 할 때 NDS는 진도 10 지진으로 한반도에 밀려들 것이다. 이재명 정부는 트럼프와의 관세협상을 군사안보 문제와 연계하는, 이른바 '패키지 딜'로 대응하겠다고 공언해왔다. 여러 상황을 볼 때 한국에 떨어진 25% 관세가 '상당 기간' 일상화될 듯하다. 반미는 누구나 가능하고 가장 쉬운 대응방안이다. 하지만 한바탕 정신승리 외에 실제 남는 것은 없다. '초저속' 거꾸로 말 경주를 보면서 협상전략부터 전면 재고찰할 것을 권한다.",관세부과
