press,title,naver_news_text,naver_news_url,body,press_html,title_html,body_html,label
뉴스1,"韓 기업 2분기 매출 -0.7%, 1년 반 만에 역성장…美관세직격탄",네이버뉴스,https://n.news.naver.com/mnews/article/421/0008477380?sid=101,,뉴스1,2분기 기업 관세 직격탄…매출 줄고 이익률 1%p '뚝',"석유화학·자동차 부진에 제조업 매출 1.7%↓…반도체도 기저에 둔화
영업이익률 5.1%로 1년새 1.1%p↓…대기업 부진, 중기만 소폭 개선
도널드 트럼프 미국 대통령 ⓒ AFP=뉴스1
(서울=뉴스1) 김혜지 기자 = 올해 2분기 한국 기업들의 매출 증가율이 2년 만에 마이너스로 전환했다. 트럼프 행정부의 고율 관세 부과가 본격화하면서 자동차와 운송장비 업종이 직격탄을 맞았고, 석유화학과 기계·전기전자 업종도 부진을 면치 못했다.
영업이익률 등 기업 수익성도 동반 하락하며 대기업 위주의 수익 둔화가 뚜렷해졌다.
한국은행이 10일 발표한 '2025년 2분기 기업경영분석 결과'에 따르면 외부감사 대상 법인기업 2만 6000여곳의 매출액은 전년 동기 대비 0.7% 감소했다. 지난 1분기 2.4%에서 석 달 만에 마이너스로 돌아선 것이다.
기업 매출액 증가율이 이같이 낮아진 것은 지난 2023년 4분기(-1.3%) 이후 1년 6개월 만의 일이다. 매출 역성장 자체도 1년 6개월 만에 처음이었다.
업종별로 보면 제조업 매출 증가율은 1분기 2.8%에서 2분기 -1.7%로 급락했다.
특히 석유화학이 -1.9%에서 -7.8%로 낙폭을 키웠는데, 유가 하락과 설비 가동률 저하로 수출액이 줄어든 영향이었다. 기계·전기전자도 5.9%에서 2.2%로 둔화했으며, 이는 인공지능(AI) 투자 확대 덕에 고부가가치 반도체 수출은 호조였으나 지난해 같은 기간의 20%대 고성장에 따른 기저 부담이 크게 작용했다.
비제조업 매출도 1분기 1.9%에서 2분기 0.3%로 증가 폭이 축소됐다. 도소매업은 철강 트레이딩과 에너지 관련 수입 감소로 5.0%에서 2.0%로 둔화했고, 운수업은 운임 하락과 소액 면세 폐지 등에 5.6%에서 -0.5% 감소세로 돌아섰다.
매출 부진은 수익성에도 직결됐다. 전체 매출액 영업이익률은 1년 전(6.2%)보다 1.1%포인트(p) 떨어진 5.1%를 기록했다. 세전순이익률 역시 같은 기간 6.7%에서 5.3%로 낮아졌다.
제조업 영업이익률은 7.1%에서 5.1%로 하락했다. 자동차·운송장비는 트럼프 관세와 판촉 경쟁 탓에 7.6%에서 2.7%로 급락했고, 기계·전기전자는 재고자산평가손실 인식으로 10.2%에서 7.4%로 하락했다. 반면 전기가스업은 연료가격 안정으로 3.2%에서 5.0%로 높아지며 선방했다.
기업 규모별로는 대기업의 수익성 악화가 뚜렷했다. 대기업 영업이익률은 6.6%에서 5.1%로 떨어졌고, 중소기업은 전문 서비스업을 중심으로 4.4%에서 5.0%로 소폭 개선됐다.
안정성 지표의 경우 부채를 자본으로 나눈 값인 부채비율은 89.8%로 전분기(89.9%)와 유사했지만, 총자본 중 이자가 발생하는 외부조달 차입금이 차지하는 비중을 뜻하는 차입금의존도는 25.0%에서 26.6%로 높아졌다. 차입금의존도가 2015년 2분기(26.9%) 이후 10년 만에 최고치를 경신했다.
3분기 기업 실적은 관세 부과로 인한 부정적 영향이 예상됐다. 문상윤 한은 기업통계팀장은 ""관세 불확실성이 협상 타결로 완화됐지만 여전히 높은 수준을 이어가고 있고, 이로 인해 부정적인 영향이 예상된다""며 ""반도체의 기저효과는 해소될 것""이라고 말했다.",관세부과
중앙일보,석화 부진·관세직격탄…기업 1년반만에 역성장,네이버뉴스,https://n.news.naver.com/mnews/article/025/0003468191?sid=101,,중앙일보,"韓 기업 2분기 매출 -0.7%, 1년 반 만에 역성장…美 관세 직격탄","한국 기업의 올해 2분기 매출이 1년 전보다 줄었다. 미국발 관세의 충격에, 석유화학을 중심으로 한 산업 부진이 겹치면서다.
10일 한국은행이 발표한 올 2분기 ‘기업경영분석’에 따르면 전 산업 매출액은 전년 동기 대비 0.7% 감소했다. 외부감사 대상 기업(2만6067개) 중 4233개 기업을 표본 조사한 결과다. 1분기 2.4% 증가했던 것에서 뒷걸음질한 것인데, 기업 매출이 역성장한 건 2023년 4분기(–1.3%) 이후 처음이다.
경기 평택시 포승읍 평택항에 수출용 컨테이너들이 쌓여있는 모습. 뉴스1
매출액 증가율은 기업의 성장성을 가늠하는 핵심 지표다. 문상윤 한국은행 기업통계팀장은 “(미국이 부과한) 품목별 관세에 따라 철강이나 자동차 등에 직접적 영향이 있었고, 중국에 대한 관세 등 간접적인 영향도 있었을 것”이라고 분석했다.
업종별로 보면 제조업 매출이 1분기 2.8% 증가에서 2분기 1.7% 감소로 꺾였다. 석유화학 업종은 국제 유가 하락과 설비 가동률 저하로 수출이 줄며 매출이 7.8% 쪼그라들었다. 기계·전기전자 매출도 1분기 5.9%에서 2.2%로 상승 폭이 줄었다. 문 팀장은 “인공지능(AI) 투자 확대에 따른 고부가가치 제품군은 수출 호조를 보였지만, 지난해 같은 기간 높은 증가율(20.7%)에 따른 기저효과도 있었다”고 설명했다.
비제조업 매출 상승률도 1분기 1.9%에서 0.3%로 둔화했다. 미국의 고율 관세 부과로 철강 교역이 위축된 데다, 유가 하락과 관세 여파로 에너지 관련 수입이 줄어든 영향이 도소매업까지 미쳤다. 운수업은 해상운임지수 하락과 소액면세제도 폐지에 따른 전자상거래 감소 등으로 타격을 받았다.
기업 수익성 지표도 악화했다. 매출액 영업이익률은 지난해 2분기 6.2%에서 올해 2분기 5.1%로 떨어졌다. 100원어치 물건을 팔아 남긴 이익이 5원 남짓한 수준으로 줄었다는 의미다. 제조업 영업이익률도 같은 기간 7.1%에서 5.1%로 낮아졌다. 특히 운송장비 업종은 트럼프 행정부의 관세 부과와 판촉 경쟁 심화로 7.6%에서 2.7%로 급락했다. 기계·전기전자는 일부 기업의 재고자산 평가손실이 반영되면서 10.2%에서 7.4%로 줄었다.
재무 안정성은 비슷했다. 기업 평균 부채비율은 89.8%로 전 분기(89.9%)와 차이가 없었다. 다만 총자본에서 차입금이 차지하는 비중인 차입금 의존도는 25%에서 26.6%로 올랐다. 2015년 2분기(26.9%) 이후 10년 만의 최고치다. 기업이 돈을 벌어 자본을 늘리기보다는 빚에 의존해 자금을 충당하고 있다는 의미다.
문 팀장은 “미국과의 관세 협상이 타결되긴 했지만, 불확실성은 여전히 높다”며 “(3분기에도) 부정적 요인이 있을 것 같지만 크기를 판단하기는 어렵다”고 설명했다.",관세부과
서울경제,"[로터리] 美관세대응, 해답은 현장에",네이버뉴스,https://n.news.naver.com/mnews/article/011/0004531453?sid=101,,서울경제,"[로터리] 美관세 대응, 해답은 현장에","강경성 KOTRA 사장
[서울경제]
산업통상자원부와 KOTRA가 지난달 말 말레이시아와 인도네시아에서 개최한 관세 대응 설명회를 찾았다. 두 나라는 글로벌 사우스의 핵심 거점이자 우리 기업이 주목하는 대체 시장이다. 미국이 이들을 포함한 아세안 주요국에 19% 이상의 비교적 높은 상호관세를 부과해 현지에 진출한 기업들은 대응 전략을 찾느라 분주했다.
미국의 고관세 조치는 현지 진출 기업에 직·간접적 영향을 미치고 있다. 미국은 특히 아세안 지역의 중국 우회 수출에 대한 환적 모니터링도 강화하며 최대 40%의 추가 관세를 경고했다. 이 때문에 말레이시아나 인도네시아에 진출한 기업들은 거래 지연, 주문 감소, 원자재 조달 차질 등의 어려움을 토로했다. 관세는 특정 국가의 문제만이 아니고 전 세계 공급망을 덮친 불확실성의 파도였다.
현장을 찾을 때마다 절감하는 것은 아무리 훌륭한 대책도 기업이 모르거나 활용하지 못하면 소용이 없다는 사실이다. KOTRA는 올 초부터 ‘관세대응 119’ 종합지원센터를 통해 7000건 넘는 상담을 이어왔고 국내·외에서 50여차례 설명회를 열며 기업과 접점을 넓혀왔다. 이제관세 부담이 실제 발생하는 시점이어서 더욱 정밀한 맞춤형 지원이 필요한 때다.
가장 시급한 과제는 물류다. 쿠알라룸푸르에서 만난 한 유통기업 대표는 “미국의 관세 발표와 유예, 변경이 반복되면서 보세창고 수요가 폭증했다”고 전했다. 보세창고는 세금을 당장 납부하지 않고 물품을 보관할 수 있어, 하루 이틀 차이로 발생하는 관세 부담을 줄여준다. 실제로 한 중소기업은 보세창고를 활용해 관세 협상 타결까지 바이어와 협상을 유예시켰고 납기 차질없이 거래를 이어갈 수 있었다고 한다. 물론 보세창고를 활용하거나 바이어의 관세 전가 등에 대응하다 보면 물류비 부담은 늘어날 수 있다. KOTRA는 이에 관세 대응 바우처를 통해 국제운송 지원 한도를 6000만 원까지 2배로 늘리고 수출물류 협업 네트워크를 확장해 놓고 있다.
기업들이 유용하다고 평한 또 다른 지원책은 미국 관세청(CBP)의 ‘사전 심사제도(e-ruling)’ 대행 서비스다. 이는 수출 전에 원산지를 한국산 등 관세에 유리한 지역으로 인정받아 리스크를 최소화하는 제도다. 절차와 서류 준비가 까다롭지만, 원산지 사전 판정을 받으면 통관 지연을 줄여 수출길이 한층 수월해진다. 일례로 국산과 중국산 원재료를 혼합해 완제품을 생산하는 중견기업 A사는 이 제도를 활용해 원산지를 한국산으로 판정받고자 KOTRA의 문을 두드렸다. KOTRA는 한국원산지정보원, 관세법인과 협력해 사전심사 컨설팅과 대행 서비스를 확충하고 있으며 현장 애로를 바탕으로 기업이 체감할 수 있는 실질적 지원을 강화해 나가고자 한다.
이런 노력들은 정부가 이달 초 발표한 ‘미국 관세 협상 후속 지원책’과 맞물려 있다. 정부의 금융 지원에 더해 기존의 관세 119 지원체계를 확장해 기업 현장의 애로사항들을 끝까지 해결하는 것이 목표다. 관세 등 무역환경 변화로 인한 불확실성을 줄이고, 실제 수출비용 경감, 수출 마케팅을 뒷받침하는 것이 KOTRA의 역할이다.
관세라는 거대한 파고를 이겨내려면 그 속살을 샅샅이 파악해야 한다. 수출품이 항구를 떠나 고객 손에 닿기까지 수많은 절차를 거쳐야 하고 그 길목마다 관세는 기업에 짐을 얹고 있다. KOTRA는 수출 현장에서 포착되는 애로에 귀 기울여 그 부담을 함께 지고 덜어주면서 기업이 관세 파고를 넘어서는 데 동반자가 될 것이다.
강경성 KOTRA 사장",관세부과
매일경제,트럼프 시대 끝나도관세전쟁은 계속…한국 경고음 커졌다,네이버뉴스,https://n.news.naver.com/mnews/article/009/0005556336?sid=101,,매일경제,트럼프 시대 끝나도 관세 전쟁은 계속…한국 경고음 커졌다,"세계지식포럼 지난 9일 개막
10일, 월터 뉴욕대 교수 연설
관세와 무역전쟁의 미래 세션
관세 정책, 쉽게 안 사라질듯
관세수입 연간 800억 달러
10일 ‘제26회 세계지식포럼(WKF)’이 열린 서울 중구 신라호텔에서 잉고 월터(맨 왼쪽) 교수와 패널들이 ‘관세와 무역전쟁의 미래’라는 주제로 대담을 나누고 있다. [안서진 기자]
“우리는 이제 무역의 중요성과 그것이 우리에게 미치는 영향을 다시 배워야 할 운명에 처해 있다.”
잉고 월터 뉴욕대학교 교수는 10일 서울 중구 장충아레나에서 개최된 ‘2025 세계지식포럼(WKF)’에서 미중 무역갈등의 새로운 국면과 그로 인한 글로벌 무역 환경의 불확실성 심화를 경고했다.
월터 교수는 “트럼프 행정부 출범 이후 무역정책 불확실성이 유례없이 급증했으며 이번 무역전쟁은 과거 2018~2019년과는 달리 광범위하고 변동성이 매우 크다”며 “기업들은 급격한 관세 변동성 때문에 공급망 재편에 신중해지는 상황이고 미국의 구매력 우위가 세계 물가 하락 효과를 낳는 ‘도둑 전략’으로 작동하고 있다”고 진단했다.
이같은 ‘도둑 전략’은 미국이 대규모 시장 지위를 바탕으로 수입품에 높은 관세를 부과해 상대 국가로부터 경제적 이익을 빼앗는 동시에 자국 내 소비자에게는 가격 안정 혹은 하락 효과를 가져다주는 방식이다.
특히 미국의 관세 정책이 정치적 인기, 막대한 관세 수입, 강력한 기득권 세력 그리고 안보 우려 등으로 인해 쉽게 사라지지 않을 것이란 전망도 나왔다. 실제 트럼프 정부의 관세 수입은 1년간 약 800억 달러에 달해 미국 국무부 예산 규모를 뛰어넘는 수준이다.
정치적 도구∙재정수입원 된 美관세...각국, 전략적 활용해야
웬디 커틀러 아시아소사이어티 정책연구소 부소장은 “미국의 관세 부과가 단순한 무역정책을 넘어서 정치적 도구이자 재정 수입원으로 자리 잡았다”며 “미국 내 오래된 관세 정책, 예를 들어 1930~60년대 도입된 ‘설탕세’, ‘치킨세’ 등이 현재까지 유지되는 것은 강력한 기득권 세력이 존재하기 때문”이라고 설명했다.
그는 “팬데믹 이후 세계 각국과 다국적기업이 공급망의 회복력을 강화하려는 움직임도 증가하고 있다”며 “이에 따라 중국이 브릭스(BRICS)와 상하이협력기구(SCO)를 통해 미국 중심의 금융·무역 체제에서 독립하려는 노력이 확대되고 있다”고 부연했다.
이날 세션에서는 글로벌 무역체계의 미래를 위해 각국이 자국만의 ‘카드’를 면밀히 분석하고 전략적으로 활용하는 게 필요하다는 조언도 나왔다. 미국 안보에 깊이 의존하는 한국과 같은 국가는 무역 정책뿐 아니라 안보 차원에서도 균형 잡힌 전략 마련이 중요하다는 설명이다.
커틀러 부소장은 “국제 무역의 현재 갈등은 단순한 경제 이슈를 넘어 안보, 투자, 그리고 사회적 가치까지 포함하는 복합적인 문제로 발전하고 있다”며 “한국이 이러한 복합적인 도전에 직면한 만큼 다각적인 국제 협력과 내실 있는 정책 대안을 통해 지속가능한 성장 기반을 마련해야 한다”고 말했다.
김명수 매경AX 대표(오른쪽)가 잉고 월터 뉴욕대 교수(가운데), 정은성 에버영코리아 대표(왼쪽)와 기념사진 촬영을 하고 있다. [안서진 기자]
마지막으로 월터 교수는 변화하는 글로벌 무역 환경에 맞서 한국 경제가 전략적 대응을 강화해야 한다고 주문했다.
그는 ESG(Environment·Social·Governance, 환경·책임·투명경영) 경영을 불확실성 대응의 해법 중 하나로 꼽으며 “ESG의 중요성이 커지는 가운데 한국 기업과 정부는 지속가능한 성장 전략을 위해 ESG 경영의 내실화를 서둘러야 한다”고 역설했다.
그는 “투자자와 소비자의 요구가 단순 수익을 넘어 사회적 책임과 환경 문제를 포함하면서 기업 경쟁력 제고와 시장 신뢰 확립을 위해 ESG 체계 강화를 반드시 추진해야 한다”고 덧붙였다.",관세부과
연합뉴스,"美서 철강관세인하 시위 포항시장 ""관세타격 각국 도시와 연대""",네이버뉴스,https://n.news.naver.com/mnews/article/001/0015617702?sid=102,,연합뉴스,"美서 철강 관세인하 시위 포항시장 ""관세타격 각국 도시와 연대""","귀국 기자간담회 열어 심정 토로
이강덕 포항시장
[포항시 제공. 재판매 및 DB 금지]
(포항=연합뉴스) 손대성 기자 = 이강덕 경북 포항시장은 미국에서 철강 관세 인하 시위를 벌인 것과 관련, ""바위에 계란 치기라도 계속 해야 하는 심정""이라고 밝혔다.
이 시장은 10일 시청에서 귀국 기자간담회를 통해 ""답답한 것은 우리인데 가만있으면 되느냐. 어떠한 노력이라도 해야 하는 것 아니냐""고 말했다.
그는 ""이번에 미국을 방문해 시위하면서 철강 관세와 관련한 절실함을 국민과 미국 사회에 알릴 수 있었다""며 ""국익에 배치되지 않는다면 적극 활동해야겠다고 느꼈다""고 털어놓았다.
미국이 고율의 철강 관세를 부과하면서 철강도시인 포항뿐만 아니라 인접 국가인 캐나다와 멕시코도 타격을 입고 있다.
이 시장은 ""파악해보니 캐나다 윈저시의 시장도 관세와 관련해 메시지를 많이 냈다""며 ""앞으로는 이처럼 관세로 타격을 입은 도시와 국제적으로 연대하고 화상회의를 함께 열어 대응하는 방안을 검토하고 있다""고 강조했다.
이 시장을 비롯한 포항시 대표단은 지난 1일과 2일 미국을 방문해 워싱턴DC 백악관과 국회의사당 앞에서 철강관세 인하를 호소하는 현수막을 들고 시위를 벌였다.
백악관 앞에서 시위하는 포항시장
(포항=연합뉴스) 이강덕 경북 포항시장이 1일(현지시간) 미국 워싱턴D.C. 백악관 앞에서 철강관세 인하 촉구 캠페인을 하고 있다. 2025.9.2 [포항시 제공. 재판매 및 DB 금지] sds123@yna.co.kr
sds123@yna.co.kr",관세부과
뉴시스,"日도요타,관세대응 美생산 재편…하이브리드차 증산",네이버뉴스,https://n.news.naver.com/mnews/article/003/0013472508?sid=104,,뉴시스,"日도요타, 관세 대응 美생산 재편…하이브리드차 증산","고급차 렉서스 미 생산은 줄여
[켄터키=AP/뉴시스]일본 도요타 자동차는 미국의 고관세 정책 아래 수익 확보를 위해 현지 생산 체제를 재편한다고 10일 니혼게이자이신문(닛케이)이 보도했다. 사진은 2010년 1월 27일 미국 켄터키주 조지타운에 있는 일본 도요타자동차 제조 공장 입구 앞을 한 자동차가 지나가고 있는 모습. 2025.09.10.
[서울=뉴시스] 김예진 기자 = 일본 도요타 자동차는 미국의 고관세 정책 아래 수익 확보를 위해 현지 생산 체제를 재편한다고 10일 니혼게이자이신문(닛케이)이 보도했다.
신문에 따르면 도요타는 미국에서 판매하는 렉서스의 생산 거점을 2곳에서 1곳으로 줄이고, 관세 영향을 크게 받는 하이브리드차(HV) 생산은 늘리기로 했다.
도널드 트럼프 미국 행정부는 지난 4월 미국이 수입하는 자동차에 대해 25% 추가 관세를 부과하기 시작했다.
미일 관세 합의에 따라 지난 4일 미 대통령령이 발표돼, 일본산 자동차 관세는 15%까지 떨어진다. 그러나 트럼프 행정부가 출범하기 전인 기존 2.5%의 6배에 달하는 고관세다.
도요타의 고급차 라인인 렉서스는 값이 비싸도 팔리기 때문에 일본에서 수출해도 현재로서는 채산성을 확보할 수 있다. 그러나 비교적 값이 저렴한 하이브리드차는 관세로 인한 영향을 받기 쉽다. 관세로 가격이 상승하기 쉽다는 뜻이다.
이에 따라 도요타는 미국에서의 생산을 재편해 관세에 대응할 수 있는 체제로 정비할 필요가 있다고 판단했다.
도요타는 현재 미국 켄터키주에서 렉서스 세단 ES, 인디애나주에서는 대형 SUV TX를 생산하고 있다.
도요타는 일단 이미 수주를 받은 만큼만 생산한 후 켄터키주에서의 렉서스 세단 ES 생산을 종료하기로 했다. 내년에 새롭게 발표할 차기 렉서스 모델은 일본에서 생산해 미국으로 수출하기로 했다. 이로써 미국에서의 렉서스 생산공장은 인디애나주 거점만 남게 된다.
이와는 별도로 렉서스 라인 2개 차종을 생산하는 캐나다 공장에서의 생산은 계속한다. 도요타 미국 법인은 신문에 “가격대에 따라 최적의 생산 거점을 결정하고 있다”고 밝혔다.
도요타 외에도 일본 자동차 기업들은 미국 관세 대책에 나서고 있다.
닛산자동차는 미국 시장 주력 자동차인 SUV ‘로그’의 일본 생산을 일부 미국 생산으로 전환했다.
마쓰다자동차는 지난 3일 북미에서의 SUV CX-5 등 일부 차종의 판매가격을 인상했다．",관세부과
파이낸셜뉴스,관세리스크·석화 부진… 기업 매출 6분기만에 '뒷걸음' [짙어지는 경기...,네이버뉴스,https://n.news.naver.com/mnews/article/014/0005404918?sid=101,,파이낸셜뉴스,관세 리스크·석화 부진… 기업 매출 6분기만에 '뒷걸음' [짙어지는 경기침체 그림자],"한은, 외감 기업 2만6천곳 분석
2분기 전체 매출 증가율 -0.7%
제조업 -1.7%… 비제조업 0.3%
수익성 지표도 동시에 나빠져
영업이익률  1.1%p 내린 5.1%
지난 2·4분기 국내 기업들의 매출액 증가율이 6개 분기 만에 처음으로 역성장했다. 미국 트럼프 행정부의 관세정책 영향으로 제조업 부진이 심화한 가운데 특히 석유화학 매출이 전 분기보다 8% 가까이 감소한 때문이다. 기업의 수익성을 나타내는 매출액 대비 영업이익률도 3개월 사이 1%p 넘게 하락하면서 국내 경제의 기초체력이 흔들리고 있다는 지적이 나온다.
한국은행이 10일 발표한 '2025년 2·4분기 기업경영분석 결과'에 따르면 외부감사 대상 법인기업 2만6067개(제조업 1만2962개·비제조업 1만3105개)의 매출액 증가율은 -0.7%로 전 분기(2.4%) 대비 하락 전환했다. 지난 2023년 4·4분기(-1.3%) 이후 6개 분기 만에 첫 하락 전환이자, 최저치다.
미국의 관세정책 영향이 본격화된 결과다. 문상윤 한은 기업통계팀장은 ""품목별 관세에서 우리나라가 직접 영향을 받은 철강, 자동차 부문은 부정적인 영향이 없다고 보기 힘들다""며 ""중국에 대한 관세 조치 등도 간접적으로 영향을 끼쳤다""고 설명했다. 이어 ""석유화학 업황이 부진하고 건설경기가 둔화한 것도 전반적으로 영향을 미쳤다""고 덧붙였다.
업종별로 보면 제조업의 매출액 증가폭(-1.7%) 하향이 두드러졌다. 국제유가 하락과 설비가동률 하락에 따른 수출액 감소로 석유화학(-7.8%)이 크게 부진했다. 인공지능(AI) 투자 확대에 따른 수출 호조에도 전년 동기의 높은 매출액 증가율(20.7%)에 따른 기저효과로 기계·전기전자(2.2%)도 증가폭이 큰 폭으로 축소됐다.
비제조업도 매출액 증가폭(0.3%)이 전 분기(1.9%)보다 하락했다. 철강 트레이딩, 에너지 관련 수입로 도소매업(2.0%)이 부진하고, 해상운임지수 하락과 소액면세제도 폐지에 다른 전자상거래 감소로 운수업(-0.5%)도 하락 전환했다.
기업규모별로 보면 대기업의 매출액 증가율은 전 분기 2.6%에서 2·4분기 -0.6%로, 중소기업은 같은 기간 1.4%에서 -1.3%로 각각 낮아졌다.
수익성 지표도 둔화됐다. 조사대상 기업의 2·4분기 매출액 대비 영업이익률은 5.1%로 지난해 2·4분기(6.2%)보다 1%p 넘게 떨어졌다. 지난해 4·4분기(4.1%) 이후 최저치다. 세전 순이익률(5.3%)도 같은 기간 1.4%p 하락하며 2024년 4·4분기(2.7%) 이후 최저치를 기록했다.
특히 운송장비 상승폭이 미국의 관세 부과 영향으로 전년 동기 7.6%에서 올해 2·4분기에는 2.7%로 쪼그라들었다. 운수업도 해상운임 하락 등에 따른 매출 감소로 고정비 부담이 증가하면서 같은 기간 성장폭이 9.1%에서 7.0%로 둔화됐다.
기업 규모별로 보면 대기업의 수익성 악화가 뚜렷했다. 대기업 영업이익률이 6.6%에서 5.1%로 떨어진 가운데, 중소기업은 전문 서비스업을 중심으로 4.4%에서 5.0%로 소폭 개선됐다.
악화된 수익성은 이자보상비율에도 영향을 끼쳤다. 기업 전체의 이자보상비율은 6월 말 기준 323.5%로, 전년 동기(418.2%) 대비 크게 하락했다.
문 팀장은 3·4분기 전망과 관련해 ""관세협상 타결에도 여전히 불확실성이 높은 상태""라며 ""자동차 산업의 경우 기업들의 수출 다변화 노력 등에 따라 관련 지표가 달라질 수 있다""고 설명했다.
그러면서 ""업황 자체가 좋은 반도체의 경우에도 향후 관세 부과 가능성도 남아 있어 상·하방 요인이 모두 있다""며 ""석유화학 부문의 부진은 단기간에 해결될지 미지수인 만큼 모니터링이 필요하다""고 진단했다.
안정성 지표는 전 분기와 비슷한 수준을 유지했다. 부채비율은 1·4분기 89.9%에서 2·4분기 89.8%로 소폭 하락했다. 지난해 3·4분기(87.8%) 이후 최저치다. 차입금 의존도는 같은 기간 25.0%에서 26.6%로 상승했다. 2015년 2·4분기(26.9%) 이후 제일 높다.
eastcold@fnnews.com 김동찬 기자",관세부과
