press,title,naver_news_text,naver_news_url,body,press_html,title_html,body_html,label
매일경제,미국 으름장에 통상본부장 빈 손 귀국…‘50%관세’ 철강업계는 불안감...,네이버뉴스,https://n.news.naver.com/mnews/article/009/0005561876?sid=101,,매일경제,미국 으름장에 통상본부장 빈 손 귀국…‘50% 관세’ 철강업계는 불안감 증폭,"공항 나서며 답변하는 여한구 통상교섭본부장 [사진 = 연합뉴스]
한미 관세협상 후속 협의를 위해 미국을 찾았던 여한구 산업통상자원부 통상교섭본부장이 19일 새벽 사실상 ‘빈손’으로 귀국했다. 김정관 산업부 장관에 이어 여 본부장까지 나서 미국 통상당국과 연쇄 회담을 했지만 한미 양국의 합의점을 찾지 못했다. 한미 협상이 장기화할 조짐에 국내 수출 기업들의 불안감도 가중되고 있다.
이날 통상당국에 따르면 이번 회담에서도 한미 양국은 3500억달러 규모의 금융 패키지 구성과 운영 방식을 두고 접점을 찾지 못했다. 미국은 일본처럼 한국이 직접 출자하는 형태로 펀드를 조성해야 한다는 입장인 반면, 한국은 대출·보험·보증 등으로 구성되는 금융 패키지 형태를 고수하고 있다.
한국 정부는 일본처럼 미국이 원할 때 원하는 만큼 자금을 조달해야 할 경우 한국 외환시장이 버티기 어려울 것이라는 입장을 전달한 것으로 알려졌다. 이날 여 본부장은 기자들과 만나 “일본과 한국은 다르다는 부분을 여러 가지 객관적 자료와 분석을 제시하며 최대한 설득하고 있다”고 설명했다.
정부는 미국 측에 무제한 통화스왑을 요청하는 등 협상 세부 사항을 하나하나 조율하고 있는 것으로 알려졌다. 아울러 미국이 한국의 무제한 스왑 요구를 거부하면 통화스왑 범위를 조정할 가능성까지 열어둔 것으로 전해졌다.
협상 장기화에 우리 수출 기업의 불안감은 더욱 가중되는 형국이다. 특히 철강에 부과된 50%의 관세는 협상 테이블에조차 오르지 못한 만큼 국내 산업을 보호하기 위한 대책 마련이 시급하다.
이날 김 장관은 경북 포항시 포스코를 찾아 “대미 관세협상에서 철강 관세 면제를 강하게 요구했지만 관철이 어려웠던 점에 대해 업계의 이해를 구한다”며 “미국 측과 관세 완화 협의를 지속하고 관세 후속 지원 대책 이행, 우회 덤핑 등 불공정 수입재 방어도 적극 추진해나겠다”고 밝혔다.
정부는 철강 기업과 금융권, 정책금융기관이 참여하는 ‘철강 수출 보증상품’을 신설해 4000억원의 지원 효과를 내겠다는 구상이다. 앞서 자동차업계도 현대자동차가 민간 기업 최초로 무역보험기금에 100억원을 출연했고, 한국무역보험공사는 자동차 부품 협력사에 6300억원 규모의 ‘수출 공급망 강화보증’을 제공하기로 했다.
이에 대해 철강업계는 근본적 해법이 될 수 없다며 아쉽다는 반응을 보이고 있다. 앞서 미국 정부는 지난 3월 자국으로 수입되는 철강·알루미늄 제품에 25%의 품목관세를 부과한 데 이어 6월부터는 관세율을 50%로 대폭 높였다. 이 때문에 대미 수출 의존도가 높은 국내 철강업계는 중국산 제품의 ‘저가 공세’, 공급과잉 사태 등과 맞물려 큰 어려움에 직면했다.
한 철강업계 관계자는 “현재 철강 수출 기업에 가장 실질적으로 필요한 지원은 관세를 낮추는 것”이라며 “과거처럼 일부 품목이라도 쿼터제를 적용하는 등 추가적인 대미 협상이 필요하다”고 밝혔다.
수출 보증상품의 실효성에 대해서도 평가가 엇갈린다. 한 철강업계 관계자는 “아직 세부적 내용이 나오지 않아 조심스럽지만 일부 업체만 혜택을 볼 수 있다는 의견이 벌써 나오고 있다”며 “보증 담보를 위한 예산 역시 결국 업계가 분담하게 될 것이기 때문에 얼마나 큰 도움이 될지 의문”이라고 말했다.",관세부과
더스쿠프,美 자동차관세'한·일 역전'… 수출 한국號에 필요한 플랜B 세워야,네이버뉴스,https://n.news.naver.com/mnews/article/665/0000005835?sid=101,,더스쿠프,美 자동차 관세 '한·일 역전'… 수출 한국號에 필요한 플랜B 세워야,"더스쿠프 양재찬의 프리즘
美 자동차 관세율 한국 · 일본 역전
대미 수출 1위 품목 자동차 타격
한국 수출 전체에 악영향 불가피
李 외교 협상 '3不 원칙' 천명
외교력 총동원해 국익 지켜내야
한미 양국이 관세협상을 두고 합의점을 찾지 못하고 있다. 그럴수록 정부는 플랜B도 대비하며 냉철하고 차분히 협상에 임해야 할 것이다.[사진 | 뉴시스]
미국이 16일부터 일본산 자동차에 대한 관세를 기존 27.5%에서 15%로 낮췄다. 이와 달리 한국은 관세율을 15%로 낮추기로 미국과 합의하고도 후속 협상이 교착 상태에 빠지며 25%로 유지되고 있다. 게다가 도널드 트럼프 대통령은 ""반도체ㆍ의약품 관세는 자동차 관세보다 더 높을 수 있다""며 엄포를 놓는 등 대미對美 수출전선이 불안하다.
한국산 자동차는 올해 3월까지만 해도 한미 자유무역협정(FTA)에 따른 무관세 혜택을 누렸다. 기본관세(2.5%)가 적용된 일본산에 비해 가격경쟁력이 있었다. 하지만 이제 낮아진 일본차 관세로 한국차는 힘든 경쟁을 하게 됐다.
그동안 일본보다 2.5%포인트 '관세 우위'에 있었던 것이 10%포인트 '관세 열세'로 바뀌면서 한국차 가격이 상대적으로 비싸지게 됐다. 관세 부담이 반영되면 지금까지 1700달러 낮았던 현대차 쏘나타의 미국 판매가격이 경쟁 차종인 도요타 캠리보다 775달러 높아진다고 한다.
한국의 대미 수출 1위 품목인 자동차가 큰 타격을 입을 것이다. 미국이 국가안보 위협을 이유로 자동차 및 부품에 25% 관세를 부과한 지난 4월 이후 대미 자동차 수출이 뒷걸음쳤는데 엎친 데 덮친 격이다.
대미 자동차 수출은 4~6월 석달 연속 두자릿수 감소율을 나타냈다. 7월에 4%대 감소로 선방하는 듯했으나 8월에 15%로 다시 감소폭이 커졌다. 한일 관세 역전이 현실화한 9월 이후 상황은 더 나빠질 것이다. 특히 최근 판매 비중이 커진 고수익 차종인 하이브리드차(HEV) 시장 피해가 클 수 있다. 미국 HEV 시장에서 일본차 비중은 이미 절반을 넘어섰다.
[사진 | 뉴시스]
자동차가 한국 수출에서 차지하는 비중은 35%로 막대하다. 글로벌 침체로 반도체 수출이 급감할 때 자동차가 이를 상쇄하며 '수출 한국호號'를 지켰는데 여의치 않게 됐다. 트럼프 정부의 관세 차별은 대미 자동차 수출뿐만 아니라 우리나라 수출 전체에 영향을 미치는 구조다. 정부와 기업이 함께 슬기로운 해결책을 찾아내야 한다.
자동차 관세 문제는 미국과 한국 정부가 관세협상에 합의해야 풀릴 수 있다. 문제는 급하다고 일본처럼 미국의 요구를 전부 수용할 수 없다는 점이다. 일본은 5500억 달러 규모 대미 투자에 대한 이익의 90%를 미국이 갖는 조건에 서명했다.
일본의 대미 투자는 트럼프 대통령 임기 내 이뤄져야 하고, 트럼프가 투자처를 지정하면 45일 안에 자금을 대는 내용도 포함됐다. 이를 이행하지 않으면 미국이 관세를 올릴 수 있다는 조항까지 들어갔다.
일방적으로 미국에 유리한 내용이다. 미국은 한국이 약속한 3500억 달러 투자를 두고도 일본 방식대로 하자고 압박한다. 한국의 외환보유액은 4160억 달러 수준이다. 외환보유액의 80%를 넘는 금액을 미국에 백지수표로 건네라는 것은 말이 안 되는 약탈적인 요구다. 우리는 당초 3500억 달러의 5% 정도만을 현금으로 미국에 투자하는 방안을 고려하고 있었다. 나머지는 지급보증과 대출금이었다.
이재명 대통령은 취임 100일 기자회견에서 외교 협상의 '3불不 원칙'을 천명했다. 이면 합의, 국익에 반하는 협상, 공정성ㆍ합리성에 어긋나는 협상은 하지 않겠다는 대국민 선언이었다. 이 대통령은 18일 공개된 미국 타임지 인터뷰에서 대미 투자와 관련해 ""(미국 요구대로) 그대로 합의했다면 탄핵 당했을 것""이라고 말했다.
정부는 시한에 쫓기지 말고 외교력을 총동원해 국익을 지켜내야 한다. 기업의 피해도 최소화해야 한다. 플랜B도 대비하며 냉철하고 차분히 협상에 임해야 할 것이다. 미국이 바라는 조선업 협력, 마스가(MASGA) 프로젝트를 지렛대로 삼을 필요가 있다.
사전 협의나 경고도 없이 동맹국의 대미 투자현장을 급습해 공장건설 일정을 맞추기 위해 땀 흘리는 한국인 근로자들을 구금한 사태에 대한 진정성 있는 사과를 요구해야 한다. 아울러 재발 방지 약속과 함께 한국인 전문직 근로자를 위한 전용 비자 정책의 수립도 요구해야 할 필요성이 있다.
낮아진 일본차 관세로 한국차는 힘든 경쟁을 하게 됐다.[사진｜뉴시스]
10월 31일 경주에서 열리는 글로벌 이벤트, 아시아·태평양경제협력체(APEC) 정상회의를 적극 활용하자. 트럼프 미국 대통령과 시진핑 중국 국가주석이 방한해 한중 정상회담과 미중 정상회담이 성사되면 세계의 이목이 한국에 집중될 것이다. 이는 곧 우리의 외교 공간을 넓히는 기회가 될 수 있다.
미국과의 관세협상이 장기화할 것에 대비해 대체 수출시장도 적극 발굴해야 한다. 그나마 다행스러운 것은 대미 수출 감소에도 전체 자동차 수출은 석달째 증가했다는 사실이다. 8월 자동차 수출액이 역대 최대를 기록한 것은 유럽연합(EU), 아세안, 중동, 호주 시장에서 선전한 덕분이다.
이참에 미국의 변칙 플레이에 휘둘리지 않도록 신시장 개척에 공을 들여 안전장치를 마련해 둬야 할 것이다. 미중 패권 다툼이 언제 끝날지 모르는 상황에서 '수출 다변화'는 매우 효과적이고 미래지향적인 대비책이다.
양재찬 더스쿠프 편집인
jayang@thescoop.co.kr",관세부과
뉴스웍스,"美 투자하라면서…트럼프, 전문비자 수수료 1인당 연 1.4억원부과",,,,,,,관세부과
글로벌이코노믹,"韓, 美 자동차관세문제 ""신속 해결"" 총력",,,,,,,관세부과
데일리메디,"""K-의료기기, 美 진출 최대 변수는 승인 아닌관세""",,,,,,,관세부과
파이낸셜투데이,"현대차,관세·투자 이중 압박…재무부담 관리 능력 시험대",,,,,,,관세부과
매일경제,현실화되는 미란보고서..한미관세협상 해법도 여기에 있다[노영우의 스...,네이버뉴스,https://n.news.naver.com/mnews/article/009/0005561913?sid=101,,매일경제,현실화되는 미란보고서..한미 관세협상 해법도 여기에 있다[노영우의 스톡 피시],"한미 관세협상이 교착상태에 빠졌다. 한미 간 협상이 결렬되면 그 파장은 관세에만 그치지 않는다. 방위비 문제, 미군 문제 등 한국과 미국은 풀어야 할 과제들이 첩첩산중이다. 첫 단추부터 잘못 꿰면 훗날 파장이 어디까지 번질지 예측하기 어렵다. 참고할 만한 내용이 미란보고서에 있다.
가장 주목받는 트럼프의 경제책사 스티브 미란
트럼프 정부 들어서 가장 주목받는 인물이 스티브 미란이다. 미란은 2024년 11월 허드슨베이캐피털 전략담당자로 근무하면서 ‘글로벌 무역시스템 재구성 사용자 가이드’라는 보고서를 냈다. 이 보고서에 트럼프가 꽂혔다. 트럼프 정부 들어 그는 승승장구하고 있다.
3월에 백악관 경제자문위원회(CEA)위원장으로 선임된데 이어 8월에는 미국 연방준비제도(Fed) 이사로 지명됐다. 백악관과 연준을 오가며 실물과 금융에 걸쳐 종횡무진 활약 중이다. 특히 트럼프 정부가 미란 보고서의 내용과 유사한 정책을 추진하면서 각별한 관심을 모은다.
미란의 아이디어는 어찌 보면 단순하다. 미국의 재정적자와 무역적자 문제를 풀기 위해서는 관세를 무기로 다른 나라로부터 자금을 끌어와야 한다는 것이다. 미란은 보고서에서 관세를 깎아주는 대가로 미국이 발행하는 100년 만기 채권을 다른 나라가 인수하는 방식을 제기했다. 100년 만기 영구채를 인수하는 것은 사실상 미국에 자금을 헌납하는 것이다. 미란은 이 과정에서 미국의 군사력과 정치·외교력을 최대한 활용해야 한다고 했다.
미란의 아이디어가 구현된 대표적인 사례가 트럼프가 2025년 진행한 무역협상이다. 미국은 2025년 상반기 주요국들을 상대로 무역협상을 진행했다. 협상 진행과정은 이렇다. 미국은 2025년 4월 국제비상경제권한법(IEEPA)에 따른 국가비상사태를 선포하고 각국에 10~50%의 상호관세를 부과한다고 발표했다.
실현되는 미란의 아이디어
상호관세율 결정 방식은 해당 국가의 대미 수출총액에 대한 대미 무역흑자 비율을 기준으로 계산됐다. 예를 들어 한국의 경우 2024년 대미 무역수지가 약658억 달러 흑자를 기록했다. 또 한국의 대미 수출 총액은 1315억 달러에 달한다. 이로부터 계산된 수출 대비 대미무역흑자 비율은 50%로 계산된다.
이것을 양국에 각각 책임이 있다는 차원에서 2로 나누면 25%가 나온다. 이런 방식으로 예산된 것이 트럼프 대통령이 각국에 적용한 상호관세율이다. 이 기준으로 중국은 24%, 일본은 24%, 대만 32% 등으로 계산됐다.
주먹구구식이란 비판이 쏟아졌지만 트럼프 입장에서는 그런 비판은 그리 중요하지 않았다. 왜냐하면 미란이 언급한 바대로 트럼프에게 상호관세는 단순한 압박용이기 때문이다.
트럼프는 상호관세 부과 이후 90일간의 유예기간을 거쳐 관세율을 최종 확정하겠다고 밝혔다. 이때부터 각국 간 미국을 상대로 한 협상전이 벌어졌다. 협상은 철저하게 미국과 상대국 양자 간에 진행됐다.
협상의 규칙은 간단했다. 4월 부과된 상호관세율을 낮추기 위해서는 미국 측이 만족할만한 새로운 당근을 제공하는 것이다. 이 당근이 만족스러우면 상호관세율을 낮춰주고 불만족스러우면 기존 관세율이 그대로 적용된다.
트럼프의 전략은 어느 정도 성공했다. 각국은 국가 역량을 총 동원해 관세를 낮추기 위한 아이디어를 스스로 제공했다. 미국은 앉아서 아이디어를 평가만 하면 됐다.
2025년 7월 중순부터 협상결과가 속속 나왔다. 일본은 상호관세율을 15%로 낮추기 위해 총5500억 달러를 미국에 투자하기로 했다. 또 일본의 쌀, 자동차, 트럭과 일부 농산물 시장을 개방하기로 했다. 아울러 미국이 진행하는 알래스카 액화천연가스(LNG) 개발 사업에 합작 투자하기로 했다.
유럽은 7500억 달러 어치의 미국 에너지를 수입하기로 했고 6000억 달러를 미국에 투자하기로 약속했다. 아울러 미국의 군사장비도 대규모로 수입하기로 했다. 미국은 이런 약속을 한 대가로 관세율을 15%로 낮춰주기로 했다.
미란이 제시한 당근 적극 활용
한국은 3500억 달러를 미국에 투자하기로 잠정 합의했다. 이중 1500억 달러는 미국 조선 산업을 육성하는데 투자한다. 한국의 기술과 인력 지원도 포함한다. 아울러 1000억 달러 어치의 미국 에너지를 구입하기로 했다. 상호관세율은 일본 EU와 같은 수준인 15%로 하기로 했다. 하지만 미국은 3500억 달러를 현금으로 달라고 요구하면서 협상이 난항을 겪고 있다.
트럼프가 각국과 협상하면서 보여준 전략은 묘하게 미란 보고서의 아이디어와 닮아있다. 먼저 미란보고서는 ‘관세는 매우 유용한 협상의 수단’이라고 했다. 관세가 목표가 아닌 수단이라는 점을 명확히 한 것이다. 실제 트럼프는 관세를 협상의 수단으로 적극 활용했다. 일단 ‘고율의 관세를 질러놓고 이 관세를 낮출 아이디어를 가지고 오라’고 통보한 것이 대표적인 예다.
100년 만기 영구채 아이디어도 곳곳에 보인다. 트럼프는 유럽 일본 한국으로부터만 1조5000억 달러에 달하는 투자를 유치했다. 일반적인 투자는 투자의 이익을 투자자가 가져간다. 그런데 이번 미국 투자는 투자 이후 발생한 이익의 90%를 미국에 남겨두는 조건이 붙었다고 미국 백악관 측은 밝혔다. 투자를 통해 발생한 이익을 다시 미국에 재투자해야 한다는 의무조항이 추가된 것이다. 이런 식의 투자는 상식적이지 않다. 미국에 투자를 하고 투자로 부터 발생한 모든 이익을 미국에 재투자한다면 이는 사실상 미국이 발행한 영구채를 중도 상환 조건이 없이 사주는 것과 비슷한 효과다.
협상과정에서 미국의 우월적 지위와 안보 군사적 이점을 최대한 활용해야 한다는 주장도 현실화됐다. 한국과 일본 EU등 미국의 동맹국들은 미국과의 관계에서 경제보다 더 중요한 것이 안보다. 트럼프 정부는 이런 상황을 적극적으로 활용해 미국 투자 규모를 늘렸다. 각국은 ‘울며 겨자 먹기’식으로 미국의 요구를 들어줄 수밖에 없었다. 이런 아이디어도 미란보고서에 기반을 둔 것으로 보인다.
하지만 미란이 제기한 ‘당근’을 활용한 국가는 아직 없었다. 미란은 보고서에서 미국의 제안을 받아들인 국가에는 연방준비제도(Fed)가 통화스왑 계약이나 달러 대출을 통해 달러 유동성을 제공해 주는 것을 당근으로 제시할 수 있다고 썼다.
한미 관세협상 분수령
유럽과 일본은 자신들의 통화가 기축통화로 인정받기 때문에 외환위기의 가능성이 없다. 하지만 한국은 상황이 다르다. 수십억 달러만 빠져나가도 외환시장은 큰 충격을 받는다. 미국에 투자를 할 때 달러 수요가 급증하기 때문에 환율이 요동칠 가능성이 매우 높다. 이럴 때 통화스왑을 통해 원화를 주고 미국 달러를 들여오거나 미 연준의 대출을 받아 달러를 확보해야 한다.
실제 지난해 미국의 실리콘벨리은행(SVB) 파산 후 발생한 은행들의 예금인출사태로 은행의 유동성이 부족하자 연준은 은행기간대출프로그램(BTFP)을 통해 긴급 유동성을 공급해 위기확산을 막았다. 이런 프로그램을 미국에 투자하는 국가로 확대 적용하는 것이 미란의 아이디어다.
한국 입장에서 3500억 달러를 미국에 투자하고 투자수익금의 90%를 미국 내에 유보하는 것은 사실상 미국 영구채를 사는 것과 비슷한 행위다. 우리가 보유한 달러를 우리 마음대로 운용할 수 없다면 통화스왑과 달러 대출을 통해 외환시장 안정을 도모하는 것은 어찌 보면 당연한 요구다. 더구나 이 아이디어를 미란이 제시했다는 것은 미국 측도 일방적인 투자유치에 대한 반대급부를 줄 필요가 있다는 공감대가 형성돼 있는 것이다.
앞으로 외환시장 안정은 한미 모두에 도움이 된다. 한국의 외환시장이 건전하게 굴러가야 미국 투자가 원활히 진행될 수 있다. 한미 통화스왑 복원은 트럼프와의 협상 내용을 현실화하기 위한 최소한의 전제조건이다. 향후 관세협상 후속논의 과정에서 관철이 필요한 부분이다.
관련기사 [노영우의 스톡피시] 관세협상 다음 과제 … 한미 통화스왑 부활
https://n.news.naver.com/article/009/0005535929?type=journalists
[스톡피시(stockfish)] 중세시대에는 대구와 청어 등 생선을 잡아 오랫동안 저장하는 방법이 국력의 상징이었습니다. 말리는 것부터 시작해 소금에 절이는 것까지 생선을 잘 저장해 파는 나라가 세계경제 패권을 장악했습니다. 저장된 생선을 의미하는 ‘스톡피시’는 당시 기술과 경제력을 상징하는 단어입니다. 21세기에도 국가간 기술·무역 경쟁의 본질은 달라지지 않았습니다. ‘스톡피시’는 세계 경제를 진단하고 혜안을 제시하는 칼럼을 지향합니다.",관세부과
동아일보,"트럼프 “中관세유예 연장 가능, 무역합의 매우 가까워져”",네이버뉴스,https://n.news.naver.com/mnews/article/020/0003662415?sid=104,,동아일보,"트럼프 “中 관세유예 연장 가능, 무역합의 매우 가까워져”","대만 5600억원대 무기 지원은 거부
동맹들과 협상 대치속 中엔 유화책
트럼프-시진핑 3개월만에 통화
AP 뉴시스
도널드 트럼프 미국 대통령과 시진핑(習近平) 중국 국가주석이 19일 통화했다. 중국 외교부와 백악관 측에 따르면 두 정상은 이날 미국 동부 시간 오전 8시(한국 시간 19일 오후 9시)부터 대화했다.
이날 두 정상은 중국의 동영상 플랫폼 ‘틱톡’의 미국 내 사업권 매각, 관세, 두 사람의 대면 정상회담 여부, 미국의 대(對)중국 반도체 수출 규제, 중국의 미국산 대두 수입 등을 논의한 것으로 알려졌다. 두 정상의 통화는 올 6월 5일 이후 3개월 만이다.
트럼프 대통령은 앞서 영국 국빈 방문 마지막 날인 18일 런던 근교 버킹엄셔에서 키어 스타머 영국 총리와 공동 기자회견을 열고 중국과의 무역 합의가 “매우 가까워졌다”고 밝혔다. 또 “중국에 대한 (고율 관세 부과 유예를) 연장할 수 있다”고도 덧붙였다.
올 1월 트럼프 대통령의 재집권 후 미국과 중국은 서로를 향해 ‘관세 폭탄’을 투하했다. 올 5월 스위스 제네바에서 열린 제1차 고위급 무역 협상을 계기로 각각 115%포인트씩 관세를 낮추기로 합의했다. 이후 영국 런던, 스웨덴 스톡홀름, 스페인 마드리드에서의 추가 협상을 거쳐 올 11월 10일까지 관세율 인하를 유예하기로 합의했다. 즉, 11월 10일 이후에도 관세 인하를 연장할 수 있음을 시사한 발언으로 풀이된다.
틱톡의 모회사인 중국 정보기술(IT) 기업 바이트댄스가 소유한 지분을 오라클 등 미국 기업이 인수하는 방안에 대해서도 두 나라가 합의에 도달한 것으로 보인다. 트럼프 대통령은 틱톡 거래를 두고 “틱톡 인수자는 전원 미국인이 될 것”이라고 자신했다.
트럼프 대통령은 그간 관세 전쟁의 주적(主敵)으로 삼았던 중국과는 고율 관세를 계속 유예하는 방식으로 별다른 마찰 없이 협상을 이어 가고 있다. 한국 등 동맹국과 협상의 세부 논의를 두고 팽팽하게 대치하는 것과 대조적이다.
특히 그는 중국이 가장 민감하게 반응하는 ‘대만’ 의제에 대해서도 중국에 유화적인 태도를보이고 있다. 18일 워싱턴포스트(WP)는 최근 트럼프 대통령이 대만에 대한 4억 달러(약 5600억 원)의 무기 지원 승인을 거부했다고 보도했다. 그가 시 주석과의 통화는 물론 다음 달 31일, 11월 1일 양일간 경북 경주에서 열리는 아시아태평양경제협력체(APEC) 정상회의 때 시 주석과의 대면 정상회담 가능성이 제기되는 상황에서 중국 측에 일종의 화해 제스처를 취한 것 아니냐는 분석이 나온다.",관세부과
