press,title,naver_news_text,naver_news_url,body,press_html,title_html,body_html,label
지디넷코리아,"""미국 중심 아닌 각국스테이블코인발행 긍정적""",네이버뉴스,https://n.news.naver.com/mnews/article/092/0002396172?sid=105,,지디넷코리아,"""미국 중심 아닌 각국 스테이블코인 발행 긍정적""","[APEC 2025] APEC 퓨처테크포럼 마이클 케이시 수석 기조연설…""AI, 프로그래머블 머니 꼭 필요""
인공지능(AI) 시대에서는 스테이블코인이 필요하며, 현재 미국 중심으로 짜여진 스테이블코인 패권에서 한국을 포함해 여러나라가 진행하는 자국 스테이블코인 발행 시도는 긍정적이라는 평가가 나왔다.
30일 경주에서 진행된 아시아태평양경제협의회(APEC) 2025 중 두나무가 진행한 '퓨처 테크 포럼'에 참석한 마이클 케이시 MIT 미디어랩 디지털 화폐 이니셔티브 수석 고문은 '스테이블코인, AI 그리고 프로그래머블 머니' 기조연설을 통해 이 같이 역설했다.
마이클 케이시 수석 고문은 ""지금 스테이블코인 거래의 99%가 달러""라면서 ""이건 단순한 달러 강세가 아니라 달러가 다른 나라의 국내 경제 안으로 들어오는 현상으로 한국 사람이 마트에서 달러 스테이블코인으로 물건을 사기 시작한다면 그건 한국은행 입장에서 진짜 문제""라고 진단했다.
30일 경주예술의전당 원화홀에서 열린 ‘퓨처테크포럼 디지털자산’에서 마이클 케이시 MIT 미디어랩 디지털 화폐 이니셔티브 수석 고문이 기조연설을 하고 있다.(사진=두나무)
이어 그는 ""이걸 '브레튼우즈 2.0'이라고 부르는 지금 체제가 더 미국 중심으로 기울어져가는 현상""이라며 ""미국의 정책 변화가 그대로 전 세계로 파고들 것""이라고 경고했다. 브레튼우즈 2.0 체제는 달러를 기축통화로 하는 1.0 체제 이후 1971년 이후 미국 달러의 패권이 더 공고해진 체제를 의미한다.
케이시 고문은 ""통화 주권을 지키기 위한 가장 현실적 길로 각 나라가 자기 통화로 된 스테이블코인을 만들고 있는 것""이라며 ""유럽·일본·한국이 지금 하는 일들은 긍정적으로 보고 있다. 자기 나라 돈을 토큰화해서 글로벌하게 쓸 수 있는 레일 위에 올리려는 시도이기 때문""이라고 평가했다.
그는 소매·국내 결제는 각국 통화 스테이블코인으로 하고, 도매·국경 간 정산은 은달러 스테이블코인으로 하는 '브레튼우즈 2.5' 체제가 될 것이라고 예견했다.
특히 AI 에이전트 거래에서는 스테이블코인이 필요하다는 점을 짚었다. 케이시 수석 고문은 ""앞으로는 사람이 아니라 AI 에이전트끼리 거래를 할텐데 그 거래는 24시간, 1초 단위로 일어난다""며 ""은행은 그런 식으로 돈을 못 움직이고, 정산하는데 이틀 뒤에 결제하는 돈으로는 AI 경제를 굴릴 수 없다""고 단언했다. 이 때문에 그는 프로그래머블 머니가 활용될 것이라고 관측했다. 케이시 수석 고문은 ""조건을 코드로 박아넣고, 신원·제재·환도를 온체인에서 처리할 수 있어야 한다""며 ""만약 몇 개의 빅테크가 AI에게 줄 화폐 모델을 정하는 구조라면 '디스토피아'가 될 것""이라고 내다봤다.",스테이블코인
지디넷코리아,"[경주 APEC] 테크포럼 연 두나무 ""스테이블코인, AI 시대 금융 혁신""(종...",네이버뉴스,https://n.news.naver.com/mnews/article/092/0002396172?sid=105,,지디넷코리아,"""미국 중심 아닌 각국 스테이블코인 발행 긍정적""","[APEC 2025] APEC 퓨처테크포럼 마이클 케이시 수석 기조연설…""AI, 프로그래머블 머니 꼭 필요""
인공지능(AI) 시대에서는 스테이블코인이 필요하며, 현재 미국 중심으로 짜여진 스테이블코인 패권에서 한국을 포함해 여러나라가 진행하는 자국 스테이블코인 발행 시도는 긍정적이라는 평가가 나왔다.
30일 경주에서 진행된 아시아태평양경제협의회(APEC) 2025 중 두나무가 진행한 '퓨처 테크 포럼'에 참석한 마이클 케이시 MIT 미디어랩 디지털 화폐 이니셔티브 수석 고문은 '스테이블코인, AI 그리고 프로그래머블 머니' 기조연설을 통해 이 같이 역설했다.
마이클 케이시 수석 고문은 ""지금 스테이블코인 거래의 99%가 달러""라면서 ""이건 단순한 달러 강세가 아니라 달러가 다른 나라의 국내 경제 안으로 들어오는 현상으로 한국 사람이 마트에서 달러 스테이블코인으로 물건을 사기 시작한다면 그건 한국은행 입장에서 진짜 문제""라고 진단했다.
30일 경주예술의전당 원화홀에서 열린 ‘퓨처테크포럼 디지털자산’에서 마이클 케이시 MIT 미디어랩 디지털 화폐 이니셔티브 수석 고문이 기조연설을 하고 있다.(사진=두나무)
이어 그는 ""이걸 '브레튼우즈 2.0'이라고 부르는 지금 체제가 더 미국 중심으로 기울어져가는 현상""이라며 ""미국의 정책 변화가 그대로 전 세계로 파고들 것""이라고 경고했다. 브레튼우즈 2.0 체제는 달러를 기축통화로 하는 1.0 체제 이후 1971년 이후 미국 달러의 패권이 더 공고해진 체제를 의미한다.
케이시 고문은 ""통화 주권을 지키기 위한 가장 현실적 길로 각 나라가 자기 통화로 된 스테이블코인을 만들고 있는 것""이라며 ""유럽·일본·한국이 지금 하는 일들은 긍정적으로 보고 있다. 자기 나라 돈을 토큰화해서 글로벌하게 쓸 수 있는 레일 위에 올리려는 시도이기 때문""이라고 평가했다.
그는 소매·국내 결제는 각국 통화 스테이블코인으로 하고, 도매·국경 간 정산은 은달러 스테이블코인으로 하는 '브레튼우즈 2.5' 체제가 될 것이라고 예견했다.
특히 AI 에이전트 거래에서는 스테이블코인이 필요하다는 점을 짚었다. 케이시 수석 고문은 ""앞으로는 사람이 아니라 AI 에이전트끼리 거래를 할텐데 그 거래는 24시간, 1초 단위로 일어난다""며 ""은행은 그런 식으로 돈을 못 움직이고, 정산하는데 이틀 뒤에 결제하는 돈으로는 AI 경제를 굴릴 수 없다""고 단언했다. 이 때문에 그는 프로그래머블 머니가 활용될 것이라고 관측했다. 케이시 수석 고문은 ""조건을 코드로 박아넣고, 신원·제재·환도를 온체인에서 처리할 수 있어야 한다""며 ""만약 몇 개의 빅테크가 AI에게 줄 화폐 모델을 정하는 구조라면 '디스토피아'가 될 것""이라고 내다봤다.",스테이블코인
뉴스1,"MIT 고문 “스테이블 코인, 신뢰 비용 낮춰 투자에 긍정적”",네이버뉴스,https://n.news.naver.com/mnews/article/421/0008574726?sid=101,,뉴스1,"[경주 APEC] 테크포럼 연 두나무 ""스테이블코인, AI 시대 금융 혁신""(종합)","마이클 케이시 MIT 고문 ""AI 에이전트와 프로그래머블 머니 결합할 것""
30일 경주예술의전당 원화홀에서 열린 ‘퓨처테크포럼 디지털자산’에서 마이클 케이시 MIT 미디어랩 디지털 화폐 이니셔티브 수석 고문이 기조연설을 하고 있다. 두나무 제공.
(서울=뉴스1) 박현영 블록체인전문기자
""현재의 글로벌 금융 시스템은 비효율적이고 비용이 많이 들며, 매우 파편화돼 있습니다. 그런데 블록체인의 개방적이고 투명한 시스템을 통해 우리는 비용을 크게 절감하기 시작했습니다.""
마이클 케이시 매사추세츠공과대학(MIT) 미디어랩 디지털 화폐 이니셔티브 수석 고문은 30일 두나무가 '아시아태평양경제협력체(APEC·에이펙) 최고경영자(CEO) 서밋'의 공식 부대행사로 주최한 '퓨처테크포럼'에서 스테이블코인이 금융 인프라를 변화시키고 있다며 이같이 말했다.
그는 ""현재 글로벌 금융 시스템에는 스위프트(SWIFT), 청산소, 투자은행, 은행 각 지점 등 모든 기관이 관여돼 있고 (국경 간 결제가 일어나는) 모든 단계에서 실패 위험이 존재한다. 이들을 신뢰하는 데도 비용이 많이 든다""면서 ""블록체인 기반 시스템을 채택하면 우리는 '수학적 증명'을 신뢰할 수 있다""고 설명했다. 블록체인 기술을 기반으로 글로벌 결제, 송금 등을 처리할 경우 신뢰 비용을 절약할 수 있다는 의미다.
블록체인 기반 금융 시스템에서 중추적인 역할을 하는 게 스테이블코인이다. 케이시 고문은 ""전 세계적으로 돈을 더 '빠르게' 이동시킬 수 있게 되면 경제적 영향이 얼마나 클지 생각해 보라""며 ""규제 당국들도 이제 스테이블코인의 중요성을 이해하기 시작했다""고 강조했다.
또 케이시 고문은 인공지능(AI) 에이전트와 '프로그래머블(Programmable) 머니'의 결합을 미래 금융의 방향으로 제시했다.
그는 ""미래엔 AI 에이전트들이 우리를 대신해 거래하게 될 것이므로 그들에게는 은행이 아닌 '프로그래머블 머니'가 필요하다""며 ""궁극적으로 화폐는 소프트웨어가 돼야 한다""고 했다. 스테이블코인을 비롯한 블록체인 기반 화폐가 이 같은 프로그래머블 머니가 될 수 있다는 것이다.
30일 열린 ‘퓨처테크포럼 디지털자산’에서 (왼쪽부터) 윤선주 두나무 CBIO, 마이클 케이시 MIT 미디어랩 디지털 화폐 이니셔티브 수석 고문, 루 인 솔라나 재단 APAC 사업개발 총괄, 폴 블루스타인 금융 저널리스트∙‘킹달러’ 저자가 ‘스테이블코인과 국경간 혁신’을 주제로 패널 토론을 진행하고 있다. 두나무 제공.
이어진 패널 토론에서도 스테이블코인의 미래 역할에 대한 논의가 이뤄졌다. '스테이블코인과 국경 간 혁신: 글로벌 금융과 규제의 가교'를 주제로 진행된 토론에서는 윤선주 두나무 최고브랜드임팩트책임자(CBIO)가 좌장을 맡고 △루 인 솔라나 재단 아시아태평양 사업개발 총괄 △폴 블루스타인 '킹달러' 저자 겸 금융 저널리스트 △마이클 케이시가 패널로 참여했다.
폴 블루스타인 금융 저널리스트는 ""각국은 (달러 중심 시대에 맞서) 화폐 주권을 보호할 수 있는 방법에 대해 고민해야 한다고 생각한다""며 ""현지 통화로 뒷받침되는 스테이블코인이 도움이 될 수 있을 것""이라고 말했다. 달러 패권이 강화되고 있는 시대에 맞서 각국 통화를 기반으로 하는 스테이블코인이 필요하다는 주장이다.
각국 통화를 기반으로 하는 스테이블코인이 나올 경우, 사용 사례를 발굴하는 게 중요하다는 주장도 언급됐다. 루 인 솔라나 재단 총괄은 ""각국 통화를 기반으로 하는 스테이블코인들은 누가 구매자가 될 것인지, 지속 가능한 실사용 사례를 만들어낼 수 있을 것인지가 중요하다""며 ""이는 정부도 좀 더 개입해야 할 필요가 있는 부분""이라고 했다.
아울러 패널들은 AI 에이전트 시대에는 스테이블코인이 기본 화폐가 될 수 있다는 케이시 고문의 주장에 공감했다. 또 스테이블코인 혁신이 적절한 규제 아래서 이뤄져야 한다고 입을 모았다.
루 인 총괄은 ""페이팔이 (솔라나 블록체인을 기반으로) 자체 스테이블코인 PYUSD를 출시했는데, 그들과 함께 자금 동결 메커니즘을 개발했다""며 규제 아래서 혁신이 일어나야 함을 강조했다.
윤선주 CBIO도 ""두나무는 스테이블코인을 블록체인 기술과 실제 금융을 연결하는 핵심 고리로 보고 있다""고 말했다.
한편 대한상공회의소가 주관하는 'APEC CEO 서밋 코리아 2025'는 경주에서 열리는 아시아태평양경제협력체(APEC) 정상회의의 주요 부대행사다. APEC CEO 서밋에서 디지털자산(가상자산)을 주제로 한 별도의 부대행사가 열린 건 국내 최초다.",스테이블코인
조선비즈,APEC에 뜬스테이블코인…두나무 대표 “디지털자산은 경제를 잇는 다리...,네이버뉴스,https://n.news.naver.com/mnews/article/366/0001118771?sid=101,,조선비즈,"MIT 고문 “스테이블 코인, 신뢰 비용 낮춰 투자에 긍정적”","[2025 APEC] 퓨처테크포럼: 디지털자산
“현 금융 시스템 국제 결제, 지나치게 복잡”
“스테이블 코인으로 달러 지배력 더 강해져”
“자국 통화 스테이블 코인으로 주권 지켜야”
세계 각국이 자국 통화를 기반으로 한 스테이블코인을 도입해야 한다는 주장이 나왔다. 자국 통화 스테이블코인이 없어 달러 기반 스테이블코인 사용이 늘면, 달러 지배력이 커져 각국의 통화 주권이 흔들릴 수 있다는 이유에서다.
마이클 케이시 미국 매사추세츠 공과대(MIT) 미디어랩 디지털화폐 이니셔티브 수석고문은 30일 경주에서 열린 ‘퓨처테크포럼: 디지털자산’에서 ‘스테이블코인, 인공지능(AI) 그리고 프로그래머블 화폐’라는 주제로 한 연설에서 이같이 밝혔다.
마이클 케이시 미국 매사추세츠 공과대(MIT) 미디어랩 디지털화폐 이니셔티브 수석고문이 30일 경주예술의전당 원화홀에서 열린 ‘퓨처테크포럼: 디지털자산’에서 기조연설을 하고 있다./두나무 제공
퓨처테크포럼은 아시아태평양경제협력체(APEC) 최고경영자(CEO) 서밋의 공식 부대행사로 가상자산 거래소 업비트를 운영하는 두나무가 주최했다.
케이시 고문은 “금융시스템은 오랫동안 은행을 중심으로 유지됐지만, 이제는 더 나은 대안이 필요하다. 국제 결제 과정이 지나치게 복잡하고 비용이 많이 드는 구조가 됐다”며 “블록체인은 수학적 증명과 투명한 시스템을 통해 신뢰 비용을 획기적으로 낮추는 기술”이라고 말했다. 이어 “스테이블코인은 결제 대기 중 묶여 있던 자본을 즉시 활용할 수 있게 해 경제성장과 투자에 긍정적인 영향을 미친다”고 덧붙였다.
그는 “자국 통화 기반 스테이블코인이 없으면 달러 기반 스테이블코인 사용이 늘어나 달러 지배력이 더 강해질 것”이라고 주장했다. 그러면서 “이렇게 되면 각국 통화 주권이 심각하게 훼손될 수 있다. 전 세계가 미국 연방준비제도(연준·Fed)의 정책에 종속되는 현재의 ‘브레턴우즈 2.0’ 체제가 더 강화될 수 있다”고 지적했다.
케이시 고문은 이런 흐름을 막기 위해 각국이 자국 통화 기반 스테이블코인을 발행해야 한다고 주장했다. 그는 “한국이 원화 기반 스테이블코인을 검토하는 것은 통화 주권을 지키면서 디지털 전환에 대비하는 올바른 방향”이라며 “소수의 플랫폼이 기술을 독점하면 전체주의적 디스토피아가 될 수 있다. 각국이 협력해 민간 주도의 블록체인 시스템이 서로 연결될 수 있도록 해야 한다”고 말했다.",스테이블코인
한겨레,"""자국 통화 기반스테이블코인구축 필요"" [APEC 2025]",네이버뉴스,https://n.news.naver.com/mnews/article/028/0002773707?sid=101,,한겨레,APEC에 뜬 스테이블코인…두나무 대표 “디지털자산은 경제를 잇는 다리”,"(왼쪽부터)윤선주 두나무 최고브랜드임팩트책임자(CBIO), 마이클 케이시 매사추세츠공대 미디어랩 디지털화폐 이니셔티브 수석고문, 루 인 솔라나 재단 아시아∙태평양 사업개발 총괄, 폴 블루스타인 금융 전문 저널리스트
스테이블코인이 아펙에 떴다. 디지털자산이 아시아태평양경제협력체(APEC∙아펙) 최고경영자(CEO) 서밋에서 인공지능, 조선, 방산 등 핵심 산업을 조망하는 부대행사인 ‘퓨처테크포럼’의 한자리를 차지했다. 한 때 “비트코인은 사기”란 눈초리를 받았던 디지털자산이 국가의 주요 산업 중 하나로 인정받은 셈이다. 포럼에 참석한 글로벌 리더들은 스테이블코인을 중심으로 디지털자산이 만들어 갈 새로운 금융 질서에 대해 열띤 논의를 펼쳤다.
30일 경주 예술의전당 원화홀에서는 아펙 시이오 서밋의 공식 부대행사로 ‘퓨처테크포럼: 디지털자산’이 열렸다. 행사에는 마이클 케이시 매사추세츠공대 미디어랩 디지털화폐 이니셔티브 수석고문, 루 인 솔라나 재단 아시아∙태평양(APAC) 사업개발 총괄 등 금융과 기술 분야의 글로벌 리더들이 참석했다. 오경석 두나무 대표는 환영사를 통해 “디지털자산은 더 이상 한정된 영역에서의 혁신이 아니다. 기술과 금융, 시장과 사람, 그리고 지역과 경제를 잇는 다리 역할을 한다”고 말했다.
포럼 참석자들은 스테이블코인이 은행 중심의 전통 금융 질서를 재편할 수 있다는 데 의견을 모았다. 이들은 특히 국제 거래에서 미국 달러나 금융기관을 거쳐야만 했던 기존 구조에서 탈피할 수 있다는 데 주목했다. 엘리자베스 로시엘로 아자(AZA) 파이낸스 최고경영자는 “금융혁신에 의해 아시아와 아프리카 간 직접 무역이 크게 증가하는 걸 목격하고 있다”며 “모든 것이 미국을 통해야 하는 전통적인 삼각형 구조에서 벗어나야 한다”고 말했다.
인공지능(AI) 에이전트 시대에 스테이블 코인이 주요한 결제 수단으로 자리 잡을 것이라는 전망도 나왔다. 인공지능 에이전트끼리의 상거래는 국가간 경계 없이 연중무휴로 빠르게 이뤄진다. 기존 결제 시스템이 따라오기 어렵다. 케이시 수석고문은 “에이전트가 우리를 대신해서 거래를 하게 되면 결국 프로그래머블 머니(설정된 조건이 맞으면 자동으로 송금결제 등을 시행할 수 있는 디지털 화폐)가 필요하다”며 “궁극적으로 화폐는 소프웨어가 되어야 한다”고 말했다.
참석자들은 스테이블코인으로 블록체인 기반 거래가 활성화되면 은행 서비스에 접근하기 어려운 개발도상국 등 비금융권 인구에게 금융접근성을 높일 수 있다는 점에도 주목했다. 이사벨 채터튼 아시아개발은행(ADB) 부국장은 “13억명의 성인이 은행 서비스에 접근할 수 없지만, 성인의 84%은 인터넷에 연결할 수 있는 휴대폰이 있다”며 “이러한 환경은 블록체인 기반 플랫폼이 작동할 엄청난 기회”라고 말했다.
다만 스테이블코인이 통화주권을 흔들 수 있다는 우려의 목소리도 나왔다. 폴 블루스타인 금융 전문 저널리스트는 “베네수엘라 등 경제가 파탄 난 국가에서 스테이블코인을 사용하기 시작하면 중앙은행은 완전히 통제력을 잃을 수 있다”고 지적했다.",스테이블코인
