press,title,naver_news_text,naver_news_url,body,press_html,title_html,body_html,label
서울경제,"업비트, 경주 APEC CEO 서밋 ‘퓨처테크포럼: 디지털자산’ 주최",네이버뉴스,https://n.news.naver.com/mnews/article/011/0004549777?sid=101,,서울경제,"조선·AI와 어깨 나란히…두나무, APEC서 '디지털자산' 포럼 주최","APEC CEO 서밋 공식 부대행사 개최···""업계 최초""
마이클 케이시·이사벨 채터튼 등 글로벌 리더 참여
오경석 두나무 대표가 30일 경주예술의전당 원화홀에서 개최된 ‘퓨처테크포럼_디지털자산’에서 환영사를 하고 있다. 사진제공=두나무
[서울경제]
가상화폐거래 업비트를 운영하는 두나무가 ‘디지털자산’을 주제로 아시아태평양경제협력체(APEC) 공식 부대행사를 주최하며 조선·방산·인공지능(AI) 등 국가 핵심 산업과 어깨를 나란히 했다.
두나무는 30일 경북 경주예술의전당 원화홀에서 APEC CEO 서밋 코리아 2025의 공식 부대행사 ‘퓨처테크포럼: 디지털자산’을 진행했다고 밝혔다. APEC CEO 서밋에서 디지털자산을 주제로 한 별도의 부대행사가 열리는 건 국내 처음으로 금융·기술·정책 분야를 대표하는 글로벌 리더들이 참석해 디지털자산의 미래와 산업 간 협력 방향을 논의했다.
포럼은 ‘미래 금융을 연결하다’를 주제로 AI, 스테이블코인, 포용 금융 등 디지털자산이 만들어갈 새로운 금융 질서와 글로벌 협력의 가능성을 다각도로 조명했다. 오경석 두나무 대표는 환영사를 통해 “연결이 곧 진보의 토대”라며 “디지털자산은 더 이상 한정된 영역의 혁신이 아니라 기술과 금융, 시장과 사람, 그리고 지역과 경제를 잇는 다리 역할을 한다”고 말했다. 이어 “이번 포럼은 디지털자산을 넘어 미래 금융의 새로운 질서를 함께 만들어가는 논의의 장이 될 것”이라고 강조했다.
기조연설은 마이클 케이시 MIT 미디어랩 디지털 화폐 이니셔티브 수석 고문이자 Advanced AI Society 의장이 맡았다. 그는 ‘스테이블코인, AI 그리고 프로그래머블 화폐: 글로벌 금융 시스템의 다가오는 대전환’을 주제로 발표하며 AI와 디지털자산의 결합이 금융 인프라의 패러다임을 바꾸는 ‘연결의 혁신’이 될 것임을 역설했다.
30일 경주예술의전당 원화홀에서 열린 ‘퓨처테크포럼 디지털자산’에서 마이클 케이시 MIT 미디어랩 디지털 화폐 이니셔티브 수석 고문이 기조연설을 하고 있다. 사진제공=두나무
패널 토론에서는 스테이블코인, 금융 포용, 제도 등 디지털자산 산업의 주요 현안이 심도 있게 다뤄졌다. 첫 번째 ‘스테이블코인과 국경 간 혁신: 글로벌 금융과 규제의 가교’ 세션에서는 윤선주 두나무 최고브랜드임팩트책임자(CBIO)가 좌장을 맡고 △루 인 솔라나 재단 APAC 사업개발 총괄 △폴 블루스타인 ‘킹달러’ 저자 겸 금융 저널리스트 △마이클 케이시가 패널로 참여했다.
패널들은 스테이블코인과 토큰화를 중심으로 국경 간 금융 인프라 혁신과 규제 협력의 균형을 논의했다. 이들은 스테이블코인이 단순한 자본 이동 수단을 넘어 글로벌 금융 신뢰를 재설계하는 기술적 기반이 될 것이라는 데 의견을 모았다.
두 번째 패널토론 세션 ‘금융 포용: 언뱅크드를 연결하다’에는 △이사벨 채터튼 아시아개발은행 민간부문 운영실 총괄 △엘리자베스 로시에로 AZA 파이낸스 CEO 겸 창업자가 패널로 참여했다. 이들은 기술 혁신이 금융의 문턱을 낮추며, 더 많은 사람들이 글로벌 경제에 참여할 수 있게 하고 있다는 데 뜻을 함께했다. 또한 기술이 사람과 기회를 잇는 새로운 연결의 장을 열고 있다고 강조했다.
마지막 세션 ‘제도화와 융합: 전통 금융과 디지털자산의 미래’에서는 오경석 두나무 대표를 비롯해 △대니 찬 마스터카드 APAC CISO △마이클 호 아메리칸 비트코인 이사회 의장이 패널로 참여했다. 좌장은 제임스 김 주한미국상공회의소(AMCHAM·암참) 회장 겸 대표이사가 맡았다. 참석자들은 금융과 디지털자산의 경계가 빠르게 허물어지고 있으며, 신뢰와 기술이 결합된 새로운 금융 생태계 구축이 앞으로의 핵심 과제라고 제시했다.
윤선주 두나무 CBIO는 “이번 포럼은 디지털자산이 글로벌 경제의 핵심 산업으로 성장했음을 보여준 의미 있는 자리였다”며 “업비트는 국가대표 거래소로서 산업 발전과 국제 논의를 주도해 한국 디지털자산의 위상을 높여가겠다”고 말했다.",스테이블코인
디지털데일리,"[APEC] ""스테이블코인은 금융 신뢰 재설계하는 기술적 기반""",네이버뉴스,https://n.news.naver.com/mnews/article/138/0002208197?sid=101,,디지털데일리,"업비트, 경주 APEC CEO 서밋 ‘퓨처테크포럼: 디지털자산’ 주최","ⓒ두나무
- 오경석 대표 “디지털자산은 기술·금융·시장·사람 잇는 다리”
- 마이클 케이시, 이사벨 채터튼, 폴 블루스타인 등 글로벌 리더 참여
[디지털데일리 박기록기자] 가상자산 거래소 업비트를 운영하는 두나무는 ‘APEC CEO 서밋 코리아 2025’의 공식 부대행사인 ‘퓨처테크포럼: 디지털자산’을 주최했다고 30일 밝혔다.
행사는 이날 오전 10시부터 오후 1시까지 경북 경주예술의전당 원화홀에서 열렸다. 금융·기술·정책 분야를 대표하는 글로벌 리더들이 참석해 디지털자산의 미래와 산업 간 협력 방향을 논의했다.
올해 ‘퓨처테크포럼’은 조선, 방산, 인공지능(AI), 미래 에너지 등 국가 핵심 산업을 주제로 구성됐다. 이 가운데 ‘디지털자산’이 포함돼 그간 실물 산업 중심의 논의가 이어져 온 APEC 무대에서 이례적인 사례로 주목받았다.
두나무에 따르면, ‘퓨처테크포럼: 디지털자산'은 ‘Connecting the Future of Finance(미래 금융을 연결하다)’를 주제로 열렸다. 포럼에서는 AI, 스테이블코인, 금융 포용 등 디지털자산이 만들어갈 새로운 금융 질서와 글로벌 협력의 가능성을 다각도로 조명했다.
행사에서 오경석 두나무 대표는 “연결이 곧 진보의 토대”라며 “디지털자산은 더 이상 한정된 영역의 혁신이 아니라, 기술과 금융, 시장과 사람, 그리고 지역과 경제를 잇는 다리 역할을 한다”고 말했다.
기조연설은 마이클 케이시 MIT 미디어랩 디지털 화폐 이니셔티브 수석 고문이자 Advanced AI Society 의장이 맡았다. 그는 ‘스테이블코인, AI 그리고 프로그래머블 화폐: 글로벌 금융 시스템의 다가오는 대전환’을 주제로 발표하며 AI와 디지털자산의 결합이 금융 인프라의 패러다임을 바꾸는 ‘연결의 혁신’이 될 것임을 역설했다.
패널 토론에서는 스테이블코인, 금융 포용, 제도 등 디지털자산 산업의 주요 현안이 심도 있게 다뤄졌다. 첫번째 ‘스테이블코인과 국경 간 혁신: 글로벌 금융과 규제의 가교’ 세션에서는 윤선주 두나무 최고브랜드임팩트책임자(CBIO)가 좌장을 맡고 루 인 솔라나 재단 APAC 사업개발 총괄, 폴 블루스타인 ‘킹달러’ 저자 겸 금융 저널리스트, 마이클 케이시가 패널로 참여했다.
패널들은 스테이블코인과 토큰화를 중심으로 국경 간 금융 인프라 혁신과 규제 협력의 균형을 논의했다. 이들은 스테이블코인이 단순한 자본 이동 수단을 넘어 글로벌 금융 신뢰를 재설계하는 기술적 기반이 될 것이라는 데 의견을 모았다.
두 번째 패널토론 세션 ‘금융 포용: 언뱅크드를 연결하다’에는 이사벨 채터튼 아시아개발은행 민간부문 운영실 총괄, 엘리자베스 로시에로 AZA 파이낸스 CEO 겸 창업자가 패널로 참여하고 윤선주 두나무 CBIO가 좌장을 맡았다. 이들은 기술 혁신이 금융의 문턱을 낮추며, 더 많은 사람들이 글로벌 경제에 참여할 수 있게 하고 있다는 데 뜻을 함께했다.
마지막 세션 ‘제도화와 융합: 전통 금융과 디지털자산의 미래’에서는 오경석 두나무 대표를 비롯해 대니 찬 마스터카드 APAC CISO, 마이클 호 아메리칸 비트코인 이사회 의장이 패널로 참여했다. 좌장은 제임스 김 주한미국상공회의소(AMCHAM·암참) 회장 겸 대표이사가 맡았다. 참석자들은 금융과 디지털자산의 경계가 빠르게 허물어지고 있으며, 신뢰와 기술이 결합된 새로운 금융 생태계 구축이 앞으로의 핵심 과제라고 제시했다.
윤선주 두나무 CBIO는 “이번 포럼은 디지털자산이 글로벌 경제의 핵심 산업으로 성장했음을 보여준 의미 있는 자리였다”며, “한국을 대표해 업비트가 이 같은 국제 무대를 주최하게 돼 뜻깊다”고 말했다.",스테이블코인
중소기업신문,"[경주 APEC] 업비트, APEC CEO 서밋 '퓨처테크포럼: 디지털자산' 주최",,,,,,,스테이블코인
뉴시스,"업비트, APEC CEO 서밋서 '퓨처테크포럼: 디지털자산' 주최",네이버뉴스,https://n.news.naver.com/mnews/article/003/0013569731?sid=101,,뉴시스,"[경주 APEC] 업비트, APEC CEO 서밋 '퓨처테크포럼: 디지털자산' 주최","APEC CEO 서밋 공식 부대행사
오경석 대표 ""디지털자산은 기술·금융·시장·사람 잇는 다리""
[서울=뉴시스] 오경석 두나무 대표가 30일 경주예술의전당 원화홀에서 개최된 ‘퓨처테크포럼_디지털자산’에서 환영사를 하고 있다. (사진=두나무) 2025.10.30 *재판매 및 DB 금지
[서울=뉴시스]이지영 기자 = 국내 가상자산 거래소 업비트를 운영하는 두나무가 APEC CEO 서밋 코리아 2025의 공식 부대행사 '퓨처테크포럼: 디지털자산'을 주최했다고 30일 밝혔다.
APEC CEO 서밋에서 디지털자산을 주제로 한 별도의 부대행사가 열리는 건 국내에서 처음 있는 일이다. 두나무는 국내 디지털자산 산업을 대표해 글로벌 협력 논의를 주도했다.
행사는 이날 오전 10시부터 오후 1시까지 경북 경주예술의전당 원화홀에서 열렸다. 금융·기술·정책 분야를 대표하는 글로벌 리더들이 참석해 디지털자산의 미래와 산업 간 협력 방향을 논의했다.
퓨처테크포럼은 APEC CEO 서밋 코리아 2025의 공식 부대행사다. 올해는 조선과 방산, 인공지능(AI), 미래 에너지 등 국가 핵심 산업을 주제로 구성됐다. 이 가운데 '디지털자산’이 포함돼 그간 실물 산업 중심의 논의가 이어져 온 APEC 무대에서 이례적 사례로 주목받았다.
퓨처테크포럼: 디지털자산은 '미래 금융을 연결하다(Connecting the Future of Finance)를 주제로 열렸다. 포럼에서는 AI, 스테이블코인, 금융 포용 등 디지털자산이 만들어갈 새로운 금융 질서와 글로벌 협력의 가능성을 조명했다.
오경석 두나무 대표는 이날 환영사를 통해 ""연결이 곧 진보의 토대""라며 ""디지털자산은 더 이상 한정된 영역의 혁신이 아니라, 기술과 금융, 시장과 사람, 그리고 지역과 경제를 잇는 다리 역할을 한다""고 말했다.
이어 ""이번 포럼은 디지털자산을 넘어 미래 금융의 새로운 질서를 함께 만들어가는 논의의 장이 될 것""이라고 강조했다.
기조연설은 마이클 케이시 MIT 미디어랩 디지털 화폐 이니셔티브 수석 고문이자 Advanced AI Society 의장이 맡았다. 그는 '스테이블코인, AI 그리고 프로그래머블 화폐: 글로벌 금융 시스템의 다가오는 대전환'을 주제로 발표했다.
패널 토론에서는 스테이블코인과 금융 포용, 제도 등 디지털자산 산업의 주요 현안이 다뤄졌다. 첫번째 '스테이블코인과 국경 간 혁신: 글로벌 금융과 규제의 가교' 세션에서는 ▲윤선주 두나무 최고브랜드임팩트책임자(CBIO)가 좌장을 맡고 ▲루 인 솔라나 재단 APAC 사업개발 총괄 ▲폴 블루스타인 '킹달러' 저자 겸 금융 저널리스트 ▲마이클 케이시 등이 패널로 참여했다.
패널들은 스테이블코인과 토큰화를 중심으로 국경 간 금융 인프라 혁신과 규제 협력의 균형을 논의했다. 이들은 스테이블코인이 단순한 자본 이동 수단을 넘어 글로벌 금융 신뢰를 재설계하는 기술적 기반이 될 것이라고 입을 모았다.
두 번째 패널토론 세션 '금융 포용: 언뱅크드를 연결하다'에는 ▲이사벨 채터튼 아시아개발은행 민간부문 운영실 총괄 ▲엘리자베스 로시에로 AZA 파이낸스 CEO 겸 창업자가 패널로 참여하고 ▲윤선주 두나무 CBIO가 좌장을 맡았다.
이들은 기술 혁신이 금융의 문턱을 낮추며, 더 많은 사람들이 글로벌 경제에 참여할 수 있게 하고 있다는 데 뜻을 함께했다. 또 기술이 사람과 기회를 잇는 새로운 연결의 장을 열고 있다고 강조했다.
마지막 세션 '제도화와 융합: 전통 금융과 디지털자산의 미래'에서는 ▲오경석 두나무 대표 ▲대니 찬 마스터카드 APAC CISO ▲마이클 호 아메리칸 비트코인 이사회 의장 등이 패널로 참여했다. 좌장은 제임스 김 주한미국상공회의소(AMCHAM·암참) 회장 겸 대표이사가 맡았다.
이들은 금융과 디지털자산의 경계가 빠르게 허물어지고 있으며, 신뢰와 기술이 결합된 새로운 금융 생태계 구축이 앞으로의 핵심 과제라고 제시했다.
윤 두나무 CBIO는 ""이번 포럼은 디지털자산이 글로벌 경제의 핵심 산업으로 성장했음을 보여준 자리였다""며 ""업비트는 국가대표 거래소로서 산업 발전과 국제 논의를 주도해 한국 디지털자산의 위상을 높여갈 것""이라고 말했다.
한편 대한상공회의소가 주관하는 ‘APEC CEO 서밋 코리아 2025'는 경주에서 열리는 아시아태평양경제협력체(APEC) 정상회의의 주요 부대행사다. 'Bridge, Business, Beyond'를 주제로 세계 21개 회원국 정상과 글로벌 CEO 1700여 명이 참여하는 아시아 태평양 지역 최대 규모의 비즈니스 장이다.",스테이블코인
아이뉴스24,[데스크칼럼] 운명인가? 비기축통화의 비애,네이버뉴스,https://n.news.naver.com/mnews/article/031/0000976666?sid=110,,아이뉴스24,[데스크칼럼] 운명인가? 비기축통화의 비애,"이창용 총재의 임기가 반년 남았다. 문재인 대통령 때 지명받은 이 총재는 윤석열 대통령을 거쳐 다시 민주당 정권에서 임기를 마치게 됐다. 아직 연임 여부는 알 수 없다.
원화 스테이블 코인이 연일 화제다. 지난 27일엔 140쪽짜리 대형 백서를 내놨다. 국회의원들은 국정감사에서도 이 코인에 많은 관심을 보였다. 젊은이들이 주식과 코인에 관심이 높다는 걸 의식한 듯, 대부분 한마디씩 걸쳤다.
정치인들은 '왜, 어서 도입하지 않느냐'라는 식의 공격적인 발언은 하지 않았다. 그저 젊은이들이 코인에 관심이 높다 보니, '나는 네 편이다'라는 분위기를 연출하는 정도로 읽힌다. 이 총재의 뚝심도 만만치 않았다. 여느 질의와 달리 코인에 관해선 단호한 견해를 주저하지 않았다. 마치 대한민국 통화 주권을 지키는 마지막 전사 같이 보였다.
이 총재가 국감에서 언급한 것처럼 원화의 국외 유출은 날로 늘고 있다. 금융회사들도 세계화하면서 해외 주식을 사고파는 규모가 커졌다. 서학개미도 무시하지 못한다. 휴가 때 해외로 여행하는 건 이제 당연한 것처럼 보인다. 이런 추세가 큰 흐름으로 자리 잡았다. 거스르기 힘들다.
이런 상황에서 원화 스테이블 코인을 도입하면…. 대한민국 중앙은행 총재로선 두려움이 앞설 만도 하다.
경상수지 흑자가 유사 이래 가장 큰데도 환율이 오르는 건 해외로 나가는 돈이 많아서라고 했다. 자본 유출을 컨트롤해야 새로운 화폐(원화 스테이블코인)를 생각해 볼 수 있다는 취지다. 비기축통화가 구조적으로 가진 핸디캡이다.
이 총재의 디지털 분산원장(블록체인) 신뢰는 높지 않아 보인다. 게다가 디페깅(스테이블 코인의 가치가 연동 자산의 가치와 괴리되는 현상) 문제는 전통적인 통화정책 책임자로선 곤혹스러울 수밖에 없다. 어떻게 화폐의 탈을 쓰고, 가치가 다를 수 있나? 분명히 어려운 문제다.
그러나 이 문제는 중앙은행시스템에서도 늘 있었다. 2011년 노벨경제학상을 받은 토머스 사전트 뉴욕대 교수는 중앙은행시스템이 대세로 자리를 잡을 때 발행했던 달러 화폐에 새겨진 'IN GOD WE TRUST'라는 문구는 실제론 '우리는 미국 연방준비제도 이사회를 믿는다'라는 뜻이라고 말한다.
[사진=EBS 캡처]
중앙은행이 국민의 돈 가치를 지켜줄 것이라는 믿음에서 출발했다는 것이다. 그러나 실제로 화폐시장은 그렇게 돌아가지 않았다. 중앙은행시스템과 함께 본격적으로 닻을 올린 명목 화폐는 물가를 치솟게 했다. 화폐시장에서 신용이 고도화하면서 폭발적으로 늘어난 유동성 문제는 이미 심각한 수준이라고 보기도 한다.
[사진=EBS 캡처]
적지 않은 거장이 중앙은행은 '내 돈의 가치를 보장하지 않는다'라고 본다. 그런 측면에서 블록체인을 활용한 거래·기록시스템은 혁신적인 것으로 평가하는 듯하다. 사전트 교수는 ""미래를 알 수는 없지만, 매우 흥미롭다""라고 말한다.
비기축통화 원화의 태생적인 취약점은 불가피하다. 이 총재의 임기가 얼마 남진 않았으나, 우리나라의 통화 시스템 발전을 위해 조금은 더 혁신에 귀를 기울였으면 하는 생각이 드는 이유다. 현존하는 중앙은행의 화폐 시스템은 이미 여러 비기축통화국에서 균열의 조짐을 보이지 않는가?",스테이블코인
매일경제,"원화스테이블코인, ‘한은 통안채’ 담보로 물꼬 트나",네이버뉴스,https://n.news.naver.com/mnews/article/009/0005581568?sid=101,,매일경제,"원화 스테이블코인, ‘한은 통안채’ 담보로 물꼬 트나","원화 스테이블코인 ‘담보물 암초’
“초단기 국채 없다” 딜레마
만기 다양한 통안채,
‘한국형 담보’로 급부상
“국내 거래소·K콘텐츠 결제 잡으면 승산”
원화스테이블코인
원화 기반 스테이블코인 발행을 둘러싼 ‘담보물’ 논쟁이 뜨겁다. 미국식 모델인 ‘초단기 국채’가 국내 시장 상황과 맞지 않는다는 한계가 명확해지면서, 가상자산 업계가 ‘한국은행 통화안정증권(통안채)’을 대안으로 주목하고 있다.
30일 가상자산 업계에 따르면 최근 원화 스테이블코인 발행시 담보물이 될 채권이 기획재정부가 발행하는 국고채를 대신해 한국은행이 발행하는 통안채가 될 것이라는 의견이 힘을 얻고 있다.
이를 통해 원화 스테이블코인 발행에 보수적이던 한국은행이 ‘통안채’라는 고리를 통해 발행사에 대한 통제권과 영향력을 확보할 할수 있다는 예측도 나온다.
美 모델 가로막은 ‘초단기 국채’의 부재
오늘날 글로벌 스테이블코인 시장의 규칙은 사실상 미국이 만들었다. 테더(USDT)나 USD코인(USDC) 등 달러 연동 스테이블코인은 발행 규모만큼 만기 3개월 이내 초단기 미국 국채나 환매조건부채권(RP) 등 현금성 자산을 담보로 보유한다.
달러 스테이블코인 보유자가 언제든 1달러로 바꿔달라고 요구할 때 즉시 지급할 수 있어야 하기에, 담보물은 ‘높은 유동성’과 ‘가치 안정성’을 동시에 갖춰야 한다.
문제는 이 모델을 원화에 그대로 적용하기 어렵다는 점이다. 기획재정부가 발행하는 고정금리부 국고채는 만기가 2년, 3년, 5년, 10년 등으로, 가장 짧은 것이 2년에 달한다.
2년물 국채는 금리 변동에 따라 채권 가격이 등락하므로, 스테이블코인의 담보 가치 안정성을 위협하는 ‘리스크’ 요인이 된다.
가상자산 업계 관계자는 “만기가 긴 채권은 금리 상승기에 가격이 하락해 담보 가치가 발행액을 밑돌 수 있다”며 “안정성이 생명인 스테이블코인에 만기 2년짜리 국채를 담보로 쓰는 것은 사실상 불가능하다”고 토로했다.
초단기 국고채 대안으로 떠오른 ‘통안채’
이런 상황에서 ‘한국은행 통안채’가 유력한 대안으로 떠올랐다. 통안채는 한은이 시중 유동성을 조절하기 위해 발행하는 채권으로, 만기 14일짜리 할인채부터 2년 만기 이표채까지 다양한 기간물이 존재한다는 것이 핵심이다.
특히 만기가 짧은 통안채는 금리 변동에 따른 가격 변동 리스크가 거의 없다. 사실상 현금과 다름없는 안정성을 제공하면서도 국고채와 동일한 최고 신용등급(AAA)을 갖췄다. 업계가 원화 스테이블코인의 담보물로 통안채를 주목하는 이유다.
아이러니한 점은 한국은행이 그간 비은행권의 원화 스테이블코인 발행에 가장 부정적인 입장이었다는 것이다. 한은은 ▲대규모 뱅크런(대량 인출) 발생 시 외환 유출 통로가 될 수 있고 ▲화폐 발행에 따른 ‘주조 차익(세뇨리지)’을 상실하며 ▲시중 유동성 조절 등 통화정책의 효력이 저하될 수 있다는 점을 꾸준히 우려해왔다.
하지만 통안채가 원화 스테이블코인의 법적 담보물로 지정된다면 상황은 바뀔 전망이다.
만약 이 같은 가정이 현실화된다면 한은이 통안채를 담보로 제공하는 과정에서 스테이블코인 발행사에 일정한 자격 요건을 부과하거나, 발행 한도를 통제하고, 실시간 모니터링을 요구하는 등 ‘간접 규제’ 수단을 확보할 수 있다. 핀테크 업계의 혁신을 무작정 막기보다, 통제 가능한 범위 내에서 관리하겠다는 실리적 판단이 작용할 수 있다는 분석이다.
업계가 ‘한은의 통제’라는 비용을 감수하면서까지 원화 스테이블코인 발행을 추진하는 데는 그만한 잠재력이 있기 때문이다.
“K-POP 업고 원화 스테이블코인, ‘글로벌 2위’ 간다”
현실적으로 원화 스테이블코인이 달러 스테이블코인의 아성을 넘기는 어렵다. 기축통화가 아닌 원화의 태생적 한계다. 하지만 업계는 틈새시장을 노리고 있다.
당장 국내 가상자산 거래소에서 현금 입출금 대신 원화 스테이블코인을 사용할 경우, 거래 편의성과 속도가 비약적으로 향상된다.
더 큰 잠재력은 ‘K-컬처’ 시장이다. 전 세계 K팝 팬들이 굿즈나 앨범을 구매할 때 달러 환전이나 복잡한 해외 결제망 대신 원화 스테이블코인을 사용하게 만든다는 구상이다.
한 가상자산 업계 종사자는 “달러 기반 코인 다음가는 ‘글로벌 2위’ 스테이블코인으로 성장할 잠재력은 충분하다”며 “이를 위해선 안정적인 담보물 확보가 선결 과제”라고 강조했다.",스테이블코인
