press,title,naver_news_text,naver_news_url,body,press_html,title_html,body_html,label
뉴시스,"한은 ""달러스테이블코인, 달러 '안전자산' 지위에 부정적일 수도""",네이버뉴스,https://n.news.naver.com/mnews/article/003/0013482115?sid=101,,뉴시스,"한은 ""달러 스테이블코인, 달러 '안전자산' 지위에 부정적일 수도""","[그래픽=뉴시스] 재판매 및 DB금지. hokma@newsis.com
[서울=뉴시스]남주현 기자 = 한국은행이 달러 스테이블코인이 국제 교역에 활용되며 달러 패권주의를 강화시킬 수도 있지만, 동시에 코인런(대규모 인출 사태)과 국채 가격 변동성을 유발해 달러의 안전자산 통화로서의 지위에 부정적으로 작용할 수 있다는 진단을 내놨다.
한은은 15일 'BOK 경제연구' 시리즈 일환으로 발간한 '달러패권과 미국발 충격의 글로벌 파급 영향( Dollar Dominance and International Spillovers of US Financial Shocks)' 보고서를 통해 이같이 밝혔다. 손민규 한은 경제모형실 금융모형팀장이 작성했다.
보고서는 동태확률일반균형(DSGE) 모형을 통해 미국 달러화의 기축통화 지위에 따른 미국 금융 충격의 국내 파급 영향에 대해 진단했다. 이와 함께 달러 스테이블 코인의 글로벌 확산 가능성과 이에 따른 달러화의 국제적 지위 변화가 국내 경제에 미칠 파급 효과에 대해서도 점검했다.
연구진은 달러 스테이블코인의 거래 편의성으로 수출입 결제에 널리 이용될 경우 달러화 가치 변동이 글로벌 교역에 미치는 영향력이 확대될 수 있다고 진단했다. 달러스테이블코인이 결제 및 송금 수단으로 널리 쓰이면 달러 패권이 강화될 것이라는 기존 연구들과 같은 해석이다.
다만 보고서는 달러 스테이블코인이 확산될 경우 담보 자산으로서 미국 국채에 대한 해외 수요가 확대될 수 있는 점은 달러 패권에 긍정적으로 평가하면서도, 달러화가 안전자산 통화로서의 지위 유지는 단정하기 어렵다는 다소 중립적인 시각도 제시했다.
과도한 미국 국채 발행이 용인돼 미국 국채 신뢰도가 저하되거나, 규제 미비로 코인런 발생 위험이 높아지고, 이로 인해 발행사의 담보자산인 미국 국채의 가격 변동성이 확대될 경우 오히려 달러화 안전자산 통화로서의 지위에 부정적으로 작용할 가능성이 있다는 분석이다.
손 팀장은 ""달러 스테이블코인이 글로벌 국제 교역에 활용되며 국제무역결제 통화나 운전자금 통화의 지위가 강화될 수 있지만, 코인런 등에 따른 신뢰 저하 등에 부정적으로 볼 가능성을 배제할 수 없다""고 말했다.
한편 이번 보고서는 글로벌 안전자산으로 달러가 선호되고, 국제 무역 결제 통화 기능이 강화되며 미국발 금융 충격이 국내 경제에 미치는 영향을 분석했다. 달러의 국제금융경로가 없을 경우 미국 금융리스크 충격은 국내 생산 감소폭의 2/3를 축소시키는 것으로 분석됐다.
우리 수출이달러화 대신 원화로 결제될 경우에는 달러 상승에 따른 우리 수출에 미치는 영향을 1/4 가량 축소시킬 것으로 봤다. 또한 우리 수출이 원화로 결제되면 미국의 금리 인상에도 국내 생산의 부정적 영향은 30% 가량 축소될 것으로 진단됐다.
손 팀장은 ""장기적으로 원화의 아시아 역내 국제화 등으로 달러화 변동이 무역결제 경로를 통해 우리 수출입에 미치는 영향을 완화해야 한다""면서 ""향후 예정된 세계국채지수(WGBI) 편입도 달러로 증폭되는 미국 금융 충격의 국내 파금 영향을 일부 완화시킬 것""이라고 말했다．",스테이블코인
뉴시스,"“스테이블코인, 글로벌 달러 패권 강화할 가능성…원화 국제화 제고해...",네이버뉴스,https://n.news.naver.com/mnews/article/003/0013482115?sid=101,,뉴시스,"한은 ""달러 스테이블코인, 달러 '안전자산' 지위에 부정적일 수도""","[그래픽=뉴시스] 재판매 및 DB금지. hokma@newsis.com
[서울=뉴시스]남주현 기자 = 한국은행이 달러 스테이블코인이 국제 교역에 활용되며 달러 패권주의를 강화시킬 수도 있지만, 동시에 코인런(대규모 인출 사태)과 국채 가격 변동성을 유발해 달러의 안전자산 통화로서의 지위에 부정적으로 작용할 수 있다는 진단을 내놨다.
한은은 15일 'BOK 경제연구' 시리즈 일환으로 발간한 '달러패권과 미국발 충격의 글로벌 파급 영향( Dollar Dominance and International Spillovers of US Financial Shocks)' 보고서를 통해 이같이 밝혔다. 손민규 한은 경제모형실 금융모형팀장이 작성했다.
보고서는 동태확률일반균형(DSGE) 모형을 통해 미국 달러화의 기축통화 지위에 따른 미국 금융 충격의 국내 파급 영향에 대해 진단했다. 이와 함께 달러 스테이블 코인의 글로벌 확산 가능성과 이에 따른 달러화의 국제적 지위 변화가 국내 경제에 미칠 파급 효과에 대해서도 점검했다.
연구진은 달러 스테이블코인의 거래 편의성으로 수출입 결제에 널리 이용될 경우 달러화 가치 변동이 글로벌 교역에 미치는 영향력이 확대될 수 있다고 진단했다. 달러스테이블코인이 결제 및 송금 수단으로 널리 쓰이면 달러 패권이 강화될 것이라는 기존 연구들과 같은 해석이다.
다만 보고서는 달러 스테이블코인이 확산될 경우 담보 자산으로서 미국 국채에 대한 해외 수요가 확대될 수 있는 점은 달러 패권에 긍정적으로 평가하면서도, 달러화가 안전자산 통화로서의 지위 유지는 단정하기 어렵다는 다소 중립적인 시각도 제시했다.
과도한 미국 국채 발행이 용인돼 미국 국채 신뢰도가 저하되거나, 규제 미비로 코인런 발생 위험이 높아지고, 이로 인해 발행사의 담보자산인 미국 국채의 가격 변동성이 확대될 경우 오히려 달러화 안전자산 통화로서의 지위에 부정적으로 작용할 가능성이 있다는 분석이다.
손 팀장은 ""달러 스테이블코인이 글로벌 국제 교역에 활용되며 국제무역결제 통화나 운전자금 통화의 지위가 강화될 수 있지만, 코인런 등에 따른 신뢰 저하 등에 부정적으로 볼 가능성을 배제할 수 없다""고 말했다.
한편 이번 보고서는 글로벌 안전자산으로 달러가 선호되고, 국제 무역 결제 통화 기능이 강화되며 미국발 금융 충격이 국내 경제에 미치는 영향을 분석했다. 달러의 국제금융경로가 없을 경우 미국 금융리스크 충격은 국내 생산 감소폭의 2/3를 축소시키는 것으로 분석됐다.
우리 수출이달러화 대신 원화로 결제될 경우에는 달러 상승에 따른 우리 수출에 미치는 영향을 1/4 가량 축소시킬 것으로 봤다. 또한 우리 수출이 원화로 결제되면 미국의 금리 인상에도 국내 생산의 부정적 영향은 30% 가량 축소될 것으로 진단됐다.
손 팀장은 ""장기적으로 원화의 아시아 역내 국제화 등으로 달러화 변동이 무역결제 경로를 통해 우리 수출입에 미치는 영향을 완화해야 한다""면서 ""향후 예정된 세계국채지수(WGBI) 편입도 달러로 증폭되는 미국 금융 충격의 국내 파금 영향을 일부 완화시킬 것""이라고 말했다．",스테이블코인
이데일리,"한은 ""달러스테이블코인확산, 달러 영향력 확대 가능성""",네이버뉴스,https://n.news.naver.com/mnews/article/018/0006116102?sid=101,,이데일리,"“스테이블코인, 글로벌 달러 패권 강화할 가능성…원화 국제화 제고해야”","한은 ‘달러패권과 미국발 충격의 글로벌 파급 영향’
기축통화 달러, 우리 기업 수출입 결제 80% 이상 차지
“WGBI 편입 시 달러 국내 영향 일부 완화 기대”
“원화 국제화 제고…달러 스테이블 코인 확산 대비해야”
[이데일리 유준하 기자] 스테이블 코인 결제가 확산할수록 달러화가 글로벌 경제에 미치는 영향력이 더 확대할 수 있다는 분석이 나왔다. 이에 따라 한국 역시 원화 국제화 제고를 통해 이에 대해 대비할 필요가 있다는 제언이다.
사진=AFP
한국은행이 15일 발표한 ‘달러패권과 미국발 충격의 글로벌 파급 영향’ 보고서는 달러가 금융 및 무역 경로를 통해 우리 경제에 미치는 영향을 수치화로 제시했다. 미국 회사채 시장의 초과 프리미엄(미국채 대비 금리 초과분)을 지표로 수치화한 금융리스크 충격은 달러 국제금융경로를 통해 국내 총 산출물 감소폭의 60% 이상 영향을 미치는 것으로 나타났다. 또한 미국발 충격에 따른 원·달러 환율 상승은 무역결제경로를 통해 25%가량의 파급력을 가했다.
손민규 한국은행 경제모형실 금융모형팀장은 “미국 달러화는 글로벌 안전자산 통화와 세계가치사슬(GVC) 운전자본 통화라는 점에서 국제금융경로를 통해 우리 경제에 영향을 미친다”면서 “또한 무역결제통화라는 점에서 국제무역경로를 통해 파급력을 전달한다”고 짚었다.
해당 분석에선 각 경로가 우리나라 경제에 미치는 영향을 분석하기 위해 각 경로가 없다는 가정 하에서의 변동분으로 영향력을 수치화했다. 이에 그는 “달러화의 국제금융경로가 없을 경우 미국 금융리스크에 따른 국내생산 감소폭은 3분의 2 이상이 축소됐다”면서 “원·달러 환율이 상승하지 않고 기업의 차입여건도 변하지 않아 국내생산 감소 효과는 대폭 축소됐다”고 설명했다.
통상 우리 수출 품목이 달러화로 거래된다는 점에서 달러의 무역결제경로를 통한 파급력도 상당하다. 달러는 현재 우리 기업 수출입 결제에서 이미 80% 이상의 비중을 차지하고 있다. 손 팀장은 “우리 수출이 달러화 대신 원화로 결제될 경우 미국 금융리스크 발생 시 국내생산(산출) 감소폭의 4분의 1가량이 축소됐다”면서 “원화 결제 시 원·달러 환율 상승이 수출가격 경쟁력 제고로 이어짐에 따라 단기적으로 수출이 증가하는 효과가 있다”고 강조했다.
미국의 금리인상으로 인한 강달러 효과는 해당 경로들을 통해 우리나라 실물경제에 영향을 미친다. 이에 금리인상에 따른 달러 강세에도 국제금융경로 또는 무역결제경로가 없을 경우 우리나라 국내 생산에 미치는 영향력은 30% 감소하는 것으로 나타났다.
이 같은 달러 파급력은 우리나라 경제에 대외변수로 작용한다는 점에서 변동성을 키우는 요소로 지적돼왔다. 일각에서는 글로벌 준비자산에서 달러화 비중이 하락하는 등 달러패권의 조용한 침식이 진행되고 있다고 주장하는 반면, 달러화의 국제적 지위가 단기간에 급격히 약화될 가능성은 낮다는 반론도 상존하는 상황이다.
손 팀장은 “아시아 역내 국가들과의 협력을 통해 원화의 국제화를 꾸준히 추진, 달러화 변동이 무역결제경로를 통해 우리 수출입에 미치는 영향을 완화할 필요가 있다”면서 “향후 예정된 WGBI 편입을 통해 우리 국채 투자매력도가 제고될 경우 미국 금융충격의 국내 파급 영향은 일부 완화될 것”이라고 봤다.
나아가 향후 달러 스테이블코인 확산에 따른 국내 경제 영향에 대비할 필요가 있다고 강조했다. 그는 “달러 스테이블코인이 거래 편의성을 바탕으로 수출입 결제에 널리 이용될 경우 세계가치사슬 운전자본경로와 무역결제경로를 통한 달러화 영향력이 확대될 가능성이 있다”고 부연했다.
자료=한국은행",스테이블코인
노컷뉴스,한은 “스테이블코인확산에 달러 영향력 확대할 것”,네이버뉴스,https://n.news.naver.com/mnews/article/079/0004066242?sid=101,,노컷뉴스,"한은 ""달러 스테이블코인 확산, 달러 영향력 확대 가능성""","연합뉴스
달러 기반 스테이블코인이 국제 결제 수단으로 널리 쓰일수록 달러 영향력도 더 커질 것이라고 한국은행이 분석했다.
한국은행은 15일 공개한 '달러 패권과 미국발 충격의 글로벌 파급 영향' 보고서에서 ""달러 스테이블코인의 글로벌 확산 가능성과 이에 따른 달러화의 국제적 지위 변화가 국내 경제에 미칠 영향에도 대비할 필요가 있다""고 조언했다.
한은은 ""달러 스테이블코인이 거래의 편의성을 바탕으로 수출입 결제에 널리 이용될 경우, GVC(글로벌가치사슬) 운전자본 경로와 무역결제 경로를 통해 달러 가치 변동이 글로벌 교역에 비치는 영향력이 확대될 가능성이 있다""고 봤다.
한은은 또 ""달러 스테이블코인이 확산될 경우 담보자산으로서 미 국채에 대한 해외 수요가 확대될 수 있다""면서도 ""이로 인해 안전자산 통화로서 달러화의 지위에 미칠 영향은 예단하기 어렵다""고 진단했다.
다만 ""과도한 미 국채 발행이 용인돼 미 국채에 대한 신뢰도가 저하되거나 규제 미비로 코인런 발생 위험이 높아지고 이로 인해 발행사의 담보자산인 미 국채의 가격 변동성이 확대될 경우, 오히려 달러화의 안전자산 통화로서의 지위에 부정적으로 작용할 가능성은 있다""고 봤다.
※CBS노컷뉴스는 여러분의 제보로 함께 세상을 바꿉니다. 각종 비리와 부당대우, 사건사고와 미담 등 모든 얘깃거리를 알려주세요.
이메일 :
jebo@cbs.co.kr
카카오톡 :
@노컷뉴스
사이트 :
https://url.kr/b71afn",스테이블코인
부산일보,"한은 “달러스테이블코인, 달러 안전자산 지위에 부정적 영향 끼칠 가...",네이버뉴스,https://n.news.naver.com/mnews/article/082/0001344869?sid=101,,부산일보,한은 “스테이블코인 확산에 달러 영향력 확대할 것”,"‘달러 패권과 미국발 충격의 글로벌 파급 영향’ 보고서
달러 기반 스테이블코인이 국제 결제 수단으로 널리 쓰일수록 달러 영향력도 더 커질 것이라는 전망이 나왔다. 서울 중구 하나은행 위·변조 대응센터에서 직원이 달러를 정리하고 있는 모습. 연합뉴스
달러 기반 스테이블코인이 국제 결제 수단으로 널리 쓰일수록 달러 영향력도 더 커질 것이라는 전망이 나왔다.
한국은행은 15일 공개한 ‘달러 패권과 미국발 충격의 글로벌 파급 영향’ 보고서에서 “달러 스테이블코인의 글로벌 확산 가능성과 이에 따른 달러화의 국제적 지위 변화가 국내 경제에 미칠 영향에도 대비할 필요가 있다”고 조언했다.
달러 스테이블코인이 거래의 편의성을 바탕으로 수출입 결제에 널리 이용될 경우, GVC(글로벌가치사슬) 운전자본 경로와 무역결제 경로를 통해 달러 가치 변동의 글로벌 교역 영향력이 더 커질 가능성이 있다는 게 한은의 설명이다.
달러가 우리나라 경제에 영향을 미치는 경로 가운데 GVC 운전자본 경로는 우리 기업이 해외 중간·자본재를 조달할 때 달러화 운전자본 차입에 주로 의존하는 것과 관련이 있다. 우리 기업의 수출입 거래에서 80% 이상이 달러로 결제되는 만큼, 달러 변동의 파장은 무역결제 경로를 통해서도 확대된다.
한은은 보고서에서 “아시아 역내 국가들과 협력을 통해 달러화 변동이 무역결제 경로로 우리 수출입에 미치는 영향을 줄일 필요가 있다”고 주장했다. 이어 “양자 간 통화스와프 체결 확대, 원화표시채권 역외 발행 등으로 원화의 아시아 역내 결제통화로서 위상을 확보해야 한다”고 덧붙였다.",스테이블코인
전자신문,"전기 이륜차타면스테이블코인보상, '탄소코인 모델' 나온다",네이버뉴스,https://n.news.naver.com/mnews/article/030/0003350519?sid=101,,전자신문,"전기 이륜차타면 스테이블코인 보상, '탄소코인 모델' 나온다","핑거, 마이크레딧체인, 바이크뱅크, 로지올(생각대로)이 '바뱅탄스코' 프로젝트를 추진한다. (왼쪽부터) 남윤호 마이크레딧체인 대표, 채현진 로지올 대표, 안인주 핑거 대표
배달 라이더의 주행 데이터가 블록체인을 통해 디지털자산으로 전환되는 '탄소코인 모델'이 내년 첫 선을 보인다.
핑거와 핑거 자회사 마이크레딧체인은 바이크뱅크, 생각대로(로지올)와 최근 전기이륜차 친환경 모빌리티와 블록체인 기술을 결합한 '바뱅탄스코' 프로젝트를 추진하기로 업무협약을 체결했다.
바뱅탄스코는 탄소감축·스테이블코인 프로젝트다. 라이더가 전기이륜차로 주행하면 탄소감축량이 토큰화돼 탄소코인이 지급되고, 이는 P2P 마켓에서 자유롭게 사고팔 수 있는 구조다. 라이더의 친환경 주행 데이터를 탄소감축량(MRV)으로 검증하고, 이를 스테이블코인 보상으로 연결해 디지털 탄소자산 생태계를 구현한다. 지급받은 코인은 배터리 충전 쿠폰 등으로 교환해 사실상 현금처럼 활용할 수 있다. 친환경 활동이 새로운 수익원으로 이어진다.
바이크뱅크는 국내 전기이륜차 렌트업체, 로지올은 배달중개 플랫폼 '생각대로'를 운영한다. 이번 프로젝트는 전기이륜차와 배달중개 플랫폼, 여기에 블록체인 기술을 결합한 모델이다. 핑거와 마이크레딧체인은 블록체인과 디지털자산·웹3 생태계 구축을 담당한다. 라이더의 주행 데이터는 블록체인에 기록돼 위·변조가 불가능하다. 다양한 디지털자산 보상은 스마트컨트랙트 기반으로 자동 처리된다.
프로젝트에는 게이미피케이션 요소도 더해졌다. 라이더는 주행과 미션을 달성하면 앱 내에서 캐릭터 능력치를 높이는 게임 보상을 받거나, NFT 뱃지·랭킹 경쟁·커뮤니티 활동으로 추가 보상을 받는다. 현실의 친환경 주행을 가상 게임과 결합한 것이다.
사진제공=마이크레딧체인
바뱅탄스코 프로젝트는 2026년 3월 서비스 오픈을 목표로 한다. 서비스 오픈 이후에는 2026년 8월까지 1만명 라이더를 확보하고, 2027년에는 10만명 이상 활동 구독라이더로 확대한다는 계획이다. 이번 프로젝트는 정부의 탄소중립 정책과 디지털자산 제도화와 발맞춘 협력이다.
안인주 핑거 대표는 “전기이륜차의 탄소저감 활동을 블록체인 기술로 탄소크레딧과 스테이블코인 등 디지털 자산으로 토큰화하는 것은 웹3 기반의 녹색 금융과 경제 전환의 출발점”이라며 “국민 누구나 환경에 기여하면서 동시에 보상을 받을 수 있는 새로운 패러다임을 열겠다”고 말했다.
이석영 바이크뱅크 대표는 “전기이륜차와 전국 라이더 네트워크를 바탕으로 라이더들에게 실질적인 보상과 만족을 제공하는 회원경제 기반 친환경 모빌리티 플랫폼으로 도약하겠다”고 강조했다.",스테이블코인
한국경제,'환율 상승→수출 증가' 공식…이젠 안 통하는 이유 [한경 외환시장 워...,네이버뉴스,https://n.news.naver.com/mnews/article/015/0005184920?sid=101,,한국경제,'환율 상승→수출 증가' 공식…이젠 안 통하는 이유 [한경 외환시장 워치],"사진=뉴스1
미국 달러화의 패권이 강화되면서 환율이 오르면 수출이 늘어난다는 공식이 힘을 잃고 있다. 수출입 대금을 달러화로 주고받기 때문에 고환율의 이점이 나타나는 데까지 시간이 너무 많이 걸린다는 분석이다. 달러 스테이블코인이 활성화될 경우 이같은 현상이 더욱 강화될 수 있다는 우려도 나온다.
한국은행은 15일 손민규 금융모형팀장이 쓴 '달러 패권과 미국발 충격의 글로벌 파급영향(Dollar Dominance and International Spillovers of US Financial Shocks)' 보고서를 통해 이같은 연구 결과를 소개했다.
손 팀장은 미국 달러화가 '글로벌 안전자산', '글로벌 공급망(GVC)의 운전자본', '결제통화' 등 기능을 통해 글로벌 경제에 큰 영향을 미치고 있다고 설명했다. 이런 가운데 미국의 금융리스크 충격이 발생할 경우 국제금융경로, 무역결제경로를 통해 한국의 국내총생산이 줄어드는 것으로 분석됐다.
무역결제경로에서는 미국의 금융리스크 충격에 따른 글로벌 달러화 강세가 우리 제품의 수입국 현지 제품가격의 상승으로 이어져 우리 수출에 부정적 영향을 주는 것으로 나타났다. 통상 고환율 시기엔 수출품 가격을 낮출 여지가 생기면서 가격경쟁력이 높아져 수출에 도움이 되는 것으로 알려져있다. 하지만 이번 분석에서는 이런 전통적 가설과 대조를 이루는 결과가 나왔다.
손 팀장은 ""국내 기업이 미국을 제외한 다른 나라에 수출할 때 무역대금을 달러로 결제하기 때문""이라며 ""달러 표시 상품을 수입하는 입장에서는 가격이 오른 효과가 나타난다""고 설명했다. 이같은 악영향은 충격 발생 후 1년간 더욱 악화되다가 이후 줄어드는 것으로 분석됐다. 악영향이 사라지는 데에는 약 3년이 걸렸다. 손 팀장은 ""중장기적으로는 국내 기업이 달러 표시 가격을 조정하면서 무역수지에 도움이 돼 통념과 같아진다""고 덧붙였다.
손 팀장은 이런 무역결제 방식에 따른 악영향은 원화 국제화를 통해 해소할 수 있다고 봤다. 무역대금이 원화로 결제될 경우 미국 달러화 가치 상승에 따라 수입국 가격이 올라갈 여지가 없어지기 때문이다. 손 팀장은 ""아시아 지역 국가들을 중심으로 양자간 통화스왑, 원화표시채권의 역외 발행 추진 등을 추진할 필요가 있다""고 말했다.
달러 스테이블코인의 확산도 주요 변수로 지목했다. 달러 스테이블코인이 거래의 편의성을 바탕으로 수출입 결제에 널리 이용될 경우 달러화 가치 변동이 글로벌 교역에 미치는 영향이 커질 것이란 전망이다. 다만 원화 스테이블코인으로 대응해야 하는지에 관해 묻자 손 팀장은 ""연구의 범위를 벗어난다""고 말을 아꼈다.
국제금융경로에선 안전자산, GVC 운전자본 역할에 따른 악영향이 두드러졌다. 미국의 금융리스크 충격이 발생하면 글로벌 위험회피 성향이 강화되고, 이는 미국 국채 수요 증가로 이어진다. 달러화는 강세를 나타내고, 한국의 수입 물가와 국내 금리는 오른다. 이에 따라 국내 투자와 소비가 줄어드는 것이다.
또 미국의 금융여건이 악화하면 달러화 운전자본 차입 여건도 나빠진다. 이는 국내기업의 중간재 투입과 생산 감소로 이어진다. 손 팀장은 미국의 금융리스크에 영향을 받아 나타나는 한국의 GDP 감소분 중 이런 국제금융경로에 따른 생산 감소분이 3분의 2에 이르는 것으로 분석했다.
이런 측면을 보완하기 위해선 세계국채지수(WGBI) 편입이 순조롭게 이뤄져야 한다고 봤다. 한국 국채의 투자 매력도가 높아지면 안전자산을 고려할 때 미국 국채로 쏠리지 않고 한국 국채를 선택할 수 있다는 것이다.",스테이블코인
