press,title,naver_news_text,naver_news_url,body,press_html,title_html,body_html,label
한국경제,"강달러, 美금융충격 증폭시켜…한은 ""스테이블코인확산 대비해야""",네이버뉴스,https://n.news.naver.com/mnews/article/015/0005184920?sid=101,,한국경제,'환율 상승→수출 증가' 공식…이젠 안 통하는 이유 [한경 외환시장 워치],"사진=뉴스1
미국 달러화의 패권이 강화되면서 환율이 오르면 수출이 늘어난다는 공식이 힘을 잃고 있다. 수출입 대금을 달러화로 주고받기 때문에 고환율의 이점이 나타나는 데까지 시간이 너무 많이 걸린다는 분석이다. 달러 스테이블코인이 활성화될 경우 이같은 현상이 더욱 강화될 수 있다는 우려도 나온다.
한국은행은 15일 손민규 금융모형팀장이 쓴 '달러 패권과 미국발 충격의 글로벌 파급영향(Dollar Dominance and International Spillovers of US Financial Shocks)' 보고서를 통해 이같은 연구 결과를 소개했다.
손 팀장은 미국 달러화가 '글로벌 안전자산', '글로벌 공급망(GVC)의 운전자본', '결제통화' 등 기능을 통해 글로벌 경제에 큰 영향을 미치고 있다고 설명했다. 이런 가운데 미국의 금융리스크 충격이 발생할 경우 국제금융경로, 무역결제경로를 통해 한국의 국내총생산이 줄어드는 것으로 분석됐다.
무역결제경로에서는 미국의 금융리스크 충격에 따른 글로벌 달러화 강세가 우리 제품의 수입국 현지 제품가격의 상승으로 이어져 우리 수출에 부정적 영향을 주는 것으로 나타났다. 통상 고환율 시기엔 수출품 가격을 낮출 여지가 생기면서 가격경쟁력이 높아져 수출에 도움이 되는 것으로 알려져있다. 하지만 이번 분석에서는 이런 전통적 가설과 대조를 이루는 결과가 나왔다.
손 팀장은 ""국내 기업이 미국을 제외한 다른 나라에 수출할 때 무역대금을 달러로 결제하기 때문""이라며 ""달러 표시 상품을 수입하는 입장에서는 가격이 오른 효과가 나타난다""고 설명했다. 이같은 악영향은 충격 발생 후 1년간 더욱 악화되다가 이후 줄어드는 것으로 분석됐다. 악영향이 사라지는 데에는 약 3년이 걸렸다. 손 팀장은 ""중장기적으로는 국내 기업이 달러 표시 가격을 조정하면서 무역수지에 도움이 돼 통념과 같아진다""고 덧붙였다.
손 팀장은 이런 무역결제 방식에 따른 악영향은 원화 국제화를 통해 해소할 수 있다고 봤다. 무역대금이 원화로 결제될 경우 미국 달러화 가치 상승에 따라 수입국 가격이 올라갈 여지가 없어지기 때문이다. 손 팀장은 ""아시아 지역 국가들을 중심으로 양자간 통화스왑, 원화표시채권의 역외 발행 추진 등을 추진할 필요가 있다""고 말했다.
달러 스테이블코인의 확산도 주요 변수로 지목했다. 달러 스테이블코인이 거래의 편의성을 바탕으로 수출입 결제에 널리 이용될 경우 달러화 가치 변동이 글로벌 교역에 미치는 영향이 커질 것이란 전망이다. 다만 원화 스테이블코인으로 대응해야 하는지에 관해 묻자 손 팀장은 ""연구의 범위를 벗어난다""고 말을 아꼈다.
국제금융경로에선 안전자산, GVC 운전자본 역할에 따른 악영향이 두드러졌다. 미국의 금융리스크 충격이 발생하면 글로벌 위험회피 성향이 강화되고, 이는 미국 국채 수요 증가로 이어진다. 달러화는 강세를 나타내고, 한국의 수입 물가와 국내 금리는 오른다. 이에 따라 국내 투자와 소비가 줄어드는 것이다.
또 미국의 금융여건이 악화하면 달러화 운전자본 차입 여건도 나빠진다. 이는 국내기업의 중간재 투입과 생산 감소로 이어진다. 손 팀장은 미국의 금융리스크에 영향을 받아 나타나는 한국의 GDP 감소분 중 이런 국제금융경로에 따른 생산 감소분이 3분의 2에 이르는 것으로 분석했다.
이런 측면을 보완하기 위해선 세계국채지수(WGBI) 편입이 순조롭게 이뤄져야 한다고 봤다. 한국 국채의 투자 매력도가 높아지면 안전자산을 고려할 때 미국 국채로 쏠리지 않고 한국 국채를 선택할 수 있다는 것이다.",스테이블코인
동아일보,"[광화문에서/한재희]스테이블코인, 두렵다면 규제 샌드박스부터 시작하...",네이버뉴스,https://n.news.naver.com/mnews/article/020/0003661219?sid=110,,동아일보,"[광화문에서/한재희]스테이블코인, 두렵다면 규제 샌드박스부터 시작하자","한재희 경제부 기자
서울 등 수도권에 직영점 5곳을 둔 한 찌개 전문점 입구엔 ‘비트코인 결제 가능’이란 안내문이 한국어와 영어로 붙어 있다. 이 가게는 국내 스타트업과 협업해 비트코인 결제망을 깔아뒀다. 온라인에서 비트코인 사용 가능 매장을 알려주는 ‘BTC맵’에도 이름을 올렸다. 코인 결제 손님에겐 특별히 음료수를 주는 서비스도 마련해 놨다. 앞으로 비트코인 거래가 대중화될 것이란 믿음 때문이다. 하지만 비트코인 결제 서비스가 7월 개시된 뒤 현재까지 5개 매장의 비트코인 결제는 0건이다.
마치 100만 년 전 호모에렉투스가 처음 불을 얻으려 열심히 부싯돌을 내리쳤듯 코인 경제 선구자들이 코인 결제를 시도하고 있지만 코인 결제의 불씨는 좀처럼 붙지 않는다. 환경이 제대로 갖춰지지 않았기 때문이다. 기존의 가상자산이용자보호법은 주로 코인 거래소를 규제하는 내용이다. 소비자를 보호하는 법이다 보니 가상자산의 국내 발행이나 코인을 활용한 결제 등에 관한 규정이 소상히 담겨 있지 않다. 부싯돌도 둘이 만나야 불꽃이 튀는데 지금은 기업들만 의욕이 있고 규정은 없어 헛손질만 계속되는 꼴이다.
국내에서 비트코인 결제가 불법은 아니지만 관련 규정이 제대로 마련돼 있지 않다 보니 자영업자들도 결제를 확대하길 꺼리게 된다. 괜히 불법 업체로 낙인이 찍힐까 걱정하는 것이다. 한 가상자산 업자는 기자에게 “규정이 없다면 막지도 말아야 하는데 한국에선 정부가 행정지도나 애매한 다른 규정을 준용해 제재할 수 있어서 몸을 사리는 중”이라고 털어놨다.
신중론자들의 우려도 일리가 있다. 가상자산 결제의 장밋빛 미래만 보고 서둘러 도입했다가 부작용으로 피해를 볼 수 있다. 2022년 루나·테라의 발행사 테라폼랩스 부실로 코인 가치가 폭락하며 ‘코인런’(대규모 코인 인출)이 발생한 바 있다. 이런 사태가 재연되면 큰일이다.
‘1달러=1코인’처럼 가치가 고정된 스테이블코인도 아직 관련 법이 없어 더 준비해야 할 게 많다.
새로운 금융에 대한 우려가 크다면 이를 관리할 법부터 빨리 마련해야 하는데 국회도 입법 속도가 더디다. 정부도 국회도 속도를 내지 못하고 있는 만큼 스테이블코인 등 가상자산 사업을 금융 규제 샌드박스 정책으로 인정해 달라고 권하고 싶다. 규제 샌드박스는 혁신성이 뛰어난 사업을 선발해 실증 사업을 한시적으로 허용하는 제도다. 모래사장같이 비교적 안전한 곳에서 여러 실험을 해보자는 취지다. 홍콩은 지난해 이미 스테이블코인 샌드박스 제도를 운용한 뒤 올해 5월 정식 조례를 도입했다. 싱가포르도 규제 샌드박스로 실험을 거친 뒤 2023년에 일종의 정부 지침인 스테이블코인 프레임워크를 확정했다.
국내에 금융 규제 샌드박스가 적용된 가상자산 서비스는 없지만 정부가 의지만 있으면 관련 법을 손질해 시도해볼 수 있다. 이억원 금융위원장도 인사청문회에서 스테이블코인을 샌드박스로 허용하는 안을 “생각도 있고, 준비도 돼 있다”고 밝힌 바 있다. 생각과 준비에 머물지 말고 부분적으로라도 실천해 봐야 우리에게 득인지 실인지 알 수 있다. 그렇지 않으면 코인 경제를 기대하는 시장의 불씨마저 사그라들 수 있다.",스테이블코인
헤럴드경제,스테이블코인2900억달러 목전…금리인하 주시 거래량 급등 [투자360],네이버뉴스,https://n.news.naver.com/mnews/article/016/0002529389?sid=101,,헤럴드경제,스테이블코인 2900억달러 목전…금리인하 주시 거래량 급등 [투자360],"테더 사상 첫 1700억달러 넘어서
시총은 늘지만 점유율은 위축
1분기 68.2%였지만 60%대 아래로
트럼프家 USD1 미국시장 경쟁자 급부상
가상자산 급등에 거래 목적 스테이블코인↑
[게티이미지]
[헤럴드경제=유동현 기자] 스테이블코인 점유율 경쟁이 본격화하면서 시가총액 규모가 2900억달러 돌파 초읽기에 들어갔다. 이번 주 미국 금리인하 기대가 고조되면서 가상자산 거래가 증가하자 거래량도 일주일 새 10%대 급등했다.
15일 디파이라마에 따르면 이날 오후 2시 기준 289개 스테이블코인 시가총액은 일주일 새 38억1700만달러(1.34%) 증가한 2895억6400만달러(약 402조원)로 집계됐다. 주로 달러에 연동돼 변동성이 제한된 특성을 감안하면 적지 않은 성장세다. 연초(2070억3000만달러) 대비 39.87% 늘어난 규모다.
전체 점유율 1위는 테더(USDT)로 1703억4900만달러(58.83%)를 기록했다. 이어 써클이 발행하는 유에스디코인(USDC)이 727억7800만달러(25.13%), 에테나랩스가 발행하는 에테나 USDe가 135억9000만달러(4.69%)로 뒤를 이었다.
스테이블코인은 지난 7월 미국에서 규율법인 지니어스법(GENIUS ACT)이 의회를 통과한 후 경쟁판이 마련됐다. 발행과 감독 규정이 정해지면서 미국 시장을 겨냥한 신규 스테이블코인이 잇달아 출시되고 있다. 도널드 트럼프 대통령 일가 중심으로 설립된 월드리버티파이낸셜(WLFI)은 이달 초 스테이블코인 USD1을 발행했고 테더사는 미국 규제 요건을 충족한 달러 기반 스테이블코인 ‘USAT’를 연말까지 출시한다고 12일 발표했다. 전체 시가총액도 지니어스법을 포함해 가상자산 3법(클래리티·반(反)CBDC법)을 다룬 ‘크립토 위크(Crypto Week)’가 진행된 지난 7월 기점으로 14.86% 올랐다.
현 시장은 USDT와 USDC가 사실상 양분하고 있다. USDT는 사상 처음으로 1700억달러를 돌파하며 성장세도 견조하다. 그러나 달러 스테이블코인 시장 내 점유율을 확보하기 위한 경쟁자가 등장하면서 전체 점유율은 우하향하고 있다. 지난 1분기 기준 점유율은 68.2%였지만 현재 60%선을 내줬다. 위기감은 써클 역시 마찬가지다. USDC의 주된 유통 기반인 코인베이스에 월드리버티파이낸셜이 USD1를 발행하면서 경쟁자로 급부상했다. USD1은 발행 2주만에 전체 6위 규모(26억6200만달러․0.92%)로 점유율을 올렸다.
히스 타버트 써클 사장과 마르코 달 라고 테더 부사장이 잇단 한국을 찾은 건 미국 내 강력한 경쟁자(USD1) 등장으로 유통 채널 확대가 필요한 위기감과 무관치 않다. 자사 달러 기반 스테이블코인을 주요국으로 확산해야하는 경쟁 국면이 펼쳐진 것이다. 한 가상자산 투자업계 관계자는 “USD1이 미국 내 유통망 점유율을 늘릴 가능성이 있기 때문에 점점 한국이나 해외 지역에 가서 본인들의 스테이블코인 유치를 늘려야 하는 상황”이라 전했다.
스테이블코인 거래량도 늘고 있다. 이번주 16~17일(현지시간) 미국 연방공개시장위원회(FOMC)에서 금리인하가 확실시되는 가운데 위험자산으로 유동성이 증가하는 것으로 풀이된다. 스테이블코인의 88%는 ‘페어링(Pairing)’ 목적으로 대부분 가상자산 거래에 쓰인다. 최근 일주일(9월8~14일) USDT 하루 평균 거래량은 884억9894만달러로 직전 일주일(9월1~7일) 770억3006만달러 대비 14.89% 늘었다. USDC도 최근 일주일(116억5410만달러) 하루 평균 거래량이 직전 일주일(99억9439만달러)대비 16.61% 증가했다.",스테이블코인
디지털투데이,이더리움 기반스테이블코인시총 1660억달러 돌파...사상 최고치,,,,,,,스테이블코인
뉴시스,"스테이블코인테더, 美 시장 정조준…점유율 '1위' 굳힐까",네이버뉴스,https://n.news.naver.com/mnews/article/003/0013483518?sid=101,,뉴시스,"스테이블코인 테더, 美 시장 정조준…점유율 '1위' 굳힐까","테더, 美 규제 준수한 '새 스테이블코인' 출시 예정
기존 USDT 논란 정면 돌파…준비금은 美 금융사가 맡아
USDC·USD1 반사이익 무산되나
[서울=뉴시스] 해당 이미지는 기사의 이해를 돕기 위해 AI로 생성 후 편집함. *재판매 및 DB 금지 (그래픽=안지혜 기자) hokma@newsis.com
[서울=뉴시스]이지영 기자 = 달러 기반 스테이블코인 점유율 1위 테더(USDT) 발행사가 미국 규제를 준수한 새로운 스테이블코인을 내놓는다. 테더가 미국 시장을 정조준하면서 점유율 2위 USDC와 트럼프 일가가 발행한 USD1 등과 격차를 유지할지 주목된다.
15일 업계에 따르면 테더는 13일(현지시간) X를 통해 ""미국을 위한 스테이블코인 USAT를 곧 출시할 것""이라고 예고했다.
USAT는 지난 7월 통과된 미국 연방 스테이블코인 규제법 '지니어스액트(GENIUS Act)'를 준수하는 것이 주요 특징이다. 미국 규제를 따르는 스테이블코인인 셈이다. 출시 시점은 연말로 예정됐다.
지니어스액트는 연방 정부의 인가를 받은 법인만 스테이블코인을 발행할 수 있도록 제한하고 있다.
테더는 이를 위해 글로벌 가상자산 커스터디(수탁) 기업 앵커리지디지털을 통해 USAT를 발행한다. 앵커리지디지털은 미국에서 유일하게 연방 은행 인가(National Bank Charter)를 받은 가상자산 기업이다. 연방 은행 인가를 받은 가상자산 기업은 가상자산에 한해 미국 어느 주에서든 제한 없이 은행 서비스를 제공할 수 있다.
테더가 기존 USDT 외에 새로운 스테이블코인을 발행한 이유는 또 있다. 준비금 논란이다. 해당 논란으로 테더가 최악의 경우 지니어스액트 시행 이후 미국에서 퇴출당할 것이란 시나리오도 제기된 바 있다.
지니어스 액트에 따르면 미국 내 모든 스테이블코인 발행자는 발행량에 상응하는 준비금을 1대1로 예치해야 한다. 여기서 준비금은 현금과 단기 미 국채 등 고유동성 자산만 인정된다. 준비금 보유 비율이 미달하면 즉시 법적 제재를 받는다.
USDT는 준비금 일부가 비트코인과 금 등 변동성 자산과 중국 자산으로 구성됐던 것으로 알려졌다.
테더가 새롭게 선보일 USAT는 이 논란을 정면 돌파했다. 우선 준비금은 미국 종합 금융 기업 캔터피츠제럴드가 관리한다. 캔터피츠제럴드는 USDT 준비금을 관리하는 기업이기도 하다.
수장도 USAT가 미국 내 입지를 다지는 데 힘을 보탤 것으로 보인다. 테더는 USAT 최고경영자(CEO)로 보 하인스 테더 미국 전략 고문을 임명했다. 하인스 CEO는 트럼프 행정부에서 첫 백악관 가상자산 자문위원장을 역임한 바 있다.
이에 전문가들은 테더가 USAT를 통해 미국 시장에 안착할 경우 우려를 뒤집고 기존 점유율을 지켜낼 것이라고 보고 있다. 현재 테더는 글로벌 스테이블코인 점유율 66%를 차지, 부동의 1위를 기록하고 있다.
그간 시장에서는 테더 입지 약화 전망에 따라 미국 내 다른 달러 기반 스테이블코인의 반사이익이 점쳐졌다. 테더 다음으로 점유율 2위에 달하는 USDC가 대표적이다.
또 트럼프 일가가 이끄는 월드 리버티 파이낸셜(World Liberty Financial, WLFI)이 자체 발행한 스테이블코인 USD1도 대표 수혜자로 예상됐다.",스테이블코인
한국금융신문,막오른스테이블 코인주도권 경쟁…가맹점·결제 네트워크 기반 유통 ...,,,,,,,스테이블코인
한국금융신문,카드사 “스테이블코인발행·유통 겸업 허용” 금융위에 업무계획 전달,,,,,,,스테이블코인
헤럴드경제,3년 전부터 준비했다…'스테이블코인패권' 노리는 일본,네이버뉴스,https://n.news.naver.com/mnews/article/016/0002529005?sid=101,,헤럴드경제,카드사 “스테이블코인 발행·유통 겸업 허용” 금융위에 업무계획 전달,"올해 연말 개정 건의안 제출 계획
여전법 내 원화 스테이블코인 신설 포함 예정
총 6차례 스테이블코인 TF로 적극 대응
스테이블코인 도입 검증 개념증명 착수
서울시 중구에 위치한 여신금융협회. [여신금융협회]
[헤럴드경제=정호원 기자] 카드업계가 스테이블코인 발행·유통 겸업 허용 등의 내용을 담은 업무계획을 금융위원회에 제출한 것으로 확인됐다. 다음달 예정된 스테이블코인 정부 발의안을 앞두고 디지털자산 시장 대응 속도를 높이기 위한 차원으로 풀이된다. 여신협은 해당 내용을 구체화해 올해 말 개정 건의안으로 제출할 예정이다.
15일 금융권에 따르면 여신금융협회는 지난달 18일 금융위원회 중소금융과에 스테이블코인 사업의 법적 명확성을 확보하기 위한 업무 계획안을 제출했다. 여신금융협회는 해당 계획안을 바탕으로 올해 연말 여전법 개정 건의서를 제출한다는 방침이다.
주요 건의 내용은 ▷스테이블코인 발행·유통 겸업 허용 ▷여신전문금융업법 개정 등이다. 현행법은 카드사의 본업 외 사업을 제한하고 있어, 스테이블코인 사업을 영위하기 위해선 법 개정이 필수라는 취지다.
특히 여전법상 신용카드와 신용카드가맹점 정의를 개정해 원화 스테이블코인 등 디지털자산 기반 지급수단을 포함할 수 있도록 요청했다. 현행법은 신용카드를 ‘증표’로 규정하고 있어 원화 스테이블코인 같은 디지털자산 지급수단을 포함하지 못한다. 또한 신용카드 가맹점의 범위도 신용·직불·선불카드 거래로 한정된다. 이에 카드업계는 디지털자산업을 영위할 법적 근거를 마련하고, 원화 스테이블코인 정의를 여전법에 신설해 줄 것을 요청했다.
한 카드사 관계자는 “스테이블코인 사업에 진출하려면 여전법 개정이 가장 기본적인 단계”라며 “법적 불확실성을 해소하기 위해 개정을 요구하는 것”이라고 설명했다. 또 “카드사는 이미 기존 인프라로 소비자와 가맹점을 연결하고 있어 은행 및 핀테크 대비 강점을 보유하고 있다는 점을 근거로 설명했다”고 덧붙였다.
현재 국회에는 스테이블코인 관련 의원안 5건이 발의되어 있고, 다음달 정부안까지 발표되면 법안 심사가 급물살을 탈 수 있어 법제화 이전부터 국회와 적극적으로 소통해 제도권 내 카드사 참여 필요성을 적극 알린다는 방침이다.
이에 카드업계는 여전법 개정과 스테이블코인 상용화를 논의하기 위해 지난 7월 말부터 9월 초까지 총 6차례 스테이블코인 TF를 열었다. TF에는 9개 카드사(삼성·신한·KB국민·현대·롯데·하나·우리·비씨·NH농협) 디지털 부문 실무진과 여신금융협회 관계자가 참석했으며, 지난 10일 활동을 마무리하고 카드업권 임원진을 대상으로 경과 보고회도 열었다.
현재 협회와 카드사는 서비스 도입의 실현 가능성을 검증하는 공동 및 개별 개념증명(PoC·Proof of Concept) 설계도 착수했다. 공동 PoC에서는 지역화폐나 카드사 포인트 교환 허브를 통해 스테이블코인을 교환하는 방안이 논의되고 있다. 업계는 내년 중순까지 공동 PoC로 실효성을 입증한 뒤, 하반기부터 스테이블코인 상용화에 나선다는 구상이다. 지난 19일에는 CARD KRW, CARD WON, K-WONPAY, 케이원페이 등 10종의 상표권도 출원했다.
한편 협회는 오는 16일 오후 3시 서울 중구 본회에서 이찬진 금융감독원장과 정완규 협회장을 비롯해 이사진과 간담회를 연다. 협회 이사회는 감사(현대카드) 1명과 카드사 CEO 7명, 캐피탈사 CEO 7명 등 총 16명으로 구성돼 있다. 이날 간담회에서 여신업계는 스테이블코인 사업 진출을 위한 법 개정과 결제 인프라 활용 방안뿐 아니라 신용카드사의 지급결제 전용 계좌 허용, 캐피탈업계의 보험대리점(GA) 진출 허용 등을 금융당국에 건의할 예정이다.",스테이블코인
글로벌이코노믹,카드사 “스테이블코인발행·유통 겸업 허용”…금융위에 건의,,,,,,,스테이블코인
헤럴드경제,"카드업계 ""스테이블코인발행·유통 겸업 허용해달라""",네이버뉴스,https://n.news.naver.com/mnews/article/016/0002529188?sid=101,,헤럴드경제,카드사 “스테이블코인 발행·유통 겸업 허용”…금융위에 건의,"여전법 원화스테이블코인 신설포함
7월 말부터 6차례 TF로 적극 대응
도입 실현검증 개념증명 설계 착수
카드업계가 스테이블코인 발행·유통 겸업 허용 등의 내용을 담은 건의안을 금융위원회에 제출한 것으로 확인됐다. 다음달 예정된 스테이블코인 정부 발의안을 앞두고 디지털자산 시장 대응 속도를 높이기 위한 차원으로 풀이된다.
15일 금융권에 따르면 여신금융협회는 지난달 18일 금융위원회 중소금융과에 스테이블코인 사업의 법적 명확성을 확보하기 위한 여전법 개정 건의서를 제출했다.
주요 건의 내용은 ▷스테이블코인 발행·유통 겸업 허용 ▷여신전문금융업법 개정 등이다. 현행법은 카드사의 본업 외 사업을 제한하고 있어, 스테이블코인 사업을 영위하기 위해선 법 개정이 필수라는 취지다.
특히 여전법상 신용카드와 신용카드가맹점 정의를 개정해 원화 스테이블코인 등 디지털자산 기반 지급수단을 포함할 수 있도록 요청했다. 현행법은 신용카드를 ‘증표’로 규정하고 있어 원화 스테이블코인 같은 디지털자산 지급수단을 포함하지 못한다. 또한 신용카드 가맹점의 범위도 신용·직불·선불카드 거래로 한정된다. 이에 카드업계는 디지털자산업을 영위할 법적 근거를 마련하고, 원화 스테이블코인 정의를 여전법에 신설해 줄 것을 요청했다.
한 카드사 관계자는 “스테이블코인 사업에 진출하려면 여전법 개정이 가장 기본적인 단계”라며 “법적 불확실성을 해소하기 위해 개정을 요구하는 것”이라고 설명했다. 또 “카드사는 이미 기존 인프라로 소비자와 가맹점을 연결하고 있어 은행 및 핀테크 대비 강점을 보유하고 있다는 점을 근거로 설명했다”고 덧붙였다.
현재 국회에는 스테이블코인 관련 의원안 5건이 발의되어 있고, 다음달 정부안까지 발표되면 법안 심사가 급물살을 탈 수 있어 법제화 이전부터 국회와 적극적으로 소통해 제도권 내 카드사 참여 필요성을 적극 알린다는 방침이다. 이에 카드업계는 여전법 개정과 스테이블코인 상용화를 논의하기 위해 지난 7월 말부터 9월 초까지 총 6차례 스테이블코인 TF를 열었다. TF에는 9개 카드사(삼성·신한·KB국민·현대·롯데·하나·우리·비씨·NH농협) 디지털 부문 실무진과 여신금융협회 관계자가 참석했으며, 지난 10일 활동을 마무리하고 카드업권 임원진을 대상으로 경과 보고회도 열었다.
현재 협회와 카드사는 서비스 도입의 실현 가능성을 검증하는 공동 및 개별 개념증명(PoC·Proof of Concept) 설계도 착수했다. 공동 PoC에서는 지역화폐나 카드사 포인트 교환 허브를 통해 스테이블코인을 교환하는 방안이 논의되고 있다. 업계는 내년 중순까지 공동 PoC로 실효성을 입증한 뒤, 하반기부터 스테이블코인 상용화에 나선다는 구상이다. 지난 19일에는 CARD KRW, CARD WON, K-WONPAY, 케이원페이 등 10종의 상표권도 출원했다.
한편 협회는 오는 16일 오후 3시 서울 중구 본회에서 이찬진 금융감독원장과 정완규 협회장을 비롯해 이사진과 간담회를 연다. 협회 이사회는 감사(현대카드) 1명과 카드사 CEO 7명, 캐피탈사 CEO 7명 등 총 16명으로 구성돼 있다. 이날 간담회에서 여신업계는 스테이블코인 사업 진출을 위한 법 개정과 결제 인프라 활용 방안뿐 아니라 신용카드사의 지급결제 전용 계좌 허용, 캐피탈업계의 보험대리점(GA) 진출 허용 등을 금융당국에 건의할 예정이다. 정호원 기자",스테이블코인
