press,title,naver_news_text,naver_news_url,body,press_html,title_html,body_html,label
한국경제,구글 vs MS…'챗GPT'가 불붙인 AI 전쟁,네이버뉴스,https://n.news.naver.com/mnews/article/015/0004806983?sid=105,,한국경제,구글 vs MS…'챗GPT'가 불붙인 AI 전쟁,"위드 AI 시대
구글, 앤스로픽에 4억弗 투자
오픈AI 손잡은 MS에 맞대응
‘게임 체인저’로 주목받고 있는 생성 인공지능(AI) 시장을 둘러싸고 구글과 마이크로소프트의 경쟁이 치열해지고 있다. 최근 오픈AI의 대화형 AI ‘챗GPT’가 AI를 활용해 보고서 작성, 코딩 등 인간의 업무를 대체할 수 있다는 사실을 입증하면서 생성 AI 시장 주도권을 잡기 위한 글로벌 빅테크의 움직임이 빨라지는 모습이다.
블룸버그통신은 4일(현지시간) 구글이 AI 스타트업 앤스로픽에 4억달러(약 5000억원)를 투자했다고 보도했다. 앤스로픽은 오픈AI 창립자 그룹 일원이던 대니앨라 애머데이, 다리오 애머데이 남매가 2021년 설립한 업체다. 지난달 AI 챗봇 ‘클로드’의 비공개 베타 테스트 서비스를 내놨다.
블룸버그는 마이크로소프트가 오픈AI와 장기 협력 계획을 맺자 구글도 앤스로픽과 협력에 나선 것이라고 분석했다.
구글과 앤스로픽은 4억달러 투자 보도를 공식적으로 확인하지는 않았지만 앤스로픽이 구글의 클라우드 컴퓨팅 서비스를 사용하는 내용의 파트너십 계약을 체결했다고 발표했다. 업계에서는 구글이 조만간 챗GPT와 같은 형태의 대화형 AI 서비스를 내놓을 것으로 보고 있다.
MS, 검색 서비스 '빙'에 챗GPT 통합
'AI 원조' 구글, 검색 챗봇 조만간 출시
현재 경쟁에서 가장 앞섰다는 평가를 받는 업체는 마이크로소프트(MS)다. MS는 오픈AI와 협력해 개발한 대규모 언어 모델 GPT-3.5와 이미지 생성 인공지능(AI) 달리2(Dall-E2), 코드 생성 AI 코덱스 등을 자사 클라우드 플랫폼 애저에 적용했다. MS의 클라우드 서비스를 이용하면 이 같은 기능을 쓸 수 있는 셈이다. 최근에는 GPT-3.5를 이용해 회의록 생성 및 요약, 음성 자동 번역 등의 기능을 활용할 수 있는 협업툴 ‘팀즈 프리미엄’을 출시하기도 했다.
가장 관심을 모으는 서비스는 MS의 검색 서비스 ‘빙’이다. MS는 챗GPT를 빙에 통합한다는 계획을 밝혔다. 시장조사업체 스태티스타에 따르면 지난달 말 기준 빙의 글로벌 검색시장 점유율은 8.9%에 불과하다. 순위론 2위지만 1위 구글(84%)의 10분의 1 수준이다. 하지만 출시 1개월 만에 챗GPT의 월간활성이용자(MAU)가 1억 명을 넘어선 만큼 빙에 챗GPT가 통합되면 점유율이 요동칠 수 있다.
검색 서비스의 패러다임 자체가 바뀔 가능성도 제기된다. 기존 검색 서비스는 검색어와 가장 관련이 높은 웹페이지를 차례대로 보여준다. 이에 비해 챗GPT와 같은 생성 AI는 질문에 대한 답을 바로 보여준다. 구글이 긴장하는 것도 이 지점이다.
구글은 작년 12월 내부적으로 ‘코드 레드’를 선언하고 챗GPT 대응에 나섰다. 그동안 구글은 글로벌 빅테크 가운데서도 가장 뛰어난 AI 기술을 보유하고 있다는 평가를 받았다. 2016년 AI 시대 개막을 알린 알파고를 개발한 것도 구글이다. 현재 모든 초거대 AI의 기반 기술이 되는 언어 병렬 처리 기술 ‘트랜스포머’도 구글이 2017년 논문을 통해 발표했다. 문장 속 단어와 같은 순차 데이터 내의 관계를 추적해 맥락과 의미를 학습하는 신경망 모델이다. 구글은 이 기술을 활용해 언어 모델 ‘람다’를 개발했다.
그동안 소극적인 움직임을 보이던 구글도 적극적인 대응에 나섰다. ‘람다2’를 활용한 챗봇 ‘견습시인’을 테스트하는 아틀라스프로젝트를 진행 중인 것으로 알려졌다. 구글 모회사 알파벳의 순다르 피차이 최고경영자(CEO)는 지난 2일 수주 또는 수개월 내에 챗봇 AI와 검색 서비스를 접목한 언어 모델을 내놓을 계획이라고 했다.
MS와 구글을 제외한 미국 빅테크들은 아직 이렇다 할 움직임을 보이고 있지 않다. 아마존은 작년 11월 구조조정을 했는데 음성 AI 비서 알렉사 담당 조직도 대상에 포함됐다. 중국에선 검색 분야 1위 업체인 바이두가 다음달 챗봇 서비스를 출시한다고 밝혔다.",시장점유율
한국경제,"구글, AI 챗봇 스타트업에 거액 투자",네이버뉴스,https://n.news.naver.com/mnews/article/015/0004806983?sid=105,,한국경제,구글 vs MS…'챗GPT'가 불붙인 AI 전쟁,"위드 AI 시대
구글, 앤스로픽에 4억弗 투자
오픈AI 손잡은 MS에 맞대응
‘게임 체인저’로 주목받고 있는 생성 인공지능(AI) 시장을 둘러싸고 구글과 마이크로소프트의 경쟁이 치열해지고 있다. 최근 오픈AI의 대화형 AI ‘챗GPT’가 AI를 활용해 보고서 작성, 코딩 등 인간의 업무를 대체할 수 있다는 사실을 입증하면서 생성 AI 시장 주도권을 잡기 위한 글로벌 빅테크의 움직임이 빨라지는 모습이다.
블룸버그통신은 4일(현지시간) 구글이 AI 스타트업 앤스로픽에 4억달러(약 5000억원)를 투자했다고 보도했다. 앤스로픽은 오픈AI 창립자 그룹 일원이던 대니앨라 애머데이, 다리오 애머데이 남매가 2021년 설립한 업체다. 지난달 AI 챗봇 ‘클로드’의 비공개 베타 테스트 서비스를 내놨다.
블룸버그는 마이크로소프트가 오픈AI와 장기 협력 계획을 맺자 구글도 앤스로픽과 협력에 나선 것이라고 분석했다.
구글과 앤스로픽은 4억달러 투자 보도를 공식적으로 확인하지는 않았지만 앤스로픽이 구글의 클라우드 컴퓨팅 서비스를 사용하는 내용의 파트너십 계약을 체결했다고 발표했다. 업계에서는 구글이 조만간 챗GPT와 같은 형태의 대화형 AI 서비스를 내놓을 것으로 보고 있다.
MS, 검색 서비스 '빙'에 챗GPT 통합
'AI 원조' 구글, 검색 챗봇 조만간 출시
현재 경쟁에서 가장 앞섰다는 평가를 받는 업체는 마이크로소프트(MS)다. MS는 오픈AI와 협력해 개발한 대규모 언어 모델 GPT-3.5와 이미지 생성 인공지능(AI) 달리2(Dall-E2), 코드 생성 AI 코덱스 등을 자사 클라우드 플랫폼 애저에 적용했다. MS의 클라우드 서비스를 이용하면 이 같은 기능을 쓸 수 있는 셈이다. 최근에는 GPT-3.5를 이용해 회의록 생성 및 요약, 음성 자동 번역 등의 기능을 활용할 수 있는 협업툴 ‘팀즈 프리미엄’을 출시하기도 했다.
가장 관심을 모으는 서비스는 MS의 검색 서비스 ‘빙’이다. MS는 챗GPT를 빙에 통합한다는 계획을 밝혔다. 시장조사업체 스태티스타에 따르면 지난달 말 기준 빙의 글로벌 검색시장 점유율은 8.9%에 불과하다. 순위론 2위지만 1위 구글(84%)의 10분의 1 수준이다. 하지만 출시 1개월 만에 챗GPT의 월간활성이용자(MAU)가 1억 명을 넘어선 만큼 빙에 챗GPT가 통합되면 점유율이 요동칠 수 있다.
검색 서비스의 패러다임 자체가 바뀔 가능성도 제기된다. 기존 검색 서비스는 검색어와 가장 관련이 높은 웹페이지를 차례대로 보여준다. 이에 비해 챗GPT와 같은 생성 AI는 질문에 대한 답을 바로 보여준다. 구글이 긴장하는 것도 이 지점이다.
구글은 작년 12월 내부적으로 ‘코드 레드’를 선언하고 챗GPT 대응에 나섰다. 그동안 구글은 글로벌 빅테크 가운데서도 가장 뛰어난 AI 기술을 보유하고 있다는 평가를 받았다. 2016년 AI 시대 개막을 알린 알파고를 개발한 것도 구글이다. 현재 모든 초거대 AI의 기반 기술이 되는 언어 병렬 처리 기술 ‘트랜스포머’도 구글이 2017년 논문을 통해 발표했다. 문장 속 단어와 같은 순차 데이터 내의 관계를 추적해 맥락과 의미를 학습하는 신경망 모델이다. 구글은 이 기술을 활용해 언어 모델 ‘람다’를 개발했다.
그동안 소극적인 움직임을 보이던 구글도 적극적인 대응에 나섰다. ‘람다2’를 활용한 챗봇 ‘견습시인’을 테스트하는 아틀라스프로젝트를 진행 중인 것으로 알려졌다. 구글 모회사 알파벳의 순다르 피차이 최고경영자(CEO)는 지난 2일 수주 또는 수개월 내에 챗봇 AI와 검색 서비스를 접목한 언어 모델을 내놓을 계획이라고 했다.
MS와 구글을 제외한 미국 빅테크들은 아직 이렇다 할 움직임을 보이고 있지 않다. 아마존은 작년 11월 구조조정을 했는데 음성 AI 비서 알렉사 담당 조직도 대상에 포함됐다. 중국에선 검색 분야 1위 업체인 바이두가 다음달 챗봇 서비스를 출시한다고 밝혔다.",시장점유율
매일경제,“중국에 남으면 재미없어”...삼성 LG 인도行 가속,네이버뉴스,https://n.news.naver.com/mnews/article/009/0005084017?sid=101,,매일경제,“중국에 남으면 재미없어”...삼성 LG 인도行 가속,"글로벌 생산기지서 중국 배제
인도가 대안으로 급속하게 부상
[사진 = 연합뉴스]
중국 성장세가 정점을 찍고 내리막길을 걷는 ‘피크차이나(Peak China)’ 현상의 대안으로 인도가 떠오르고 있다. 미중 갈등에 코로나19 팬데믹 봉쇄로 중국 산업의 경쟁력이 떨어진 반면, 인도는 높은 성장률을 이여가며 14억 인구를 보유한 대국으로 자리잡았기 때문이다.
삼성전자·현대자동차·LG전자·포스코 등 국내 기업은 물론 애플 등 글로벌 기업들도 사업의 무게 중심을 중국에서 인도로 옮겨가는 흐름이다.
5일 재계에 따르면 LG전자는 최근 인도 푸네 공장에 20억루피(약 304억원)를 투자해 양문형 냉장고라인을 증설했다. 신규 라인의 연간 생산능력은 약 10만대다.
그동안 LG전자는 푸네공장에서 1도어 냉장고와 2도어 상냉장·하냉동 냉장고를 생산해왔다. 그런데 최근 인도 시장에서 저가인 1도어 시장 대신 2도어 시장이 비중이 커지자 생산라인을 증설한 것이다. LG전자 인도법인의 지난해 3분기 누적 매출은 2조5800억원 수준으로, 코로나 직전인 2019년 3분기 누적 매출(2조1675억원)을 회복하고 성장 추세에 있다.
삼성전자 역시 인도 공략을 강화하고 있다. 특히 최근 전세계 2위 규모의 스마트폰 시장인 인도에서 신제품 갤럭시S23 시리즈를 내세워 1위를 하겠다는 목표를 밝혔다. 노태문 삼성전자 MX(모바일경험) 사업부장(사장)은 지난 1일(현지시간) 열린 갤럭시언팩 기자간담회에서 “인도에서 1위 자리를 탈환하고 지키는 것이 우리 목표”라고 말했다. 인도 스마트폰 시장은 중국에 이은 2위 시장으로 삼성전자는 샤오미에 이어 시장점유율 2위를 차지하고 있다.
포스코도 성장잠재력을 보유한 인도 지역에 대한 투자를 추진중에 있다. 최정우 포스코그룹 회장은 올해 신년사에서 ‘2030 성장비전’ 달성을 위해 “인도 지역에 기존 투자와 시너지를 낼 수 있는 현지 완결형 투자 기회를 모색하겠다”고 밝히기도 했다.
이에 앞서 현대자동차는 2028년까지 400억 루피(약 6080억원)를 투자해 전기차 관련 연구·개발(R&D)과 인프라스트럭처를 확장하기로 밝혔던 바 있다. 현지의 전기차 시장 주도권을 잡겠다는 의지다.
기업들이 이처럼 인도에 주목하는 것은 인도가 생산기지이자 소비시장의 역할을 동시에 담당할 수 있기 때문이다. 14억 인구를 보유한 인도는 올해 중국을 제치고 세계 1위 인구대국 자리에 오를 것으로 예상된다.
한국은행은 ‘인도 경제 현황과 성장잠재력, 리스크 평가’ 보고서에서 “서방국가와 중국·러시아 사이 갈등으로 글로벌 공급망에서 중국 역할이 축소되면서 인도의 반사 효과 수혜가 예상된다”고 밝혔다.
인도·미국 자유무역협정(FTA) 협상, 미국 정부의 탈중국 기업에 대한 세제 혜택 등과 함께 미국 기업을 중심으로 인도로의 생산기지 이전이 가속화될 가능성이 있다는 것이다.
인도는 올해까지 3년 연속 연 6% 넘는 고도성장을 이어갈 것으로 예상된다. S&P글로벌은 지난해 11월 보고서에서 “2021년부터 2030년까지 10년 동안 인도 경제는 연 평균 6.3%씩 성장해 일본과 독일을 제치고 세계 3위 경제 대국이 될 것”이라고 전망했다.
코트라는 보고서에서 “인도는 코로나19로 가장 큰 피해를 입은 국가지만 대규모 고용창출, 경제성장 회복을 이룩했다”며 “억눌린 수요 창출로 추가적인 경제 확대가 이뤄질 것으로 전망된다”고 내다봤다.
미중 갈등으로 정치적 불확실성이 커진 점도 인도의 몸값이 오르는 배경이다. 인도는 4개국(미국·일본·호주·인도) 안보협의체인 ‘쿼드(Quad)’ 회원국이다. 미국과 일본은 최근 반도체와 인공지능(AI), 무선통신(5G) 등 첨단 기술 협력을 강화하는 내용을 담은 ‘핵심 신흥기술 구상(iCET)를 체결했다. 이에 따라 제너럴일렉트릭(GE) 에어로스페이스가 인도로 진출해 제트 엔진을 공동 개발한다.
이미 글로벌 기업들이 중국에 있던 생산기지를 인도로 옮겨가고 있다. 애플이 대표적인 예다. 외신에 따르면 애플은 아이패드 중국 생산라인을 인도로 옮기는 방안을 검토하고 있다. 지난해 9월 출시된 아이폰14도 인도에서 생산된다. 중국의 ‘제로 코로나’ 정책으로 정저우 폭스콘 공장 가동이 원활하지 않아 실적이 악화한 탓이다. 애플의 작년 4분기 순이익은 1년 전보다 13.3% 감소했다.
애플 최대협력업체인 대만 폭스콘 역시 인도 공장 인력을 4배로 확대하기로 했다. 지난해 9월에는 인도 광산업체 베단타그룹과 손잡고 약 1조5400루피(약 15조2100억원)를 투자해 인도 구자라트주에 반도체·디스플레이 생산단지를 건설하기로 했다. 대만 3위 파운드리(반도체 위탁생산) 업체인 PSMC도 인도에 반도체 공장을 짓는 방안을 검토 중이다. 구글 모회사인 알파벳 역시 구글의 ‘픽셀폰’의 일부 생산라인을 중국에서 인도로 옮기고 있다.
한은은 “인도 경제의 고성장 가능성을 고려해 적극적으로 인도 진출을 모색해야한다”며 “성공적 진출을 위해서는 먼저 진출한 서방기업, 인도 정부 규제, 비친화적 기업 환경에 대한 대비도 필요하다”고 조언했다.",시장점유율
이데일리,챗GPT 주목하는 삼성·SK…고성능 메모리 반도체 새 판 될까,네이버뉴스,https://n.news.naver.com/mnews/article/018/0005418638?sid=101,,이데일리,챗GPT 주목하는 삼성·SK…고성능 메모리 반도체 새 판 될까,"챗GPT 등장에 빅테크 '초거대 AI' 경쟁 대두
AI 돌리려면 고부가 D램 탑재한 GPU 필요
메모리 기업들, HBM 등 첨단 반도체 수요 기대
차세대 D램 주도권 쥔 삼성·SK…“새 기회”
[이데일리 이다원 기자] 챗GPT(ChatGPT)가 촉발한 초거대 인공지능(AI) 경쟁이 치열해지는 가운데 메모리 반도체 기업들도 이에 주목하고 있다. 고부가 D램 등 첨단 메모리 수요가 점진적으로 늘어날 가능성이 점쳐지기 때문이다.
5일 업계에 따르면 미국 비영리 연구소 ‘오픈AI’가 개발한 챗GPT 인기에 글로벌 반도체 기업들이 주목하고 있다. 지난해 11월 첫 선을 보인 챗GPT는 사람과 대화하는 것만큼 자연스러운 답변을 내놓는 점이 특징이다. 이에 글로벌 이용자 수가 하루 동안 1000만명을 넘기는 등 뜨거운 관심을 받고 있다.
마이크로소프트(MS), 구글 등 글로벌 빅테크 기업들도 속속 초거대 AI 경쟁에 뛰어들었다. MS는 오픈AI에 100억달러 수준 투자를 결정했고 구글도 부랴부랴 AI 전략을 재정비하며 챗GPT에 대항할 서비스를 내놓겠다고 했다. 초거대 AI 활용 시대가 본격적으로 열린 셈이다.
삼성전자 HBM-PIM. (사진=삼성전자 뉴스룸)
메모리 반도체 기업들 역시 이를 주목하고 있다. AI 고도화를 위해 D램 등 메모리 반도체를 대거 투입해야 하기 때문이다. 김영건 미래에셋증권 연구원은 “챗GPT 대중화는 직접적으로는 GPU 수요를, 간접적으로는 D램 수요를 중심으로 하는 메모리 수요를 촉진하는 요인”이라고 내다봤다.
현재 AI용으로 쓰이는 그래픽처리장치(GPU) 제품에는 고대역폭 메모리(HBM)를 비롯한 고효율 D램 메모리 반도체가 대거 탑재된다. 특히 AI용 반도체 시장의 핵심으로 꼽히는 HBM의 경우 D램 여러 개를 수직으로 연결해 3D 형태로 만든 제품이다. 메모리 기업들로서는 여러 개의 D램을 더 비싼 가격에 공급할 수 있어 이득이다.
세계 메모리 톱3 기업이 모두 HBM을 생산하고 있지만 업계에서는 삼성전자(005930)와 SK하이닉스(000660)가 기술력에서 상대적으로 앞섰다고 보고 있다. HBM을 고도화하거나 차세대 HBM 제품을 개발하는 등 성과를 냈기 때문이다.
삼성전자와 SK하이닉스는 글로벌 고객사와 협력해 HBM 제품을 공급 중이다. 삼성전자는 지난해 10월 AMD와 손 잡은 삼성전자는 메모리 반도체와 AI 프로세서를 합친 ‘HBM-PIM’ 제품을 내놓았다. HBM에 연산 기능까지 더해져 시스템 성능과 효율이 향상되는 점이 특징이다.
SK하이닉스 HBM3 제품. (사진=SK하이닉스)
SK하이닉스는 엔비디아에 HBM3 제품을 지난해부터 꾸준히 공급하며 시장을 넓혀가고 있다. HBM3은 초당 819GB 데이터를 처리할 수 있는 첨단 고대역폭 메모리다. 특히 엔비디아가 세계 GPU 시장 점유율 80% 이상을 기록하는 점을 고려하면 SK하이닉스의 경쟁력도 점차 커질 것이란 전망이 나온다.
또 AI 학습에서 텍스트뿐만 아니라 이미지·비디오 등 다양한 데이터가 쓰이는 ‘멀티모달’ 비중이 늘어나면서 서버·스토리지 확충을 위한 빅테크의 투자도 기대 요인이다. 서버, 데이터센터 등에 쓰이는 고성능 메모리 수요 역시 꾸준히 증가할 가능성이 있어서다.
이에 국내 반도체 기업들의 기대감도 커지고 있다. 김재준 삼성전자 메모리사업부 부사장은 지난달 31일 작년 4분기 실적 콘퍼런스콜에서 “자연어 기반 대화형 AI 서비스가 미래 메모리 수요에 긍정적 영향이 있을 것”으로 내다봤다.
박명수 SK하이닉스 D램 마케팅 담당도 지난 1일 컨콜에서 “언어모델의 확장성, 대중을 상대로 한 AI의 일반화와 상용화라는 점에서 파급성이 크고 향후 기술적 진화에 따라 메모리뿐만 아니라 업계 전반의 활용 확장 가능성이 크다”고 언급했다.",시장점유율
전자신문,"韓-美 5년 세탁기 분쟁, 이달 끝난다",네이버뉴스,https://n.news.naver.com/mnews/article/030/0003076476?sid=105,,전자신문,"韓-美 5년 세탁기 분쟁, 이달 끝난다","美, 원만한 합의 목표로 협의 요청
세이프가드 조치 완전 종료 전망
韓 점유율 오르고 WTO도 위법 지적
5년 동안 한국 기업을 옥좨 온 미국 세탁기 세이프가드(긴급수입제한) 조치가 이달 말께 완전 종료될 것으로 예상된다. 수입제한 조치가 무색하게 미국 내 우리 세탁기 점유율이 올라가는 등 실효성에 의문까지 제기되면서 종료 절차를 밟고 있다는 관측이 나온다.
5일 업계에 따르면 산업통상자원부는 미국 정부와 이달 말 완료를 목표로 세탁기 세이프가드 조치 관련 이해당사국 간 분쟁 협의를 진행하고 있다.
협상은 지난해 4월 미국 정부의 요청에 따른 것으로, 법리적 다툼이 아닌 이해 당사국 간 원만한 협의를 목표로 한다. 미국 정부의 세탁기 세이프가드 조치 연장 여부가 핵심 의제다. 우리 정부는 애초 계획한 이달 중 종료를 집중적으로 주장하고 있는 것으로 알려졌다.
미국 정부는 지난 2018년 2월부터 수입산 세탁기에 관세를 적용한 세이프가드를 발동했다. 완제품 기준 연간 120만대 이상의 수입 제품에 최대 50% 관세를 적용하는 게 골자다. 2021년까지 3년 시행 후 올해 2월까지 2년 연장됐다. 다만 최대 8년까지 조치를 발동할 수 있게 한 만큼 연장 여부에 관심이 집중되고 있다.
미국 정부는 아직 방침을 정하지 않았지만 연장하기엔 부담스러운 상황이다. 지난해 2월 세계무역기구(WTO)가 미국 세이프가드 관련 핵심 쟁점 5개 모두 위법하다며 한국의 손을 들어준 게 컸다. 당시 도널드 트럼프 정부가 강력하게 추진한 미국 자국 우선주의에 국제기구가 경고음을 보내면서 세탁기 세이프가드 조치가 동력을 잃은 것으로 분석된다.
미국 정부도 WTO 결정에 상소하는 대신 원만한 합의를 위한 이해당사국 간 분쟁 협의를 요청했다. 이에 따라 지난해 4월부터 한·미 양국은 이달 중 완전 합의를 목표로 협상을 하고 있다.
미국 정부의 조치 연장 명분이 약하다는 점과 함께 재연장 절차를 위한 물리적 시간이 부족하다는 것 역시 이달 중 완전 종료 공산을 높이고 있다. 세이프가드 조치 연장을 위해서는 시행 6개월 전 자국 기업의 연장 신청이나 행정부의 직권상정 등이 있어야 하지만 모두 이뤄지지 않은 것으로 우리 정부는 파악하고 있다.
미국 사우스 캐롤라이나주 뉴베리카운티에 위치한 삼성전자 생활가전 공장에서 직원이 세탁기를 생산하고 있다.
세이프가드 조치 후 삼성전자·LG전자 등 우리 기업은 미국 현지 공장 설립, 혁신 기술 개발 등으로 발 빠르게 대응하며 오히려 미국 시장 지배력을 높였다. 2018년까지만 해도 삼성전자와 LG전자의 미국 내 세탁기 시장 점유율은 월풀에 밀려 10% 후반을 기록했지만 지난해 기준 20%를 넘어서며 시장 1, 2위를 차지하고 있다. 특히 반도체, 자동차 등 자국 보호주의 조치에 국제사회의 비판이 커지는 상황에서 세탁기 산업 보호까지 연장하기에는 미국으로선 부담이 크다는 지적까지 나온다.
LG전자 직원이 미국 테네시주 클락스빅에 있는 세탁기 라인에서 드럼 세탁기를 생산하고 있다.
정부 관계자는 “아직 최종 협의가 이뤄지지 않아 미국 정부의 추가 조치를 예단하기는 어렵다”면서도 “다만 추가 연장을 위해서는 사전 조치가 있어야 하는데 시점을 넘긴 것으로 보인다”고 설명했다.
5년을 끈 세탁기 규제가 종료되면 장기화 조짐을 보이는 리스크가 해소되면서 우리 기업의 사업 전략도 다변화될 것으로 보인다. 중장기적으로 미국 내 생산공장 증설과 생산 확대 등으로 시장 영향력을 기를 것으로 업계는 기대하고 있다.",시장점유율
