press,title,naver_news_text,naver_news_url,body,press_html,title_html,body_html,label
매일경제,"최윤범고려아연회장, 영풍 지분 다 팔았다…동업관계 청산",네이버뉴스,https://n.news.naver.com/mnews/article/009/0005385298?sid=101,,매일경제,"고려아연, 연이틀 폭등···최윤범, 영풍 지분 전량 매각","나란히 20% 가까운 상승세
영풍·MBK파트너스 연합과 경영권 분쟁이 이어지고 있는 고려아연 주가가 25일 이틀 연속 급등했다.
연이은 공개매수로 시장 내 유통물량이 감소한 상황에서 주가가 급등세를 이어간 것이다.
이날 한국거래소에 따르면 고려아연 주가는 전거래일 대비 10.11% 상승한 125만3000원에 거래를 마쳤다.
장중 한때 29.17%까지 상승폭을 키우며 147만원까지 상승, 역대 최고가를 새로 쓰기도 했다.
고려아연은 전날 주가가 가격제한폭까지 오른 113만8000원을 기록했다. 전날 유가증권시장 13위까지 오른 시가총액이 이날 11위까지 올라선 모습이다.
고려아연 지분 1.85%를 보유한 영풍정밀 주가는 롤러코스터를 탔다.
역시 전날 상한가인 2만6000원으로 거래를 마쳤던 영풍정밀은 이날 오전 한때 3만원을 넘어셨다가 오후 들어 급락, 12.69% 하락한 2만2700원에 거래를 마쳤다.
지난 23일 마감한 최윤범 고려아연 회장 측 공개매수 결과가 조만간 공개될 것으로 전망되는 가운데 최 회장 측은 이번 자사주 공개매수 결과를 포함할 경우 고려아연 지분율을 최대 36.49%까지 높일 수 있을 전망이다.
앞서 공개매수를 끝낸 영풍·MBK파트너스 연합은 고려아연 지분율을 38.47%까지 높인 상황이다.
양측 모두 안정적인 과반 지분을 확보하지 못하면서 향후 장내 매수를 통한 지분 경쟁이 이어지리라는 관측이 나오고 있다.
이런 가운데 최윤범 회장과 작은 아버지인 최창영 명예회장은 영풍 측 지분을 전량 매도했다. 고려아연, 영풍간 동업 관계를 완전히 끝낸 것이다.
이날 전자공시스템에 따르면 최 회장은 지난 23일 보유한 영풍 1723주를 주당 36만 6424원에 매도했다. 이에 따라 최 회장의 영풍 주식은 한 주도 남지 않았다.
최 명예회장도 지난 24일 1만 4637주를 모두 장내매도 하고 지분 관계를 정리했다.
올해 상반기 기준 최 회장과 최 명예회장이 보유한 영풍 지분은 각각 2.18%(4만 235주), 4.14%(7만 6299주)였다.
한편, 영풍·MBK파트너스 연합과 경영권 분쟁 중인 고려아연 일부 임원들이 자기주식 공개매수 경쟁 기간 고려아연 주식을 장내에서 사들인 것으로 나타났다.
경영권 분쟁이 불거지자 임원들도 주식을 확보해 현 경영진의 경영권 방어에 힘을 보태려는 것으로 보인다.
다만 임원들이 자사주를 취득했음에도 거래 발생일 이후 10일 이상 늦게 공시한 점은 시장의 지적을 받고 있다.
이날 금융감독원 전자공시시스템에 따르면 고려아연 본부장급 비등기임원 5인은 영풍·MBK 연합과 고려아연의 자사주 공개매수가 진행된 지난달 말부터 이달 초까지 고려아연 주식을 총 118주 사들였다.
총액으로는 7800만원 수준이다. 주식 취득 단가는 주당 68만원대부터 75만원대 사이다.
다만 고려아연 임원들은 지분 취득일로부터 짧게는 10일, 길게는 한달 이상 늦게 보고했다.
자본시장법 상 상장주식 발행회사의 임원 등의 지분거래는 거래 발생일로부터 5일 이내에 공시해야 한다.
고려아연 측은 “갑작스런 경영권 분쟁 상황으로 회사가 경황이 없어서 임원들의 지분 취득을 한 번에 취합해 늦게 공시하게 됐다”고 입장을 밝혔다.",고려아연
뉴스1,"최윤범고려아연회장, 영풍 지분 전량 매도",네이버뉴스,https://n.news.naver.com/mnews/article/421/0007868291?sid=101,,뉴스1,"최윤범 고려아연 회장, 영풍 지분 다 팔았다…동업관계 청산","최창영 고려아연 명예회장도 전량 매도
ⓒ News1 양혜림 디자이너
(서울=뉴스1) 김종윤 기자 = 최윤범 고려아연(010130) 회장이 영풍(000670) 지분을 전량 매도했다. 최 회장의 작은아버지인 최창영 명예회장 역시 지분을 모두 털어냈다. 고려아연-영풍의 동업 관계가 끝나면서 관계 정리에 나선 것으로 해석된다.
25일 전자공시시스템에 따르면 최 회장은 지난 23일 보유한 영풍 1723주를 주당 36만 6424원에 매도했다. 이에 따라 최 회장의 영풍 주식은 한 주도 남지 않았다.
최 명예회장도 지난 24일 1만 4637주를 모두 장내매도 하고 지분 관계를 정리했다.
올해 상반기 기준 최 회장과 최 명예회장이 보유한 영풍 지분은 각각 2.18%(4만 235주), 4.14%(7만 6299주)였다.
최 회장 측은 MBK·영풍 연합과 경영권 분쟁이 불거지면서 주식을 매도하기 시작했다. 지난달 첫 매도를 시작으로 순차적으로 지분을 매도했다. 고려아연-영풍의 동업 관계가 사실상 종결된 만큼 상대방의 지분을 보유할 필요성이 사라졌기 때문이다.",고려아연
머니투데이,'표대결' 앞두고 롤러코스터 탄고려아연·영풍정밀 주가,네이버뉴스,https://n.news.naver.com/mnews/article/008/0005105627?sid=101,,머니투데이,'표대결' 앞두고 롤러코스터 탄 고려아연·영풍정밀 주가,"25일 고려아연 주가가 전일대비 10% 상승했다. 공개매수 종료로 유통주식 물량이 줄어든데다 최 회장측과 MBK·영풍이 본격적 장내매수에 나설 것이란 기대감이 반영되며 주가는 2일 연속 고공행진을 이어갔다. 다만, 이날 주가는 장중 등락을 반복하며 높은 변동성을 보였다.
한국거래소에 따르면 이날 고려아연 주가는 전 거래일 대비 10.11% 상승한 125만3000원을 기록했다. 최윤범 고려아연 회장측의 공개매수 종료 다음날인 전일 상한가를 기록한데 이어 2일 연속 급등세다.
발행 주식 총수의 20%를 사들이는 최 회장측 공개매수(고려아연 자사주 공개매수와 베인캐피탈 공개매수) 종료로 유통주식 물량이 줄어든 가운데 양측이 곧 장내매수 경쟁에 돌입할 것이란 기대가 투자자들 사이에 형성된 영향이다. 아직 최 회장측 공개매수 청약 규모가 공개되지 않았지만 이와 무관하게 양측 모두 확실한 의결권 지분율 우위를 가져가지 못한건 사실상 확정됐다. 때문에 양측이 장내매수를 통해 조금이라도 더 많은 의결권 지분 확보에 나설 수 밖에 없는 상황이다.
하지만 주가 상승세가 이어지면 양측 모두 쉽사리 장내 매수에 나서기가 어려워진다. 주가가 오른 만큼 장내매수에 투입해야 할 자금 규모도 불어나기 때문이다. 최 회장측과 MBK·영풍의 공개매수 가격이 각각 89만원, 83만원에서 종료됐단 점을 감안하면 100만원 이상으로 훌쩍 뛴 가격에 장내매수에 나설 여력은 작아질 수 밖에 없다.
주가가 경영권 분쟁의 변수로 작용할 가능성이 있는 셈이다. 양측 모두 연내 열릴 수 있는 임시 주주총회부터 멀게는 내년 3월 예정된 정기주주총회까지 의결권 지분율에서 조금이라도 우위에 서기위한 장내매수 전략 마련에 나서야 하는데 주가 상황에 따라 주총 전 의결권 지분율에 대한 셈법이 엉킬 수 있다.
양측 셈법이 복잡한 가운데 이날 주가는 높은 변동성을 보였다. 장 초반 147만원을 기록하며 전일보다 29.2% 급등했지만 곧바로 상승분을 대부분 반납하며 118만원까지 주저앉았다. 이후에도 등락을 반복하다 125만3000원에 거래를 마쳤다. 앞서 금융감독원은 고려아연 경영권 분쟁이 과열 양상을 보이자 소비자경보 주의 등급을 발령한 바 있다.
이날 고려아연 지분 1.85%를 보유한 영풍정밀 주가 변동성은 고려아보다도 컸다. 전일 상한가를 기록한 영풍정밀은 장중 한때 25.8% 급등하며 3만2700원까지 치솟았지만 MBK와 영풍이 영풍정밀에 대한 경영협력계약을 해지했다는 소식이 전해지자 낙폭을 키워 전일대비 12.69% 급락한 2만2700원으로 장을 마감했다. 최 회장 측의 영풍정밀 공개매수 성공에 따라 MBK·영풍으로선 영풍정밀에 대한 연합전선을 유지할 필요가 없어져 협력계약을 해지했다.
한편 지난 23일 자사주 공개매수를 종료한 고려아연은 이날 장 마감까지 공개매수 청약 규모를 공시하지 않은 상태다. 청약 결과 공시 법정 한도일인 오는 28일까지 공개매수 결과가 나오지 않으면 해당 기간 최 회장측은 결과를 알고있는 반면, MBK·영풍은 모르는 정보의 불균형 상태가 이어진다.",고려아연
머니투데이,고려아연주가 125만원…장중 시총 10위 진입도,네이버뉴스,https://n.news.naver.com/mnews/article/008/0005105627?sid=101,,머니투데이,'표대결' 앞두고 롤러코스터 탄 고려아연·영풍정밀 주가,"25일 고려아연 주가가 전일대비 10% 상승했다. 공개매수 종료로 유통주식 물량이 줄어든데다 최 회장측과 MBK·영풍이 본격적 장내매수에 나설 것이란 기대감이 반영되며 주가는 2일 연속 고공행진을 이어갔다. 다만, 이날 주가는 장중 등락을 반복하며 높은 변동성을 보였다.
한국거래소에 따르면 이날 고려아연 주가는 전 거래일 대비 10.11% 상승한 125만3000원을 기록했다. 최윤범 고려아연 회장측의 공개매수 종료 다음날인 전일 상한가를 기록한데 이어 2일 연속 급등세다.
발행 주식 총수의 20%를 사들이는 최 회장측 공개매수(고려아연 자사주 공개매수와 베인캐피탈 공개매수) 종료로 유통주식 물량이 줄어든 가운데 양측이 곧 장내매수 경쟁에 돌입할 것이란 기대가 투자자들 사이에 형성된 영향이다. 아직 최 회장측 공개매수 청약 규모가 공개되지 않았지만 이와 무관하게 양측 모두 확실한 의결권 지분율 우위를 가져가지 못한건 사실상 확정됐다. 때문에 양측이 장내매수를 통해 조금이라도 더 많은 의결권 지분 확보에 나설 수 밖에 없는 상황이다.
하지만 주가 상승세가 이어지면 양측 모두 쉽사리 장내 매수에 나서기가 어려워진다. 주가가 오른 만큼 장내매수에 투입해야 할 자금 규모도 불어나기 때문이다. 최 회장측과 MBK·영풍의 공개매수 가격이 각각 89만원, 83만원에서 종료됐단 점을 감안하면 100만원 이상으로 훌쩍 뛴 가격에 장내매수에 나설 여력은 작아질 수 밖에 없다.
주가가 경영권 분쟁의 변수로 작용할 가능성이 있는 셈이다. 양측 모두 연내 열릴 수 있는 임시 주주총회부터 멀게는 내년 3월 예정된 정기주주총회까지 의결권 지분율에서 조금이라도 우위에 서기위한 장내매수 전략 마련에 나서야 하는데 주가 상황에 따라 주총 전 의결권 지분율에 대한 셈법이 엉킬 수 있다.
양측 셈법이 복잡한 가운데 이날 주가는 높은 변동성을 보였다. 장 초반 147만원을 기록하며 전일보다 29.2% 급등했지만 곧바로 상승분을 대부분 반납하며 118만원까지 주저앉았다. 이후에도 등락을 반복하다 125만3000원에 거래를 마쳤다. 앞서 금융감독원은 고려아연 경영권 분쟁이 과열 양상을 보이자 소비자경보 주의 등급을 발령한 바 있다.
이날 고려아연 지분 1.85%를 보유한 영풍정밀 주가 변동성은 고려아보다도 컸다. 전일 상한가를 기록한 영풍정밀은 장중 한때 25.8% 급등하며 3만2700원까지 치솟았지만 MBK와 영풍이 영풍정밀에 대한 경영협력계약을 해지했다는 소식이 전해지자 낙폭을 키워 전일대비 12.69% 급락한 2만2700원으로 장을 마감했다. 최 회장 측의 영풍정밀 공개매수 성공에 따라 MBK·영풍으로선 영풍정밀에 대한 연합전선을 유지할 필요가 없어져 협력계약을 해지했다.
한편 지난 23일 자사주 공개매수를 종료한 고려아연은 이날 장 마감까지 공개매수 청약 규모를 공시하지 않은 상태다. 청약 결과 공시 법정 한도일인 오는 28일까지 공개매수 결과가 나오지 않으면 해당 기간 최 회장측은 결과를 알고있는 반면, MBK·영풍은 모르는 정보의 불균형 상태가 이어진다.",고려아연
한국경제,'고려아연분쟁' 장내매수 기대감에…영풍정밀도 24%↑[핫종목],네이버뉴스,https://n.news.naver.com/mnews/article/015/0005049024?sid=101,,한국경제,고려아연 주가 125만원…장중 시총 10위 진입도,"장내매수 경쟁 조짐에 급등
▶
마켓인사이트
10월 25일 오후 4시 4분
고려아연 주가가 이틀째 폭등하면서 시가총액 상위 13위에 진입했다. 이 회사 경영권을 놓고 격돌하는 최윤범 고려아연 회장과 MBK파트너스·영풍 연합이 장내매수 경쟁에 나설 것이라는 기대가 작용한 결과다.
고려아연은 25일 유가증권시장에서 10.11% 오른 125만3000원에 마감했다. 이 회사 주가는 장 초반 147만원까지 치솟으면서 시가총액이 30조원을 웃돌아 시가총액 순위가 상위 10위 기업에 오르기도 했다. 하지만 이후 상승폭 일부를 반납하면서 종가 기준 시가총액이 25조9412억원으로 집계됐다. 경영권 분쟁 전 40위권을 맴돌던 시가총액 순위는 이날 13위를 나타냈다.
고려아연 주가는 최 회장 측과 MBK파트너스·영풍 연합이 앞으로 지분 매수 경쟁에 나설 것이라는 관측에 따라 치솟고 있다. 두 차례의 공개매수 과정에서 고려아연 유통 주식 물량이 줄어든 것도 주가 변동성을 키웠다는 분석이 나온다. 최 회장 측이 자사주 공개매수 결과 발표 시기를 최대한 미루면서 시장의 불확실성을 부추기고 있다는 지적도 있다. 최 회장 측은 오는 28일 공개매수 결과를 밝힐 계획이다.
영풍정밀도 이날 급등락 장세를 나타냈다. 장 초반 이 회사 주가는 3만2700원까지 올랐다. 하지만 MBK파트너스와 영풍 연합이 영풍정밀에 대한 경영협력계약을 해지했다고 공시하면서 주가는 내림세로 전환했다. 영풍정밀은 이날 12.69% 하락한 2만2700원에 거래를 마쳤다. 최 회장 측이 영풍정밀 주식 공개매수에 성공해 지분을 70% 이상 확보하면서 경영권을 완전히 접수했다. MBK파트너스와 영풍은 이에 따라 영풍정밀 경영권 인수를 위한 계약을 해지했다.",고려아연
조선비즈,"고려아연, 자사주 공개매수로 지분 10%대 초반 확보한 듯",네이버뉴스,https://n.news.naver.com/mnews/article/366/0001027085?sid=101,,조선비즈,"고려아연, 자사주 공개매수로 지분 10%대 초반 확보한 듯","양측 지분율 격차 더 축소
최윤범 고려아연 회장 측이 자기주식 공개매수를 통해 10%가 조금 넘는 지분을 확보한 것으로 알려졌다. 고려아연은 공개매수를 통해 취득한 자사주를 전량 소각할 예정이다.
그래픽=손민균
25일 투자은행(IB) 업계에 따르면, 고려아연은 지난 23일까지 진행한 자사주 공개매수에서 10%가 넘는 지분을 확보한 것으로 전해진다. IB 업계 관계자는 “공개매수에 응한 사람들의 청약 건 모두 체결됐다”면서 “정확한 수치는 공유되지 않았지만, 10% 조금 넘는 수준의 지분을 사들인 것으로 안다”고 전했다.
앞서 최 회장 측은 베인캐피탈과 함께 진행한 자사주 매입에 전체 발행 주식의 약 20%인 414만657주 취득을 목표로 삼았다. 베인캐피탈이 최대로 확보할 수 있는 2.5% 외에는 소각해야 한다. 앞서 공개매수를 진행한 MBK파트너스와 영풍 연합은 지분을 5.34% 추가 확보해 지분율(발행 주식 수 기준)을 38.47%까지 끌어올린 상태다.
최 회장 측 고려아연은 362만3075주(현재 발행 주식 총수의 17.5%)를 자사주 형태로 주당 89만원에 사들여 모두 소각하기로 했다. 소각 후 발행 주식 수가 그만큼 줄어드는 것이어서, 기존 주주들의 의결권 지분율은 높아질 수밖에 없다.
최 회장 측이 최대 목표치를 공개매수로 확보해 소각한다는 가정 하에 MBK-영풍의 의결권 지분율은 48.03%, 최씨 일가 및 우호 주주들의 의결권 지분율은 45.59%가 될 것으로 추산된 바 있다. 그러나 실제로 자사주 공개매수에 참여한 주식이 전체의 10%를 조금 넘는 것으로 알려짐에 따라, 양측이 확보하게 될 의결권 지분도 줄어들게 됐다.",고려아연
세계일보,‘지분 경쟁’고려아연황제주 등극 [경제 레이더],네이버뉴스,https://n.news.naver.com/mnews/article/022/0003979916?sid=101,,세계일보,‘지분 경쟁’ 고려아연 황제주 등극 [경제 레이더],"경영권을 둘러싼 ‘사생결단’ 지분 경쟁이 벌어지고 있는 고려아연의 주가가 110만원을 뚫고 올랐다. 가격제한폭까지 치솟으면서 역대 최고가를 기록, 40위권이었던 시가총액은 13위로 수직상승했다.
고려아연은 자기주식 공개매수가 마감된 이튿날인 24일 코스피 시장에서 가격제한폭까지 주가가 오른 채 장을 마쳤다. 전날 대비 29.91% 오른 113만8000원을 기록했다.
최윤범 고려아연 회장 측이 추진한 고려아연 자사주 공개매수 종료일인 지난 23일 서울 여의도 한국거래소 홍보관 모니터를 통해 고려아연 주가가 표시되고 있다. 뉴스1
전날 공개매수가인 89만원보다 낮은 87만6000원으로 마감한 주가는 MBK파트너스·영풍과의 지분 경쟁이 지속될 것이라는 전망에 개장 직후 급등했고, 역대 최고가 기록을 세우며 상한가에 진입했다.
이로써 고려아연은 코스피 시장에서 삼성바이오로직스와 함께 1주당 가격이 100만원 이상인 ‘황제주’에 등극했다. 경영권 분쟁 발생 전 코스피 시장에서 40위권을 유지하던 시총도 이날 13위까지 끌어올렸다.
고려아연 측은 전날 마감된 자사주 공개매수 결과를 조만간 공개할 예정이다.
최윤범 회장 측은 우군인 베인케피털과 함께한 이번 자사주 공개매수 결과를 포함하면 고려아연 지분율을 36.49%까지 높일 수 있을 것으로 보인다. 앞서 공개매수를 끝낸 영풍·MBK 연합은 38.47%까지 높인 상태다. 고려아연 측이 밝힌 대로 이번에 공개매수한 자사주를 소각하면 영풍·MBK 연합의 지분율은 42.74%, 최 회장 측은 40.27%가 된다.
이처럼 양측 모두 공개매수 후에도 안정적 과반 지분을 확보하지 못하면서 향후에도 장내 매수 및 우호 지분 확보 등 치열하게 경쟁할 것이라는 관측이 나온다.
증권업계 관계자는 “양측이 공개매수 후 남은 시장 유통 주식을 장내 매수 형태로 경쟁적으로 확보할 것으로 보여 고려아연사 주식 수요는 꾸준할 테고, 주가는 당분간 고공행진할 것”이라고 내다봤다.
한편 법조계에 따르면 고려아연의 지분 1.85%를 보유한 영풍정밀은 전날 서울중앙지법 민사50부에 영풍 경영진을 상대로 한 계약이행금지 등 가처분에 대한 취하서를 제출했다. 영풍정밀은 최 회장 측이 지배하고 있다.",고려아연
세계일보,"140만원 넘었다…‘황제주’고려아연, 주가 폭등에 시총 10위 진입",네이버뉴스,https://n.news.naver.com/mnews/article/022/0003979916?sid=101,,세계일보,‘지분 경쟁’ 고려아연 황제주 등극 [경제 레이더],"경영권을 둘러싼 ‘사생결단’ 지분 경쟁이 벌어지고 있는 고려아연의 주가가 110만원을 뚫고 올랐다. 가격제한폭까지 치솟으면서 역대 최고가를 기록, 40위권이었던 시가총액은 13위로 수직상승했다.
고려아연은 자기주식 공개매수가 마감된 이튿날인 24일 코스피 시장에서 가격제한폭까지 주가가 오른 채 장을 마쳤다. 전날 대비 29.91% 오른 113만8000원을 기록했다.
최윤범 고려아연 회장 측이 추진한 고려아연 자사주 공개매수 종료일인 지난 23일 서울 여의도 한국거래소 홍보관 모니터를 통해 고려아연 주가가 표시되고 있다. 뉴스1
전날 공개매수가인 89만원보다 낮은 87만6000원으로 마감한 주가는 MBK파트너스·영풍과의 지분 경쟁이 지속될 것이라는 전망에 개장 직후 급등했고, 역대 최고가 기록을 세우며 상한가에 진입했다.
이로써 고려아연은 코스피 시장에서 삼성바이오로직스와 함께 1주당 가격이 100만원 이상인 ‘황제주’에 등극했다. 경영권 분쟁 발생 전 코스피 시장에서 40위권을 유지하던 시총도 이날 13위까지 끌어올렸다.
고려아연 측은 전날 마감된 자사주 공개매수 결과를 조만간 공개할 예정이다.
최윤범 회장 측은 우군인 베인케피털과 함께한 이번 자사주 공개매수 결과를 포함하면 고려아연 지분율을 36.49%까지 높일 수 있을 것으로 보인다. 앞서 공개매수를 끝낸 영풍·MBK 연합은 38.47%까지 높인 상태다. 고려아연 측이 밝힌 대로 이번에 공개매수한 자사주를 소각하면 영풍·MBK 연합의 지분율은 42.74%, 최 회장 측은 40.27%가 된다.
이처럼 양측 모두 공개매수 후에도 안정적 과반 지분을 확보하지 못하면서 향후에도 장내 매수 및 우호 지분 확보 등 치열하게 경쟁할 것이라는 관측이 나온다.
증권업계 관계자는 “양측이 공개매수 후 남은 시장 유통 주식을 장내 매수 형태로 경쟁적으로 확보할 것으로 보여 고려아연사 주식 수요는 꾸준할 테고, 주가는 당분간 고공행진할 것”이라고 내다봤다.
한편 법조계에 따르면 고려아연의 지분 1.85%를 보유한 영풍정밀은 전날 서울중앙지법 민사50부에 영풍 경영진을 상대로 한 계약이행금지 등 가처분에 대한 취하서를 제출했다. 영풍정밀은 최 회장 측이 지배하고 있다.",고려아연
매일경제,"'황제주'고려아연, 장내매수 2차전 기대 속 이틀 연속 강세[특징주]",네이버뉴스,https://n.news.naver.com/mnews/article/009/0005385251?sid=101,,매일경제,"140만원 넘었다…‘황제주’ 고려아연, 주가 폭등에 시총 10위 진입","지난 22일 오전 서울 한 호텔에서 박기덕 고려아연 사장이 자사주 공개 매수 종결을 하루 앞두고 연 기자회견에서 발언하고 있다. [사진 = 연합뉴스]
경영권 분쟁에 휩싸인 고려아연 주가가 폭등세를 이어가며 역대 최고가를 경신했다.
25일 오전 9시 40분 현재 고려아연은 전일 대비 27만7000원(24.34%) 급등한 141만5000원에 거래되고 있다.
전날 상한가에 이어 주가가 이틀 연속 치솟으면서 시가총액은 29조원대로 불어 코스피 시가총액 상위 10위에 진입했다.
공개매수 종료 이후에도 ‘장내매수’를 이어갈 것이라는 전망에 투자심리가 몰린 것으로 풀이된다. 영풍·MBK파트너스 연합의 경영권 확보 시도를 방어하기 위한 최윤범 고려아연 회장 측의 자사주 공개매수는 지난 23일 종료됐지만, 양측 모두 과반 지분을 확보하지 못했기 때문이다.
고려아연은 자사주 공개매수 결과를 곧 공개하는 방안을 검토 중인 것으로 알려졌다. 최 회장 측은 우군인 베인케피털과 함께 한 이번 자사주 공개매수 결과를 포함하면 고려아연 지분율을 최대 36.49%까지 높일 수 있을 것으로 예상된다.
앞서 공개매수를 끝낸 영풍·MBK 연합은 고려아연 지분율을 38.47%까지 높였다. 고려아연이 공개매수한 자사주를 소각할 계획인 점을 고려하면 영풍·MBK 연합의 지분율은 42.74%, 최 회장 측의 지분율은 40.27%가 될 수 있다.",고려아연
