press,title,naver_news_text,naver_news_url,body,press_html,title_html,body_html,label
뉴시스,국내 금융사의 해외 자회사 소유 쉬워진다…자금지원규제도완화,네이버뉴스,https://n.news.naver.com/mnews/article/003/0011979163?sid=101,,뉴시스,국내 금융사의 해외 자회사 소유 쉬워진다…자금지원 규제도 완화,"금융당국, 해외진출 활성화 위한 규제개선 방안 발표
[서울=뉴시스] 김진아 기자 = 김주현 금융위원장이 5일 오후 서울 중구 은행연합회에서 열린 제7차 금융규제혁신회의에서 발언하고 있다. 2023.04.05. bluesoda@newsis.com
[서울=뉴시스] 김형섭 기자 = 국내 금융회사의 해외진출 확대를 위해 해외 자회사 인수·설립 관련 규제가 대폭 완화된다. 해외 자회사에 대한 자금지원도 쉬워진다.
금융위원회와 금융감독원은 17일 정부서울청사에서 개최된 제8차 금융규제혁신회의에서 이같은 내용을 담은 '금융회사 해외진출 활성화를 위한 규제개선 방안'을 발표했다.
앞서 금융위는 금융산업의 글로벌화를 위해 지난 3월 금융국제화대응단을 구성하고 은행·금융투자·보험·여신전문금융(여전)·핀테크·인프라 등 업권별 간담회와 릴레이 세미나를 통해 해외진출 관련 국내 규제개선 요구를 수렴했다.
금융사의 해외 자회사 소유 범위 대폭 확대
금융당국은 우선 금융사의 해외 자회사 소유 범위를 대폭 확대키로 했다. 현재는 국내 금융사의 건전성 확보와 이해상충 방지를 막기 위해 소유(일정비율 이상 출자) 범위를 제한하고 있다.
은행은 다른 회사에 대한 지분 15% 이상 출자를 제한하고 있으며 금융업이나 직접 관련 업종 등에 한해서만 자회사 소유가 가능하다. 금융지주의 경우 비금융회사의 주식 소유가 금지되며 자회사가 영위하는 금융업의 종류에 따라 손자회사의 범위도 제한된다.
금융당국은 해외에서 현지법이 허용하는 범위 내에서 은행, 여전사, 핀테크사 등의 해외 금융사 및 비금융사 출자 제한을 완화키로 했다.
구체적으로 은행의 해외 비금융자회사 소유를 허용하고 금융지주의 자회사는 현지법이 허용하는 범위 내에서 해외 비금융사를 소유할 수 있게 된다. 금융지주의 자회사인 비금융사의 해외 투자일임·자문사 소유도 허용된다.
보험사에 대해서도 해외 자회사 소유범위가 확대되고 절차도 간소화된다. 현재는 보험사가 보험업과 관련없는 업무를 영위하는 자회사를 소유하려 할 경우 금융위의 승인을 받도록 하고 있다.
금융당국은 앞으로 보험사의 해외 금융사 소유를 전향적으로 허용하고 사전신고 대상인 해외 자회사의 범위를 확대할 계획이다.
해외 자회사 인수·설립 관련 규제완화가 이뤄질 경우 현지 수요에 맞춘 사업 다각화로 국내 금융사들이 해외 시장에서 경쟁력을 가질 수 있을 전망이다.
예컨대 자동차 금융을 영위하는 국내 여전사가 해외에서 렌터카 업체를 인수해 영업 채널을 확대할 수 있으며 보험사가 해외 은행을 소유하는 것도 전향적으로 허용되는 것이다. 금융지주의 자회사인 핀테크사가 해외에서 투자자문업·투자일임업을 영위하는 자회사를 인수하는 것도 가능해진다.
이를 위해 금융당국은 올해 4분기 중에 은행법령과 금융지주회사법 시행령, 보험업법 시행령 등을 개정할 방침이다.
은행지주 자회사간 신용공여한도 3년간 10%p 이내에서 확대
또 금융당국은 4분기 중에 해외 자회사에 대한 자금지원 관련 규제도 완화키로 했다.
해외 현지법인의 경우 신용도 미흡, 담보 부족 등으로 진출 초기에 현지 자금조달이 어려운데 금융지주회사법상 자회사 간 신용공여 한도 규제로 인해 국내 계열사로부터의 자금조달에 제약이 있었다.
금융당국은 4분기 중에 금융지주회사 감독규정을 개정해 3년간 10%포인트 이내에서 신용공여한도를 추가 부여해 자금조달 애로를 해소할 방침이다.
[서울=뉴시스] 김진아 기자 = 김주현 금융위원장이 5일 오후 서울 중구 은행연합회에서 열린 제7차 금융규제혁신회의에서 발언하고 있다. 2023.04.05. bluesoda@newsis.com
보험회사의 자회사에 대한 담보제공도 허용할 계획이다. 현재는 보험사의 해외 보험자회사에 대한 채무보증만 허용되고 있는데 4분기 중에 보험업법 개정안을 마련해 담보제공까지 허용한다는 것이다.
기존에 허용중인 채무보증 조건인 '총자산의 3% 한도 내, 직전분기말 지급여력비율 200% 이상 등'의 범위 내에서 자회사를 위한 담보제공을 허용할 방침이다. 이 경우 국내 보험사가 현지 은행에 국공채 등을 담보로 제공하고 현지 은행이 해외 자회사에 대해 채무보증을 하는 방식(신용장 제도)으로 영업기금을 대체할 수 있게 된다.
아울러 금융당국은 국내 적용을 전제로 마련돼 해외 점포에 적용하기에 부적절한 규제에 대해서도 하반기 중에 예외를 마련하거나 적용을 배제키로 했다.
일부 국가의 경우 외국 재보험사의 지점 설립 관련 규정이 없는 대신 사무소의 경우에 일부 영업활동을 허용하는 등 국내와는 다른 법률체계를 운영하고 있다. 그러나 국내 법령상 해외지사를 영업활동이 가능한 해외지점과 조사·연락업무를 담당하는 ‘해외사무소’로 구분하고 있어 현지에서 허용하는 제도의 이점을 활용할 수 없었다.
해외진출규정이 개정되면 현지법이 허용하는 범위에서 사무소도 영업활동이 가능해진다. 해외금융기관에 외국법인에 대한 외화표시 대출채권 양도를 허용하는 등 금융사의 해외 진출 및 투자 확대를 지원하는 방안도 추진된다.
보고·공시 규정 유연 적용…검사·제재도 자율개선 중심으로
해외법인 관련 보고·공시 규정도 전면 손질한다.
국내 금융사의 동일한 해외직접투자 행위에 대해 금융업권법 및 해외진출규정에 따라 중복해 신고·보고 의무를 부과하는 경우가 있었지만 앞으로는 개별 업권법에 따라 신고·보고시 해외진출규정에 따른 신고·보고 의무를 면제한다.
역외금융회사 투자에 대한 사전신고 의무도 사후보고로 전면 전환하는 등 해외직접투자 신고에 따른 행정부담도 완화된다.
이와 함께 금융당국은 해외법인에 대한 검사시 현지 규제 및 시장상황 등을 고려하고 건전성과 내부통제 측면에서 예방·개선 중심의 검사를 실시키로 했다. 이는 해외에서 가능한 영업 형태이지만 국내법에 의한 제재 대상인 경우 금융사들이 당국의 검사·제재 가능성을 우려하고 있는 점을 감안한 것이다.
제재보다 자율개선이 필요한 규정위반 사안에 대해서는 금융사가 자율개선을 약속하는 내용의 '기관제재 갈음 MOU' 활용을 적극 검토키로 했다.
이밖에도 금융당국은 ▲지속적인 규제 개선 ▲주요국 현지 외교공관 등을 통한 해외진출 협력 네트워크 강화 ▲해외금융협력협의회 역할 강화 등을 감은 '금융사·핀테크의 해외진출 및 금융인프라 수출 지원' 방안을 하반기 중 발표키로 했다.
김주현 금융위원장은 ""비록 국내외 금융시장에 불안요인이 잔존해 있지만 향후 경제 여건이 점차 개선될 것으로 기대되는 만큼 금융 규제혁신을 통해 장기적인 성장의 토대를 마련하는 것이 매우 중요한 시점""이라며 ""이러한 규제 개선이 국내 금융사들의 신규 해외진출을 촉진하고 창의성과 역량을 최대로 발휘해 국제 무대에서 활약할 수 있도록 하는 밑바탕이 될 것""이라고 기대했다.
이복현 금감원장은 ""현지 감독당국과의 긴밀한 네트워크 구축 및 협력 강화를 통해 해외진출 금융회사의 인허가 등을 적극 지원해 나가겠다""며 ""금융권에서도 성공적인 해외진출 모델을 확산해 나가기 위한 노력을 기울이면서 글로벌화에 상응하는 내부통제 및 리스크관리 역량을 확충해달라""고 당부했다．",규제완화
뉴시스,금융사 해외자회사 소유범위 대폭확대…자금지원규제완화,네이버뉴스,https://n.news.naver.com/mnews/article/003/0011979163?sid=101,,뉴시스,국내 금융사의 해외 자회사 소유 쉬워진다…자금지원 규제도 완화,"금융당국, 해외진출 활성화 위한 규제개선 방안 발표
[서울=뉴시스] 김진아 기자 = 김주현 금융위원장이 5일 오후 서울 중구 은행연합회에서 열린 제7차 금융규제혁신회의에서 발언하고 있다. 2023.04.05. bluesoda@newsis.com
[서울=뉴시스] 김형섭 기자 = 국내 금융회사의 해외진출 확대를 위해 해외 자회사 인수·설립 관련 규제가 대폭 완화된다. 해외 자회사에 대한 자금지원도 쉬워진다.
금융위원회와 금융감독원은 17일 정부서울청사에서 개최된 제8차 금융규제혁신회의에서 이같은 내용을 담은 '금융회사 해외진출 활성화를 위한 규제개선 방안'을 발표했다.
앞서 금융위는 금융산업의 글로벌화를 위해 지난 3월 금융국제화대응단을 구성하고 은행·금융투자·보험·여신전문금융(여전)·핀테크·인프라 등 업권별 간담회와 릴레이 세미나를 통해 해외진출 관련 국내 규제개선 요구를 수렴했다.
금융사의 해외 자회사 소유 범위 대폭 확대
금융당국은 우선 금융사의 해외 자회사 소유 범위를 대폭 확대키로 했다. 현재는 국내 금융사의 건전성 확보와 이해상충 방지를 막기 위해 소유(일정비율 이상 출자) 범위를 제한하고 있다.
은행은 다른 회사에 대한 지분 15% 이상 출자를 제한하고 있으며 금융업이나 직접 관련 업종 등에 한해서만 자회사 소유가 가능하다. 금융지주의 경우 비금융회사의 주식 소유가 금지되며 자회사가 영위하는 금융업의 종류에 따라 손자회사의 범위도 제한된다.
금융당국은 해외에서 현지법이 허용하는 범위 내에서 은행, 여전사, 핀테크사 등의 해외 금융사 및 비금융사 출자 제한을 완화키로 했다.
구체적으로 은행의 해외 비금융자회사 소유를 허용하고 금융지주의 자회사는 현지법이 허용하는 범위 내에서 해외 비금융사를 소유할 수 있게 된다. 금융지주의 자회사인 비금융사의 해외 투자일임·자문사 소유도 허용된다.
보험사에 대해서도 해외 자회사 소유범위가 확대되고 절차도 간소화된다. 현재는 보험사가 보험업과 관련없는 업무를 영위하는 자회사를 소유하려 할 경우 금융위의 승인을 받도록 하고 있다.
금융당국은 앞으로 보험사의 해외 금융사 소유를 전향적으로 허용하고 사전신고 대상인 해외 자회사의 범위를 확대할 계획이다.
해외 자회사 인수·설립 관련 규제완화가 이뤄질 경우 현지 수요에 맞춘 사업 다각화로 국내 금융사들이 해외 시장에서 경쟁력을 가질 수 있을 전망이다.
예컨대 자동차 금융을 영위하는 국내 여전사가 해외에서 렌터카 업체를 인수해 영업 채널을 확대할 수 있으며 보험사가 해외 은행을 소유하는 것도 전향적으로 허용되는 것이다. 금융지주의 자회사인 핀테크사가 해외에서 투자자문업·투자일임업을 영위하는 자회사를 인수하는 것도 가능해진다.
이를 위해 금융당국은 올해 4분기 중에 은행법령과 금융지주회사법 시행령, 보험업법 시행령 등을 개정할 방침이다.
은행지주 자회사간 신용공여한도 3년간 10%p 이내에서 확대
또 금융당국은 4분기 중에 해외 자회사에 대한 자금지원 관련 규제도 완화키로 했다.
해외 현지법인의 경우 신용도 미흡, 담보 부족 등으로 진출 초기에 현지 자금조달이 어려운데 금융지주회사법상 자회사 간 신용공여 한도 규제로 인해 국내 계열사로부터의 자금조달에 제약이 있었다.
금융당국은 4분기 중에 금융지주회사 감독규정을 개정해 3년간 10%포인트 이내에서 신용공여한도를 추가 부여해 자금조달 애로를 해소할 방침이다.
[서울=뉴시스] 김진아 기자 = 김주현 금융위원장이 5일 오후 서울 중구 은행연합회에서 열린 제7차 금융규제혁신회의에서 발언하고 있다. 2023.04.05. bluesoda@newsis.com
보험회사의 자회사에 대한 담보제공도 허용할 계획이다. 현재는 보험사의 해외 보험자회사에 대한 채무보증만 허용되고 있는데 4분기 중에 보험업법 개정안을 마련해 담보제공까지 허용한다는 것이다.
기존에 허용중인 채무보증 조건인 '총자산의 3% 한도 내, 직전분기말 지급여력비율 200% 이상 등'의 범위 내에서 자회사를 위한 담보제공을 허용할 방침이다. 이 경우 국내 보험사가 현지 은행에 국공채 등을 담보로 제공하고 현지 은행이 해외 자회사에 대해 채무보증을 하는 방식(신용장 제도)으로 영업기금을 대체할 수 있게 된다.
아울러 금융당국은 국내 적용을 전제로 마련돼 해외 점포에 적용하기에 부적절한 규제에 대해서도 하반기 중에 예외를 마련하거나 적용을 배제키로 했다.
일부 국가의 경우 외국 재보험사의 지점 설립 관련 규정이 없는 대신 사무소의 경우에 일부 영업활동을 허용하는 등 국내와는 다른 법률체계를 운영하고 있다. 그러나 국내 법령상 해외지사를 영업활동이 가능한 해외지점과 조사·연락업무를 담당하는 ‘해외사무소’로 구분하고 있어 현지에서 허용하는 제도의 이점을 활용할 수 없었다.
해외진출규정이 개정되면 현지법이 허용하는 범위에서 사무소도 영업활동이 가능해진다. 해외금융기관에 외국법인에 대한 외화표시 대출채권 양도를 허용하는 등 금융사의 해외 진출 및 투자 확대를 지원하는 방안도 추진된다.
보고·공시 규정 유연 적용…검사·제재도 자율개선 중심으로
해외법인 관련 보고·공시 규정도 전면 손질한다.
국내 금융사의 동일한 해외직접투자 행위에 대해 금융업권법 및 해외진출규정에 따라 중복해 신고·보고 의무를 부과하는 경우가 있었지만 앞으로는 개별 업권법에 따라 신고·보고시 해외진출규정에 따른 신고·보고 의무를 면제한다.
역외금융회사 투자에 대한 사전신고 의무도 사후보고로 전면 전환하는 등 해외직접투자 신고에 따른 행정부담도 완화된다.
이와 함께 금융당국은 해외법인에 대한 검사시 현지 규제 및 시장상황 등을 고려하고 건전성과 내부통제 측면에서 예방·개선 중심의 검사를 실시키로 했다. 이는 해외에서 가능한 영업 형태이지만 국내법에 의한 제재 대상인 경우 금융사들이 당국의 검사·제재 가능성을 우려하고 있는 점을 감안한 것이다.
제재보다 자율개선이 필요한 규정위반 사안에 대해서는 금융사가 자율개선을 약속하는 내용의 '기관제재 갈음 MOU' 활용을 적극 검토키로 했다.
이밖에도 금융당국은 ▲지속적인 규제 개선 ▲주요국 현지 외교공관 등을 통한 해외진출 협력 네트워크 강화 ▲해외금융협력협의회 역할 강화 등을 감은 '금융사·핀테크의 해외진출 및 금융인프라 수출 지원' 방안을 하반기 중 발표키로 했다.
김주현 금융위원장은 ""비록 국내외 금융시장에 불안요인이 잔존해 있지만 향후 경제 여건이 점차 개선될 것으로 기대되는 만큼 금융 규제혁신을 통해 장기적인 성장의 토대를 마련하는 것이 매우 중요한 시점""이라며 ""이러한 규제 개선이 국내 금융사들의 신규 해외진출을 촉진하고 창의성과 역량을 최대로 발휘해 국제 무대에서 활약할 수 있도록 하는 밑바탕이 될 것""이라고 기대했다.
이복현 금감원장은 ""현지 감독당국과의 긴밀한 네트워크 구축 및 협력 강화를 통해 해외진출 금융회사의 인허가 등을 적극 지원해 나가겠다""며 ""금융권에서도 성공적인 해외진출 모델을 확산해 나가기 위한 노력을 기울이면서 글로벌화에 상응하는 내부통제 및 리스크관리 역량을 확충해달라""고 당부했다．",규제완화
아시아경제,"금융사, 해외 진출규제 완화...자회사 소유 범위 확대",네이버뉴스,https://n.news.naver.com/mnews/article/277/0005287502?sid=101,,아시아경제,금융사 해외자회사 소유범위 대폭확대…자금지원 규제완화,"금융당국, 제8차 금융규제혁신회의 개최
국내 금융회사의 해외 진출을 독려하기 위해 금융당국이 해외 자회사에 대한 소유 범위를 대폭 확대한다. 아울러 해외 현지 법인의 원활한 운영을 위해 해외 자회사에 대한 자금지원 규제도 완화한다.
김주현 금융위원장이 7일 서울 종로구 정부서울청사에서 취임 1주년 기자간담회를 갖고 있다. 사진=윤동주 기자 doso7@
금융위원회는 17일 서울 종로구 정부서울청사에서 '제8회 금융규제혁신회의'를 열고 이런 내용을 담은 금융회사 해외 진출 활성화를 위한 규제개선 방안 등을 논의했다고 밝혔다.
이번 규제개선 방안에 따라 당국은 우선 금융산업 글로벌화를 위해 금융회사의 해외 자회사 소유 범위를 대폭 확대키로 했다. 해외시장에서 현지법이 허용하는 범위 내에서 은행, 보험, 여신전문금융사 및 핀테크사의 해외 금융사 및 비금융사 출자 제한을 완화키로 했다.
예컨대 국내에서 자동차 금융을 영업하는 국내 여전사가 해외에서 렌터카 업체를 인수해 영업력을 확대하거나, 보험회사가 해외 은행을 소유하는 것을 허용하는 식이다. 당국 측은 ""향후 현지 금융 수요에 맞춘 비즈니스 다각화로 국내 금융사가 해외 시장에서 경쟁력을 가질 수 있을 것으로 기대된다""고 전했다.
아울러 당국은 해외 자회사에 대한 자금지원 규제도 완화키로 했다. 현행 금융지주회사법 등에 따르면 국내 금융사의 개별 자회사에 대한 신용공여 한도는 자기자본의 10%로 규정돼 있다. 해외 현지법인의 경우 진출 초기 자금조달에 어려움을 겪는 경우가 많은데 국내 계열사로부터의 자금조달마저 제한이 있었던 셈이다.
이에 따라 당국은 금융지주회사 감독규정 개정을 통해 일정 기간 10%포인트 이내의 신용공여한도를 추가로 부여, 자금조달 애로를 해소한다는 방침이다. 또 보험회사의 자회사에 대한 담보제공도 허용한다. 이 경우 국내 보험회사가 인수한 해외 은행에 국공채 등을 담보로 제공하고, 현지 은행이 해외 자회사에 채무보증을 하는 방식(신용장 제도)으로 영업기금을 대체할 수 있게 된다.
이외에도 당국은 ▲국내 적용을 전제로 마련돼 해외 점포에 적용하기 어려운 규제는 예외를 마련하거나 적용을 배제 ▲해외 진출 관련 보고 및 공시 관련 규정 개선 ▲건전성·내부통제 개선 중심의 검사·제재방안 마련 등을 추진키로 했다.
한편 당국은 이날 상호저축은행 합병 등 인가기준 개정과 관련한 논의도 진행했다. 당국은 저축은행 경쟁력 강화를 위해 비수도권 저축은행 등을 중심으로 영업 구역 확대를 수반하는 동일 대주주의 소유·지배, 합병에 대한 허용기준을 완화할 방침이다. 이를 통해 저축은행들이 규모의 경제를 통해 자금중개기능을 높이고 경영 건전성을 제고할 수 있을 것으로 당국은 보고 있다.
김주현 금융위원장은 ""비록 국내외 금융시장에 불안 요인이 잔존해 있으나 금융 규제혁신을 통해 장기적 성장의 토대를 마련하는 것이 매우 중요한 시점""이라면서 ""이번 규제 개선 방안은 국내 금융회사의 신규 해외 진출을 촉진하고, 현지에서 창의성과 역량을 최대로 발휘해 국제무대에서 활약할 수 있도록 하는 밑바탕이 될 것""이라고 밝혔다.",규제완화
전자신문,금융회사 '해외진출' 날개단다… 자회사 소유범위 늘리고 자금지원규제...,네이버뉴스,https://n.news.naver.com/mnews/article/030/0003118449?sid=101,,전자신문,"금융사, 해외 진출 규제 완화...자회사 소유 범위 확대","금융당국이 17일 정부서울청사에서 제8차 금융규제혁신회의를 열었다.
앞으로 국내 금융사의 해외 자회사 소유 범위가 확대된다. 국내 카드사가 해외에서 렌터카 업체를 인수하는 게 가능해지고, 보험회사도 해외 은행을 소유할 수 있게 된다.
금융위원회는 17일 정부서울청사에서 제8차 금융규제혁신회의를 열고, 이 같은 내용을 논의했다.
금융당국은 해외 자회사 소유 범위를 대폭 확대한다. 해외에서 현지 법이 허용하는 범위 내에서 은행, 보험, 여전사 및 핀테크사의 해외 금융회사 및 비금융회사 출자 제한을 완화한다.
이에 따라 자동차 금융을 영위하는 국내 여신금융회사가 해외에서 렌터카 업체를 인수해 영업 채널을 확대할 수 있게 된다. 또 보험회사가 해외 은행을 소유하는 것도 전향적으로 허용된다. 금융지주회사의 자회사인 핀테크사가 해외에서 투자자문업·투자일임업을 영위하는 자회사를 인수하는 것도 가능해진다.
김주현 금융위원장은 “국내 금융회사들의 신규 해외진출을 촉진하고, 금융회사들이 창의성과 역량을 최대로 발휘해 국제 무대에서 활약할 수 있도록 하는 밑바탕이 될 것”이라고 말했다.
해외 자회사에 대한 자금지원 규제도 완화한다. 그간 해외 현지법인의 경우 진출 초기에 현지 자금조달이 어렵지만 금융지주회사법령상 자회사등간 신용공여 한도 규제로 국내 계열사로부터의 자금조달에 제약이 있었다.
현재 자회사 등의 다른 개별 자회사등에 대한 신용공여 한도는 자기자본의 10%, 모든 자회사 등에 대한 모든 신용공여 합계는 자기자본의 20%로 제한돼 있다. 여기에 더해 3년간 10%p이내로 추가로 신용공여 한도를 부여할 계획이다.
보험회사의 자회사에 대한 담보제공도 허용할 계획이다. 국내 보험회사가 현지 은행에 국공채 등을 담보로 제공하고 현지 은행이 해외 자회사에 채무보증을 하는 방식으로 영업기금을 대체할 수 있게 된다.
이외에도 해외 점포에 적용하기에 부적절한 규제 등은 예외를 마련하거나 적용을 배제한다. 규정이 개정되면 현지법이 허용하는 범위에서 사무소도 영업활동이 가능해진다.
이날 회의에서는 저축은행의 경쟁력을 강화하기 위해 대주주변경·합병 등 인가기준 개정을 추진하는 내용도 논의됐다. 당국은 비수도권 저축은행 등을 중심으로 영업구역 확대를 수반하는 동일 대주주의 소유·지배, 합병에 대한 허용기준을 완화한다. 현재 영업구역이 확대되는 저축은행의 합병은 원칙적으로 허용하지 않고 있다.",규제완화
