press,title,naver_news_text,naver_news_url,body,press_html,title_html,body_html,label
KBS,냉방 취약층 지원 130만 세대로 확대‥내년 692억 원 투입,네이버뉴스,https://n.news.naver.com/mnews/article/056/0011801265?sid=101,,KBS,내년 냉방 취약층 지원 130만 세대로 늘린다,"점점 심해지는 여름 더위로 냉방용 전기 수요가 증가하는 가운데, 정부가 내년 여름 냉방비 지원 대상을 130만 세대 이상으로 늘립니다.
산업통상자원부는 내년 에너지 바우처 가운데 하절기 예산을 올해(609억 5천 원)보다 13.7% 늘어난 692억 7천만 원으로 편성했다고 오늘(15일) 밝혔습니다.
지원 대상은 올해 115만 세대에서 내년 130만 7천 세대로 늘리기로 했습니다.
하절기 에너지 바우처는 기초생활수급 가구 가운데 기후 민감 계층에 속하는 세대에 여름 냉방용 전기요금을 지원하는 복지 사업입니다.
노인과 영유아, 장애인, 임산부, 한부모 가족, 소년소녀 가장 등이 포함된 세대는 여름철 전기요금 차감 등의 방식으로 세대당 5만 4천 원을 지원받을 수 있습니다.
한국전력은 정부 에너지 바우처와 별도로 복지 할인 제도를 운영해 취약계층의 여름철 전기요금을 최대 2만 원까지 할인해주고 있습니다.
한전에 따르면, 지난달 에너지 바우처와 한전 복지 할인을 동시에 적용받은 세대 가운데 31만 3천 세대의 전기요금은 '0원'이었고, 22만 5천 가구의 전기요금은 1만 원 미만이었습니다.
한편 역대급 폭염이 닥친 올해 주택용 전기요금 부담은 전반적으로 크게 늘었습니다.
한전은 지난 8월 주택용 전기의 가구당 평균 사용량이 363kWh(킬로와트시)로 지난해 같은 달보다 9% 증가해 가구당 평균적으로 요금이 13% 올라 고지된다고 설명했습니다.
기상청에 따르면 지난달 폭염일수는 16일로, 2016년 16.6일에 이어 관련 통계를 집계한 1973년 이래 두 번째로 많았습니다. 지난달 열대야 일수도 11.3일로 통계 집계 이후 처음 두 자릿수를 기록했습니다.
[사진 출처 : 연합뉴스]
■ 제보하기
▷ 전화 : 02-781-1234, 4444
▷ 이메일 : kbs1234@kbs.co.kr
▷ 카카오톡 : 'KBS제보' 검색, 채널 추가
▷ 네이버, 유튜브에서 KBS뉴스를 구독해주세요!",전기요금
MBC,냉방 취약층 지원 130만 세대로 확대…내년 692억원 투입,네이버뉴스,https://n.news.naver.com/mnews/article/214/0001374497?sid=101,,MBC,냉방 취약층 지원 130만 세대로 확대‥내년 692억 원 투입,"자료사진
점점 심해지는 여름 더위로 냉방용 전기 수요가 증가하는 가운데 정부가 내년 여름 냉방비 지원 대상을 130만 세대 이상으로 늘린다고 밝혔습니다.
산업통상자원부에 따르면 내년 에너지 바우처 중 하절기 예산은 692억 7천만 원으로 올해 609억 5천만 원보다 13.7% 증가했습니다.
하절기 에너지 바우처 지원 대상은 올해 115만 세대에서 내년 130만 7천 세대로 확대됩니다.
하절기 에너지 바우처는 기초생활수급 가구 중 기후 민감 계층에 속하는 세대에 여름 냉방용 전기요금을 지원하는 복지 사업으로 여름철에 전기요금 차감 등의 방식으로 세대당 5만 4천 원을 지원합니다.",전기요금
부산일보,'노인·영유아' 냉방 취약층 지원 130만세대로 확대,네이버뉴스,https://n.news.naver.com/mnews/article/082/0001288808?sid=101,,부산일보,냉방 취약층 지원 130만 세대로 확대…내년 692억원 투입,"정부가 내년 여름 냉방비 지원 대상을 130만 세대 이상으로 늘린다. 사진은 서울의 한 건물 에어컨 실외기들. 연합뉴스
점점 심해지는 여름 더위로 냉방용 전기 수요가 증가하는 가운데 정부가 내년 여름 냉방비 지원 대상을 130만 세대 이상으로 늘린다.
15일 산업통상자원부에 따르면 내년 에너지 바우처 중 하절기 예산은 692억 7000만 원으로 편성됐다. 올해의 609억 5000만 원보다 13.7% 증가한 것이다.
하절기 에너지 바우처는 기초생활수급 가구 중 기후 민감 계층에 속하는 세대에 여름 냉방용 전기요금을 지원하는 복지 사업이다. 노인, 영유아, 장애인, 임산부, 한부모 가족, 소년소녀 가장 등이 지원 대상이다. 이들 세대는 여름철에 전기요금 차감 등의 방식으로 세대당 5만 4000원을 지원받는다.
하절기 에너지 바우처 지원 대상은 올해 115만 세대에서 내년 130만 7000세대로 확대된다. 한국전력은 정부 에너지 바우처와 별도로 복지 할인 제도를 운영해 취약계층의 여름철 전기요금을 최대 2만 원까지 할인해주고 있다.
한전에 따르면 올해 8월 에너지 바우처와 한전 복지 할인을 동시에 적용받은 세대 중 31만 3000세대의 전기요금은 '0원'이었고, 22만 5000가구의 전기요금은 1만 원 미만이었다.
역대급 폭염이 닥친 올해 전반적으로 주택용 전기요금 부담이 크게 늘어났다.
한전은 지난 8월 주택용 전기의 가구당 평균 사용량이 363kWh(킬로와트시)로 작년 같은 달보다 9% 증가해 가구당 평균적으로 요금이 13% 올라 고지된다고 설명했다.
기상청에 따르면 지난 8월 폭염일수는 16일로, 2016년 16.6일에 이어 관련 통계를 집계한 1973년 이래 두 번째로 많았다. 지난달 열대야 일수도 11.3일로 통계 집계 이후 처음 두 자릿수를 기록했다.",전기요금
매일신문,[기고] '지방'이라는 페달을 돌려야 한다,네이버뉴스,https://n.news.naver.com/mnews/article/088/0000904905?sid=110,,매일신문,[기고] '지방'이라는 페달을 돌려야 한다,"김장호 구미시장
김장호 구미시장
며칠 전 일이다. 운동하려고 헬스장 자전거에 앉았는데 안장 높이가 낮아 불편했다. 옆자리 여학생은 안장이 높았는지 살짝 낮춘 다음 페달을 돌리기 시작했다. 자전거를 탈 때도 안장 높이가 맞지 않으면 페달을 제대로 돌릴 수 없는데, 하물며 국가라는 거대 조직은 오죽하겠는가. 지역마다 문화, 자원, 특성이 달라서 모든 도시를 획일화된 잣대로 재단하면 균형발전은 요원하다.
균형발전 모범사례는 멀리서 찾을 것도 없다. 박정희 대통령이 추진한 권역별 산업 배치를 통한 국가발전전략을 보면 알 수 있다. 국가 전체 발전이라는 원대한 계획에 따라 각 지역으로 분산시킨 국가산단들은 전국을 거점별로 발전시켜 우리나라의 선진국 대열 진입에 밑거름 역할을 했다.
그러나 오늘날 우리는 수도권 집중화에 따른 불균형 문제로 큰 시름을 앓고 있다. 지난해 경북에서만 8천205명이 순유출됐고, 그중 절반 이상이 수도권으로 이주했다. 대부분 미래를 책임질 청년들이다. 지방 소멸 위기가 목전에 다가왔다. 매우 가슴 아픈 일이다.
이제라도 국가 차원의 균형발전 전략을 새롭게 짜야 할 때다. 진정한 균형발전은 단순히 모든 지역을 같은 출발선상에 놓는 것이 아니다. 체형에 맞게 자전거 안장을 조절해야만 편안한 주행이 가능하듯, 균형발전 전략에도 지역별 특성과 잠재력을 고려한 맞춤형 접근이 필요하다. 대한민국의 각 지역이 각자의 자전거 페달을 힘차게 돌릴 수 있도록 다음과 같은 여건을 조성해 줘야 한다.
첫째, 법인세율 지방 차등제를 시행해야 한다. 지방 이전 기업에 대한 세액 감면은 수도권 기업이 누리던 혜택을 포기할 만한 동기를 부여하지 못하고 있다. 따라서 한 걸음 더 나아가, 지역별로 법인세를 차등 적용해 지방 이전을 촉진해야 한다.
둘째, 전기요금의 차등화제를 도입해야 한다. 미국, 영국, 일본 등 선진국들은 이미 발전 시설 인근 지역에 전기를 저렴하게 공급하는 지역별 차등 요금제를 시행하고 있다. 해외 사례를 통해 이미 효과가 검증된 만큼 빨리 도입해 전력 자급률이 높은 지방 도시들의 산업 경쟁력을 강화해야 한다.
셋째, 산업단지가 있는 지역에는 문화브랜드산단과 아이돌봄가능산단을 조성해야 한다. 전통적인 산업단지에 문화적 요소를 결합해 청년들이 살고 싶은 공간으로 재창조하는 한편, 근로자들이 일과 육아를 병행할 수 있도록 산업단지 내에 돌봄 시설을 갖춰, 젊은 인재들이 지방에서 살며 일하고 싶어지도록 만들어야 한다. 구미는 이런 산단 만들기에 앞장서고자 한다.
이런 정책으로 지방 도시의 경쟁력을 키워야만 인구 감소를 막고 소멸 위기를 극복할 수 있을 것이다. 대한민국 사상 최초로 부모 세대보다 못 사는 자녀 세대 도래를 우려하는 시대다. 이를 막고 국가 발전에 새로운 추진력을 제공 가능한 것은 오직 지방뿐이다. 그러려면 지방에서 태어난 이들이 고향에서 교육받고, 일하고, 가정을 이루며 지방에서 생애 전주기를 영위할 수 있게 해야 한다.
얼마 전 뉴스에서 희소식을 접했다. 지난해 우리나라 1인당 국민 총소득(GNI)이 3만 6천194달러로 사상 처음 일본을 앞질렀다는 것이다. 이런 희소식이 일시적인 현상이 아니라 지속 가능하기 위해서는 '답은 지방에 있다'. 지역 맞춤형 균형발전으로 성장 동력을 확보하고 힘차게 자전거 페달을 돌려 GNI 4만, 5만 달러 시대가 활짝 열리길 기대한다.",전기요금
한국일보,[르포]폭염에도 에어컨 잘 찾지 않는 독일…전쟁까지 겹쳐 가전 고를 때...,네이버뉴스,https://n.news.naver.com/mnews/article/469/0000823426?sid=104,,한국일보,[르포]폭염에도 에어컨 잘 찾지 않는 독일…전쟁까지 겹쳐 가전 고를 때 1순위는 '고효율',"베를린 IFA 2024 현장 가보니
대형 건물도 에어컨 사용 자제
전기료 걱정 고효율 제품 선호
독일 베를린 중심가 쿠담거리에 있는 가전 매장 자툰에서 고객들이 LG전자 직원의 설명을 들으며 제품을 살펴보고 있다. LG전자 제공
독일은 상점이나 사무실, 집에도 에어컨이  있는 경우가 많지 않아요. 에어컨을 틀어달라 요청하는 경우도 드물어요.
독일 가전매장 관계자
유럽 최대 가전전시회 IFA 2024가 한창이던 7일(현지시간) 독일 베를린 쿠담 거리에 위치한 가전매장 자툰(Saturn)의 3층 전시장.
자툰은 한국의 하이마트처럼 갖가지 가전을 모아놓은 곳인데 실내 온도 30도가 넘을 만큼 무더워 매장 관계자에게 묻자 이런 답이 돌아왔다.
푹푹 찌는 사우나 같은 열기는 IFA 전시장 안에서도 고스란히 느껴졌다.
몇몇 기업의 대형 전시관을 제외하면 에어컨을 세게 틀어놓은 곳이 많지 않았다. 우리나라의 전시관이나 박물관 실내는 서늘할 정도로 추워 여름철 피서지로 사랑받는 것과 대조를 이뤘다. 독일에서 머문 대형 호텔 체인을 빼면 일반 식당도
에어컨을 켠 곳을 찾아보기 어려울 정도
였다.
독일인이 에어컨을 멀리하는 이유가 뭘까.
현지 가이드와 관계자들에게 물어보니
①지정학적 이유
를 첫손에 꼽았다. 한국보다 북쪽에 있어서 여름은 서늘하고 겨울은 추워서 에어컨의 필요성을 못 느꼈는데 최근 이상고온 현상이 심화했다는 것. 에어컨이 없어도 버틸 만했다는 분석은 사실에 가까워 보였다. 독일을 대표하는 프리미엄 가전기업 밀레도 에어컨을 팔지 않았기 때문이다.
②친환경 건축의 영향
도 있어 보인다. 베를린의 건물은 실외기 설치할 곳을 따로 둔 곳이 많지 않았다.  대신 단열 성능을 강화해 에너지 낭비를 최소화하는 공법으로 지은 곳이 많다고 한다. 국내에선 오래된 건물도 공사를 통해 천장에 시스템에어컨을 설치한 경우가 많은데 독일에선 드물었다. 베를린에 사는 가전업체 관계자는 ""독일인은 창문을 닫으면 바깥의 더운 공기가 들어오는 것을 차단해서 내부가 시원해진다고 생각한다""면서 ""에어컨은 실외기를 설치하는 규정이 까다롭고 노후된 건물이 많아 쓰기에 번거롭다""고 말했다.
러·우 전쟁으로 에너지 위기 불러… 에너지 절약 고삐
올해 100주년을 맞은 유럽 최대 가전전시회 IFA2024가 열린 독일 베를린의 전시장 모습. 베를린=김지현 기자
③에너지 절약이 생활화된 영향
도 크다. 유럽은 러시아의 우크라이나 침공 이후 에너지 위기에 직격탄을 맞아 에너지 절약에 더 민감해졌다. 독일도 곳곳에서 거리 조명 밝기를 낮추거나  에어컨 사용을 제한하는 것은 물론 겨울에는 온수 사용 시간도 조절 중이다. 에너지 사용 비용에 부담을 느끼는 소비자들은 가전의 에너지 효율 등급표를 꼼꼼하게 따져 예상 전기요금까지 비교한 뒤 구매하는 경우가 많다고 한다. 에어컨이 선풍기 수십 대와 맞먹는 양의 전력을 쓴다는 점을 감안하면 '기피 대상'일 수밖에 없는 셈이다.
이런 사정 때문에
가전 기업들은 유럽에서 고효율 에너지 제품을 만들어 적극 홍보하는 추세
다. 강대종 LG전자 H&A사업본부 실장은 기자들과 만나 ""이번에 유럽에 와보니 러시아·우크라이나 전쟁 이후 전기요금이 약 네 배, 가스요금은 아홉 배 올랐다고 하더라""며 ""기업들은 어떻게든 적은 양의 전력으로 (가전을) 운전하는 프로그램을 유럽에서도 전개하고 있다""고 설명했다.",전기요금
머니투데이,긴 연휴에 쏘카 예약↑…인천국제공항 주변 78% 증가,네이버뉴스,https://n.news.naver.com/mnews/article/008/0005090356?sid=105,,머니투데이,긴 연휴에 쏘카 예약↑…인천국제공항 주변 78% 증가,"쏘카 앱으로 쏘카를 호출하는 모습. /사진 제공=쏘카
추석 연휴 기간 쏘카 회원은 강원도 지역의 숙소를 가장 많이 예약한 것으로 나타났다. 쏘카로 숙소를 예약한 회원 10명 중 4명은 쏘카의 숙박-이동 연계 서비스 혜택을 활용할 것으로 확인됐다.
모빌리티 혁신 플랫폼 쏘카는 추석 연휴 기간(14~17일 체크인 날짜 기준) 쏘카 숙소 및 차량 사전 예약 데이터를 분석한 결과 이같이 나타났다고 밝혔다.
쏘카 회원이 가장 많이 예약한 숙소 지역은 수도권과의 높은 접근성, 뛰어난 자연경관 등을 가진 강원도(20.1%)로 나타났다. 경상북도(9.1%), 경기도(8.8%), 전라남도(8.5%) 등이 뒤를 이었다.
아울러 숙소를 예약한 회원 10명 중 4명은 숙박 기간 카셰어링을 결합해 숙소와 이동을 한 번에 준비한 것으로 나타났다. 특히 인천 숙소 예약자의 10명 중 7명은 쏘카의 숙박-이동 연계 서비스를 활용했다.
가장 인기 있는 숙소 유형은 호텔(38.6%)로 집계됐다. 합리적인 가격에 이용할 수 있는 모텔(36.0%), 프라이빗한 휴가를 즐길 수 있는 펜션(24.5%) 등이 뒤를 이었다. 일자별 예약률은 14일(35.4%), 15일(30.2%) 등 연휴가 본격적으로 시작되는 초반에 집중되는 경향을 보였다.
길어진 추석 연휴로 4일 이상 쏘카를 예약한 건수도 지난해 추석 연휴 기간에 비해 6%포인트 늘어난 것으로 조사됐다. 지난해 대비 쏘카 사전 예약 판매 비중도 4%가량 증가했다.
쏘카에 따르면 이번 추석 연휴는 주말 포함 5일 연휴와 이틀의 휴가를 추가하면 총 9일을 쉴 수 있어 3~4일 구간의 예약(22%→11%)은 감소했지만 1~3일(62%→67%)과 4일 이상(16%→22%)의 예약이 증가했다. 예약 건당 평균 대여 시간은 39시간으로 나타났다.
쏘카는 교통 거점 인근 400개의 쏘카존에 3700여 대의 쏘카를 배치해 운영 중이다. 지난해 추석 대비 교통 거점 쏘카존 차량의 사전 예약 대여 시간은 13% 증가했고 평수기와 비교하면 약 2배(183%)가량 증가했다. 특히 인천국제공항 인근 28개 쏘카존 기준 지난해 추석 대비 편도 예약 수요가 78% 증가했다.
차종별로 살펴보면 내연기관 차량 대비 전기차 사전 예약이 20%포인트 높은 수준으로 나타났다. 이는 장거리 이동의 경우 전기차 주행 요금이 상대적으로 저렴하고 추석 연휴 기간의 통행료 면제 외에도 전기차는 고속도로 통행료 50% 할인 등의 혜택을 누릴 수 있기 때문으로 풀이된다.
이 밖에도 일반 중형 세단과 중형 SUV 차종 대비 RV(카니발)와 승합(스타리아) 모델의 사전 예약이 20%포인트 높게 나타났다.
지역별로는 서울에서 출발하는 수도권 명절 이동 수요가 가장 높게 나타났다. 이후 강원도, 전라도, 부산 지역이 뒤를 이었다.
쏘카는 알뜰한 가을 여행을 돕기 위해 문화체육관광부·한국관광공사와 함께 '2024 대한민국 숙박세일 페스타'를 진행한다. 11월17일까지 3만원(7만원 이상 숙소), 2만원(7만원 미만 숙소) 등 선착순 페스타 할인 쿠폰은 물론 중복으로 할인되는 50만원 상당의 숙박 쿠폰팩과 카셰어링 75%·55% 할인 쿠폰 등 쏘카 단독 혜택도 제공한다. 할인 대상은 11월 24일까지 입실하는 모든 숙소다.
쏘카에서 숙소를 처음 예약하는 회원에게는 현금처럼 사용할 수 있는 1만 크레딧도 주어진다. 대상은 11월 24일까지 숙소 예약 후 체크인까지 완료한 첫 쏘카 숙소 이용자 전원이다. 다음 달 13일까지 입실한 회원은 10월14일, 10월14일부터 11월24일까지 입실한 회원은 11월 25일 지급된다. 크레딧은 지급일로부터 30일 이내 사용할 수 있다.",전기요금
데일리안,"환경개선 설비투자 서두르는 시멘트 업계, “목표치 97% 집행”",네이버뉴스,https://n.news.naver.com/mnews/article/119/0002873001?sid=101,,데일리안,"환경개선 설비투자 서두르는 시멘트 업계, “목표치 97% 집행”","15일 한국시멘트협회에 따르면 올해 설비투자 계획 규모는 6076억원이다. 이중 현재까지 5892억원을 집행해 달성률이 97% 수준에 달해 올해는 당초 계획을 초과한 투자액을 사용할 것으로 예상된다.ⓒ한국시멘트협회
[데일리안 = 임정희 기자] 장기적인 건설경기 침체로 시멘트 출하 급감, 재고 급증 등의 이중고에도 국내 시멘트 업계가 제품 생산 중 발생하는 환경 영향을 낮추기 위한 설비투자에 박차를 가하고 있다.
강화되는 환경기준에 선제적으로 대응하고 글로벌 이슈인 온실감축을 위한 탄소중립 조기 달성을 위해 중장기적인 성장 동력 확보가 시급하다는 판단이 작용한 것으로 보인다.
문제는 지속적인 투자 규모 확대로 올해 예상되는 업계 순이익을 전부 투입해야 할 것으로 전망되는 상황 속에서 주요 원부자재 가격 급등, 전기요금 인상 등 여파 등이 걸림돌로 꼽힌다.
15일 한국시멘트협회에 따르면 올해 설비투자 계획 규모는 6076억원이다. 이중 현재까지 5892억원을 집행해 달성률이 97% 수준에 달해 올해는 당초 계획을 초과한 투자액을 사용할 것으로 예상된다.
시멘트 업계는 최근 5년간 급속도로 설비투자 재원을 확대하고 있다. 지난 2020년 3429억원에 그쳤던 투자 규모는 올해 두 배에 가까운 6076억원이 목표치로 제시되며 증가했다.
이중 환경영향 저감을 위한 투자가 전체 투자액의 약 80% 수준을 차지하는데, 여기에는 SCR 설치 비용은 제외돼 있어 향후 SCR 설치에 본격 나설 경우 투자 규모가 급격한 수준으로 늘어날 것으로 예상된다.
하지만 최근 시멘트 업계 내에서는 향후 설비투자 집행이 순조롭게 진행될 수 있을 지에 대한 전망에 회의적이다. 안정적인 설비투자를 위해서는 재원 확보가 최대 관건이지만 오히려 올해 상반기 출하량은 줄고 재고는 증가하는 등 실물지표는 악화된 상황이다.
올해 상반기 시멘트 생산량은 1년 전 대비 13%가량 감소한 2274만t에 불과했다. 출하량도 같은 기간 12%가량 줄어들면서 2284만t으로 집계됐으며 재고량은 출하량 감소에 따라 126만t으로 16%가량 증가했다.
여기에 하반기 예정된 전기요금 인상까지 예고돼 있어 우려가 크다. 전기요금은 시멘트 제조원가 중 유연탄 조달비용과 함께 원가비중이 높다. 지난해 유연탄 조달비용이 다소 안정화됐지만 전기요금 인상이 이를 상쇄해 반사이익을 얻지 못했다는 평가가 크다.
시멘트 업계 관계자는 “올해 설비투자 조기집행 기조는 강화되는 환경기준에 대비해 오염물질 저감 시설 투자 등을 최대한 앞당기고 탄소중립 달성에 필요한 순환자원의 안정적인 사용 확대를 위해 관련 시설의 신설 및 증축으로 불가피하다”고 설명했다.
다만 “올해 상반기 국내 시멘트 업계는 지난해 하반기의 판매가격 인상 효과가 반영되면서 3194억원의 순이익을 실현했지만 설비투자 계획을 감안하면 올해 예상되는 순이익은 고스란히 환경영향 저감 등을 위한 설비투자에 투입했다고 해도 과언이 아닐 정도”라며 “일시적인 기저효과가 반영된 상반기 실적이 외화내빈(外華內貧)에 불과한 상황”이라고 설명했다.",전기요금
대구MBC,"대구교통공사, '산업용'에서 '철도용' 전력으로 개선 건의",네이버뉴스,https://n.news.naver.com/mnews/article/657/0000029962?sid=102,,대구MBC,"대구교통공사, '산업용'에서 '철도용' 전력으로 개선 건의","대구교통공사는 한국철도공사, 서울교통공사 등 14개 전국 철도 운영 기관과 함께 전기 요금 제도 개선 내용을 담은 공동 건의문을 한국전력공사에 전달했습니다.
현재 철도 운영 기관은 전기 요금 계약 종별을 영리 목적의 일반 기업과 같은 산업용 전력으로 납부했는데, ‘교육용 전력’과 같은 수준의 ‘철도용 전력’ 전기 요금 계약 종별 신설을 공동 건의했습니다.
공사는 2021년까지 매년 280억 원 정도의 전기 요금을 납부했는데, 최근 3년간 전기 요금이 40%가량 급등하면서 2024년은 430억 원의 전기 요금을 부담해야 할 것으로 예상합니다.
공사는 2023년부터 전사적인 절전 운동으로 연간 20억 원 정도를 절감하고 있지만, 전기요금 절감에는 한계가 있어 재정적 어려움이 가중되고 있다고 밝혔습니다.",전기요금
아시아투데이,"""추석 물가 잡아라""…고물가에 장바구니 부담 느끼는 서민들",,,,,,,전기요금
