press,title,naver_news_text,naver_news_url,body,press_html,title_html,body_html,label
뉴시스,"[세쓸통]우리나라전기료 얼마나 싸길래…가정용, 석유부국보다 저렴?",네이버뉴스,https://n.news.naver.com/mnews/article/003/0012788525?sid=101,,뉴시스,"[세쓸통]우리나라 전기료 얼마나 싸길래…가정용, 석유부국보다 저렴?","가정용 전기료 韓보다 저렴한 곳 '헝가리·터키'뿐
산업용 OECD 35개국 중 26위…日·獨·英·佛보다 싸
한전, 저렴한 전기료에 누적적자 41조…부채 202조
[수원=뉴시스] 김종택 기자 = 8월분 전기요금 고지서  발송작업을 하고 있다. 2024.08.27. jtk@newsis.com
[세종=뉴시스]손차민 기자 = 에어컨 없이 못 살 것만 같던 무더운 날씨가 한풀 꺾였지만 날아든 전기요금 고지서를 보고 있자니 한숨이 절로 나오는 요즘입니다. 각 가정이 부담할 전기요금이 작년 이맘때보다 평균 7500원 올라 6만원을 훌쩍 넘었다고 합니다. 이쯤되면 우리나라 전기요금이 너무 비싸지 않나 싶은 생각도 듭니다.
이게 정말 사실일까요. 놀랍게도 우리나라 전기요금은 세계 주요국에 비해 저렴한 편이라고 합니다. '가정용은 비싸고, 산업용은 싸게 받는 것 아닌가'라는 반문이 나올 텐데요. 실제로는 가정용과 산업용 전기요금 모두 낮은 수준입니다.
15일 한국전력공사에 따르면 우리나라의 지난해 산업용 전기요금은 1㎿h(메가와트시)당 122.1달러입니다. 경제협력개발기구(OECD) 35개국과 비교하면 26위에 해당합니다.
우리나라보다 산업용 전기요금이 저렴한 나라는 이스라엘(117.6달러), 캐나다(108달러), 스웨덴(95달러), 핀란드(84.6달러), 노르웨이(82.5달러), 미국(80.5달러) 등입니다. 대표적인 원유, 천연가스 부국들이 이름을 올리고 있습니다.
산업용 전기요금이 가장 비싼 곳은 영국(321.4달러)입니다. 우리나라와 산업 구조가 비슷한 일본 역시 1㎿h당 177.9달러로 우리나라보다 비쌌습니다.
[서울=뉴시스]
제조업 기반으로 경제 구조가 짜인 우리나라가 산업용 전기요금이 저렴한 건 익히 알려진 얘기입니다.
그런데 가정용 전기요금이 저렴하다는 건 이해가 잘 가지 않습니다. 자세히 살펴보면 가정용 전기요금의 경우 우리나라가 주요국 대비 더 낮은 수준인 것을 알 수 있습니다.
우리나라 가정용 전기요금은 지난해 1㎿h당 130.4달러입니다. OECD 37개국을 줄 세웠을 때 35위에 해당합니다. 우리나라보다 가정용 전기요금이 저렴한 곳은 헝가리(120.9달러)와 터키(72.6달러)뿐입니다.
가정용 전기요금이 가장 비싼 곳은 덴마크입니다. 덴마크의 가정용 전기요금은 1㎿h당 518.3달러로 우리나라보다 약 4배 정도 비쌉니다. 다음으로 영국(452.3달러), 독일(440.3달러), 벨기에(437.3달러) 등이 있습니다.
비교국을 전 세계로 넓혀보겠습니다. 국제 에너지 가격 사이트 '글로벌페트롤프라이스닷컴'에 따르면 지난해 말 우리나라 가정용 전기요금은 1㎿h당 131달러로, 비교 대상군이 된 148개국 중 77위로 허리춤에 위치해 있습니다. 우리나라 경제규모가 세계 10위권인 것을 감안하면 전기요금이 저렴한 편인 걸 굳이 따로 설명하지 않아도 될 것 같습니다.
[서울=뉴시스] 9일 한국전력공사에 따르면 지난달 말 기준 주택용 가구당 평균 전기 사용량은 363㎾h다. 역대급 폭염에 냉방기기 사용이 증가하면서 지난달 주택용 평균 전기요금이 1년 전보다 7500원 증가한 6만3610원을 기록했다. 10가구 중 8가구는 전기요금이 전년 동월보다 늘었고, 113만 가구는 5만원 이상 전기료 부담이 급등했다. (그래픽=전진우 기자)618tue@newsis.com
같은 기간 산업용 전기요금(115달러)은 가정용보다 더 낮은 83위에 해당합니다. 가정용의 경우 세계 평균의 83%, 산업용은 74% 수준으로 저렴한 셈입니다.
그럼 누진세가 적용되는 여름철만 놓고 봐도 상황이 같을까요. 한전이 지난달 가정용 가구당 평균 전기 사용량인 363㎾h에 대해 국가별 전기요금 납부액을 비교한 결과, 우리나라는 6만3610원이었습니다.
일본(동경전력)은 13만5625원, 프랑스(EDF)는 14만8057원으로 우리나라와 비교해 2배 이상이었습니다. 더욱이 미국(SCE)은 15만9166원으로 2.5배, 독일(E.on)은 18만3717원으로 3배에 달하는 것으로 나타났습니다.
프랑스와 독일은 누진세가 없지만, 일본과 미국은 누진세가 있는 것을 감안해도 우리나라보다 훨씬 많은 수준의 요금을 내야 합니다.
[세종=뉴시스]국가별 여름철 전기요금 수준 비교 그래픽이다.(사진=한전 제공) *재판매 및 DB 금지
국민 체감과는 달리 어떻게 따져봐도 다른 나라보다 우리나라의 전기요금은 낮은 편입니다.
기름 한 방울 안 나오는 우리나라에서 전기요금이 낮다는 것은 그만큼 한전이 손해를 보고 전기를 판매하고 있다는 것이겠죠. 한전은 시장형 공기업이기에 전기를 판매한 수익으로 회사를 운영하고 있습니다.
국제 에너지 가격이 천정부지로 치솟는 동안, 저렴한 전기요금이 지속되며 한전 적자는 눈덩이처럼 불어났습니다.
지난 2021년 2분기부터 쌓인 한전 적자는 2분기 말 기준 41조원입니다. 이로 인한 한전의 부채는 200조원을 넘어선 지 오래입니다.
이에 에너지 당국은 전기 요금 인상을 검토하고 있습니다. 안덕근 산업통상자원부 장관은 지난달 기자들과 만나 전기요금 인상에 대해 ""폭염이 지난 뒤에 검토할 예정""이라고 밝힌 바 있습니다.
우리나라 전기요금이 아무리 싸다고 한들 각 가정의 씀씀이와 따져보면 부담이 아닐 수 없습니다. 더욱이 에너지 취약계층에게 있어서는 생존과 관련된 문제입니다. 전기요금 인상을 더는 미룰 수 없는 지경이라면 부디 합리적인 수준에서 인상안이 마련되기를 기대해봅니다.
※'세쓸통' = '세상에 쓸모없는 통계는 없다'는 일념으로 통계 속에 숨겨진 이야기를 찾아내 알기 쉽게 풀어내고자 합니다.
[서울=뉴시스]",전기요금
연합뉴스TV,전기요금언제 올리나…정부의 선택은,네이버뉴스,https://n.news.naver.com/mnews/article/422/0000682275?sid=101,,연합뉴스TV,전기요금 언제 올리나…정부의 선택은,"[앵커]
전기요금 고지서 받기가 두렵다는 분들이 많으신데요.
정부 입장에서는 전기요금 정상화가 고민입니다.
전기요금을 인상해야 할 이유와 배경은 갖췄는데, 8월 폭염으로 급증한 전기요금 고지서가 발목을 잡고 있습니다.
박진형 기자의 보도입니다.
[기자]
한국전력의 재무위기는 심각한 수준입니다.
올해 상반기 기준 한전의 총부채는 202조8천900억원.
지난 2020년 132조5천억원 수준에서 2021년 145조8천억원, 2022년 192조원으로 급격하게 불었습니다.
러시아 우크라이나 전쟁으로 국제 에너지 가격이 급등했지만 물가 상승 우려로 2021년부터 원가 아래로 전기를 공급한 탓입니다.
2022년 이후 총 6차례에 걸쳐 kWh(킬로와트시)당 전기요금을 45.3원 약 44% 인상하며 작년 3분기부터 역마진 구조를 벗어났지만, 갈 길이 멉니다.
대규모 부채로 작년부터 연간 4조원이 넘는 이자가 발생했고, 올해 상반기에도 벌써 2조2천억원이 이자비용으로 나갔습니다.
정부는 전기요금 정상화는 불가피하다는 입장.
지난달 27일 안덕근 산업통상자원부 장관은 기자간담회에서 폭염이 지나면 전기요금 정상화 시점을 고민하겠다고 밝혔습니다.
8월 소비자물가 상승률은 2%로 3년 5개월 만에 가장 낮은 수준을 기록하면서 전기요금 정상화 주장에 힘을 실어줬지만 역대급 폭염이 이어진 8월에 사용한 전기요금 고지서가 발목을 잡았습니다.
전체 가구의 76%인 1,922만 가구의 8월 전기요금이 올랐는데, 이들 가구는 작년보다 평균 1만7,000원 정도를 더 내야 합니다.
지난해보다 3만~5만원을 더 내야 하는 집은 126만 가구, 5만~10만원을 더 내야 하는 집도 75만 가구나 됩니다.
전기요금을 작년보다 10만원 이상 더 내야 하는 집도 38만 가구에 달합니다.
빠른 인상은 더위가 계속될수록 부담이 되고, 너무 늦출 경우 겨울 난방비 증가로 이어질 수 있는 상황. 정부의 고민이 깊어지고 있습니다.
연합뉴스TV 박진형입니다. (in@yna.co.kr)
#전기요금 #한국전력 #산업부
연합뉴스TV 기사문의 및 제보 : 카톡/라인 jebo23",전기요금
중앙일보,오죽하면 삼겹살도 직접 구워준다…설 곳 잃은 PC방의 비명,네이버뉴스,https://n.news.naver.com/mnews/article/025/0003386635?sid=101,,중앙일보,오죽하면 삼겹살도 직접 구워준다…설 곳 잃은 PC방의 비명,"서울 여의도에 위치한 한 PC방. 나상현 기자
명절날 아이들끼리 손에 1000원 몇장 들고 찾아가던, 혹은 어른들 잔소리를 피해 한숨 돌릴 안식처가 되어주던 전자 놀이터. 과거 청소년들의 문화 성지로 군림했던 PC방이 빠르게 사라지고 있다. 스마트폰 발달로 모바일 게임 시장이 급성장하면서 수요가 줄어들고, 높아진 인건비와 전기요금에 운영이 힘들어진 현실까지 겹친 탓이다.
박경민 기자
15일 국세청 100대 생활업종 통계에 따르면 전국 PC방 사업자 수는 매년 6월 기준 2017년 1만648개에서 올해 7484개로 29.7% 급감했다. 매년 감소세에 놓인 데다, 특히 지난해(8011개)엔 전년 대비 12.3% 감소하는 등 코로나를 거치며 증발 속도도 빨라지고 있다.
지역별로는 부산이 2017년 749개에서 올해 386개로 48.5% 쪼그라들면서 가장 큰 감소폭을 보였다. 뒤이어 전북(-40.8%), 대구(-40.6%), 서울(-38.9%), 울산(-36.2%), 경남(-29.2%), 제주(-29.2%), 경북(-27.4%) 순으로 이어졌다. 상대적으로 젊은 인구가 많은 세종은 5.6% 줄어드는 데 그쳤다.
원인은 복합적이다. 우선 모바일 게임 시장이 확대되면서 PC게임에 대한 수요 자체가 옅어진 측면이 크다. 한국콘텐츠진흥원(콘진원)이 발간한 게임백서에 따르면 2022년 기준 모바일게임의 매출액 비중은 64.4%로 가장 컸고, PC게임 비중은 28.6%를 차지했다. 10년 전인 2012년의 경우 PC게임이 86.8%로 절대적이고, 모바일게임은 10.1%에 불과했다. 10년 새 모바일게임과 PC게임의 입지가 뒤바뀐 것이다.
2022년 게임 플랫폼별 매출액 비중. 한국콘텐츠진흥원
이는 스마트폰의 발전과 연관성이 크다. 고스펙 게임이 구동될 만큼 성능 좋은 기기가 등장하면서 게임사들도 상대적으로 투입하는 자본이 적은 모바일 게임으로 눈을 돌리기 시작했다. 배틀그라운드 모바일, 던전앤파이터 모바일 등 기존 PC게임을 모바일 버전으로 출시하거나, PC와 모바일에서 모두 플레이할 수 있는 멀티 플랫폼으로 출시하는 식이다. 2022년 항저우 아시안 게임에서 PC 버전 배틀그라운드가 아닌 모바일 버전 배틀그라운드를 e스포츠 종목으로 채택했던 점도 이같은 변화를 상싱적으로 보여준다.
여기에 PC보다 스마트폰을 더 일찍 접하고, 더 친숙한 청소년 세대 특성까지 더해지면서 PC방을 가야 하는 이유가 점점 사라지고 있다. 한국청소년정책연구원에 따르면 2021년 기준 설문대상 청소년의 98%가 스마트폰을 보유하고 있었다. 서울 광진구에서 PC방을 운영하는 이모(50)씨는 “PC방 주고객층인 청소년 손님들이 눈에 띄게 줄었다”며 “모바일 게임이 워낙 많이 늘어났고, 이용자를 끌어올 만한 PC용 대작 온라인 게임이 나오지 않는 것도 크다고 본다”고 말했다.
PC방 풍경. 중앙일보DB
설상가상으로 매년 오르는 고정비도 운영상 어려움을 더하고 있다. PC방은 대부분 24시간 운영이 기본인 만큼 막대한 전기요금이 고정적으로 나오고, 최저임금도 매년 빠르게 상승하고 있다. 특히 내년부터 시간당 최저임금이 사상 처음으로 1만원을 돌파하면서 PC방 업주들의 시름은 깊어질 것으로 보인다.
실제 콘진원이 전국 PC방 1000개를 대상으로 설문조사를 실시한 결과, 경영상 체감 악화 원인으로 ‘고정비용 상승’이 59.5%(1+2순위 기준)로 가장 많았다. 가장 필요한 정부 지원으로도 ‘인건비와 월세가 너무 비싸기에 고정비에 대한 지원 정책’을 꼽았다.
이에 인건비라도 아끼기 위해 무인 PC방을 운영하거나, ‘PC토랑’이라 불릴 정도로 다양한 먹거리 판매에 집중하는 생존 방식도 등장하고 있다. 서울 용산구에 있는 한 PC방은 정육점처럼 삼겹살을 직접 구워주는 것으로 소셜네트워크서비스(SNS)에서 유명세를 타기도 했다.
김기홍 한국인터넷PC카페협동조합 이사장은 “PC방은 24시간 운영되다 보니 전기요금과 주휴수당 포함 최저임금이 오를수록 더욱 취약해지는 업종이다. 최근 야간 운영을 아예 포기하는 업주들도 늘어나고 있다”며 “소상공인용 전기요금 체계를 바꿔주고, 소상공인과 노동자 모두 상생할 수 있도록 정부 지원도 필요하다”고 밝혔다.",전기요금
중앙일보,"“0명, 진짜 역대급입니다” PC방 한때 ‘열풍’ 난리더니…폐업 ‘비명...",네이버뉴스,https://n.news.naver.com/mnews/article/025/0003386635?sid=101,,중앙일보,오죽하면 삼겹살도 직접 구워준다…설 곳 잃은 PC방의 비명,"서울 여의도에 위치한 한 PC방. 나상현 기자
명절날 아이들끼리 손에 1000원 몇장 들고 찾아가던, 혹은 어른들 잔소리를 피해 한숨 돌릴 안식처가 되어주던 전자 놀이터. 과거 청소년들의 문화 성지로 군림했던 PC방이 빠르게 사라지고 있다. 스마트폰 발달로 모바일 게임 시장이 급성장하면서 수요가 줄어들고, 높아진 인건비와 전기요금에 운영이 힘들어진 현실까지 겹친 탓이다.
박경민 기자
15일 국세청 100대 생활업종 통계에 따르면 전국 PC방 사업자 수는 매년 6월 기준 2017년 1만648개에서 올해 7484개로 29.7% 급감했다. 매년 감소세에 놓인 데다, 특히 지난해(8011개)엔 전년 대비 12.3% 감소하는 등 코로나를 거치며 증발 속도도 빨라지고 있다.
지역별로는 부산이 2017년 749개에서 올해 386개로 48.5% 쪼그라들면서 가장 큰 감소폭을 보였다. 뒤이어 전북(-40.8%), 대구(-40.6%), 서울(-38.9%), 울산(-36.2%), 경남(-29.2%), 제주(-29.2%), 경북(-27.4%) 순으로 이어졌다. 상대적으로 젊은 인구가 많은 세종은 5.6% 줄어드는 데 그쳤다.
원인은 복합적이다. 우선 모바일 게임 시장이 확대되면서 PC게임에 대한 수요 자체가 옅어진 측면이 크다. 한국콘텐츠진흥원(콘진원)이 발간한 게임백서에 따르면 2022년 기준 모바일게임의 매출액 비중은 64.4%로 가장 컸고, PC게임 비중은 28.6%를 차지했다. 10년 전인 2012년의 경우 PC게임이 86.8%로 절대적이고, 모바일게임은 10.1%에 불과했다. 10년 새 모바일게임과 PC게임의 입지가 뒤바뀐 것이다.
2022년 게임 플랫폼별 매출액 비중. 한국콘텐츠진흥원
이는 스마트폰의 발전과 연관성이 크다. 고스펙 게임이 구동될 만큼 성능 좋은 기기가 등장하면서 게임사들도 상대적으로 투입하는 자본이 적은 모바일 게임으로 눈을 돌리기 시작했다. 배틀그라운드 모바일, 던전앤파이터 모바일 등 기존 PC게임을 모바일 버전으로 출시하거나, PC와 모바일에서 모두 플레이할 수 있는 멀티 플랫폼으로 출시하는 식이다. 2022년 항저우 아시안 게임에서 PC 버전 배틀그라운드가 아닌 모바일 버전 배틀그라운드를 e스포츠 종목으로 채택했던 점도 이같은 변화를 상싱적으로 보여준다.
여기에 PC보다 스마트폰을 더 일찍 접하고, 더 친숙한 청소년 세대 특성까지 더해지면서 PC방을 가야 하는 이유가 점점 사라지고 있다. 한국청소년정책연구원에 따르면 2021년 기준 설문대상 청소년의 98%가 스마트폰을 보유하고 있었다. 서울 광진구에서 PC방을 운영하는 이모(50)씨는 “PC방 주고객층인 청소년 손님들이 눈에 띄게 줄었다”며 “모바일 게임이 워낙 많이 늘어났고, 이용자를 끌어올 만한 PC용 대작 온라인 게임이 나오지 않는 것도 크다고 본다”고 말했다.
PC방 풍경. 중앙일보DB
설상가상으로 매년 오르는 고정비도 운영상 어려움을 더하고 있다. PC방은 대부분 24시간 운영이 기본인 만큼 막대한 전기요금이 고정적으로 나오고, 최저임금도 매년 빠르게 상승하고 있다. 특히 내년부터 시간당 최저임금이 사상 처음으로 1만원을 돌파하면서 PC방 업주들의 시름은 깊어질 것으로 보인다.
실제 콘진원이 전국 PC방 1000개를 대상으로 설문조사를 실시한 결과, 경영상 체감 악화 원인으로 ‘고정비용 상승’이 59.5%(1+2순위 기준)로 가장 많았다. 가장 필요한 정부 지원으로도 ‘인건비와 월세가 너무 비싸기에 고정비에 대한 지원 정책’을 꼽았다.
이에 인건비라도 아끼기 위해 무인 PC방을 운영하거나, ‘PC토랑’이라 불릴 정도로 다양한 먹거리 판매에 집중하는 생존 방식도 등장하고 있다. 서울 용산구에 있는 한 PC방은 정육점처럼 삼겹살을 직접 구워주는 것으로 소셜네트워크서비스(SNS)에서 유명세를 타기도 했다.
김기홍 한국인터넷PC카페협동조합 이사장은 “PC방은 24시간 운영되다 보니 전기요금과 주휴수당 포함 최저임금이 오를수록 더욱 취약해지는 업종이다. 최근 야간 운영을 아예 포기하는 업주들도 늘어나고 있다”며 “소상공인용 전기요금 체계를 바꿔주고, 소상공인과 노동자 모두 상생할 수 있도록 정부 지원도 필요하다”고 밝혔다.",전기요금
연합뉴스,냉방 취약층 지원 130만세대로 확대…내년 692억원 투입,네이버뉴스,https://n.news.naver.com/mnews/article/001/0014932563?sid=102,,연합뉴스,냉방 취약층 지원 130만세대로 확대…내년 692억원 투입,"올해보다 13.7% 증가…기후 민감계층 냉방비 5만4천원씩 지원
폭염에 달아오른 쪽방촌 골목길
(서울=연합뉴스) 신현우 기자 = 전국 곳곳 낮 최고기온이 30도를 웃돈 지난 6월 20일 서울 영등포 쪽방촌에서 한 주민이 밖으로 나와 더위를 식히고 있다.
※알림 : 이 사진은 일반 카메라로 촬영한 사진과 열화상 카메라 모듈로 촬영한 사진을 그래픽 프로그램으로 편집해 한장으로 표현하였음. 2024.6.20
nowwego@yna.co.kr
(끝)
(세종=연합뉴스) 차대운 기자 = 점점 심해지는 여름 더위로 냉방용 전기 수요가 증가하는 가운데 정부가 내년 여름 냉방비 지원 대상을 130만세대 이상으로 늘린다.
15일 산업통상자원부에 따르면 내년 에너지 바우처 중 하절기 예산은 692억7천만원으로 편성됐다. 올해의 609억5천만원보다 13.7% 증가했다.
하절기 에너지 바우처는 기초생활수급 가구 중 기후 민감 계층에 속하는 세대에 여름 냉방용 전기요금을 지원하는 복지 사업이다.
노인, 영유아, 장애인, 임산부, 한부모 가족, 소년소녀 가장 등이 지원 대상이다. 이들 세대는 여름철에 전기요금 차감 등의 방식으로 세대당 5만4천원을 지원받는다.
하절기 에너지 바우처 지원 대상은 올해 115만세대에서 내년 130만7천세대로 확대된다.
한국전력은 정부 에너지 바우처와 별도로 복지 할인 제도를 운영해 취약계층의 여름철 전기요금을 최대 2만원까지 할인해주고 있다.
한전에 따르면 올해 8월 에너지 바우처와 한전 복지 할인을 동시에 적용받은 세대 중 31만3천세대의 전기요금은 '0원'이었고, 22만5천가구의 전기요금은 1만원 미만이었다.
역대급 폭염이 닥친 올해 전반적으로 주택용 전기요금 부담이 크게 늘어났다.
한전은 지난 8월 주택용 전기의 가구당 평균 사용량이 363kWh(킬로와트시)로 작년 같은 달보다 9% 증가해 가구당 평균적으로 요금이 13% 올라 고지된다고 설명했다.
기상청에 따르면 지난 8월 폭염일수는 16일로, 2016년 16.6일에 이어 관련 통계를 집계한 1973년 이래 두 번째로 많았다. 지난달 열대야 일수도 11.3일로 통계 집계 이후 처음 두 자릿수를 기록했다.
cha@yna.co.kr",전기요금
연합뉴스,내년 냉방 취약층 지원 130만 세대로 늘린다,네이버뉴스,https://n.news.naver.com/mnews/article/001/0014932563?sid=102,,연합뉴스,냉방 취약층 지원 130만세대로 확대…내년 692억원 투입,"올해보다 13.7% 증가…기후 민감계층 냉방비 5만4천원씩 지원
폭염에 달아오른 쪽방촌 골목길
(서울=연합뉴스) 신현우 기자 = 전국 곳곳 낮 최고기온이 30도를 웃돈 지난 6월 20일 서울 영등포 쪽방촌에서 한 주민이 밖으로 나와 더위를 식히고 있다.
※알림 : 이 사진은 일반 카메라로 촬영한 사진과 열화상 카메라 모듈로 촬영한 사진을 그래픽 프로그램으로 편집해 한장으로 표현하였음. 2024.6.20
nowwego@yna.co.kr
(끝)
(세종=연합뉴스) 차대운 기자 = 점점 심해지는 여름 더위로 냉방용 전기 수요가 증가하는 가운데 정부가 내년 여름 냉방비 지원 대상을 130만세대 이상으로 늘린다.
15일 산업통상자원부에 따르면 내년 에너지 바우처 중 하절기 예산은 692억7천만원으로 편성됐다. 올해의 609억5천만원보다 13.7% 증가했다.
하절기 에너지 바우처는 기초생활수급 가구 중 기후 민감 계층에 속하는 세대에 여름 냉방용 전기요금을 지원하는 복지 사업이다.
노인, 영유아, 장애인, 임산부, 한부모 가족, 소년소녀 가장 등이 지원 대상이다. 이들 세대는 여름철에 전기요금 차감 등의 방식으로 세대당 5만4천원을 지원받는다.
하절기 에너지 바우처 지원 대상은 올해 115만세대에서 내년 130만7천세대로 확대된다.
한국전력은 정부 에너지 바우처와 별도로 복지 할인 제도를 운영해 취약계층의 여름철 전기요금을 최대 2만원까지 할인해주고 있다.
한전에 따르면 올해 8월 에너지 바우처와 한전 복지 할인을 동시에 적용받은 세대 중 31만3천세대의 전기요금은 '0원'이었고, 22만5천가구의 전기요금은 1만원 미만이었다.
역대급 폭염이 닥친 올해 전반적으로 주택용 전기요금 부담이 크게 늘어났다.
한전은 지난 8월 주택용 전기의 가구당 평균 사용량이 363kWh(킬로와트시)로 작년 같은 달보다 9% 증가해 가구당 평균적으로 요금이 13% 올라 고지된다고 설명했다.
기상청에 따르면 지난 8월 폭염일수는 16일로, 2016년 16.6일에 이어 관련 통계를 집계한 1973년 이래 두 번째로 많았다. 지난달 열대야 일수도 11.3일로 통계 집계 이후 처음 두 자릿수를 기록했다.
cha@yna.co.kr",전기요금
