press,title,naver_news_text,naver_news_url,body,press_html,title_html,body_html,label
세계일보,불황 속 ‘호황’…작년 로또 판매액 6조원 육박 ‘역대 최대’,네이버뉴스,https://n.news.naver.com/mnews/article/022/0004006633?sid=101,,세계일보,불황 속 ‘호황’…작년 로또 판매액 6조원 육박 ‘역대 최대’,"로또 당첨 번호를 형상화한 그림. 게티이미지뱅크
지난해 로또복권 판매액이 6조원에 육박하며 역대 최고 기록을 경신했다. 고물가와 고금리로 소비 심리가 위축된 가운데, 미래에 대한 불확실성이 커지면서 복권을 통한 일확천금의 기대 심리가 확산된 것으로 분석된다.
30일 기획재정부와 복권 수탁 사업자인 동행복권에 따르면 지난해 로또복권 판매액은 5조9562억원으로 역대 최대를 기록했다.
지난해 대비 판매량 증가율은 2020년 9.3%, 2021년 8.6%, 2022년 7.9%, 2023년 2.4%로 하락하는 추세였지만, 지난해에는 5.4%로 반등했다.
로또는 판매 시작 이듬해인 2003년 3조8000억원어치가 팔리며 ‘광풍’에 휩싸였다. 사행성 논란이 빚어지자 정부는 당첨금 이월 횟수를 줄였고, 2004년에는 한 게임당 가격을 2000원에서 1000원으로 내렸다. 그러자 연간 판매액은 2조원대로 감소했다.
그러나 2014년 판매액은 다시 3조원대를 넘었고, 2019년에는 4조3181억원으로 처음 4조원대로 올라섰다. 2021년에는 5조1148억원으로 5조원대가 됐다. 지금과 같은 추세라면 내년 판매액은 6조원을 웃돌 것으로 예상된다.
복권은 흔히 경기 불황기에 판매가 증가하는 ‘불황형 상품’으로 불린다. 경제적 어려움이 심화될수록 복권에 대한 기대 심리가 커지기 때문이다.
작년 로또복권 판매액이 6조원에 육박하며 역대 최고 기록을 경신했다. 작년 5월 30일 서울 시내의 한 복권방에서 복권을 사려는 시민들로 붐비고 있다. 뉴시스
전문가들은 이러한 현상에 대해 서민들의 경제적 부담과 미래에 대한 불확실성이 맞물린 결과로 분석한다. 노동을 통해 자산을 축적하기보다 물가와 집값 상승 속도가 더 빠른 상황에서 현실적 기대를 접고 복권을 통해 부를 추구하려는 심리가 확산되고 있다는 것이다.
한 경제연구원 관계자는 “삶이 팍팍할수록 복권 구매는 희망을 거는 심리적 대안이 된다”며 “이러한 경향은 경제 상황이 개선되기 전까지 지속될 가능성이 높다”고 전망했다.
한편, 지난해 1등은 총 763명이다. 회차에 따라 당첨금액이 최대 8배 이상 차이가 났는데, 가장 당첨 액수가 컸던 회차는 11월 23일 추첨한 1147회차였다. 당시 8명이 각각 33억2300여만원을 받았다.
반면 7월 13일 추첨한 1128회차에서는 당첨자가 무려 63명이나 나오며 1명당 당첨금은 4억2000여만원에 그쳤다. 로또로 ‘인생 역전’을 이루기는 어렵다는 말까지 나왔다.
숫자 5개와 보너스 숫자를 맞추는 2등도 회차당 격차가 컸다. 9월 21일 추첨한 1138회차에서는 2등에게 각각 8879만원(50명)이 돌아갔지만, 12월 14일 추첨한 1150회차에서는 2등 당첨금이 1969만원(226명)에 그쳤다.
로또 구매자가 가장 많았던 회차는 2월 10일 추첨한 1106회차였다. 한 주 동안 1266억원어치(1억2660게임)가 팔렸다. 반면 8월 3일 추첨한 1131회에서는 1091억원어치(1910게임)로 가장 적게 팔린 주로 기록됐다.",소비심리
이코노미스트,주춤했던 여행업계 '훈風' 부는 이유,네이버뉴스,https://n.news.naver.com/mnews/article/243/0000071983?sid=103,,이코노미스트,주춤했던 여행업계 '훈風' 부는 이유,"지난해 누적 방한객 전년비 50% 껑충
해외여행 수요 꾸준히 증가...올해 '역대 최다' 찍나
인천국제공항 출국장에서 여행객들이 오가고 있다. [사진 연합뉴스]
주춤했던 여행업계가 활기를 되찾고 있다. 엔데믹 이후 하늘길이 열리면서 급증했던 인바운드(외국인의 한국여행), 아웃바운드(내국인의 해외여행) 수요는 지난해 대내외적 요인들로 인해 잠시 위축됐으나, 빠른 회복세에 따른 호조가 기대된다는 전망이다.
음악과 드라마, 뷰티, 패션, 음식 등 다양한 한류 콘텐츠가 인기를 끌면서 지난해 방한 관광객은 눈에 띄게 늘었다.
한국관광공사가 발표한 한국관광통계에 따르면 2024년 1~11월 누적 방한객은 1510만명으로 전년 동기 대비 51.1% 증가했다. 코로나19 확산 이전인 2019년 동기 대비로는 94% 수준까지 회복한 셈이다.
멤버십 기반 글로벌 숙소 원가예약 플랫폼 올마이투어닷컴의 예약 데이터 분석 결과에 따르면, 동절기(2024년 12월 1일~2025년 2월 28일 투숙 기준) 방한 관광객들의 숙소 예약 건수는 전년 동기 대비 392% 증가한 것으로 나타났다.
지역별 예약 비중은 서울(84%)이 1위를 차지했으며, 한류의 중심인 명동이 위치한 중구 소재 숙소 예약률(56%)이 특히 높았다.
올해 정부는 여러 변수로 위축된 방한 심리를 신속하게 전환해, 2019년 1750만명이던 방한 관광객을 1850만명까지 늘리겠다는 목표를 세웠다.
또한 앞으로 내국인의 해외여행 수요는 꾸준한 증가가 예상된다. 실제로 지난해 이커머스 플랫폼 미정산 사태로 인한 소비심리 침체와 고환율 기조에도 내국인의 해외여행 수요는 꺾이지 않은 바 있다.
한국공항공사에 따르면 2024년 국제선 여객수는 8930만8868명으로 전년 동기 대비 30.1% 증가했다. 이는 역대 최다 여행객 수를 기록했던 2019년의 98.2%에 해당하는 수치로 올해 역대 최다 해외여행객 달성 가능성도 엿보인다.
특히 이달 27일이 임시공휴일로 지정되자 여행업계는 더욱 분주해졌다. 설 연휴가 6일로 늘어나면서 숙박 플랫폼을 통한 국내 및 해외 숙소 예약률도 상승세를 기록 중이다.
실제로 임시공휴일 지정 소식이 나온 1월 8일을 기준으로 올마이투어닷컴의 전후 7일 간 숙소 상품 예약률을 비교한 결과, 설 연휴 기간(1월 25일~30일) 숙소 예약률은 국내 숙소가 약 82%, 해외 숙소가 약 168% 증가했다. 오는 10월에도 추석을 낀 ‘황금연휴’가 최대 10일까지 가능한 만큼 여행업계 훈풍이 지속될 것으로 전망된다.",소비심리
JIBS,"“월급은 그대로인데, 왜 더 가난할까?”.. 물가 폭주, 소득 격차 “금...",네이버뉴스,https://n.news.naver.com/mnews/article/661/0000050013?sid=101,,JIBS,"“월급은 그대로인데, 왜 더 가난할까?”.. 물가 폭주, 소득 격차 “금융위기 후  최악”","임금 2.8%↑vs.물가 3.6% 폭등.. 실질소득 차 “더 벌어져”
“소득은 올랐다는데, 왜 살림살이는 더 빠듯할까?
세금 부담 줄었다지만.. 감세 혜택은 “최상위층 독식”
“월급은 올랐는데, 생활은 더 빠듯해졌다.”
2023년 근로자의 평균 임금 상승률이 2.8%에 그치며 2년 연속 둔화한 가운데, 소비자물가는 3.6% 폭등했습니다. 물가가 임금 상승폭을 크게 웃돌면서 실질소득 격차는 금융위기 이후 가장 크게 벌어졌습니다. 소득은 정체되고, 장바구니 부담은 커지면서 국민 체감 경기는 한층 더 얼어붙고 있습니다.
경제 전반에 스태그플레이션(저성장·고물가) 경고음이 울리는 가운데, 체감 경기는 더 얼어붙고 있습니다. 소득은 늘지 않는데, 생활비 부담만 가중되는 악순환이 지속되면서 ‘살림살이 후퇴’에 대한 불만이 커지는 상황입니다.
■ “오르는 건 물가뿐”.. 근로자 소득, 인플레이션에 밀려
30일 국회 기획재정위원회 소속 임광현 더불어민주당 의원이 국세청에서 제출받은 자료에 따르면, 2023년(귀속연도) 근로자의 평균 소득(총급여 기준)은 4,332만 원으로 전년 대비 2.8% 증가한 것으로 나타났습니다. 하지만 이는 코로나19가 본격화한 2020년(2.3%) 이후 가장 낮은 증가율입니다.
반면, 같은 기간 소비자물가는 3.6% 상승하며 임금 상승률을 크게 웃돌았습니다. 이에 따라 실질소득 상승률(근로소득 증가율-소비자물가 상승률)은 -0.8%포인트(p)를 기록해 2년 연속 마이너스를 나타냈습니다. 2009년(-2.0%) 금융위기 이후 처음으로 마이너스를 기록했던 2022년(-0.4%)보다 격차가 더 커진 셈입니다.
이처럼 근로자의 임금 상승률이 둔화한 것은 경기 침체를 비롯해 기업들의 인건비 부담 증가, 고용시장 위축 등이 복합적으로 작용한 결과로 분석되고 있습니다.
■ “세금 부담 줄었다?”.. 최상위층만 반긴 개정안
근로소득자의 세 부담은 2023년 전년 대비 소폭 감소했습니다. 정부는 세법 개정을 통해 과세표준 5,000만 원 이하 구간의 세율을 낮춰 서민·중산층 지원을 강화하겠다고 밝혔지만, 실질적인 감세 효과는 최상위 소득층에 집중된 것으로 나타났습니다.
실제 근로소득자 가운데 최상위 0.1% 구간인 2만 852명의 평균 소득은 9억 6,004만으로, 이 구간의 1인당 평균 결정세액은 3억 3,290만원으로 전년 대비 1,836만 원 감소(-5.2%)했습니다.
반면 중위 50% 소득 구간 20만 8,523명의 1인당 평균 근로소득은 3,302만 원이었다. 이 구간 소득자들의 1인당 평균 결정세액은 29만 2,054만원으로 전년 대비 0.9% 오히려 증가했습니다. 결국, 세금 감면의 혜택을 가장 크게 본 것은 극소수의 초고소득층이라는 비판이 제기될 수 밖에 없습니다.
■ “경제 위기, 더 심각해진다”.. 실질소득 감소의 후폭풍
전문가들은 근로자의 실질소득이 계속 감소할 경우 소비 위축과 경기 둔화가 가속화될 가능성이 크다고 경고하고 있습니다. 기업이 임금 상승을 억제하는 가운데, 고물가가 지속될 경우 가계 소비력이 약화되고 내수 시장 전반이 위축될 수 있다는 게 이유입니다.
실질임금 하락이 지속될 경우에는, 장기적으로 소비 침체를 부추길 수 있다는 우려도 내놓고 있습니다.
한국은행 역시 최근 발표한 보고서에서 “실질소득 감소가 지속될 경우 소비 심리가 크게 악화할 가능성이 높다”라며 “소득 불평등 심화와 저소득층의 경제적 부담 증가에 대한 정책 대응이 필요하다”라고 밝히고 있습니다.
임 의원은 “소득 상승률이 둔화하면서 국민의 실질 구매력이 떨어지고 있다”라며 “근로자의 소득 증대를 위한 보다 적극적인 조세·재정정책이 필요하다”라고 강조했습니다.",소비심리
서울경제,지난해 법원 경매 신청건수 12만건 육박…금융위기 이후 최다 규모,네이버뉴스,https://n.news.naver.com/mnews/article/011/0004444922?sid=101,,서울경제,지난해 법원 경매 신청건수 12만건 육박…금융위기 이후 최다 규모,"11만 9000여건으로 2009년 이후 가장 많아···고금리·경기침체 후폭풍
올해 2·3분기 경매 진행물건 정점 찍을 듯···1월 서울 아파트 낙찰가율은 상승
[연합뉴스 자료사진]
[연합뉴스 자료사진]
[서울경제]
지난해 법원에 경매를 신청한 물건 수가 12만건에 육박하며 글로벌 금융위기 이후 최대치를 기록했다. 고금리와 경기침체의 그늘이 경매 물건 증가로 이어진 것이다. 올해는 비상계엄과 탄핵 정국도 경매 시장에 변수로 작용할 전망이다.
━
작년 경매 신청건수 15년 만에 최대…올해는 탄핵정국이 변수
29일 법원 경매정보 통계와 법무법인 명도에 따르면 지난해 경매를 신청한 신규 경매 물건수는 총 11만 9312건으로 전년(10만 1145건) 대비 18% 증가했다. 이는 부동산 시장이 침체했던 2013년(11만 9166건)을 넘어서 글로벌 금융위기로 경매 물건이 급증한 2009년(12만 4252건) 이후 15년 만에 가장 많은 것이다. 경매 신청 물건 수는 채권자들이 신규로 경매 신청을 한 물건의 수로, 유찰 물건이 누적되는 경매 진행(입찰) 건수보다 최근 경기 상황을 가장 정확하게 반영한다.
2021년 3분기부터 본격화된 금리 인상과 경기 침체 여파로 대출금을 갚지 못한 채무자가 늘기 시작하면서 2022년 7만 7459건이던 신규 경매 신청 건수는 2023년(10만 1145건)에 10만건을 넘었고, 지난해 12만건에 육박하는 신규 물건이 쌓였다. 강은현 법무법인 명도 경매연구소장은 ""고금리와 경기 침체의 후폭풍이 시차를 두고 경매 시장에 영향을 주면서 지난해 경매 물건이 글로벌 경제위기 수준에 버금갈 정도로 증가했다""고 설명했다.
지난해 신규 경매 신청 건수는 1월(1만 619건)부터 1만건을 넘기 시작해 3~5월 석 달 연속 1만건을 웃돌았고, 8월에 1만 1426건으로 정점을 찍었다. 그러나 이후 9월부터 9000건대로 줄어들기 시작해 12월에 8989건으로 감소하는 등 소폭의 감소 추세를 보이고 있다.
전문가들은 경매 신청 후 첫 입찰에 부쳐지기까지 평균 6~7개월이 소요되는 점을 고려할 때 입찰장에 나오는 경매 진행 물건 수가 올해 2∼3분기에 정점을 찍을 것으로 예상한다.
앞으로의 변수는 탄핵 정국 이후 시장 흐름이다. 강은현 소장은 ""일단 작년 3분기 이후 경매 물건 감소세가 관측되고 있지만 작년 12월 비상계엄·탄핵정국 이후 소비심리 위축과 경기 침체 심화 등의 변화된 상황은 반영되지 않은 결과""라며 ""비상계엄 사태 이후 일반 부동산 매매 시장도 침체한 만큼 장래에 경매 물건이 다시 증가할 가능성도 배제할 수 없다""고 말했다.
━
올해 1월 서울 아파트 낙찰가율 소폭 상승…신건·고가 낙찰도 늘어
일단 지난해 말 탄핵 정국 여파로 주춤했던 서울 아파트 경매 시장은 올해 들어 다소 회복된 모습이다. 법원경매 전문회사 지지옥션에 따르면 올해 1월 서울 아파트 경매 낙찰가율(감정가 대비 낙찰가격 비율)은 93.3%를 기록했다. 서울 아파트 경매 낙찰가율은 지난해 10월 97.0%까지 오른 뒤 11월 94.9%, 12월에는 탄핵 정국 여파로 91.8%로 떨어지며 두 달 연속 감소 추세를 보였으나 올해 들어 다시 낙찰가율이 상승한 것이다.
낙찰률(경매 진행건수 대비 낙찰건수)도 지난해 말 비상계엄 이후 39.8%로 감소했으나 올해 1월에는 47.2%로 회복됐다. 이달 들어 강남 등 인기 지역을 중심으로 고가 응찰과 신건 입찰도 다시 증가하는 분위기다.
서울 강남구 대치동 은마아파트 106㎡는 지난 14일 감정가 27억 1900만원에 첫 입찰에 부쳐졌는데 5명이 응찰해 29억 8599만 9000원에 낙찰됐다. 감정가의 109.8%에 달하는 고가 낙찰이고, 2위 응찰자가 써낸 금액보다 약 2억원가량 높은 금액이다.
성동구 성수동1가 강변건영 85㎡는 이달 6일 열린 2회차 경매에서 무려 32명이 경쟁을 벌여 감정가(17억 3000만 원)의 105.2%인 18억 2000만 원 선에 낙찰됐다. 양천구 신정동 삼성쉐르빌 주상복합아파트 150㎡는 지난 17일 첫 경매에서 감정가(19억 4000만 원)보다 높은 20억 1489만 원(103.9%)에 주인을 찾았다.
지지옥션 집계에 따르면 이달 23일까지 낙찰된 서울 아파트 가운데 감정가의 100% 이상으로 고가 낙찰된 아파트의 비중은 21.36%로 작년 12월(14.41%)보다 크게 증가했다.
긴 설 연휴로 이달 서울 아파트 입찰 물건 수(경매 진행 건수)는 231건으로 지난달(279건)보다 감소했다.
다만 비아파트나 상업용 부동산 경매는 여전히 침체가 지속되는 분위기다.
1월 서울의 상가 경매 낙찰가율은 68.0%로 지난달(71.0%)보다 하락했고, 응찰자 수도 지난달 평균 1.80명에서 이달에는 1.38명으로 감소했다.
경기도의 1월 상가 낙찰가율은 지난달(53.0%)보다 낮은 48.1%로 50%에도 못 미쳤다. 이주현 지지옥션 전문위원은 ""이달 들어 강남 등 인기 지역에 투자자들이 몰리는 것은 1월 설 연휴로 입찰 물건이 감소한 것도 영향을 미쳤을 것""이라며 ""상가나 비아파트 경매는 여전히 냉랭한 편이고, 앞으로 경매 물건도 더 늘어날 것으로 예상되는 만큼 무리한 고가 낙찰은 지양하는 게 좋다""고 말했다.",소비심리
에너지경제,"[E-로컬뉴스] 칠곡군,포항시, 경북문화관광공사 소식 등",,,,,,,소비심리
한국경제,"포항시, 100억어치 지역화폐 특판",네이버뉴스,https://n.news.naver.com/mnews/article/015/0005087617?sid=102,,한국경제,"포항시, 100억어치 지역화폐 특판","포항사랑카드 10% 할인 판매
지역 소상공인 살리기 나서
경북 포항시는 다음달 3일부터 포항사랑카드 100억원어치를 10% 특별 할인 판매한다고 30일 밝혔다. 구매 희망자는 다음달 3일 0시 15분부터 모바일 앱에서 충전할 수 있다. 개인 구매 한도는 최대 50만원이며, 이번에는 지류형 상품권을 판매하지 않는다.
포항사랑카드는 지역 내 음식점 소매업 서비스업 등 2만2000여 개의 가맹점은 물론 포항형 택시 호출 플랫폼인 타보소 택시에서 사용할 수 있다. 가맹점으로 등록된 소상공인은 소비자의 방문 증가로 매출이 늘어나고 해당 매출분의 카드 수수료까지 절감이 가능하다.
포항시는 앞서 이달 초에도 포항사랑카드와 상품권 500억원어치를 10% 특별 할인 판매해 ‘완판(판매 완료)’했다. 설을 앞둔 데다 평소 할인율(7%)보다 높은 10%를 적용하면서 인기가 높았다는 설명이다.
포항시는 2017년 처음으로 지역 자금의 역외 유출을 막고 소상공인을 살리기 위해 포항사랑상품권 1300억원어치를 발행했다. 이후 시장 흐름이 디지털 화폐로 변화하는 데 대응해 2020년 카드형 포항사랑상품권인 포항사랑카드를 출시했고, 모바일 결제와 삼성페이, 교통카드 기능 적용 등을 통해 사용자 편의성을 높였다. 상품권 누적 발행액은 약 7년 만인 지난해 2월 2조원을 넘어섰다.
포항시는 이번 10% 할인 발행이 끝나면 앞으로 7% 상시 할인율을 적용해 포항사랑상품권을 지속 판매할 예정이다. 이강덕 시장은 “이번 포항사랑상품권 10% 할인 발행이 위축된 소비심리를 끌어올려 침체된 골목상권에 활력을 불어넣을 것으로 기대한다”고 말했다.
포항=하인식 기자 hais@hankyung.com",소비심리
한국경제,"포항사랑카드 100억 원, 2월3일부터 10% 특별 할인판매",네이버뉴스,https://n.news.naver.com/mnews/article/015/0005087617?sid=102,,한국경제,"포항시, 100억어치 지역화폐 특판","포항사랑카드 10% 할인 판매
지역 소상공인 살리기 나서
경북 포항시는 다음달 3일부터 포항사랑카드 100억원어치를 10% 특별 할인 판매한다고 30일 밝혔다. 구매 희망자는 다음달 3일 0시 15분부터 모바일 앱에서 충전할 수 있다. 개인 구매 한도는 최대 50만원이며, 이번에는 지류형 상품권을 판매하지 않는다.
포항사랑카드는 지역 내 음식점 소매업 서비스업 등 2만2000여 개의 가맹점은 물론 포항형 택시 호출 플랫폼인 타보소 택시에서 사용할 수 있다. 가맹점으로 등록된 소상공인은 소비자의 방문 증가로 매출이 늘어나고 해당 매출분의 카드 수수료까지 절감이 가능하다.
포항시는 앞서 이달 초에도 포항사랑카드와 상품권 500억원어치를 10% 특별 할인 판매해 ‘완판(판매 완료)’했다. 설을 앞둔 데다 평소 할인율(7%)보다 높은 10%를 적용하면서 인기가 높았다는 설명이다.
포항시는 2017년 처음으로 지역 자금의 역외 유출을 막고 소상공인을 살리기 위해 포항사랑상품권 1300억원어치를 발행했다. 이후 시장 흐름이 디지털 화폐로 변화하는 데 대응해 2020년 카드형 포항사랑상품권인 포항사랑카드를 출시했고, 모바일 결제와 삼성페이, 교통카드 기능 적용 등을 통해 사용자 편의성을 높였다. 상품권 누적 발행액은 약 7년 만인 지난해 2월 2조원을 넘어섰다.
포항시는 이번 10% 할인 발행이 끝나면 앞으로 7% 상시 할인율을 적용해 포항사랑상품권을 지속 판매할 예정이다. 이강덕 시장은 “이번 포항사랑상품권 10% 할인 발행이 위축된 소비심리를 끌어올려 침체된 골목상권에 활력을 불어넣을 것으로 기대한다”고 말했다.
포항=하인식 기자 hais@hankyung.com",소비심리
위키트리,"포항시, 2월 포항사랑카드 100억원 10% 특별 할인판매",,,,,,,소비심리
아이뉴스24,포항 사랑 카드 내달 3일부터 100억원어치 10% 특별할인 판매,네이버뉴스,https://n.news.naver.com/mnews/article/031/0000904715?sid=102,,아이뉴스24,"포항시, 2월 포항사랑카드 100억원 10% 특별 할인판매","내달 3일부터 포항사랑카드 100억원, 10% 특별 할인판매 시작
연초 10% 할인 대폭 확대 발행…골목상권 소비 촉진 및 민생경제 회복
개인 구매 한도 50만 원, 보유 한도 70만 원, 지류형은 판매하지 않아
경북 포항시는 오는 2월 3일부터 100억원 규모의 카드형·모바일 포항사랑상품권(포항사랑카드)을 10% 특별 할인판매한다고 30일 밝혔다.
앞서 시는 지난 1월 포항사랑카드 350억 원과 지류형 상품권 150억 원을 10% 할인판매해 높은 호응을 얻은 바 있다. 이에 경기 침체 극복과 지역경제 활성화를 위해 2월에도 100억 원 규모의 추가 할인판매를 추진한다.
포항사랑카드 2월 10% 할인 홍보물. [사진=포항시청]
이번 판매는 모바일 앱(iM샵)에서 2월 3일 00시 15분부터, 107개 판매 대행점에서는 영업시간 내 충전 가능하다. 개인 구매 한도는 최대 50만 원, 보유 한도는 70만 원이며, 2월에는 지류형 상품권은 판매하지 않는다.
판매 대행 금융기관은 iM뱅크, 지역 농·수협, 새마을금고, 신협, 산림조합 등이며, 자세한 정보는 포항시청 홈페이지와 모바일 앱(iM샵)에서 확인할 수 있다. 충전 전 모바일 앱에서 카드 잔액을 미리 확인하면 더욱 편리하다.
포항사랑카드는 지역 내 음식점, 소매업, 서비스업 등 2만 2000여개 가맹점과 포항형 택시 호출 플랫폼 '타보소 택시'에서도 사용 가능하다. 이를 통해 소비 촉진과 골목상권 활성화는 물론, 가맹점 수수료 절감 효과도 기대된다.
이강덕 포항시장은 ""포항사랑상품권의 10% 할인판매가 위축된 소비심리를 회복시키고, 지역 소상공인의 매출 증대에 기여할 것으로 기대된다""며 ""올해도 지속적인 정책 지원을 통해 지역경제 활성화에 최선을 다하겠다""고 말했다.",소비심리
