press,title,naver_news_text,naver_news_url,body,press_html,title_html,body_html,label
이데일리,트럼프 압력에도 美 금리 동결…한은의 선택은,네이버뉴스,https://n.news.naver.com/mnews/article/018/0005933350?sid=101,,이데일리,트럼프 압력에도 美 금리 동결…한은의 선택은,"美 1월 FOMC서 정책금리 동결…4.25~4.5%
파월 “정책기조 서둘러 조정할 필요가 없다”
한미 금리차 150bp 유지…2월 금통위로 시선
공식 성장률 전망치 발표와 함께 기준금리 결정
[이데일리 장영은 기자] 미국 연방준비제도(Fed·연준)가 새해 첫 연방공개시장위원회(FOMC)에서 정책금리를 동결했다. 제롬 파월 연준 의장이 금리 인하를 서두르지 않겠다는 뜻을 재차 밝히면서 3월 금리 인하도 확실치 않다. 시장의 시선은 이달 금융통화위원회(금통위)에서 ‘잠시 멈춤’을 선택한 한국은행의 선택으로 옮겨가고 있다.
(사진= AFP)
파월 “금리 인하 서두를 필요 없다”
연준은 28~29일(현지시간) 연방공개시장위원회(FOMC)에서 정책금리를 기존 4.25~4.50%로 동결하기로 결정했다. 지난해 9월 피벗(통화정책 방향 전환)을 시작한 이후 세차례 연속 금리 인하를 결정한 연준은 이번에 처음으로 동결로 의견을 모았다. 이번 결정은 만장일치였다.
연준은 성명서에서 현 경기 상황에 대해 “최근 지표에 따르면 경제활동이 견조한 속도로 계속 확대되고 있는 것으로 보인다”며 “실업률은 최근 몇달간 낮은 수준에서 안정화됐고, 고용시장은 견고한 상태를 유지하고 있지만, 인플레이션은 다소 높은(somewhat elevated) 수준을 유지하고 있다”고 평가했다.
파월 의장은 “경제가 계속 강세를 유지하고 인플레이션이 2%를 향해 꾸준히 이동하는 것이 아니라면 우리는 더 오랫동안 정책적 인내를 유지할 수 있다”며 “우리는 정책기조를 서둘러 조정할 필요가 없다”고 밝혔다.
이어 3월 회의에서 금리를 인하할 가능성에 대한 질문에는 “(인플레이션이 둔화하는) 연속적인 수치”를 보고 싶다고 강조했다. 인플레이션이 둔화하는 증거가 명확해지지 않는다면 금리를 재차 동결할 수도 있다는 뜻으로 해석된다.
파월 의장은 도널드 트럼프 대통의 금리 인하 압박에 대해서는 말을 아꼈다. 이날 기자회견에서 트럼프 대통령이 최근 스위스 다보스에서 열린 세계경제포럼에서 “연준에 즉각적인 금리 인하를 요구하겠다”고 한 것에 대한 입장을 묻자 “그렇게(코멘트) 하는 것은 적절하지 않다”면서 “트럼프 대통령과 접촉한 적도 없다”고 답했다.
반면, 트럼프 대통령은 FOMC 이후 자신의 소셜미디어 트루스 소셜을 통해 “제롬 파월 연방준비제도 의장과 연준이 인플레이션으로 만든 문제를 막는 데 실패했다”고 비판하고 나섰다.
시장은 파월 의장의 기자회견 이후 3월 금리 동결 가능성을 올려 잡았다. 우리 시간으로 오전 10시 기준 시카고상품거래소(CME) 패드워치툴에 따르면 연방기금금리(FFR) 선물시장 참가자들이 보는 3월 정책금리 동결 가능성은 77%로, 한달 전(50%)과 1주일 전(75.2%)에 비해 높아졌다. 25bp(1bp=0.01%포인트) 인하 가능성은 23%로, 한달 전(45.3%)의 절반 수준으로 낮아졌다.
잠시 멈춘 한은, 2월에 금리인하 재개할까
연준의 이번 결정으로 한미 금리 역전폭은 150bp를 유지했다. 코로나19 대유행 시기 미국이 치솟는 인플레이션을 잡기 위해 정책금리를 가파르게 올리면서 2022년 7월 미국의 금리가 우리나라보다 높아진 이후 2년 반 동안 금리 역전 상태가 지속되고 있다.
한미 금리 역전폭은 최대 200bp까지 벌어졌다 다소 줄어들긴 했으나, 연준이 금리 인하를 서두르지 않겠다는 뜻을 재차 밝히면서 한은에는 다소 부담이 되고 있다. 미국보다 빠르게 기준금리를 내릴 경우 역전폭이 커지면서 외국인 자금 유출과 외환시장 변동성 확대가 우려되기 때문이다.
국내 상황만 놓고 보면 금리 인하 필요성이 증대되고 있다. 한은은 지난 23일 우리나라의 지난해 국내총생산(GDP)이 전년대비 2.0%(속보치) 증가한 것으로 집계됐다고 밝혔다. 비상계엄 이후 경제 심리 냉각으로 소비와 건설투자가 당초 예상보다 부진하게 나오면서 지난해 11월 전망치(2.2%)를 밑돌았으며, 지난 20일 발표한 경기상황평가에서 제시한 전망치인 2.0~2.1%의 하단에 간신히 걸쳤다. 여기에 작년 4분기 전기대비 성장률이 0.1%를 기록하면서 2개 분기 연속 0.1%의 낮은 성장률을 기록하는 등 경기 하강 우려가 제기되고 있다.
이에 시장에선 한은이 다음달 수정경제전망을 제시하면서 기준금리를 25bp 인하할 것이란 의견이 대세다. 이달 금통위에선 1400원대 후반에서 등락하는 환율과 미 신정부 정책 변화 등의 대외 요인을 고려해 금리 인하를 잠시 멈췄지만, 수출 부진과 내수 위축이 우려되는 국내 경기 상황을 감안하면 다음달엔 인하를 재개할 것이란 분석이다. 이창용 한은 총재도 금통위 이후 기자회견에서 “모든 금통위원들이 경기 상황만 보면 지금 금리를 내리는 것이 당연한 상황이라고 봤다”고 말했다.
반면, 다음달 인하도 쉽지 않다는 목소리도 작지 않다. △트럼프 2기 정책 리스크 △외환시장 변동성 확대 △금리 인하 여력을 고려했을 때 한은이 신중할 수밖에 없다는 이유에서다. 김진일 고려대 교수는 “금통위원들의 3개월 내 금리전망 기간에는 4월 금통위까지 포함된다”며 “현재 국내외 상황과 통화정책의 효과 등을 고려했을 때 금리 인하를 쉽게 결정할 수 있는 상황은 아니다”라고 말했다.",소비심리
이데일리,트럼프 압박에도 연준 '금리 동결'…한은도 '속도 조절',네이버뉴스,https://n.news.naver.com/mnews/article/018/0005933350?sid=101,,이데일리,트럼프 압력에도 美 금리 동결…한은의 선택은,"美 1월 FOMC서 정책금리 동결…4.25~4.5%
파월 “정책기조 서둘러 조정할 필요가 없다”
한미 금리차 150bp 유지…2월 금통위로 시선
공식 성장률 전망치 발표와 함께 기준금리 결정
[이데일리 장영은 기자] 미국 연방준비제도(Fed·연준)가 새해 첫 연방공개시장위원회(FOMC)에서 정책금리를 동결했다. 제롬 파월 연준 의장이 금리 인하를 서두르지 않겠다는 뜻을 재차 밝히면서 3월 금리 인하도 확실치 않다. 시장의 시선은 이달 금융통화위원회(금통위)에서 ‘잠시 멈춤’을 선택한 한국은행의 선택으로 옮겨가고 있다.
(사진= AFP)
파월 “금리 인하 서두를 필요 없다”
연준은 28~29일(현지시간) 연방공개시장위원회(FOMC)에서 정책금리를 기존 4.25~4.50%로 동결하기로 결정했다. 지난해 9월 피벗(통화정책 방향 전환)을 시작한 이후 세차례 연속 금리 인하를 결정한 연준은 이번에 처음으로 동결로 의견을 모았다. 이번 결정은 만장일치였다.
연준은 성명서에서 현 경기 상황에 대해 “최근 지표에 따르면 경제활동이 견조한 속도로 계속 확대되고 있는 것으로 보인다”며 “실업률은 최근 몇달간 낮은 수준에서 안정화됐고, 고용시장은 견고한 상태를 유지하고 있지만, 인플레이션은 다소 높은(somewhat elevated) 수준을 유지하고 있다”고 평가했다.
파월 의장은 “경제가 계속 강세를 유지하고 인플레이션이 2%를 향해 꾸준히 이동하는 것이 아니라면 우리는 더 오랫동안 정책적 인내를 유지할 수 있다”며 “우리는 정책기조를 서둘러 조정할 필요가 없다”고 밝혔다.
이어 3월 회의에서 금리를 인하할 가능성에 대한 질문에는 “(인플레이션이 둔화하는) 연속적인 수치”를 보고 싶다고 강조했다. 인플레이션이 둔화하는 증거가 명확해지지 않는다면 금리를 재차 동결할 수도 있다는 뜻으로 해석된다.
파월 의장은 도널드 트럼프 대통의 금리 인하 압박에 대해서는 말을 아꼈다. 이날 기자회견에서 트럼프 대통령이 최근 스위스 다보스에서 열린 세계경제포럼에서 “연준에 즉각적인 금리 인하를 요구하겠다”고 한 것에 대한 입장을 묻자 “그렇게(코멘트) 하는 것은 적절하지 않다”면서 “트럼프 대통령과 접촉한 적도 없다”고 답했다.
반면, 트럼프 대통령은 FOMC 이후 자신의 소셜미디어 트루스 소셜을 통해 “제롬 파월 연방준비제도 의장과 연준이 인플레이션으로 만든 문제를 막는 데 실패했다”고 비판하고 나섰다.
시장은 파월 의장의 기자회견 이후 3월 금리 동결 가능성을 올려 잡았다. 우리 시간으로 오전 10시 기준 시카고상품거래소(CME) 패드워치툴에 따르면 연방기금금리(FFR) 선물시장 참가자들이 보는 3월 정책금리 동결 가능성은 77%로, 한달 전(50%)과 1주일 전(75.2%)에 비해 높아졌다. 25bp(1bp=0.01%포인트) 인하 가능성은 23%로, 한달 전(45.3%)의 절반 수준으로 낮아졌다.
잠시 멈춘 한은, 2월에 금리인하 재개할까
연준의 이번 결정으로 한미 금리 역전폭은 150bp를 유지했다. 코로나19 대유행 시기 미국이 치솟는 인플레이션을 잡기 위해 정책금리를 가파르게 올리면서 2022년 7월 미국의 금리가 우리나라보다 높아진 이후 2년 반 동안 금리 역전 상태가 지속되고 있다.
한미 금리 역전폭은 최대 200bp까지 벌어졌다 다소 줄어들긴 했으나, 연준이 금리 인하를 서두르지 않겠다는 뜻을 재차 밝히면서 한은에는 다소 부담이 되고 있다. 미국보다 빠르게 기준금리를 내릴 경우 역전폭이 커지면서 외국인 자금 유출과 외환시장 변동성 확대가 우려되기 때문이다.
국내 상황만 놓고 보면 금리 인하 필요성이 증대되고 있다. 한은은 지난 23일 우리나라의 지난해 국내총생산(GDP)이 전년대비 2.0%(속보치) 증가한 것으로 집계됐다고 밝혔다. 비상계엄 이후 경제 심리 냉각으로 소비와 건설투자가 당초 예상보다 부진하게 나오면서 지난해 11월 전망치(2.2%)를 밑돌았으며, 지난 20일 발표한 경기상황평가에서 제시한 전망치인 2.0~2.1%의 하단에 간신히 걸쳤다. 여기에 작년 4분기 전기대비 성장률이 0.1%를 기록하면서 2개 분기 연속 0.1%의 낮은 성장률을 기록하는 등 경기 하강 우려가 제기되고 있다.
이에 시장에선 한은이 다음달 수정경제전망을 제시하면서 기준금리를 25bp 인하할 것이란 의견이 대세다. 이달 금통위에선 1400원대 후반에서 등락하는 환율과 미 신정부 정책 변화 등의 대외 요인을 고려해 금리 인하를 잠시 멈췄지만, 수출 부진과 내수 위축이 우려되는 국내 경기 상황을 감안하면 다음달엔 인하를 재개할 것이란 분석이다. 이창용 한은 총재도 금통위 이후 기자회견에서 “모든 금통위원들이 경기 상황만 보면 지금 금리를 내리는 것이 당연한 상황이라고 봤다”고 말했다.
반면, 다음달 인하도 쉽지 않다는 목소리도 작지 않다. △트럼프 2기 정책 리스크 △외환시장 변동성 확대 △금리 인하 여력을 고려했을 때 한은이 신중할 수밖에 없다는 이유에서다. 김진일 고려대 교수는 “금통위원들의 3개월 내 금리전망 기간에는 4월 금통위까지 포함된다”며 “현재 국내외 상황과 통화정책의 효과 등을 고려했을 때 금리 인하를 쉽게 결정할 수 있는 상황은 아니다”라고 말했다.",소비심리
뉴스토마토,정국혼란에 1%대 저성장까지…2월 금리인하 ‘유력’,,,,,,,소비심리
연합뉴스,계엄 충격에 금융불안지수 레고랜드 사태 수준으로 급등,네이버뉴스,https://n.news.naver.com/mnews/article/001/0015183600?sid=101,,연합뉴스,계엄 충격에 금융불안지수 레고랜드 사태 수준으로 급등,"지난달 19.2로 1.1p↑…野 임광현 ""정치 불확실성 조속히 끝내야""
JP모건 올해 성장률 1.2% 전망…0.1%p 하향
[연합뉴스 자료사진. 재판매 및 DB 금지]
(서울=연합뉴스) 한지훈 기자 = 지난해 12월 비상계엄 충격에 금융불안지수(FSI)가 레고랜드 사태 당시 수준으로 치솟았던 것으로 나타났다.
국내 정치 불확실성이 금융 불안을 가중하고 실물 경제에 악영향을 미친 사실이 구체적인 수치로 드러난 것이다.
30일 국회 기획재정위원회 소속 더불어민주당 임광현 의원이 한국은행에서 제출받은 자료에 따르면, 지난해 12월 금융불안지수는 전월보다 1.1포인트(p) 오른 19.2로 연중 최고치를 기록했다.
이는 레고랜드 사태로 채권 시장에 대혼란이 벌어진 2022년 9월(19.7) 때와 비슷했다.
글로벌 금융위기 때인 2008년 11월(76.9), 코로나19 팬데믹 때인 2020년 4월(25.1)보다 낮지만, 박근혜 전 대통령 탄핵 때인 2016년 12월(9.5)의 두 배 수준이었다.
이 지수는 한은이 금융과 실물 부문에서 나타나는 금융불안 가능성을 판단하기 위해 작성하는 종합지수로, 금융시장, 대외, 실물, 은행, 비은행 등 5개 부문별 20개 세부 지표를 반영한다.
여기에는 코스피와 환율 변동성뿐 아니라 신용부도스와프(CDS) 스프레드, 소비자심리지수, 교역 규모 감소율, 대출 연체율 등이 두루 포함된다.
지난달 금융불안지수 급등에는 주가 하락, 신용 스프레드 상승, 경제심리지수 하락 등이 복합적으로 영향을 미친 것으로 한은은 분석했다.
이런 가운데 성장 전망은 계속 추락하기도 했다.
국제금융센터에 따르면, 씨티는 올해 한국의 실질 국내총생산(GDP) 성장률 전망치를 최근 1.5%에서 1.4%로 하향 조정했다. JP모건도 1.3%에서 1.2%로 낮췄다.
리서치 전문회사인 캐피털 이코노믹스(CE)는 가장 낮은 1.1%를 제시했다.
한은은 금융불안지수 12 이상을 '주의단계', 24 이상을 '위험단계'로 각각 분류하는데, 현 수준은 주의단계에 해당한다.
임 의원은 특히 윤석열 대통령이 취임한 2022년 5월(10.2)을 제외하고는 윤 대통령 임기 내내 지수가 12를 웃돌았으며, 평균 지수가 18.5에 달했다고 지적했다.
과거 박근혜 정부 때는 평균 지수가 11.1, 문재인 정부 때는 7.1에 그쳤다고 그는 부연했다.
임 의원은 ""계엄 사태가 금융시장과 실물경제에 미친 충격이 구체적인 지표로 처음 확인됐다""며 ""정치 불확실성을 조속히 끝내고, 내수 활성화와 민생 안정을 위한 추가경정예산안 편성에도 정부가 적극 협조해야 한다""고 강조했다.
hanjh@yna.co.kr",소비심리
연합뉴스,"윤석열 정부 내내 높았던 금융불안지수, 계엄 때 최고치",네이버뉴스,https://n.news.naver.com/mnews/article/001/0015183600?sid=101,,연합뉴스,계엄 충격에 금융불안지수 레고랜드 사태 수준으로 급등,"지난달 19.2로 1.1p↑…野 임광현 ""정치 불확실성 조속히 끝내야""
JP모건 올해 성장률 1.2% 전망…0.1%p 하향
[연합뉴스 자료사진. 재판매 및 DB 금지]
(서울=연합뉴스) 한지훈 기자 = 지난해 12월 비상계엄 충격에 금융불안지수(FSI)가 레고랜드 사태 당시 수준으로 치솟았던 것으로 나타났다.
국내 정치 불확실성이 금융 불안을 가중하고 실물 경제에 악영향을 미친 사실이 구체적인 수치로 드러난 것이다.
30일 국회 기획재정위원회 소속 더불어민주당 임광현 의원이 한국은행에서 제출받은 자료에 따르면, 지난해 12월 금융불안지수는 전월보다 1.1포인트(p) 오른 19.2로 연중 최고치를 기록했다.
이는 레고랜드 사태로 채권 시장에 대혼란이 벌어진 2022년 9월(19.7) 때와 비슷했다.
글로벌 금융위기 때인 2008년 11월(76.9), 코로나19 팬데믹 때인 2020년 4월(25.1)보다 낮지만, 박근혜 전 대통령 탄핵 때인 2016년 12월(9.5)의 두 배 수준이었다.
이 지수는 한은이 금융과 실물 부문에서 나타나는 금융불안 가능성을 판단하기 위해 작성하는 종합지수로, 금융시장, 대외, 실물, 은행, 비은행 등 5개 부문별 20개 세부 지표를 반영한다.
여기에는 코스피와 환율 변동성뿐 아니라 신용부도스와프(CDS) 스프레드, 소비자심리지수, 교역 규모 감소율, 대출 연체율 등이 두루 포함된다.
지난달 금융불안지수 급등에는 주가 하락, 신용 스프레드 상승, 경제심리지수 하락 등이 복합적으로 영향을 미친 것으로 한은은 분석했다.
이런 가운데 성장 전망은 계속 추락하기도 했다.
국제금융센터에 따르면, 씨티는 올해 한국의 실질 국내총생산(GDP) 성장률 전망치를 최근 1.5%에서 1.4%로 하향 조정했다. JP모건도 1.3%에서 1.2%로 낮췄다.
리서치 전문회사인 캐피털 이코노믹스(CE)는 가장 낮은 1.1%를 제시했다.
한은은 금융불안지수 12 이상을 '주의단계', 24 이상을 '위험단계'로 각각 분류하는데, 현 수준은 주의단계에 해당한다.
임 의원은 특히 윤석열 대통령이 취임한 2022년 5월(10.2)을 제외하고는 윤 대통령 임기 내내 지수가 12를 웃돌았으며, 평균 지수가 18.5에 달했다고 지적했다.
과거 박근혜 정부 때는 평균 지수가 11.1, 문재인 정부 때는 7.1에 그쳤다고 그는 부연했다.
임 의원은 ""계엄 사태가 금융시장과 실물경제에 미친 충격이 구체적인 지표로 처음 확인됐다""며 ""정치 불확실성을 조속히 끝내고, 내수 활성화와 민생 안정을 위한 추가경정예산안 편성에도 정부가 적극 협조해야 한다""고 강조했다.
hanjh@yna.co.kr",소비심리
민중의소리,"“12월 금융불안지수, 계엄 충격에 치솟아”…‘레고랜드 사태’ 수준",,,,,,,소비심리
헤럴드경제,"계엄·탄핵 정국에 금융불안지수, `레고랜드 사태` 수준 상승",네이버뉴스,https://n.news.naver.com/mnews/article/016/0002421730?sid=101,,헤럴드경제,"“12월 금융불안지수, 계엄 충격에 치솟아”…‘레고랜드 사태’ 수준","주가·경제심리지수 하락 등 반영
[헤럴드경제=양영경 기자] 지난해 12월 금융불안지수(FSI)가 레고랜드 사태 당시 수준으로 치솟았던 것으로 나타났다. 비상계엄·탄핵사태 등에 따른 국내 정치 불확실성이 금융 불안을 키우고 실물 경제에 악영향을 미쳤다는 사실이 구체적인 수치로 드러났다는 평가가 나온다.
30일 국회 기획재정위원회 소속 더불어민주당 임광현 의원이 한국은행을 통해 확보한 자료에 따르면 지난해 12월 금융불안지수는 전월보다 1.1포인트 오른 19.2로 연중 최고치를 기록했다. 이는 레고랜드 사태로 채권 시장이 패닉에 빠졌던 2022년 9월(19.7)과 비슷한 수준이다.
서울 중구 하나은행 딜링룸.  [연합]
글로벌 금융위기 때인 2008년 11월(76.9)과 코로나19 팬데믹 때인 2020년 4월(25.1)보다 낮지만, 박근혜 전 대통령 탄핵 때인 2016년 12월(9.5)의 두 배 수준으로 치솟았다.
금융불안지수는 한은이 금융과 실물 부문에서 나타나는 금융불안 가능성을 판단하기 위해 작성하는 종합지수다. 금융시장, 대외, 실물, 은행, 비은행 등 5개 부문별 20개 세부 지표를 반영한다. 코스피와 환율 변동성뿐 아니라 신용부도스와프(CDS) 스프레드, 소비자심리지수, 교역 규모 감소율, 대출 연체율 등이 두루 포함된다.
한은은 금융불안지수 12 이상을 ‘주의단계’, 24 이상을 ‘위험단계’로 각각 분류하는데 현 수준은 주의단계에 해당한다. 지난달 금융불안지수에는 주가 하락, 신용 스프레드 상승, 경제심리지수 하락 등이 반영된 것으로 한은은 분석했다.
임 의원은 “계엄 사태가 금융시장과 실물경제에 미친 충격이 구체적인 지표로 처음 확인됐다”며 “정치 불확실성을 조속히 끝내고, 내수 활성화와 민생 안정을 위한 추가경정예산안 편성에도 정부가 적극 협조해야 한다”고 말했다.",소비심리
디지털타임스,계엄 충격에 금융불안지수 연중 최고치…'레고랜드 사태' 수준,네이버뉴스,https://n.news.naver.com/mnews/article/029/0002932117?sid=101,,디지털타임스,"계엄·탄핵 정국에 금융불안지수, `레고랜드 사태` 수준 상승","작년 12월 금융불안지수(FSI)가 레고랜드 사태 당시 수준으로 치솟았던 것으로 나타났다. 비상계엄과 탄핵정국 등 국내 정치 불확실성이 금융 시장과 실물경제에 악영향을 미친 것이다.
30일 국회 기획재정위원회 소속 더불어민주당 임광현 의원이 한국은행에서 제출받은 자료에 따르면, 지난해 12월 금융불안지수는 전월보다 1.1포인트(p) 오른 19.2로 연중 최고치를 기록했다.
이는 레고랜드 사태로 채권 시장에 대혼란이 벌어진 2022년 9월(19.7) 때와 비슷했다.
글로벌 금융위기 때인 2008년 11월(76.9), 코로나19 팬데믹 때인 2020년 4월(25.1)보다 낮지만, 박근혜 전 대통령 탄핵 때인 2016년 12월(9.5)의 두 배 수준이다.
이 지수는 한은이 금융과 실물 부문에서 나타나는 금융불안 가능성을 판단하기 위해 작성하는 종합지수로, 금융시장, 대외, 실물, 은행, 비은행 등 5개 부문별 20개 세부 지표를 반영한다.
여기에는 코스피와 환율 변동성뿐 아니라 신용부도스와프(CDS) 스프레드, 소비자심리지수, 교역 규모 감소율, 대출 연체율 등이 두루 포함된다.
지난달 금융불안지수 급등에는 주가 하락, 신용 스프레드 상승, 경제심리지수 하락 등이 복합적으로 영향을 미친 것으로 한은은 분석했다.
한은은 금융불안지수 12 이상을 '주의단계', 24 이상을 '위험단계'로 각각 분류하는데, 현 수준은 주의단계에 해당한다.
한국은행 전경.  한은 제공",소비심리
