press,title,naver_news_text,naver_news_url,body,press_html,title_html,body_html,label
세계일보,‘포항 원팀’으로 이차전지산업글로벌경쟁력높인다,네이버뉴스,https://n.news.naver.com/mnews/article/022/0003990620?sid=102,,세계일보,‘포항 원팀’으로 이차전지 산업 글로벌 경쟁력 높인다,"포항 이차전지산업 기업협의회 정기총회, 성과 공유 및 기업 간 네트워크 구축
유공자 표창으로 지역 이차전지 산업 발전 기여자 격려
포항시, 혁신적인 기술 개발과 지속 가능한 이차전지 산업 생태계 구축에 총력
포항시는 지난달 28일 포스코국제관에서 ‘포항 이차전지산업 기업협의회 정기총회’를 개최했다고 1일 밝혔다.
이번 총회는 올 한 해 활동 및 성과를 공유하며 이차전지 산업 발전 방향을 모색하고, 기업 간 협력 강화를 위한 네트워크를 구축하는 것을 목적으로 열렸다.
포항시는 지난달 28일 포스코국제관 열린 ‘포항 이차전지산업 기업협의회 정기총회’에서 이차전지 산업의 지속 가능한 성장과 발전에 기여한 유공자에게 표창을 수여했다. (왼쪽부터 김병훈 에코프로머티리얼즈 대표(기업협의회 회장), 안현준 뉴테크엘아이비 과장, 김지훈 동국산업 차장, 이상혁 리텍 대표, 이은솔 다원화학 대표, 박재홍 피엠그로우 대표. 김재우 비에스원 대표). 포항시 제공
총회에는 이강덕 포항시장을 비롯 이재진 포항시의회 부의장, 김병훈 기업협의회 회장, 장미정 경북도 미래첨단산업과장, 곽진환 선린대 총장, 김형락 포항대 부총장, 장세인 한국폴리텍대학 포항캠퍼스 학장 등 산·학·연·관 관계자 70여 명이 참석했다.
기업협의회 성원 보고를 시작으로 이날 총회는 결산 및 감사 보고, 주요 안건 심의와 기업협의회-선린대 간 산학 협력 MOU 체결, 주요 활동 실적 보고, 유공자 표창 등으로 진행됐다.
기업협의회는 2024년 한 해 기업 간의 협력과 정보 공유로 회원사들의 경쟁력을 높이고, 이차전지 산업의 인재 양성과 기술 혁신을 촉진하는 데 중점을 두며 여러 가지 중요한 성과를 달성한 바 있다.
기업협의회 소개책자를 발간해 회원사들의 비즈니스 모델과 성과를 홍보하고, 인터배터리 2024, 인터배터리 유럽 2024, 세계한인경제인대회 포항시 홍보관에 참여해 회원사들의 제품을 전시함으로써 산업 내에서의 입지를 강화하고 바이어와의 네트워킹 기회를 마련했다.
협의회-교육기관 간 업무협약으로 흥해공업고등학교 협약형 특성화고, 포스텍 배터리 특성화대학원, 한동대 글로컬 대학 선정 등에 기여하는 등 인재 양성과 기술 개발을 촉진하는 데 기여했다.
에코프로 이차전지 오픈이노베이션 참여, 동국산업 니켈도금강판 공장 준공, 포항시-㈜엘케이앤텍 간 이차전지 부품사업 MOU 체결 등 각 기업들의 활동도 활발히 추진하며 지역 이차전지산업 발전에 노력해 왔다.
포항시는 이날 신기술 개발, 투자 유치, 일자리 창출 등 이차전지 산업의 지속 가능한 성장과 발전에 기여한 ㈜다원화학, ㈜비에스원, ㈜리텍, ㈜피엠그로우, 동국산업㈜, ㈜뉴테크엘아이비 대표 및 직원 6명에게 유공자 표창패를 수여하며, 회원사들이 지역 산업 발전에 미친 긍정적인 영향을 높이 평가했다.
이강덕 포항시장은 “이차전지 기업협의회는 2050 전지보국 실현을 위해 포항원팀으로 이차전지 산업의 발전을 이끌어가고 있다”며 “지역 내 모든 기업과 연구기관이 협력해 혁신적인 기술 개발과 지속 가능한 생태계를 구축, 글로벌시장에서 경쟁력을 갖춘 선도 도시로 나아가겠다”고 말했다.",산업경쟁력
세계일보,'포항 원팀'으로 이차전지산업글로벌경쟁력높인다,네이버뉴스,https://n.news.naver.com/mnews/article/022/0003990620?sid=102,,세계일보,‘포항 원팀’으로 이차전지 산업 글로벌 경쟁력 높인다,"포항 이차전지산업 기업협의회 정기총회, 성과 공유 및 기업 간 네트워크 구축
유공자 표창으로 지역 이차전지 산업 발전 기여자 격려
포항시, 혁신적인 기술 개발과 지속 가능한 이차전지 산업 생태계 구축에 총력
포항시는 지난달 28일 포스코국제관에서 ‘포항 이차전지산업 기업협의회 정기총회’를 개최했다고 1일 밝혔다.
이번 총회는 올 한 해 활동 및 성과를 공유하며 이차전지 산업 발전 방향을 모색하고, 기업 간 협력 강화를 위한 네트워크를 구축하는 것을 목적으로 열렸다.
포항시는 지난달 28일 포스코국제관 열린 ‘포항 이차전지산업 기업협의회 정기총회’에서 이차전지 산업의 지속 가능한 성장과 발전에 기여한 유공자에게 표창을 수여했다. (왼쪽부터 김병훈 에코프로머티리얼즈 대표(기업협의회 회장), 안현준 뉴테크엘아이비 과장, 김지훈 동국산업 차장, 이상혁 리텍 대표, 이은솔 다원화학 대표, 박재홍 피엠그로우 대표. 김재우 비에스원 대표). 포항시 제공
총회에는 이강덕 포항시장을 비롯 이재진 포항시의회 부의장, 김병훈 기업협의회 회장, 장미정 경북도 미래첨단산업과장, 곽진환 선린대 총장, 김형락 포항대 부총장, 장세인 한국폴리텍대학 포항캠퍼스 학장 등 산·학·연·관 관계자 70여 명이 참석했다.
기업협의회 성원 보고를 시작으로 이날 총회는 결산 및 감사 보고, 주요 안건 심의와 기업협의회-선린대 간 산학 협력 MOU 체결, 주요 활동 실적 보고, 유공자 표창 등으로 진행됐다.
기업협의회는 2024년 한 해 기업 간의 협력과 정보 공유로 회원사들의 경쟁력을 높이고, 이차전지 산업의 인재 양성과 기술 혁신을 촉진하는 데 중점을 두며 여러 가지 중요한 성과를 달성한 바 있다.
기업협의회 소개책자를 발간해 회원사들의 비즈니스 모델과 성과를 홍보하고, 인터배터리 2024, 인터배터리 유럽 2024, 세계한인경제인대회 포항시 홍보관에 참여해 회원사들의 제품을 전시함으로써 산업 내에서의 입지를 강화하고 바이어와의 네트워킹 기회를 마련했다.
협의회-교육기관 간 업무협약으로 흥해공업고등학교 협약형 특성화고, 포스텍 배터리 특성화대학원, 한동대 글로컬 대학 선정 등에 기여하는 등 인재 양성과 기술 개발을 촉진하는 데 기여했다.
에코프로 이차전지 오픈이노베이션 참여, 동국산업 니켈도금강판 공장 준공, 포항시-㈜엘케이앤텍 간 이차전지 부품사업 MOU 체결 등 각 기업들의 활동도 활발히 추진하며 지역 이차전지산업 발전에 노력해 왔다.
포항시는 이날 신기술 개발, 투자 유치, 일자리 창출 등 이차전지 산업의 지속 가능한 성장과 발전에 기여한 ㈜다원화학, ㈜비에스원, ㈜리텍, ㈜피엠그로우, 동국산업㈜, ㈜뉴테크엘아이비 대표 및 직원 6명에게 유공자 표창패를 수여하며, 회원사들이 지역 산업 발전에 미친 긍정적인 영향을 높이 평가했다.
이강덕 포항시장은 “이차전지 기업협의회는 2050 전지보국 실현을 위해 포항원팀으로 이차전지 산업의 발전을 이끌어가고 있다”며 “지역 내 모든 기업과 연구기관이 협력해 혁신적인 기술 개발과 지속 가능한 생태계를 구축, 글로벌시장에서 경쟁력을 갖춘 선도 도시로 나아가겠다”고 말했다.",산업경쟁력
대경일보,'포항 원팀'으로 이차전지산업글로벌경쟁력높인다!,,,,,,,산업경쟁력
투어코리아뉴스,"선린대-포항 이차전지산업기업협의회, 산ㆍ학 협력 체결",,,,,,,산업경쟁력
한국경제,"서울 양재 일대 'AI 특구' 지정…""첨단산업생태계 마련""",네이버뉴스,https://n.news.naver.com/mnews/article/015/0005063783?sid=101,,한국경제,"서울 양재 일대 'AI 특구' 지정…""첨단산업 생태계 마련""","사진=서울시
서울 서초구 양재동 일대 약 40만㎡가 '인공지능(AI) 특구'로 지정됐다.
서울시는 지난달 28일 열린 중소벤처기업부 지역특화발전특구위원회에서 '양재 AI 미래융합혁신특구'에 대한 심의가 통과됐다고 1일 밝혔다. 지역특화발전특구는 전국 기초자치단체가 지역 특화사업을 추진하려는 경우, 관련 규제 특례를 적용해주는 제도다.
양재 일대는 삼성전자, 현대, LG, KT 등 대기업 연구소와 300여개 중소기업 부설 연구소가 자생적으로 집적된 지역이다. 이 지역은 앞으로 특허법, 출입국관리법 등 6개 규제 특례가 적용된다. 특허 출원 우선 심사, 해외 우수인력 비자 발급 조건 완화 및 체류 기간 연장 등 혜택이 주어진다.
인공지능 전문 인재 양성, 스타트업 창업과 기술혁신 지원 등 특구 활성화를 위한 15개 특화 사업도 5년간 추진된다. AI 스타트업 펀드 조성 및 융자도 지원받는다.
시는 지난 5월 개관한 연면적 1만㎡ 규모 서울AI허브 외에 2030년까지 'AI 서울 테크시티'를 조성하고, 더케이호텔 재개발과 관련해 공공기여분 토지 5만㎡를 추가로 확보할 예정이다.
카이스트(KAIST) AI 대학원 등  국내외 산·학·연 협력을 통해 인재를 양성하고, 구글, 마이크로소프트 등 글로벌 빅테크 기업과 캐나다 밀라, 독일 사이버밸리 등 연구기관과의 협력도 확대하기로 했다.
이해우 서울시 경제실장은 ""자본과 글로벌 인재, 기업이 모여드는 세계적 수준의 AI 기반 첨단산업 생태계를 조성하기 위한 초석을 다졌다""며 ""대한민국 AI 경쟁력 도약을 위해 서울과 양재가 구심점이 될 수 있도록 하겠다""고 말했다.",산업경쟁력
뉴시스,"광주테크노파크 메디헬스케어센터,산업통상자원부 장관상",네이버뉴스,https://n.news.naver.com/mnews/article/003/0012934101?sid=102,,뉴시스,"광주테크노파크 메디헬스케어센터, 산업통상자원부 장관상","2023년말 기준 기업수 500개, 매출 1조3206억원, 고용 4710명
[광주=뉴시스]광주테크노파크 메디헬스케어센터, 산업통상자원부 장관상
[광주=뉴시스] 배상현 기자 = 광주테크노파크는 메디헬스케어센터가  최근 산업통상자원부 주최로 열린 ‘2024년 바이오산업의 날’에서 지역바이오산업 진흥 및 기업 경쟁력강화에 기여한 공로로 우수바이오센터에 선정돼 산업부 장관상을 수상했다고 1일 밝혔다.
광주테크노파크 메디헬스케어센터는 올해 산자부의 산업혁신기반구축사업 과제인 ‘골대체융합의료기기 실증기반구축사업’선정돼 사업을 추진 중이며, 치과, 정형외과, 안과 및 기능성화장품 사업까지 기업 지원을 위해 10개가 넘는 사업을 지원하면서 지역경제활성화에 기여한 바를 인정받았다.
지난 2002년 당시 광주지역 의료산업은 매출액 2억원, 고용인원 22명, 2개사에 불과했던 관련 기업이 광주테크노파크 타이타늄특수합금센터를 시작으로 현재 메디헬스케어센터가 의료 산업의 성장을 위해 꾸준히 기업을 육성해 현재는 치과, 정형외과, 안과, 바이오, 기능성화장품 등의 인프라를 구축했다.
이를 통해 비R&D 기업지원과 R&D사업, 기반구축사업 유치 등을 통해 2023년말 기준 매출  1조3206억원, 고용 4,710명, 관련기업은 500개사로 급격히 성장했으며  산업육성을 통한 지역 경제활성화에 크게 기여한 것으로 평을 받고 있다.
광주테크노파크 김영집 원장은 ""K-바이오는 세계 2위의 바이오의약품 제조경쟁력을 가지는 우리 주력 브랜드로 자리 잡았다""며 ""올해 바이오 수출도 150억 달러를 넘을 것으로 예상된다. 앞으로도 광주지역이 경쟁력을 갖는 생체의료 중심의 인체이식형 의료기기를 중심으로 미래 주력산업으로 성장할 수 있도록 아낌없이 지원하겠다""고 말했다.",산업경쟁력
뉴시스,광주TP 메디헬스케어센터 ‘바이오산업기여’ 장관상,네이버뉴스,https://n.news.naver.com/mnews/article/003/0012934101?sid=102,,뉴시스,"광주테크노파크 메디헬스케어센터, 산업통상자원부 장관상","2023년말 기준 기업수 500개, 매출 1조3206억원, 고용 4710명
[광주=뉴시스]광주테크노파크 메디헬스케어센터, 산업통상자원부 장관상
[광주=뉴시스] 배상현 기자 = 광주테크노파크는 메디헬스케어센터가  최근 산업통상자원부 주최로 열린 ‘2024년 바이오산업의 날’에서 지역바이오산업 진흥 및 기업 경쟁력강화에 기여한 공로로 우수바이오센터에 선정돼 산업부 장관상을 수상했다고 1일 밝혔다.
광주테크노파크 메디헬스케어센터는 올해 산자부의 산업혁신기반구축사업 과제인 ‘골대체융합의료기기 실증기반구축사업’선정돼 사업을 추진 중이며, 치과, 정형외과, 안과 및 기능성화장품 사업까지 기업 지원을 위해 10개가 넘는 사업을 지원하면서 지역경제활성화에 기여한 바를 인정받았다.
지난 2002년 당시 광주지역 의료산업은 매출액 2억원, 고용인원 22명, 2개사에 불과했던 관련 기업이 광주테크노파크 타이타늄특수합금센터를 시작으로 현재 메디헬스케어센터가 의료 산업의 성장을 위해 꾸준히 기업을 육성해 현재는 치과, 정형외과, 안과, 바이오, 기능성화장품 등의 인프라를 구축했다.
이를 통해 비R&D 기업지원과 R&D사업, 기반구축사업 유치 등을 통해 2023년말 기준 매출  1조3206억원, 고용 4,710명, 관련기업은 500개사로 급격히 성장했으며  산업육성을 통한 지역 경제활성화에 크게 기여한 것으로 평을 받고 있다.
광주테크노파크 김영집 원장은 ""K-바이오는 세계 2위의 바이오의약품 제조경쟁력을 가지는 우리 주력 브랜드로 자리 잡았다""며 ""올해 바이오 수출도 150억 달러를 넘을 것으로 예상된다. 앞으로도 광주지역이 경쟁력을 갖는 생체의료 중심의 인체이식형 의료기기를 중심으로 미래 주력산업으로 성장할 수 있도록 아낌없이 지원하겠다""고 말했다.",산업경쟁력
광주매일신문,광주테크노파크 메디헬스케어센터산업통상자원부 장관상,,,,,,,산업경쟁력
경남도민일보,그린바이오 연계 우주항공 농식품산업육성 모색,,,,,,,산업경쟁력
경남도민일보,‘경남 그린바이오 연계 우주항공 농식품산업육성’ 산학연관 지혜 모...,,,,,,,산업경쟁력
스포츠서울,"전북자치도, 혁신의료기기 실증센터 개소...의생명산업발판 구축",네이버뉴스,https://n.news.naver.com/mnews/article/468/0001112309?sid=102,,스포츠서울,"전북자치도, 혁신의료기기 실증센터 개소...의생명 산업 발판 구축","전북자치도가 지난달 29일 혁신의료기기 실증센터를 개소하고 의생명 산업 발판을 구축하기로 했다.  /  전북자치도
[스포츠서울 l 전주=고봉석 기자] 전북자치도는 지난달 29일 국내 최초로 ‘메카노바이오 활성소재 혁신의료기기 실증센터’를 개소하고, 차세대 의료기기 산업 육성을 위한 핵심 인프라를 구축했다고 밝혔다.
전북대 전주캠퍼스 내에 위치한 실증센터는 총사업비 215억원이 투입된 대규모 프로젝트로, 연면적 1,168㎡ 규모에 최첨단 장비 22종이 갖추어 진다.
특히 우수비임상시험기준(GLP) 시설을 도입해 메카노바이오 기술 기반의 의료기기 개발부터 생물학적 안전성 평가까지 원스톱 지원이 가능해 진다.
도는 이번 실증센터 개소로 의료기기 산업 지원을 위한 3단계 지원체계를 구축했다.
2022년 개소한 ‘중재적 메카노바이오 기술융합 연구센터’에서 첨단 기술개발을, ‘혁신의료기기 실증센터’에서 상용화 지원을, ‘메카노바이오헬스 혁신의료기기 전문인력 양성센터’에서 전문인력 양성을 담당하는 유기적 협력체계를 구축했다.
특히 전문인력 양성센터는 올해 보건복지부 공모사업에 선정되어 전북대학교, (사)캠틱종합기술원과 함께 기업 재직자와 대학생을 대상으로 맞춤형 전문교육을 실시하고 있다.
2024년부터 2025년까지 130명의 전문인력을 배출할 계획이다.
전북도 윤세영 바이오방위산업과장은 “이번 실증센터 개소로 연구개발에서 상용화, 인력양성까지 이어지는 전주기 지원체계를 완성했다”며 “차세대 의료기기 분야 글로벌 경쟁력을 확보해 의생명 산업의 거점으로 도약하겠다”고 밝혔다.
kobs@sportsseoul.com",산업경쟁력
헤럴드경제,“시흥시는 바이오산업육성할 수 있는 다양한 자원·잠재력 갖추고 있...,네이버뉴스,https://n.news.naver.com/mnews/article/016/0002395253?sid=100,,헤럴드경제,“시흥시는 바이오산업 육성할 수 있는 다양한 자원·잠재력 갖추고 있다”,"신영기 서울대 시흥캠퍼스 본부장, ‘경기시흥 바이오 특화단지 추진 방향과 전망(육성 로드맵)’에서
[헤럴드경제=박준환 기자]시흥시(시장 임병택)가 지난달 29일 시청 글로벌센터에서 개최된 ‘열린회의’에서 신영기 서울대학교 시흥캠퍼스 본부장을 초청해 ‘경기시흥 바이오 특화단지 추진 방향과 전망(육성 로드맵)’을 발표하며 시흥시 바이오산업의 비전을 수립하고, 지역 바이오산업의 경쟁력 강화에 나섰다.
이날 신영기 본부장은 시흥시가 대한민국 바이오산업의 중심으로 자리매김하기 위해 나아가야 할 방향을 제시하며, 바이오 특화단지 생태계 육성 로드맵을 주제로 인프라, 연구개발(R&D), 인력양성 교육프로그램, 기업지원 전략을 설명했다.
신영기 본부장은 “시흥시는 바이오산업을 육성할 수 있는 다양한 자원과 잠재력을 갖추고 있다”고 말했다. 또한 성공적인 바이오클러스터 모델로 꼽히는 ‘보스턴 바이오클러스터’ 사례를 언급하며 “효과적인 바이오클러스터 조성을 위해 연구개발(R&D) 기반의 산ㆍ학ㆍ연ㆍ병ㆍ관 협력 네트워크와 연구개발(R&D)부터 임상까지 이어지는 전주기 지원 프로세스를 구축해야 한다”고 강조했다.
시 관계자는 “이번 발표는 앞으로 경기시흥 바이오 특화단지 조성을 위해 필요한 전략과 과제를 구체적으로 모색하는 유익한 시간이 됐다. 시흥시를 대한민국 바이오산업의 중심지로 만들기 위해 다방면에서 협업해 나가겠다”고 했다.
한편, 시흥시는 지난 5일 한국화학융합시험연구원(KTR)과 상호협력을 위한 업무협약을 체결하고, 11월 7일에는 ‘제7차 SNU 바이오클러스터’ 자문단 회의에 참석해 산ㆍ학ㆍ연ㆍ병ㆍ관 협력 방안을 논의하는 등 성공적인 바이오 특화단지 조성에 속도를 내고 있다.",산업경쟁력
헤럴드경제,"시흥시, 바이오 특화단지 육성 로드맵 발표…서울대와 바이오산업비전...",네이버뉴스,https://n.news.naver.com/mnews/article/016/0002395253?sid=100,,헤럴드경제,“시흥시는 바이오산업 육성할 수 있는 다양한 자원·잠재력 갖추고 있다”,"신영기 서울대 시흥캠퍼스 본부장, ‘경기시흥 바이오 특화단지 추진 방향과 전망(육성 로드맵)’에서
[헤럴드경제=박준환 기자]시흥시(시장 임병택)가 지난달 29일 시청 글로벌센터에서 개최된 ‘열린회의’에서 신영기 서울대학교 시흥캠퍼스 본부장을 초청해 ‘경기시흥 바이오 특화단지 추진 방향과 전망(육성 로드맵)’을 발표하며 시흥시 바이오산업의 비전을 수립하고, 지역 바이오산업의 경쟁력 강화에 나섰다.
이날 신영기 본부장은 시흥시가 대한민국 바이오산업의 중심으로 자리매김하기 위해 나아가야 할 방향을 제시하며, 바이오 특화단지 생태계 육성 로드맵을 주제로 인프라, 연구개발(R&D), 인력양성 교육프로그램, 기업지원 전략을 설명했다.
신영기 본부장은 “시흥시는 바이오산업을 육성할 수 있는 다양한 자원과 잠재력을 갖추고 있다”고 말했다. 또한 성공적인 바이오클러스터 모델로 꼽히는 ‘보스턴 바이오클러스터’ 사례를 언급하며 “효과적인 바이오클러스터 조성을 위해 연구개발(R&D) 기반의 산ㆍ학ㆍ연ㆍ병ㆍ관 협력 네트워크와 연구개발(R&D)부터 임상까지 이어지는 전주기 지원 프로세스를 구축해야 한다”고 강조했다.
시 관계자는 “이번 발표는 앞으로 경기시흥 바이오 특화단지 조성을 위해 필요한 전략과 과제를 구체적으로 모색하는 유익한 시간이 됐다. 시흥시를 대한민국 바이오산업의 중심지로 만들기 위해 다방면에서 협업해 나가겠다”고 했다.
한편, 시흥시는 지난 5일 한국화학융합시험연구원(KTR)과 상호협력을 위한 업무협약을 체결하고, 11월 7일에는 ‘제7차 SNU 바이오클러스터’ 자문단 회의에 참석해 산ㆍ학ㆍ연ㆍ병ㆍ관 협력 방안을 논의하는 등 성공적인 바이오 특화단지 조성에 속도를 내고 있다.",산업경쟁력
스포츠서울,"강원관광재단, 제11기 강원 전시 복합산업(MICE) 서포터즈 해단식 개최",네이버뉴스,https://n.news.naver.com/mnews/article/468/0001112248?sid=102,,스포츠서울,"강원관광재단, 제11기 강원 전시 복합 산업(MICE) 서포터즈 해단식 개최","강원 전시 복합 산업(MICE) 미래의 산실 ‘2024년 강원 전시 복합 산업(MICE) 서포터즈 해단식’ 진행
한국관광공사 올해의 전시 복합 산업(MICE) 서포터즈 상 수상 및 미래내일 일경험 최우수상 등 큰 성과
사진|강원관광재단
[스포츠서울ㅣ춘천=김기원기자]강원관광재단(대표이사 최성현)은 지난 11월 30일 춘천에서 제11기 강원 전시 복합 산업(MICE) 서포터즈 해단식을 개최하며 한 해 동안의 활동을 마무리했다. 이번 해단식은 서포터즈의 노고를 격려하고, 강원특별자치도의 전시 복합 산업(MICE) 산업 발전에 기여한 성과를 공유하는 자리로 마련됐다.
강원 전시 복합 산업(MICE) 서포터즈는 올해 한국마이스(MICE)협회에서 주최한 ‘코리아 영마이스 페스티벌’, 고용노동부 사업의 ‘미래내일 일경험 프로젝트’, 부산관광공사와의 ‘강원-부산 서포터즈 교류 워크숍’ 등 여러 활동에 참여하며 강원의 전시 복합 산업(MICE) 가능성과 매력을 알렸다. 특히 이러한 노력은 한국관광공사에서 수여한 ‘올해의 전시 복합 산업(MICE) 서포터즈 상’을 수상하는 영예로 이어지며 서포터즈의 역량과 성과를 입증했다.
강원대학교 대학일자리플러스센터와 협업하여 산업 전문가를 초청한 온라인 및 오프라인 강연을 통해 학생들의 전시 복합 산업(MICE) 산업에 대한 이해도를 높였으며, 다양한 미션과 협업을 통해 강원특별자치도의 가치를 홍보하는 데 큰 역할을 했다.
해단식에서는 활동 결과 발표, 우수 서포터즈 시상, 수료증 수여가 진행되었으며, 서포터즈들이 작성한 의견을 통해 내년 활동에 대한 기대와 제언도 공유되었다. 특히 서포터즈들이 직접 제작한 전용 로고와 커뮤니티는 지속 가능한 네트워크 구축의 기반이 되었으며, 앞으로의 활동이 더욱 체계적이고 효과적으로 운영될 것으로 기대된다고 관계자는 전했다.
최성현 강원관광재단 대표이사는 환영사를 통해 “서포터즈 여러분의 열정과 헌신이 강원 전시 복합 산업(MICE) 산업의 성장을 이끄는 원동력이 되었다”며 “강원특별자치도의 전시 복합 산업(MICE) 경쟁력을 높이는 데 앞으로도 함께 노력하겠다”고 강조했다.
강원관광재단은 ‘2025-2026 강원 방문의 해’를 준비하며, 2025년 서포터즈와 함께 더 큰 성과를 만들어갈 계획이다. 서포터즈 활동을 통해 도내 베뉴와의 협력 강화, 행사의 다양성 확대 등을 목표로 강원의 전시 복합 산업(MICE) 생태계를 한층 강화할 예정이다.
acdcok4021@sportsseoul.com",산업경쟁력
