press,title,naver_news_text,naver_news_url,body,press_html,title_html,body_html,label
블로터,"송창현,자율주행·플레오스 데뷔 전 떠나...현대차 미래차 불투명",네이버뉴스,https://n.news.naver.com/mnews/article/293/0000075953?sid=101,,블로터,"송창현, 자율주행·플레오스 데뷔 전 떠나...현대차 미래차 불투명","송창현 현대차그룹 AVP본부 사장이 9월 서울 중구 웨스턴조선서울 호텔에서 열린 '글로벌 모빌리티 콘퍼런스' 행사서 기조연설을 하고 있는 모습./사진=조재환 기자
송창현 현대자동차그룹 AVP본부 사장 겸 포티투닷 대표이사가 3일 사의를 표명했다. 송 사장은 블라인드 등에 공유된 고별 메시지를 통해 ""오늘 저는 회장님(정의선 회장)과의 면담을 통해 현대차그룹 AVP 본부장과 포티투닷 대표직을 내려놓게 됐다""고 밝혔다.
송 사장은 올 3월 서울 삼성동 코엑스에서 열린 개발자 컨퍼런스 '플레오스25'를 통해 차세대 인포테인먼트 플랫폼 '플레오스 커넥트'와 '아트리아 AI' 기반 자율주행 기술을 2026년부터 순차적으로 선보이겠다고 밝혔다. 하지만 그가 이 계획의 결과물을 보지 못한 채 떠나면서 현대차그룹의 미래차 전략은 당분간 불투명해졌다는 평가가 나온다.
송 사장은 고별 메시지에서 사업 진행 과정의 난관을 구체적으로 언급했다. 그는 ""하드웨어 중심의 거대한 산업에서 소프트웨어의 DNA를 심고 단순히 차를 만드는 것이 아닌 AI 디바이스를 만들겠다는 무모해 보이던 도전은 쉽지 않았다""며 ""테크 스타트업과 레거시 산업 사이에서 수도 없이 충돌했다""고 회고했다.
자율차 기술 가능성 보였지만...장기화 실패
그가 이러한 어려움을 토로한 것은 정 회장과 손을 잡고 미래 모빌리티 사업을 함께 추진한 지 약 6년 만이다. 두 사람은 2019년 4월 서울 강남구 현대모터스튜디오서울에서 열린 간담회에서 미래 모빌리티 혁신 트렌드에 대한 의견을 교환했다. 당시 정 회장은 송 사장이 이끌던 포티투닷의 통찰력을 높게 평가했고 송 사장은 현대차의 전폭적인 지원 속에 새로운 모빌리티 지침서를 만들 수 있다는 자신감을 내비쳤다.
정 회장의 지원 아래 현대차그룹 자회사로 편입된 포티투닷은 카메라 기반 자율주행차 개발에 집중했다. 이 준비 과정은 2021년 서울 마포구 상암동 자율주행 시범운영지구에 투입된 기아 니로EV 기반 자율주행차와 2022년 서울 청계천에서 운행된 자율주행셔틀로 이어졌다.
청계천 일대에서 2년 넘게 운행된 뒤 2025년 1월부터 운행이 중단된 포티투닷 8인승 자율주행 셔틀 /사진=조재환 기자
서울 상암동 니로EV 자율주행차에는 라이다(LiDAR) 대신 7개의 카메라와 5개의 레이더가 장착됐다. 해당 장치는 '오토노머스 키트'로 묶여 차량 상단에 배치됐으며 실내에는 자율주행 상황 안내용 모니터 외에 별도 장치는 탑재되지 않았다. 이 차량은 신호 대응 정차와 교차로 좌·우회전 등에서 비교적 자연스러운 대응 능력을 보였다.
청계천 자율주행셔틀 역시 라이다를 제외하고 12개의 카메라와 6개의 레이더를 채택했다. 8인승 구성의 실내에는 착좌감 중심의 좌석과 개방감을 위한 파노라마 글라스 루프가 적용됐다.
포티투닷의 시도는 대중의 관심을 받았다. 2023년 4월 기준 모빌리티 플랫폼 TAP!을 통한 자율주행차 이용 건수는 서비스 개시 14개월 만에 약 2만명을 돌파했다. 2021년 11월 서울시로부터 자율주행 운송 허가를 받은 지 약 2년 만에 거둔 성과다.
그러나 이 같은 생태계는 오래 지속되지 못했다. 상암동 니로EV 자율주행차는 2024년 12월을 끝으로 3년간의 운행을 종료했고, 청계천 자율주행셔틀 역시 운행 2년 만인 올해 1월부터 멈춰섰다. 특히 현대차 주도의 고속도로 자율주행(HDP) 양산차 적용 시기가 무기한 연기되면서 현대차그룹의 자율주행 전략은 테슬라와의 기술 격차를 좁히지 못했다는 지적도 나온다.
구글 자율차 협력 이끌었지만, 테슬라 FSD 그늘 가려져
송 사장은 2024년 10월 호세 무뇨스 현대차 대표이사 사장과 함께 아이오닉5 기반 구글 웨이모원 자율주행차 운행 협약을 이끌어냈다. 위장막 테스트 중인 아이오닉5 웨이모 자율주행차는 11월부터 미국 샌프란시스코 일대에서 시범주행에 들어갔다.
그러나 그는 현대차의 엔드투엔드 기반 자율주행 기술이 테슬라를 능가할 수 있는지에 대해 확신을 갖지 못했다. 송 사장은 9월 서울 중구 웨스틴조선호텔에서 열린 국토교통부 '2025 글로벌 모빌리티 컨퍼런스' 강연 후 기자와 만나 관련 질문을 받자 ""잘 모르겠다""고 답한 바 있다.
송창현 현대차그룹 AVP본부 사장 겸 포티투닷 대표이사(사진 가운데)가 3월 서울 코엑스에서 드니스 네클리우도프 구글 안드로이드오토모티브 엔지니어링 담당(사진 오른쪽)과 함께 플레오스커넥트가 탑재된 아이오닉6 전시차 앞에서 대화를 나누고 있다./사진=조재환 기자
송 사장의 사의 표명은 산업통상부 주도의 SDV(소프트웨어 기반 차량) 표준화 협의체 결성 행사 이후 채 한 달도 지나지 않아 발표돼 파장이 예상된다. 당시 산업부는 그를 협의체 의장으로 지명하고 2026년 말까지 SDV API 표준을 마련한다는 계획을 밝혔다. 자율주행 분야가 SDV 표준의 핵심으로 평가되는 만큼, 송 사장의 경험이 협의체에 반영될 것이란 기대감이 컸다.
업계에서는 송 사장의 사의 표명이 테슬라의 FSD 국내 도입 시점과 맞물려 있다는 분석도 나온다. 자신을 현대차 직원이라고 밝힌 한 블라인드 이용자는 ""송 사장이 포티투닷에서 내놓은 결과물이 없었다""고 지적하며 그의 사의 표명에 당혹감을 드러냈다. 결국 2026년부터 순차 공개될 플레오스 커넥트와 SDV 페이스카 관련 사업은 송 사장이 아닌 다른 임원이 맡게 됐다.",자율주행
블로터,현대차자율주행수장 사임…포티투닷 어디로?,네이버뉴스,https://n.news.naver.com/mnews/article/293/0000075953?sid=101,,블로터,"송창현, 자율주행·플레오스 데뷔 전 떠나...현대차 미래차 불투명","송창현 현대차그룹 AVP본부 사장이 9월 서울 중구 웨스턴조선서울 호텔에서 열린 '글로벌 모빌리티 콘퍼런스' 행사서 기조연설을 하고 있는 모습./사진=조재환 기자
송창현 현대자동차그룹 AVP본부 사장 겸 포티투닷 대표이사가 3일 사의를 표명했다. 송 사장은 블라인드 등에 공유된 고별 메시지를 통해 ""오늘 저는 회장님(정의선 회장)과의 면담을 통해 현대차그룹 AVP 본부장과 포티투닷 대표직을 내려놓게 됐다""고 밝혔다.
송 사장은 올 3월 서울 삼성동 코엑스에서 열린 개발자 컨퍼런스 '플레오스25'를 통해 차세대 인포테인먼트 플랫폼 '플레오스 커넥트'와 '아트리아 AI' 기반 자율주행 기술을 2026년부터 순차적으로 선보이겠다고 밝혔다. 하지만 그가 이 계획의 결과물을 보지 못한 채 떠나면서 현대차그룹의 미래차 전략은 당분간 불투명해졌다는 평가가 나온다.
송 사장은 고별 메시지에서 사업 진행 과정의 난관을 구체적으로 언급했다. 그는 ""하드웨어 중심의 거대한 산업에서 소프트웨어의 DNA를 심고 단순히 차를 만드는 것이 아닌 AI 디바이스를 만들겠다는 무모해 보이던 도전은 쉽지 않았다""며 ""테크 스타트업과 레거시 산업 사이에서 수도 없이 충돌했다""고 회고했다.
자율차 기술 가능성 보였지만...장기화 실패
그가 이러한 어려움을 토로한 것은 정 회장과 손을 잡고 미래 모빌리티 사업을 함께 추진한 지 약 6년 만이다. 두 사람은 2019년 4월 서울 강남구 현대모터스튜디오서울에서 열린 간담회에서 미래 모빌리티 혁신 트렌드에 대한 의견을 교환했다. 당시 정 회장은 송 사장이 이끌던 포티투닷의 통찰력을 높게 평가했고 송 사장은 현대차의 전폭적인 지원 속에 새로운 모빌리티 지침서를 만들 수 있다는 자신감을 내비쳤다.
정 회장의 지원 아래 현대차그룹 자회사로 편입된 포티투닷은 카메라 기반 자율주행차 개발에 집중했다. 이 준비 과정은 2021년 서울 마포구 상암동 자율주행 시범운영지구에 투입된 기아 니로EV 기반 자율주행차와 2022년 서울 청계천에서 운행된 자율주행셔틀로 이어졌다.
청계천 일대에서 2년 넘게 운행된 뒤 2025년 1월부터 운행이 중단된 포티투닷 8인승 자율주행 셔틀 /사진=조재환 기자
서울 상암동 니로EV 자율주행차에는 라이다(LiDAR) 대신 7개의 카메라와 5개의 레이더가 장착됐다. 해당 장치는 '오토노머스 키트'로 묶여 차량 상단에 배치됐으며 실내에는 자율주행 상황 안내용 모니터 외에 별도 장치는 탑재되지 않았다. 이 차량은 신호 대응 정차와 교차로 좌·우회전 등에서 비교적 자연스러운 대응 능력을 보였다.
청계천 자율주행셔틀 역시 라이다를 제외하고 12개의 카메라와 6개의 레이더를 채택했다. 8인승 구성의 실내에는 착좌감 중심의 좌석과 개방감을 위한 파노라마 글라스 루프가 적용됐다.
포티투닷의 시도는 대중의 관심을 받았다. 2023년 4월 기준 모빌리티 플랫폼 TAP!을 통한 자율주행차 이용 건수는 서비스 개시 14개월 만에 약 2만명을 돌파했다. 2021년 11월 서울시로부터 자율주행 운송 허가를 받은 지 약 2년 만에 거둔 성과다.
그러나 이 같은 생태계는 오래 지속되지 못했다. 상암동 니로EV 자율주행차는 2024년 12월을 끝으로 3년간의 운행을 종료했고, 청계천 자율주행셔틀 역시 운행 2년 만인 올해 1월부터 멈춰섰다. 특히 현대차 주도의 고속도로 자율주행(HDP) 양산차 적용 시기가 무기한 연기되면서 현대차그룹의 자율주행 전략은 테슬라와의 기술 격차를 좁히지 못했다는 지적도 나온다.
구글 자율차 협력 이끌었지만, 테슬라 FSD 그늘 가려져
송 사장은 2024년 10월 호세 무뇨스 현대차 대표이사 사장과 함께 아이오닉5 기반 구글 웨이모원 자율주행차 운행 협약을 이끌어냈다. 위장막 테스트 중인 아이오닉5 웨이모 자율주행차는 11월부터 미국 샌프란시스코 일대에서 시범주행에 들어갔다.
그러나 그는 현대차의 엔드투엔드 기반 자율주행 기술이 테슬라를 능가할 수 있는지에 대해 확신을 갖지 못했다. 송 사장은 9월 서울 중구 웨스틴조선호텔에서 열린 국토교통부 '2025 글로벌 모빌리티 컨퍼런스' 강연 후 기자와 만나 관련 질문을 받자 ""잘 모르겠다""고 답한 바 있다.
송창현 현대차그룹 AVP본부 사장 겸 포티투닷 대표이사(사진 가운데)가 3월 서울 코엑스에서 드니스 네클리우도프 구글 안드로이드오토모티브 엔지니어링 담당(사진 오른쪽)과 함께 플레오스커넥트가 탑재된 아이오닉6 전시차 앞에서 대화를 나누고 있다./사진=조재환 기자
송 사장의 사의 표명은 산업통상부 주도의 SDV(소프트웨어 기반 차량) 표준화 협의체 결성 행사 이후 채 한 달도 지나지 않아 발표돼 파장이 예상된다. 당시 산업부는 그를 협의체 의장으로 지명하고 2026년 말까지 SDV API 표준을 마련한다는 계획을 밝혔다. 자율주행 분야가 SDV 표준의 핵심으로 평가되는 만큼, 송 사장의 경험이 협의체에 반영될 것이란 기대감이 컸다.
업계에서는 송 사장의 사의 표명이 테슬라의 FSD 국내 도입 시점과 맞물려 있다는 분석도 나온다. 자신을 현대차 직원이라고 밝힌 한 블라인드 이용자는 ""송 사장이 포티투닷에서 내놓은 결과물이 없었다""고 지적하며 그의 사의 표명에 당혹감을 드러냈다. 결국 2026년부터 순차 공개될 플레오스 커넥트와 SDV 페이스카 관련 사업은 송 사장이 아닌 다른 임원이 맡게 됐다.",자율주행
비즈워치,"현대차그룹, AI자율주행전면 수술…송창현 사장 사임",네이버뉴스,https://n.news.naver.com/mnews/article/648/0000042400?sid=101,,비즈워치,현대차 자율주행 수장 사임…포티투닷 어디로?,"네이버 출신 송창현 사장, 정의선 면담후 사임
현대차그룹, 송 사장 회사에 2.1조 투자했지만
""스타트업과 회사 사이에서 수도 없이 충돌""
네이버 출신의 자율주행 개발자 송창현 현대자동차 사장이 사임하면서 현대차그룹의 소프트웨어 중심 자동차(SDV) 전략의 변화가 불가피해졌다. 현대차그룹은 2019년 송 사장이 설립한 자율주행 스타트업 포티투닷에 투자하고, 2021년 파격적인 대우로 그를 영입했지만 가시적인 성과를 내는 데 실패한 것으로 평가된다.
4일 업계에 따르면 송창현 현대차 첨단차플랫폼(AVP) 본부장은 최근 정의선 그룹 회장을 만나 사의를 표명했다. 그는 직원에게 보낸 이메일을 통해 ""거대한 하드웨어 중심의 산업에서 소프트웨어의 DNA를 심고 단순히 차를 만드는 것이 아닌 인공지능(AI) 디바이스를 만들겠다는 무모해 보이던 도전은 그 과정이 정말 쉽지 않고 순탄치 않았다""고 말했다. 이어 ""테크 스타트업과 레거시 산업의 회사 사이에서 수도 없이 충돌했다""고 덧붙였다.
미국 퍼듀대에서 전산학을 전공한 송 사장은 네이버 CTO(최고기술책임자)를 거쳐 2021년 현대차에 합류했다. 현대차와 기아는 그에게 자율주행 등 모빌리티 핵심 기술 개발을 맡기며 파격적인 대우를 해줬다. TaaS(Transportation as a Service·서비스로서의 교통)본부를 설립해 그를 본부장(사장)으로 영입했고, 그가 2019년 창업한 포티투닷 대표 겸직을 허용했다. 현대차그룹은 2022년 포티투닷까지 인수했다.
현대차와 기아는 지난 6년간 포티투닷에 총 2조1504억원 투자한 것으로 집계된다. 현대차 1조3001억원, 기아 8503억원이다. 우선 두 회사는 2019년 포티투닷(당시 코드42) 설립 당시 초기 투자금(현대차 20억원, 기아 150억원)을 댔다. 송 사장을 영입한 이듬해인 2022년 현대차·기아는 포티투닷을 4277억원에 인수했다. 이후 두 회사는 2023년 3462억원, 2024년 2617억원, 2025년 1조978억원을 출자하며 투자를 이어가고 있다.
현대차그룹이 2조원을 넘게 투자했지만, 아직 뚜렷한 성과는 나오지 않고 있다. 포티투닷은 2023년 938억원, 2024년 1754억원 등 매년 당기순손실이 누적되면서 작년 말 기준 결손금이 5590억원에 이른다. 현대차그룹의 지원 없이는 생존이 어려운 재무구조인 셈이다.
스타트업 대표를 겸직한 그가 현대차그룹에서 수없이 충돌하는 동안 글로벌 완성차 회사는 자율주행에 대한 결과물을 만들어냈다. 테슬라는 감독형 완전자율주행(FSD, Full Self Driving)을 고도화하는데 성공했고 미국과 캐나다, 중국 등에 이어 지난달 한국에도 감독형 FSD 서비스를 도입했다. GM의 핸즈프리(Hands-free) 운전자 보조 시스템 '슈퍼크루즈' 서비스도 지난 10월 한국에 출시됐다. 바이두, 샤오펑 등 중국 자율주행 기술도 세계적인 수준으로 높아진 상황이다.
이날 김준성 메리츠증권 연구원은 송 사장의 사임에 대해 ""자체 기술 도전보다 엔비디아와의 협업에 집중하는 것이, 더 빠르게 더 많은 부분에서 테슬라와의 격차 축소를 견인할 것이라는 현대차그룹 수뇌부의 포석""이라고 해석했다. 현대차그룹은 지난 10월 차세대 AI칩 '엔비디아 블랙웰'을 기반의 자율주행 개발에 나서는 등 엔비디아와 협업을 강화하고 있다.",자율주행
이데일리,현대차그룹자율주행지휘자 송창현 사장 사직,네이버뉴스,https://n.news.naver.com/mnews/article/018/0006177392?sid=103,,이데일리,"현대차그룹, AI 자율주행 전면 수술…송창현 사장 사임","그룹 AVP본부장 겸 포티투닷 대표 송창현 사장 사임
네이버 출신…포티투닷 창업 후 현대차그룹에 편입
2024년엔 그룹 미래차 핵심 조직 AVP 본부장도 겸임
테슬라 FSD 국내 서비스 개시 후 '특단 조치'로 해석
[이데일리 정병묵 기자] 현대차그룹이 자율주행 소프트웨어중심차(SDV) 부문 대대적 조직개편에 나선다. 정의선 회장이 직접 앉힌 스타트업 출신 송창현 첨단차량플랫폼(AVP)본부장 겸 포티투닷 사장이 용퇴한다. 대미 수출 관세 리스크를 턴 연말 그룹 인사 기조가 조직 안정에 방점이 찍힌 가운데, 인공지능(AI), 자율주행 등 신사업 분야는 ‘칼바람’이 예정됐다는 전망도 나온다.
2022년 정의선(오른쪽) 당시 현대차 수석부회장이 서울 논현동 현대모터스튜디오 서울에서 송창현 포티투닷 대표와 만나 악수하고 있다. (사진=현대차그룹)
4일 완성차 업계에 따르면 송 사장은 3일 포티투닷 직원들에게 메일을 통해 “오늘 정의선 회장님과 면담을 통해 현대차그룹 AVP 본부장과 포티투닷 대표직을 내려놓게 됐다”며 ‘작별 인사’를 전했다.
송 사장은 “거대한 하드웨어 중심 산업에서 소프트웨어 DNA를 심고 차가 아닌 AI 디바이스를 만들겠다는 무모한 도전이 쉽지 않고 순탄치 않았다. 레거시 산업의 회사 사이에서 수없이 충돌했다”며 “AVP본부장을 겸직하면서 SDV 전환을 이끄는 동안 보이지 않는 벽에 부딪힐 때마다 저를 버티게 한 것은 포티투닷 리더분과 여러분의 열정이었다”고 전했다.
그는 또 “저의 부재가 조직에 잠시 혼란을 주겠으나 여러분의 꿈은 꺾을 수 없을 것”이라며 “제가 미쳐 다 이루지 못한 다리를 튼튼하게 완성시켜 달라. 포티투닷 창업자로서 한분 한분 마음 깊이 간직하고 떠난다. 혁신의 소식을 기다리겠다”고 부연했다.
송 사장은 네이버 최고기술책임자(CTO) 출신 소프트웨어 전문가다. 2019년 자율주행 소프트웨어 기업 포티투닷을 창업했다. 2022년 정의선 당시 현대차그룹 수석부회장은 포티투닷의 기술력을 높이 사 지분 90%를 사들이며 현대차그룹 계열사로 편입했다.
정 회장은 지난해 송 사장에게 중책인 현대차그룹 AVP본부장 자리도 맡겼다. 작년 초 신설된 AVP본부는 현대차·기아 SDV본부, 남양연구소 소프트웨어 연구 조직, 차세대 플랫폼 개발 인력 등이 속한 미래차 관련 핵심 조직이다.
송 사장의 사임은 최근 테슬라의 감독형 자율주행(FSD) 국내 출시와도 무관하지 않다는 해석이 나온다. 업계 관계자는 “테슬라 차가 소프트웨어 업데이트를 통해 국내 곳곳을 다니고 있는데 포티투닷과 AVP본부의 역할이 더욱 중요해지고 있다”며 “이번 인사를 통해 SDV 부문을 전면 개편하는 모양새”라고 전했다.
이에 따라 AVP본부의 다음 수장이 누가 될 것인지도 관심이 쏠린다. 업계에서는 내부 승진보다 외부 전문가 영입 쪽에 더 무게가 실린다.",자율주행
동아일보,"현대차그룹, AI·자율주행대수술 예고…첨단차 개발 수장 용퇴(종합)",네이버뉴스,https://n.news.naver.com/mnews/article/020/0003679413?sid=101,,동아일보,현대차그룹 자율주행 지휘자 송창현 사장 사직,"현대자동차 양재 사옥. 2025.04.24 뉴시스
현대자동차와 기아의 자율주행 및 스마트카 개발을 지휘해 온 송창현 현대차그룹 AVP(첨단플랫폼)본부장(사장)·포티투닷 대표가 물러난다.
현대차그룹은 4일 “송 사장이 최근 일신상의 이유로 퇴임 의사를 밝혔고, 회사가 이를 존중해 사임을 수용했다”고 밝혔다. 송 사장도 포티투닷 임직원에게 “(정의선) 회장님과의 면담을 통해 직을 내려놓게 됐다”는 내용의 메시지를 보낸 것으로 전해졌다.
2015년 네이버 초대 최고기술책임자(CTO)를 지냈던 송 사장은 2019년 1월 포티투닷을 설립했다. 이 회사가 2022년 현대차그룹에 인수되며 송 사장은 SDV사업부를 거쳐 AVP본부장직에 올랐다. 업계에서는 현대차그룹의 자율주행이 뚜렷한 성과를 내지 못한 데 대해 송 사장이 책임을 지고 물러난다는 해석도 나온다. 현대차그룹은 “송 사장이 관장하던 프로젝트는 AVP본부와 포티투닷 등 각 부문 리더를 중심으로 차질 없이 진행될 것”이라고 전했다.",자율주행
