press,title,naver_news_text,naver_news_url,body,press_html,title_html,body_html,label
매일경제,"""AI에자율주행얹은 물류망 구축""…한진·카카오, '똑똑한 배송' 시대 ...",네이버뉴스,https://n.news.naver.com/mnews/article/009/0005601100?sid=101,,매일경제,AI·자율주행 기술로 택배 혁신,"한진·카카오모빌리티 MOU
한진이 카카오모빌리티의 인공지능(AI)과 자율주행 기술을 물류 현장에 이식한다. 전통적 물류 강자 한진의 인프라스트럭처에 카카오의 정보기술(IT) 플랫폼을 입혀 물류 산업의 디지털 전환을 앞당기겠다는 전략이다.
한진은 카카오모빌리티와 'AI 기반 물류 네트워크 공동 구축'을 위한 업무협약(MOU)을 체결했다고 4일 밝혔다. 혁신 기술이 적용될 핵심 무대는 '미들 마일(Middle-Mile)'이다. 미들 마일이란 택배가 개인 고객에게 배송되는 마지막 단계(라스트 마일) 직전, 기업 화물이 물류센터와 거점 사이를 이동하는 중간 운송 과정을 뜻한다.
한진은 카카오모빌리티가 보유한 AI 물류 시스템을 미들 마일 구간에 적용한다. AI가 최적 경로를 산출해 물류 거점 간 이동 시간을 단축하고, 빈 트럭으로 운행하는 '공차율'을 줄여 운송 효율을 극대화한다는 구상이다. 양사는 축적된 운송 데이터를 기반으로 미래 물류 수요를 정교하게 예측하는 AI 모델도 공동 개발하기로 했다.
양사는 '로지스틱스 4.0' 실현을 위한 미래 기술 도입도 추진한다. 로지스틱스 4.0은 사물인터넷(IoT), 빅데이터, 로봇 등 4차 산업혁명 기술을 물류에 접목해 자동화를 이루는 것을 말한다. 양사는 이를 위해 AI 기반 자동화 물류 운영 체계인 'AX(인공지능 전환)' 구축에 속도를 낸다.
[정지성 기자]",자율주행
데일리안,"LG이노텍, CES 2026서자율주행·전기차 솔루션 총출동",네이버뉴스,https://n.news.naver.com/mnews/article/119/0003032680?sid=101,,데일리안,"LG이노텍, CES 2026서 자율주행·전기차 솔루션 총출동","AI 기반 ADV 시대 겨냥… 자율주행·전기차 목업 2대에 핵심 부품 35종 탑재
LG이노텍이 고객사에 발송한CES 2026초청장 이미지. LG이노텍은 내년1월6일부터9일까지 미국 라스베이거스에서 열리는CES 2026에 참가하여,차별화된 미래 모빌리티 솔루션을 대거 선보일 계획이다.ⓒLG이노텍
[데일리안 = 임채현 기자] LG이노텍이 내년 1월 미국 라스베이거스에서 열리는 CES 2026에서 자율주행차와 전기차(EV)를 중심으로 한 미래 모빌리티 솔루션을 대규모로 선보인다. 차량 하드웨어에 AI 기반 소프트웨어를 결합한 ADV(AI Defined Vehicle·인공지능 정의 차량) 시대가 본격화하는 가운데, 단순 부품 공급을 넘어 ‘통합 모빌리티 솔루션 기업’으로 도약한다는 전략이다.
3일 LG이노텍에 따르면, 회사는 라스베이거스 컨벤션센터 웨스트홀 입구에 단독 부스를 마련하고 자율주행·전기차 목업(Mockup) 2대를 중심으로 총 35종의 핵심 제품을 전시한다. 기존처럼 부품을 나열하는 방식 대신 실제 차량 형태에 탑재해 ‘턴키(Turn-Key) 솔루션’으로 구현하는 방식이다.
자율주행 컨셉카에는 카메라, 라이다, 레이더, 조명 등 ADAS 및 자율주행 관련 부품 20종이 장착된다. 특히 차량 내부 센싱 기술을 묶은 인캐빈(In-Cabin) 솔루션이 전시의 중심이 된다. 처음 공개되는 언더디스플레이(UD) 카메라 모듈은 화면 아래에 카메라를 숨겨 실내 디자인 제약을 줄이는 제품이다. 어린이 감지 기능(CPD)을 결합한 차세대 디지털키 등 소프트웨어 기반 융복합 기술도 함께 선보인다.
외부 센싱 제품도 강화됐다. AX(AI 전환) 기반 소프트웨어로 렌즈 세정 기능을 고도화한 ‘액티브 클리닝 카메라 모듈’, FMCW 라이다, 차량용 레이더 등이 포함된다. 자율주행 목업은 운전석·조수석 탑승이 가능하며, 전방 대형 스크린을 통해 자율주행 상황을 시뮬레이션 형태로 체험할 수 있다. CES 2026 혁신상을 받은 ‘초슬림 픽셀 라이팅 모듈’도 전방·후방에 적용된다.
전기차 목업에는 무선 배터리 관리 시스템(BMS)과 BMS·배터리 정션박스를 결합한 B-Link 등 파워트레인 제품 15종이 탑재된다. LG이노텍은 전기차 부품의 통합 설계 역량을 강조하며 시스템 엔지니어링 기반 경쟁력을 부각할 계획이다.
문혁수 LG이노텍 대표는 “CES 2026을 통해 미래 모빌리티 선도 기업 입지를 더욱 확고히 할 것”이라며 “차별적 고객가치를 제공하는 융합 솔루션을 지속 선보이며 신뢰받는 기술 파트너가 되겠다”고 말했다.
LG이노텍은 이달 중순부터 공식 홈페이지 내 CES 2026 페이지를 통해 주요 전시 제품과 전시 현황을 순차 공개할 예정이다.",자율주행
데일리안,"LG이노텍, CES 2026에서자율주행등 미래차 혁신 대거 공개",네이버뉴스,https://n.news.naver.com/mnews/article/119/0003032680?sid=101,,데일리안,"LG이노텍, CES 2026서 자율주행·전기차 솔루션 총출동","AI 기반 ADV 시대 겨냥… 자율주행·전기차 목업 2대에 핵심 부품 35종 탑재
LG이노텍이 고객사에 발송한CES 2026초청장 이미지. LG이노텍은 내년1월6일부터9일까지 미국 라스베이거스에서 열리는CES 2026에 참가하여,차별화된 미래 모빌리티 솔루션을 대거 선보일 계획이다.ⓒLG이노텍
[데일리안 = 임채현 기자] LG이노텍이 내년 1월 미국 라스베이거스에서 열리는 CES 2026에서 자율주행차와 전기차(EV)를 중심으로 한 미래 모빌리티 솔루션을 대규모로 선보인다. 차량 하드웨어에 AI 기반 소프트웨어를 결합한 ADV(AI Defined Vehicle·인공지능 정의 차량) 시대가 본격화하는 가운데, 단순 부품 공급을 넘어 ‘통합 모빌리티 솔루션 기업’으로 도약한다는 전략이다.
3일 LG이노텍에 따르면, 회사는 라스베이거스 컨벤션센터 웨스트홀 입구에 단독 부스를 마련하고 자율주행·전기차 목업(Mockup) 2대를 중심으로 총 35종의 핵심 제품을 전시한다. 기존처럼 부품을 나열하는 방식 대신 실제 차량 형태에 탑재해 ‘턴키(Turn-Key) 솔루션’으로 구현하는 방식이다.
자율주행 컨셉카에는 카메라, 라이다, 레이더, 조명 등 ADAS 및 자율주행 관련 부품 20종이 장착된다. 특히 차량 내부 센싱 기술을 묶은 인캐빈(In-Cabin) 솔루션이 전시의 중심이 된다. 처음 공개되는 언더디스플레이(UD) 카메라 모듈은 화면 아래에 카메라를 숨겨 실내 디자인 제약을 줄이는 제품이다. 어린이 감지 기능(CPD)을 결합한 차세대 디지털키 등 소프트웨어 기반 융복합 기술도 함께 선보인다.
외부 센싱 제품도 강화됐다. AX(AI 전환) 기반 소프트웨어로 렌즈 세정 기능을 고도화한 ‘액티브 클리닝 카메라 모듈’, FMCW 라이다, 차량용 레이더 등이 포함된다. 자율주행 목업은 운전석·조수석 탑승이 가능하며, 전방 대형 스크린을 통해 자율주행 상황을 시뮬레이션 형태로 체험할 수 있다. CES 2026 혁신상을 받은 ‘초슬림 픽셀 라이팅 모듈’도 전방·후방에 적용된다.
전기차 목업에는 무선 배터리 관리 시스템(BMS)과 BMS·배터리 정션박스를 결합한 B-Link 등 파워트레인 제품 15종이 탑재된다. LG이노텍은 전기차 부품의 통합 설계 역량을 강조하며 시스템 엔지니어링 기반 경쟁력을 부각할 계획이다.
문혁수 LG이노텍 대표는 “CES 2026을 통해 미래 모빌리티 선도 기업 입지를 더욱 확고히 할 것”이라며 “차별적 고객가치를 제공하는 융합 솔루션을 지속 선보이며 신뢰받는 기술 파트너가 되겠다”고 말했다.
LG이노텍은 이달 중순부터 공식 홈페이지 내 CES 2026 페이지를 통해 주요 전시 제품과 전시 현황을 순차 공개할 예정이다.",자율주행
매일경제,"LG이노텍, CES 2026서자율주행차·전기차 목업 앞세워 미래차 혁신 솔루...",네이버뉴스,https://n.news.naver.com/mnews/article/009/0005600123?sid=101,,매일경제,"LG이노텍, CES 2026에서 자율주행 등 미래차 혁신 대거 공개","LG이노텍이 내년 1월 개최되는 세계 최대 가전·정보통신(IT) 전시회 ‘CES 2026’에서 자율주행과 전기자동차 등 미래 모빌리티 혁신 솔루션을 대거 선보인다.
내년 1월 6일부터 나흘간 미국 라스베이거스에서 개최되는 CES 2026에는 미래 유망 산업 분야를 선도하는 글로벌 혁신 기업들의 다양한 신제품과 기술 등이 전시될 예정이다. LG이노텍은 라스베이거스 컨벤션센터 웨스트홀에 미래 모빌리티 단독 테마로 전시 부스를 마련하고 관련 제품 35종을 선보인다.
LG이노텍은 내년 CES 2026에서 하드웨어를 넘어 인공지능(AI)이 접목된 소프트웨어를 포함한 솔루션 형태의 전시 제품을 선보일 계획이다. 부품 단위를 넘어 ‘고객 맞춤형 미래 모빌리티 솔루션’ 기업으로의 도약 목표를 달성하기 위한 전략의 일환이다.
특히 인공지능 정의 차량(ADV) 시대가 본격화한 만큼 글로벌 완성차 기업들의 부품(하드웨어)과 연동된 소프트웨어가 결합된 턴 키(Turn Key) 형태의 솔루션을 향한 선호도가 높아지고 있다는 점을 적극 반영했다.
LG이노텍은 이 같은 점을 강조하기 위해 제품 전시 방식에도 변화를 줬다. 부품 단위 전시 제품을 나열하는 기존 방식 대신 자율주행차와 전기차 등 미래 모빌리티를 대표하는 두 개의 테마를 앞세워 각 목업(Mockup·모형)에 핵심 융·복합 솔루션을 탑재하는 형태로 전시를 진행한다.
전기차 모형에는 무선 배터리 관리 시스템(BMS)과 배터리 정션 박스(BJB) 기능이 결합된 ‘B링크’ 등 핵심 파워·모터 제품 15종이 장착된다.
자율주행 콘셉트카 모형에는 센싱·통신·조명 등 차량 내외부를 아우르는 자율주행(AD)과 첨단운전자보조시스템(ADAS)용 부품 20종이 탑재된다. 이번에 처음 공개되는 ‘언더 디스플레이 카메라 모듈’이 대표적이다. 또 아동 감지(CPD) 기능이 장착된 ‘차세대 디지털키 솔루션’ 등 융·복합 제품도 전시된다.
안전한 자율주행을 위한 라이다(LiDAR)와 레이더(Radar) 등이 탑재된 자율주행차 모형은 관람객이 운전석과 조수석에 실제 시승해볼 수 있도록 디자인됐다. 전방에 설치된 사이니지 화면을 통해 LG이노텍 센싱 솔루션을 기반으로 하는 차별화된 자율주행 경험을 시뮬레이션 형태로 체험할 수 있다.",자율주행
지디넷코리아,"어플라이드 인튜이션, SNC와 전장자율화 맞손",네이버뉴스,https://n.news.naver.com/mnews/article/092/0002401145?sid=105,,지디넷코리아,"어플라이드 인튜이션, SNC와 전장 자율화 맞손","지역 미사일 방어·무인항공기 대응 작전 분야 중심 협력
글로벌 피지컬 인텔리전스 기업 어플라이드 인튜이션은 글로벌 항공우주·방산 기업 시에라 네바다 코퍼레이션(SNC)과 차세대 자율 방위 기술 개발을 위해 파트너십을 체결했다고 4일 밝혔다.
어플라이드 인튜이션은 민수와 군수에 모두 사용할 수 있는 듀얼유즈 자율 소프트웨어 기술력을 시에라 네바다 코퍼레이션이 축적해온 개방형 아키텍처 임무 시스템 개발 역량과 결합해 전장 자율화 가속화에 나선다.
전투원에게 임무 수행이 가능한 자율 시스템을 더욱 신속하게 제공하는 것을 목표로 한다. 지역 미사일 방어와 무인항공기 대응 작전 분야를 중심으로 협력한다. 분산형 자율성과 실시간 센서 융합 기술로 전장에서 대응 시간과 위험을 줄인다는 계획이다.
우선 협력 분야는 SNC의 원정 지역 방위(EAAD) 시스템이다. EAAD시스템에 어플라이드 인튜이션의 차량 지능 플랫폼을 적용해 오프로드 자율주행 능력과 기술성숙도 (TRL) 최고 수준 방위 능력을 결합한다.
또한 복잡성을 낮춰 단 기간 내 활용 가능하며 다양한 플랫폼과 환경에서 운용할 수 있다. 자율 EAAD는 어플라이드 인튜이션의 차량용 OS, 어큐이티 지상 자율주행 기술, 액시온 임무 통제 시스템을 기반으로 구현된다.
카사르 유니스 어플라이드 인튜이션 CEO 겸 공동 창립자는 ""미 국방부는 자율성 실험 단계에서 운영 자율성 단계로 전환하고 있으며, 어플라이드 인튜이션은 이번 파트너십을 통해 이러한 전환을 지원하고 있다""라며 ""즉시 배치 가능한 전장 자율성 시스템을 구축할 것""이라고 말했다.
한편 어플라이드 인튜이션은 올해 초 시리즈 F 투자 라운드에서 6억 달러를 유치하며 기업가치를 150억 달러로 끌어 올렸다. 어플라이드 인튜이션의 액시온·어큐이티 방위 제품군은 미 국방부 주요 프로그램 전반에 사용되고 있다.",자율주행
지디넷코리아,"어플라이드 인튜이션, SNC와자율방위 기술 파트너십",네이버뉴스,https://n.news.naver.com/mnews/article/092/0002401145?sid=105,,지디넷코리아,"어플라이드 인튜이션, SNC와 전장 자율화 맞손","지역 미사일 방어·무인항공기 대응 작전 분야 중심 협력
글로벌 피지컬 인텔리전스 기업 어플라이드 인튜이션은 글로벌 항공우주·방산 기업 시에라 네바다 코퍼레이션(SNC)과 차세대 자율 방위 기술 개발을 위해 파트너십을 체결했다고 4일 밝혔다.
어플라이드 인튜이션은 민수와 군수에 모두 사용할 수 있는 듀얼유즈 자율 소프트웨어 기술력을 시에라 네바다 코퍼레이션이 축적해온 개방형 아키텍처 임무 시스템 개발 역량과 결합해 전장 자율화 가속화에 나선다.
전투원에게 임무 수행이 가능한 자율 시스템을 더욱 신속하게 제공하는 것을 목표로 한다. 지역 미사일 방어와 무인항공기 대응 작전 분야를 중심으로 협력한다. 분산형 자율성과 실시간 센서 융합 기술로 전장에서 대응 시간과 위험을 줄인다는 계획이다.
우선 협력 분야는 SNC의 원정 지역 방위(EAAD) 시스템이다. EAAD시스템에 어플라이드 인튜이션의 차량 지능 플랫폼을 적용해 오프로드 자율주행 능력과 기술성숙도 (TRL) 최고 수준 방위 능력을 결합한다.
또한 복잡성을 낮춰 단 기간 내 활용 가능하며 다양한 플랫폼과 환경에서 운용할 수 있다. 자율 EAAD는 어플라이드 인튜이션의 차량용 OS, 어큐이티 지상 자율주행 기술, 액시온 임무 통제 시스템을 기반으로 구현된다.
카사르 유니스 어플라이드 인튜이션 CEO 겸 공동 창립자는 ""미 국방부는 자율성 실험 단계에서 운영 자율성 단계로 전환하고 있으며, 어플라이드 인튜이션은 이번 파트너십을 통해 이러한 전환을 지원하고 있다""라며 ""즉시 배치 가능한 전장 자율성 시스템을 구축할 것""이라고 말했다.
한편 어플라이드 인튜이션은 올해 초 시리즈 F 투자 라운드에서 6억 달러를 유치하며 기업가치를 150억 달러로 끌어 올렸다. 어플라이드 인튜이션의 액시온·어큐이티 방위 제품군은 미 국방부 주요 프로그램 전반에 사용되고 있다.",자율주행
뉴스1,"""지형 한계 극복""…현대차·기아,자율주행로봇 '모베드' 공개",네이버뉴스,https://n.news.naver.com/mnews/article/421/0008639830?sid=103,,뉴스1,"""지형 한계 극복""…현대차·기아, 자율주행 로봇 '모베드' 공개","배송·물류·촬영 등 다양한 상황에서 활용 가능한 탑모듈 결합
프로 모델 자율주행 지원…내년 상반기부터 본격 판매 예정
현대자동차·기아 차세대 자율주행 모빌리티 로봇 플랫폼 '모베드'(Mobile Eccentric Droid, MobED)
(서울=뉴스1) 박기범 기자 = 활용 목적과 환경에 관계없이 다양한 지형에서 안정적으로 주행할 수 있는 다재 다능한 모바일 로봇 플랫폼이 세계 무대에서 첫 선을 보인다.
현대자동차(005380)·기아(000270)는 3일 일본 '도쿄 빅 사이트'에서 개최된 '일본 국제 로봇 전시회 2025'(IREX)에서 차세대 자율주행 모빌리티 로봇 플랫폼 '모베드'(Mobile Eccentric Droid, MobED)의 양산형 모델을 최초 공개했다.
모베드는 혁신적인 바퀴 구동 시스템을 갖춘 현대차·기아의 신개념 소형 모빌리티 플랫폼이다. 지난 2022년 미국 라스베이거스에서 열린 CES에서 콘셉트 모델로 처음 소개된 이후 약 3년간의 제품 개발 과정을 거쳐 양산형 모델로 새롭게 탄생했다.
모베드가 기존 로봇 플랫폼과 차별화되는 가장 큰 특징은 '지형의 한계를 뛰어넘는 주행 안정성'이다. DnL(Drive-and-Lift) 모듈을 기반으로 4개의 독립 구동 휠과 편심 자세 제어 메커니즘을 갖췄다. 각 휠에는 세 개의 모터가 탑재돼 개별 바퀴의 동력과 조향, 바디의 자세 제어 기능을 수행해 차체를 원하는 기울기로 조절할 수 있다. 이로 인해 경사나 요철이 있는 표면이나 최대 20㎝ 높이의 연석 구간에서도 안정적으로 균형을 유지할 수 있다.
플랫폼 상단에는 각종 장치를 자유롭게 부착할 수 있는 마운팅 레일이 적용돼 목적에 따라 모듈을 간단하고 편리하게 결합할 수 있다. 플랫폼 내 탑재된 배터리와 제어기를 활용해 탑모듈을 작동하거나 제어할 수 있는 별도의 포트도 적용됐다.
이러한 특징은 모베드가 앞으로 실외 배송, 순찰, 연구, 영상 촬영 등 폭넓은 산업 분야에서 활용될 수 있는 기반이 된다.
현대차·기아가 이번에 선보인 양산형 모베드는 베이직과 프로 라인업으로 구분된다. 베이직 모델은 자율주행 로봇 구현을 위한 연구 개발용으로 설계돼 로봇을 구입한 연구기관이나 개발자가 필요에 따라 자체 개발한 자율주행 소프트웨어를 적용하는 등 실험용 플랫폼으로 활용할 수 있다.
프로 모델은 인공지능(AI) 기반 알고리즘과 라이다·카메라 융합 센서를 적용한 자율주행 기술을 탑재해 사람과 장애물을 인식하고 실내외 이동, 물류 배송, 촬영 등 복잡하고 광범위한 환경에서도 안전하고 효율적으로 주행할 수 있다.
사용자 친화적인 인터페이스를 적용해 누구나 간단하게 조작할 수 있다는 점도 모베드의 장점이다. 모베드를 구동하는데 사용되는 별도의 리모트 컨트롤러는 3D 그래픽 기반의 터치 스크린으로 구현돼 직관적이고 편리한 사용자 경험을 제공하며, 로봇에 대한 기술적인 이해가 낮아도 누구나 손쉽게 조작할 수 있다.
모베드는 너비 74㎝, 길이 115㎝, 최대 속도 시속 10㎞로 1회 충전 시 최대 4시간 주행이 가능하다. 최대 적재중량은 라인업에 따라 47~57㎏ 수준이다.
현대차·기아는 모베드의 다양한 확장 가능성을 보여주기 위해 시연 중심으로 전시관을 구성했다. 전시장 내부에 연석, 경사로, 방지턱 등 다양한 지형 외에도 산업 현장을 모사한 환경을 구현하고, 모베드가 자율주행 및 자세 제어 기술 등을 활용해 임무를 완수하는 모습을 연출했다.
또한, 탑모듈 결합 콘셉트 모델인 △모베드 로딩(Loading) △모베드 언로딩(Unloading) △모베드 딜리버리(Delivery) △모베드 골프(Golf) △모베드 브로드캐스팅(Broadcasting) △모베드 어반호퍼(Urban Hopper) 등도 전시해 관람객들의 이목을 집중시켰다.
현대차·기아는 이번 IREX 공개를 시작으로 양산형 모베드를 내년 상반기부터 고객에게 판매 예정이다. 현대차·기아 로보틱스랩 현동진 상무는 ""모베드는 단순한 이동 플랫폼을 넘어 다양한 산업과 일상에서 활용 가능한 차세대 모빌리티 설루션""이라며 ""글로벌 로봇 시장에서 새로운 기준을 제시하고, 사람과 로봇이 공존하는 미래를 앞당기기 위해 노력할 것""이라고 밝혔다.
한편, 현대차·기아는 양산형 모베드의 주요 기술과 확장성에 대해 설명하는 영상도 공개했다. 이 영상은 현대차그룹 유튜브 채널에서 시청할 수 있다.
박스 싣는 모베드.
모베드 딜리버리",자율주행
