press,title,naver_news_text,naver_news_url,body,press_html,title_html,body_html,label
서울경제,법원 로비서 채가고 35년 산 영주권자까지구금…한인사회 '초긴장',네이버뉴스,https://n.news.naver.com/mnews/article/011/0004529714?sid=104,,서울경제,법원 로비서 채가고 35년 산 영주권자까지 구금…한인사회 '초긴장',"교민들 '정부 역할' 주문
시민권자와 결혼한 재미 음악가
석연찮은 추방 위기 등 공포 확산
합법 체류자도 체포·구금 잇따라
미국 이민세관단속국(ICE)에 체포됐다가 석방된 고연수(가운데) 씨가 8월 4일(현지 시간) 뉴욕 맨해튼 ICE 청사 앞에서 성공회 뉴욕교구 소속의 어머니 김기리 신부를 끌어안고 울음을 터트리고 있다. AFP연합뉴스
[서울경제]
미국 교민 사회는 4일(현지 시간) 미국 이민세관단속국(ICE)·국토안보수사국(HSI)의 현대차그룹·LG에너지솔루션 합작공장 급습을 두고 뒤숭숭한 분위기가 역력했다. 도널드 트럼프 행정부 출범 이후 영주권자나 비자 심사를 받고 있는 합법적 체류자까지 체포·구금되는 일이 잇따르면서 현지에 체류하는 교민·유학생·주재원들은 우리 정부의 적극적인 역할을 주문하고 나섰다.
이날 교민 사회 관계자들에 따르면 올 들어 한인 사회에 대한 ICE 등의 단속은 말 그대로 무분별하게 이뤄지고 있다. 트럼프 대통령의 불법체류자 척결 기조 아래 성과를 내기 위한 공권력의 무리수가 교민들의 정당한 권리마저 억압하고 있다는 지적이 쏟아진다. 성공회 뉴욕교구, 뉴욕이민연대에 따르면 올해 7월 31일 대한성공회 서울교구의 첫 여성 사제인 김기리 신부의 딸 고연수(20) 씨가 뉴욕 이민법원에 출석해 법정을 나서다가 ICE 요원들에게 기습적으로 체포되는 일이 벌어졌다. 고 씨는 재판에서 올 10월로 심리 기일을 연기받은 상태였다. 고 씨는 2021년 3월 종교비자의 동반가족비자(R-2 비자)로 미국에 입국해 합법적으로 체류했다. 고 씨는 뉴욕주에서 고등학교를 졸업하고 미국 퍼듀대에 재학 중이었다. 고 씨는 구금 나흘 만에 보석으로 석방됐다. 이명석 뉴욕한인회장은 “고 씨 사건으로 한인 이민자들이 심하게 동요하고 있다”며 불합리한 추방 사례 실태 조사, 정보 공유, 법률 지원, 영사관 차원의 신속 대응 체계 강화 등을 한국 정부에 요청했다.
이재명 대통령이 8월 24일(현지 시간) 미국 워싱턴DC에서 열린 동포 간담회 도중 미주한인봉사교육단체협의회 나눔터 최인혜 사무총장이 건넨 김태흥(40) 씨 어머니의 편지를 전달받고 있다. 김 씨는 올 7월 21일 한국에서 미국 샌프란시스코공항으로 들어오다 이민 당국에 붙잡혀 현재까지 구금 중이다. 연합뉴스
앞서 미국 영주권자인 김태흥(40) 씨가 한국에서 형제의 결혼식에 참석한 뒤 미국으로 돌아오는 길에 샌프란시스코공항에서 당국에 붙잡혔다. 다섯 살 때 미국으로 건너온 김 씨는 텍사스 A&M대 박사과정을 밟으며 라임병 백신 연구를 진행하고 있었다. 가족들은 김 씨가 2011년 소량의 대마초 소지 혐의로 기소돼 사회봉사 명령을 받았던 전력이 문제가 됐을 것으로 추정하고 있다. 김 씨는 지난달 29일 첫 재판을 받았으며 아직도 구치소에 구금된 상태다. 미주한인봉사교육단체협의회는 지난달 24일 워싱턴DC에서 열린 동포 간담회에서 이재명 대통령에게 김 씨 모친의 구명 요청 편지를 전달하기도 했다. 최근에는 한인 바이올리니스트 존 신(37) 씨가 ICE에 붙잡혀 구금되는 일도 벌어졌다. 신 씨의 아내인 미국 시민권자 다나에 스노우 씨는 이 사실을 지난달 20일 남편에게 걸려온 전화를 통해 알았다. 신 씨는 열 살 때 미국으로 이주해 초중고교와 대학을 모두 유타주에서 나왔다. 신 씨의 변호사는 2019년께 신 씨가 음주운전 등으로 단속됐던 전력이 구금 이유가 된 것 같다고만 밝혔다. 신 씨는 이미 법에 따른 치료 목적 수강, 보호관찰 기간 등을 다 거쳤고 운전면허증도 재발급 받았으나 해당 이력으로 합법적 체류 자격이 상실돼 추방 위기에 몰린 것으로 전해졌다. 이달 3일에는 로스앤젤레스(LA) 한인타운 한복판의 세차장에 연방 세관국경보호국(CBP) 요원들이 들이닥쳐 라틴계 직원 5명을 체포하기도 했다. 주LA총영사관에 따르면 한국인이 이민 관련 이슈로 피해를 본 사례는 지난 2년간 1건밖에 없었다가 올해는 벌써 5건으로 늘었다.
김동석 미주한인유권자연대(KAGC) 대표는 “한국 국적자인 영주권자가 체포될 경우 한국 정부가 적극적으로 관여해 외교적으로 풀어야 한다”고 강조했다. 뉴저지 지역의 한 대기업 주재원은 “과거에는 가볍게 넘어갈 만한 단속 사안도 현재는 한 번 잘못 걸리면 한국으로 영영 추방될 수 있다는 불안이 한인 사회에 늘고 있다”며 “경찰이나 공무원들을 보면 자극하지 않기 위해 다들 최대한 조심하고 있다”고 분위기를 전했다.",한인구금
이투데이,"[종합] 美, 현대차-LG엔솔 공장서 450명 체포…“구금해제 위해 총력”",,,,,,,한인구금
이투데이,LG엔솔 “구금해제 총력”…미 공장 단속에 한국인 450명 체포,,,,,,,한인구금
뉴스토마토,"美, 현대차-LG엔솔공장서 불체자 단속…""한국인 포함 450명 체포""(종합)",,,,,,,한인구금
연합뉴스,"“한국인 출장자 30여명 연행”…美, 현대차-LG엔솔공장서 불체자 450명...",네이버뉴스,https://n.news.naver.com/mnews/article/001/0015607640?sid=104,,연합뉴스,"美, 현대차-LG엔솔공장서 불체자 단속…""한국인 포함 450명 체포""(종합)","차량 수백대 동원해 단속…""한국서 출장간 직원도 30명이상 연행돼""
미 조지아주 서배너 엘라벨에 위치한 HMGMA
[현대차그룹 제공. 재판매 및 DB 금지]
(워싱턴=연합뉴스) 박성민 조준형 특파원 = 미국 이민세관단속국(ICE)과 국토안보수사국(HSI) 등이 4일(현지시간) 조지아주 서배나에 위치한 현대차그룹-LG에너지솔루션의 합작 배터리 공장(HL-GA 배터리회사) 건설현장에서 대대적인 불법체류자 단속을 벌인 것으로 파악됐다.
'서배나 모닝뉴스'(SMN)에 따르면 조지아주 순찰대 관계자는 ""브라이언 카운티에 있는 현대 메타플랜트의 배터리 공장 건설 현장에서 HSI의 범죄 수색영장 집행 작전을 지원했다""고 전했다.
또 현지매체 WSAV는 수백대의 법집행 차량이 동원된 가운데, 이날 오전부터 진행된 이번 단속에서 약 450명이 체포됐다고 소개했다.
현지의 한국 영사 업무 담당자에 따르면 '불법체류' 혐의를 받는 이 인원 중에는 한국에서 현지로 출장을 간 직원 30명 이상(협력업체 직원 포함)과, 현지에서 채용된 근로자들이 포함된 것으로 파악됐다.
한국에서 출장간 사람들은 대부분 회의 참석이나 계약 등을 위한 비자인 B1비자나, 무비자인 전자여행허가(ESTA)를 소지한 채 현지에서 일을 하고 있었던 것으로 파악된다.
이들 역시 '체류목적에 부합하지 않는 활동'을 했다는 이유로 단속의 대상이 된 것으로 알려졌다.
당국이 현장 공사를 담당하는 업체에 소속된 일용직 노동자 중 불법체류자들을 가려내 체포하는 과정에서, 허용된 체류자격을 넘어선 활동을 한 것으로 의심되는 한국인 출장자들도 체포된 것으로 파악됐다.
체포된 사람 중 상당수는 추가조사를 위해 조지아주 폭스턴에 위치한 ICE 시설로 연행된 것으로 전해졌다.
현지를 관할하는 주애틀랜타 한국총영사관은 재미 한인 변호사 등으로 변호인단을 꾸리고 있다. 변호인단은 한국인들이 구금된 시설을 조만간 방문할 예정이라고 총영사관 관계자가 전했다.
HL-GA 배터리회사 선임 홍보 전문가인 메리 베스 케네디는 공식 성명에서 ""우리 건설 현장에서의 활동과 관련해 관계 당국과 전적으로 협력 중이다. 당국의 업무를 지원하기 위해 건설 작업을 일시 중단했다""고 밝혔다.
대대적인 불법체류자 단속 및 추방 정책을 펴고 있는 미국 트럼프 행정부는 외국인 근로자가 다수 일하는 공장이나 농장 등을 급습해 불법체류자로 의심되는 사람들을 체포한 뒤 수용 시설로 이송하고 있다.
min22@yna.co.kr",한인구금
디지털타임스,"[자막뉴스] 현대차·LG까지 단속원 '우르르'…트럼프 칼날에 ""450명 체포...",네이버뉴스,https://n.news.naver.com/mnews/article/029/0002980398?sid=101,,디지털타임스,"“한국인 출장자 30여명 연행”…美, 현대차-LG엔솔공장서 불체자 450명 체포","미 조지아주 서배너 엘라벨에 위치한 HMGMA [현대차그룹 제공]
미국 이민세관단속국(ICE)과 국토안보수사국(HSI) 등이 4일(현지시간) 조지아주 서배나에 위치한 현대차그룹-LG에너지솔루션의 합작 배터리 공장(HL-GA 배터리회사) 건설현장에서 대대적인 불법체류자 단속을 벌였다.
미국 ‘서배나 모닝뉴스’(SMN)에 따르면 조지아주 순찰대 관계자는 이날 “브라이언 카운티의 현대 메타플랜트의 배터리 공장 건설 현장에서 HSI의 범죄 수색영장 집행 작전을 지원했다”고 밝혔다.
현지 매체 WSAV는 수백대의 법집행 차량이 동원된 가운데, 이날 오전부터 진행된 이번 단속에서 약 450명이 체포됐다고 보도했다.
현지의 한국 영사 업무 담당자에 따르면 ‘불법체류’ 혐의를 받는 이 인원 중에는 한국에서 현지로 출장을 간 직원 30명 이상(협력업체 직원 포함)과 현지 채용 근로자들이 포함된 것으로 파악됐다.
한국에서 출장간 사람들은 대부분 회의 참석이나 계약 등을 위한 비자인 B1비자나, 무비자인 전자여행허가(ESTA)를 소지한 채 현지에서 일을 하고 있었던 것으로 파악된다.
이들 역시 ‘체류목적에 부합하지 않는 활동’을 했다는 이유로 단속의 대상이 된 것으로 알려졌다.
당국이 현장 공사를 담당하는 업체에 소속된 일용직 노동자 중 불법체류자들을 가려내 체포하는 과정에서, 허용된 체류자격을 넘어선 활동을 한 것으로 의심되는 한국인 출장자들도 체포된 것으로 파악됐다.
체포된 사람 중 상당수는 추가조사를 위해 조지아주 폭스턴에 위치한 ICE 시설로 연행된 것으로 전해졌다.
현지를 관할하는 주애틀랜타 한국총영사관은 재미 한인 변호사 등으로 변호인단을 꾸리고 있다. 변호인단은 한국인들이 구금된 시설을 조만간 방문할 예정이라고 총영사관 관계자가 전했다.
HL-GA 배터리회사 선임 홍보 전문가 메리 베스 케네디는 “우리 건설 현장에서의 활동과 관련해 관계 당국과 전적으로 협력 중이다. 당국의 업무를 지원하기 위해 건설 작업을 일시 중단했다”고 밝혔다.
불법체류자 단속 및 추방 정책을 펴고 있는 미국 트럼프 행정부는 외국인 근로자가 다수 일하는 공장이나 농장 등을 급습해 불법체류자로 의심되는 사람들을 체포한 뒤 수용 시설로 이송하고 있다.",한인구금
뉴스버스,[단독] 미 이민당국 현대차·LG본사 직원까지 250명 체포·구금,,,,,,,한인구금
미주중앙일보,'불체자구금'한인음악가 석방…법원 2만5000불에 보석 허용,,,,,,,한인구금
미주한국일보,타운서 이민단속 ‘공포’…한인운영 세차장 급습,,,,,,,한인구금
미주한국일보,불법체류자 단속반한인타운 업소 급습,,,,,,,한인구금
라디오코리아,"KIWA,한인타운 포함 LA서 진행하는 비헌법적 이민 단속 중단하라!",,,,,,,한인구금
서울신문,美추방 “최악의 범죄자”에 한국인 포함…한인사회는 “석방 촉구” ...,네이버뉴스,https://n.news.naver.com/mnews/article/081/0003570581?sid=104,,서울신문,美추방 “최악의 범죄자”에 한국인 포함… 한인사회는 “석방 촉구” 노력,"살인으로 14년 복역한 저스틴 정
수감생활로 인해 영주권 신청 놓쳐
“자진출국 준비 중 강제체포·구금”
3개월간 LA서만 5000명 이상 체포
불법체류자 단속 강도를 높이고 있는 미 이민세관단속국(ICE)에 지난 6월 체포된 저스틴 정(사진 일부 모자이크 처리함). 미 국토안보부 홈페이지 캡처
불법 이민자 추방 강도를 높이고 있는 도널드 트럼프 2기 행정부가 지난 6월 이후 로스앤젤레스(LA) 지역에서만 5000명 이상을 체포한 가운데 지난달 27일(현지시간) 폭스뉴스는 ‘최악 중 최악’(worst of the worst)의 강력 범죄자 명단에 한국인이 포함됐다고 보도했다. 미 정부 측 시각과는 달리 현지 한인사회는 해당 한국인 ‘석방 촉구’ 운동을 벌여와 눈길을 끈다.
폭스뉴스에 따르면 크리스티 놈 미 국토안보부 장관은 이날 성명에서 “LA에서 5000명 이상을 체포했다. 불법 체류자, 갱단원, 아동 성범죄자, 그리고 살인범을 거리에서 쫓아냈다”며 “이는 소중한 생명을 구한 것”이라고 밝혔다.
그는 이어 “미국 납세자들은 범죄로 인한 비용과 복지 혜택 부담을 덜게 됐다”면서 “불법 체류자는 저희가 찾아내 체포, 송환하겠다. 이것은 시작에 불과하다”고 강조했다.
특히 강조된 구금자 가운데는 멕시코, 엘살바도르, 베트남, 중국, 에리트레아 국민과 함께 한국인도 포함됐다.
국토안보부는 한국인인 저스틴 정(35)이 살인과 주거지에서의 총격 등 혐의로 징역 75년을 선고받은 바 있다고 설명했다.
미국 로스앤젤레스(LA) 지역의 한 주차장에서 이민세관단속국(ICE) 요원들이 불법 이민자를 체포하고 있다. 폭스뉴스 보도화면 캡처
정씨와 함께 ‘최악의 범죄자’로 거론된 인물로는 살인으로 종신형을 선고받은 멕시코인 후안 카를로스 마린히폴리토, 1급 강간죄와 근친상간죄로 유죄 판결을 받은 엘살바도르인 조엘 벤제민 레이예스, 이물질을 이용한 강간과 중상해를 초래한 폭행 등 혐의의 에리트레아인 요하네스 제라이, 납치·강간·강제추행·마약소지 등 혐의의 베트남인 꾸옥 둥 팜, 14세 미만 아동에게 음란한 행위를 해 유죄 판결을 받은 멕시코인 여성 마르티나 자카리아스 등이 있다.
그러나 정씨의 체포를 보는 한인사회의 시각은 다르다.
미주한국일보·미주중앙일보 등에 따르면 민권센터 등 미주한인봉사단체협의회(NAKASEC)는 정씨가 미 이민세관단속국(ICE) 요원들에게 체포된 지난 6월 미국 내 각 지역 연방 상하원의원들에게 정씨의 석방을 촉구하는 전화 걸기 캠페인을 시작했다.
정씨는 16세이던 2006년 8월 LA 인근 로랜드하이츠에서 열린 한 파티에 참석했다가 살인 혐의를 받게 됐다. 2세 때 부모님을 따라 이민온 정씨는 고교 시절 한 한인 갱단에 가입하게 됐는데 파티에서 또 다른 한인 갱단과 패싸움 도중 발생한 총격에 갱단원이 아닌 21세 대만계 미국인이 사망했다.
1급 살인 혐의를 받은 정씨는 징역 82년형이 선고됐다가 15년형으로 감형됐고, 총 14년간 복역 후 2020년 6월 가석방됐다. 정씨는 수감생활로 영주권 신청을 놓치는 바람에 추방 명령을 받았고, 이 때문에 이번 불법 이민자 체포 작전 대상이 됐다.
민권센터 등에 따르면 정씨는 복역 중에도 학업을 이어가며 고교 졸업 학력을 마쳤고, 출소 후 미용학 학위를 취득해 미용사로 일하며 가정을 꾸렸다. 또 지역사회에서 위험에 처한 청소년들의 멘토로 활동하며 변화된 삶을 살아왔다.
그는 내년 2월 아버지가 될 예정으로 전해졌다. 자신의 자진 출국이 아내와 아이를 가장 잘 지원할 수 있는 길이라 믿었고, ICE의 자진 출국 지침을 성실히 이행할 계획을 세우고 있던 차에 갑자기 강제 체포·구금됐다는 설명이다.
한편 트럼프 행정부의 이민 정책을 주도하는 스티븐 밀러 백악관 부비서실장은 지난 5월 ICE 회의에 참석해 하루 3000명을 체포하라고 지시했다. 이는 트럼프 2기 첫 100일 동안 하루 평균 체포자 수(665명)의 4배가 넘는 규모다.
이에 현장에서는 비현실적인 목표치 때문에 ‘마구잡이식’ 체포가 이뤄지고 있으며, ICE 요원들이 사복 차림으로 거리와 주차장, 학교, 교회 등에서 이민자들을 무차별적으로 체포하는 모습이 포착돼 비판도 커지고 있다고 로이터통신은 전했다.",한인구금
미주한국일보,공항서 체포한인추방재판 종결 신청 불허,,,,,,,한인구금
연합뉴스,"美, 현대차-LG엔솔 건설현장 불체자 단속…""한국인 300명 체포""(종합3보...",네이버뉴스,https://n.news.naver.com/mnews/article/001/0015608805?sid=104,,연합뉴스,"美, 현대차-LG엔솔 건설현장 불체자 단속…""한국인 300명 체포""(종합3보)","단기비자·비자면제프로그램으로 美서 일하던 출장자들 대거적발
제3국민 포함 총 450명 체포 발표…美당국 ""불법고용 적극 조사중""
체류 목적 위반으로 체포되면 재판 받아야…구금 기간 길어질 수도
미 조지아주 현대차-LG엔솔 합작 배터리 공장 불법체류자 단속 현장
[ATF 애틀랜타 지부 엑스(X·옛 트위터) 캡처. 재판매 및 DB 금지]
(워싱턴·서울=연합뉴스) 조준형 박성민 특파원 김아람 기자 = 미국 이민 당국이 4일(현지시간) 조지아주 서배나의 현대차그룹-LG에니저솔루션의 합작 배터리 공장((HL-GA 배터리회사) 건설 현장에서 대대적인 불법체류자 단속을 벌여 한국인 약 300명(최대 추정치)이 체포·구금됐다.
미 주류·담배·총포 담당국(ATF) 애틀랜타 지부는 이날 엑스(X·옛 트위터) 공식 계정에 올린 글에서 ""오늘 국토안보수사국(HSI), 이민세관단속국(ICE), 마약단속국(DEA), 조지아주 순찰대 등과 함께 조지아주 브라이언 카운티에 있는 현대차 배터리 공장 건설 현장에서 대규모 이민 단속 작전을 벌였다""고 밝혔다.
이어 ""불법체류자 약 450명을 체포했으며, 이는 지역 사회 안전에 대한 우리의 확고한 의지를 보여준다""고 덧붙였다.
체포된 사람 가운데 한국 국적인 사람은 200∼300명 선인 것으로 전해지고 있다.
아울러 이날 단속에서 체포된 사람이 560명에 달한다는 얘기도 일각에서 나온다.
당국이 현장 공사를 담당하는 업체에 소속된 일용직 노동자 중 불법체류자들을 가려내 체포하는 과정에서, 허용된 체류자격을 넘어선 활동을 한 것으로 의심되는 한국인 출장자들도 대거 체포된 것으로 보인다.
ATF 애틀랜타 지부는 이 소식을 전하면서 현장에서 단속 요원들이 불법체류자들을 검거하는 사진을 함께 올렸다.
이번 단속에 대해 미 국토안보부 관계자는 로이터 통신에 ""사법부 허가를 받아 집행한 작전""이라며 ""우리는 불법 고용 행위를 적극적으로 조사하고 있다""고 말했다.
HSI 조지아주 책임자인 스티븐 슈랑크 특별수사관은 현지 지역 방송으로 중계된 브리핑에서 단속과 관련해 ""체포가 이뤄지고 있다""고 전했다.
HL-GA 배터리회사 선임 홍보 전문가인 메리 베스 케네디는 공식 성명에서 ""우리 건설 현장에서의 활동과 관련해 관계 당국과 전적으로 협력 중이다. 당국의 업무를 지원하기 위해 건설 작업을 일시 중단했다""고 밝혔다.
미 조지아주 현대차-LG엔솔 합작 배터리 공장 불법체류자 단속 현장
[ATF 애틀랜타 지부 엑스(X·옛 트위터) 캡처. 재판매 및 DB 금지]
트럼프 행정부가 관세폭탄 등으로 미국에 대한 대대적인 투자를 압박하고 있지만, 불법 이민 및 불법체류와 관련해서는 대미 투자기업에 대해서도 강경한 법 집행을 하겠다는 의도로 풀이된다.
한국에서 출장 간 사람들은 대부분 회의 참석이나 계약 등을 위한 비자인 B1비자나, 무비자인 전자여행허가(ESTA)를 소지한 채 현지에서 일을 하고 있었던 것으로 파악된다.
이들 역시 '체류목적에 부합하지 않는 활동'을 했다는 이유로 단속의 대상이 된 것으로 알려졌다.
미 조지아주 서배너 엘라벨에 위치한 HMGMA
[현대차그룹 제공. 재판매 및 DB 금지]
체포된 사람 중 상당수는 추가조사를 위해 조지아주 폭스턴에 위치한 ICE 시설로 연행된 것으로 전해졌다.
대대적인 불법체류자 단속 및 추방 정책을 펴고 있는 미국 트럼프 행정부는 외국인 근로자가 다수 일하는 공장이나 농장 등을 급습해 불법체류자로 의심되는 사람들을 체포한 뒤 수용 시설로 이송하고 있다.
이번 일은 미국 체류자격 문제의 엄중성을 간과한 한국 기업들의 직원 파견 관행과 무관치 않다는 지적도 나온다.
조지아주의 한인 기업들 상황에 정통한 이종원 변호사는 연합뉴스와의 통화에서 ""기업들이 정식 주재원 비자를 받으려면 시간이 많이 걸리니 급한 업무를 위해 무비자 단기 방문용인 ESTA(전자여행허가제)를 이용하거나 방문 비자를 받아서 오는 경우가 적지 않다""며 ""B1, B2와 같은 단기 방문 비자나 ESTA로 미국에 입국해 근로를 하면 이민법 위반이 된다""고 말했다.
이 같은 기업들의 관행이 트럼프 행정부 강경한 이민정책에 따른 강화된 단속에 타깃이 된 측면이 있어 보인다.
작년 대선에서 불법이민 이슈는 트럼프 대통령의 최대 득표요인 중 하나였고, 그 정책에 대한 지지를 발판 삼아 트럼프 대통령은 집권 이후 불법체류자 체포 및 추방에 총력전을 펴고 있다.
동시에 트럼프 행정부는 외국 기업의 미국내 제조업 시설 투자를 통한 고용 증대 효과를 환영하는 입장이긴 하지만 자국민이 아닌 불법체류자를 고용하는 데 대해서는 강경한 이민정책의 잣대를 그대로 적용하고 있는 양상이다.
한국인들이 대거 구금됨에 따라 한국 외교부 등 정부 당국은 이들에 대한 영사 지원에 나섰다.
현지를 관할하는 주애틀랜타 한국총영사관은 재미 한인 변호사 등으로 변호인단을 꾸리고 있다. 변호인단은 한국인들이 구금된 시설을 조만간 방문할 예정이라고 총영사관 관계자가 전했다.
B1, B2 등 단기 방문 비자를 받은 사람들이 체류목적 위반 혐의로 체포된 경우 추방에 앞서 이민 법원의 재판을 받아야 하는데 자칫 구금이 길어질 가능성도 배제할 수 없는 것으로 현지 소식통은 전했다.
min22@yna.co.kr",한인구금
