press,title,naver_news_text,naver_news_url,body,press_html,title_html,body_html,label
연합뉴스,"'美 투자했더니 체포?' 현대차-LG엔솔 공장 짓던 韓300명, 이민당국에 잡...",네이버뉴스,https://n.news.naver.com/mnews/article/001/0015608805?sid=104,,연합뉴스,"美, 현대차-LG엔솔 건설현장 불체자 단속…""한국인 300명 체포""(종합3보)","단기비자·비자면제프로그램으로 美서 일하던 출장자들 대거적발
제3국민 포함 총 450명 체포 발표…美당국 ""불법고용 적극 조사중""
체류 목적 위반으로 체포되면 재판 받아야…구금 기간 길어질 수도
미 조지아주 현대차-LG엔솔 합작 배터리 공장 불법체류자 단속 현장
[ATF 애틀랜타 지부 엑스(X·옛 트위터) 캡처. 재판매 및 DB 금지]
(워싱턴·서울=연합뉴스) 조준형 박성민 특파원 김아람 기자 = 미국 이민 당국이 4일(현지시간) 조지아주 서배나의 현대차그룹-LG에니저솔루션의 합작 배터리 공장((HL-GA 배터리회사) 건설 현장에서 대대적인 불법체류자 단속을 벌여 한국인 약 300명(최대 추정치)이 체포·구금됐다.
미 주류·담배·총포 담당국(ATF) 애틀랜타 지부는 이날 엑스(X·옛 트위터) 공식 계정에 올린 글에서 ""오늘 국토안보수사국(HSI), 이민세관단속국(ICE), 마약단속국(DEA), 조지아주 순찰대 등과 함께 조지아주 브라이언 카운티에 있는 현대차 배터리 공장 건설 현장에서 대규모 이민 단속 작전을 벌였다""고 밝혔다.
이어 ""불법체류자 약 450명을 체포했으며, 이는 지역 사회 안전에 대한 우리의 확고한 의지를 보여준다""고 덧붙였다.
체포된 사람 가운데 한국 국적인 사람은 200∼300명 선인 것으로 전해지고 있다.
아울러 이날 단속에서 체포된 사람이 560명에 달한다는 얘기도 일각에서 나온다.
당국이 현장 공사를 담당하는 업체에 소속된 일용직 노동자 중 불법체류자들을 가려내 체포하는 과정에서, 허용된 체류자격을 넘어선 활동을 한 것으로 의심되는 한국인 출장자들도 대거 체포된 것으로 보인다.
ATF 애틀랜타 지부는 이 소식을 전하면서 현장에서 단속 요원들이 불법체류자들을 검거하는 사진을 함께 올렸다.
이번 단속에 대해 미 국토안보부 관계자는 로이터 통신에 ""사법부 허가를 받아 집행한 작전""이라며 ""우리는 불법 고용 행위를 적극적으로 조사하고 있다""고 말했다.
HSI 조지아주 책임자인 스티븐 슈랑크 특별수사관은 현지 지역 방송으로 중계된 브리핑에서 단속과 관련해 ""체포가 이뤄지고 있다""고 전했다.
HL-GA 배터리회사 선임 홍보 전문가인 메리 베스 케네디는 공식 성명에서 ""우리 건설 현장에서의 활동과 관련해 관계 당국과 전적으로 협력 중이다. 당국의 업무를 지원하기 위해 건설 작업을 일시 중단했다""고 밝혔다.
미 조지아주 현대차-LG엔솔 합작 배터리 공장 불법체류자 단속 현장
[ATF 애틀랜타 지부 엑스(X·옛 트위터) 캡처. 재판매 및 DB 금지]
트럼프 행정부가 관세폭탄 등으로 미국에 대한 대대적인 투자를 압박하고 있지만, 불법 이민 및 불법체류와 관련해서는 대미 투자기업에 대해서도 강경한 법 집행을 하겠다는 의도로 풀이된다.
한국에서 출장 간 사람들은 대부분 회의 참석이나 계약 등을 위한 비자인 B1비자나, 무비자인 전자여행허가(ESTA)를 소지한 채 현지에서 일을 하고 있었던 것으로 파악된다.
이들 역시 '체류목적에 부합하지 않는 활동'을 했다는 이유로 단속의 대상이 된 것으로 알려졌다.
미 조지아주 서배너 엘라벨에 위치한 HMGMA
[현대차그룹 제공. 재판매 및 DB 금지]
체포된 사람 중 상당수는 추가조사를 위해 조지아주 폭스턴에 위치한 ICE 시설로 연행된 것으로 전해졌다.
대대적인 불법체류자 단속 및 추방 정책을 펴고 있는 미국 트럼프 행정부는 외국인 근로자가 다수 일하는 공장이나 농장 등을 급습해 불법체류자로 의심되는 사람들을 체포한 뒤 수용 시설로 이송하고 있다.
이번 일은 미국 체류자격 문제의 엄중성을 간과한 한국 기업들의 직원 파견 관행과 무관치 않다는 지적도 나온다.
조지아주의 한인 기업들 상황에 정통한 이종원 변호사는 연합뉴스와의 통화에서 ""기업들이 정식 주재원 비자를 받으려면 시간이 많이 걸리니 급한 업무를 위해 무비자 단기 방문용인 ESTA(전자여행허가제)를 이용하거나 방문 비자를 받아서 오는 경우가 적지 않다""며 ""B1, B2와 같은 단기 방문 비자나 ESTA로 미국에 입국해 근로를 하면 이민법 위반이 된다""고 말했다.
이 같은 기업들의 관행이 트럼프 행정부 강경한 이민정책에 따른 강화된 단속에 타깃이 된 측면이 있어 보인다.
작년 대선에서 불법이민 이슈는 트럼프 대통령의 최대 득표요인 중 하나였고, 그 정책에 대한 지지를 발판 삼아 트럼프 대통령은 집권 이후 불법체류자 체포 및 추방에 총력전을 펴고 있다.
동시에 트럼프 행정부는 외국 기업의 미국내 제조업 시설 투자를 통한 고용 증대 효과를 환영하는 입장이긴 하지만 자국민이 아닌 불법체류자를 고용하는 데 대해서는 강경한 이민정책의 잣대를 그대로 적용하고 있는 양상이다.
한국인들이 대거 구금됨에 따라 한국 외교부 등 정부 당국은 이들에 대한 영사 지원에 나섰다.
현지를 관할하는 주애틀랜타 한국총영사관은 재미 한인 변호사 등으로 변호인단을 꾸리고 있다. 변호인단은 한국인들이 구금된 시설을 조만간 방문할 예정이라고 총영사관 관계자가 전했다.
B1, B2 등 단기 방문 비자를 받은 사람들이 체류목적 위반 혐의로 체포된 경우 추방에 앞서 이민 법원의 재판을 받아야 하는데 자칫 구금이 길어질 가능성도 배제할 수 없는 것으로 현지 소식통은 전했다.
min22@yna.co.kr",한인구금
파이낸셜뉴스,미국 현대차-LG엔솔 공장서 체포된 한국인 300명 넘어…정부 “유감” ...,네이버뉴스,https://n.news.naver.com/mnews/article/014/0005402461?sid=101,,파이낸셜뉴스,"'美 투자했더니 체포?' 현대차-LG엔솔 공장 짓던 韓300명, 이민당국에 잡혀가","대미투자 상징 현장 급습한 美 이민당국
美 당국 ""475명 체포, 그중 다수가 한국 국적""
현대차 ""구금된 현대차 직원은 없어""
LG엔솔 ""직원들 신속한 구금해제에 적극 협조""
미국에 투자는 투자대로 하면서
투자된 공장 건설 현장서 대규모 단속
한국 본사 직원들까지 체포에 기업들 부담↑
미국 이민당국이 4일(현지시간) 조지아주에 위치한 현대자동차와 LG에너지솔루션이 공동으로 건설 중인 조지아주 브라이언 카운티 소재 전기차 배터리 공장 건설현장을 급습해 불법체류자 혐의가 있는 450여명을 체포했다. 체포된 이들 중에는 출장간 한국인 수십명도 포함돼 있는 것으로 알려졌다. 이번 수사에 참여한 주류·담배·총기·폭발물 단속국 애틀랜타 지부(ATF Atlanta)는 엑스(X, 옛 트위터)를 통해 이번 작전에는 “국토안보수사국(HSI)과 연방수사국(FBI), 마약단속국(DEA), 이민세관단속국(ICEO), 조지아주 순찰국 및 기타 기관이 참여했다”고 밝혔다. (ATF 애틀랜타 X 계정 캡처) /사진=뉴스1화상
[파이낸셜뉴스] 미국 조지아주 서배나에 위치한 현대차그룹-LG에너지솔루션(HL-GA 배터리)의 합작 배터리 공장 건설 현장을 미국 이민당국의 급습해 불법체류자를 단속하는 과정에서 한국 본사 직원 등 한국인 300여명이 체포되는 일이 벌어졌다.
트럼프 행정부의 압박이 거세지는 가운데 대규모 미국 투자의 상징으로 꼽히는 현장에서 한국 직원들을 포함한 한국인들이 대거 체포돼 구금되는 상황이 벌어지면서, 투자는 투자대로 하면서도 각종 제재에 시달리는 대미 투자 현주소가 여실히 드러났다는 지적이 제기되고 있다.
■美 투자상징 현장서 한인 300명 체포돼
미국 국토안보수사국(HSI)은 5일(현지시간) 전날 HL-GA 배터리회사 건설 현장에서 벌인 불법체류자 단속과 관련해 475명을 체포했으며 이중 다수는 한국 국적이라고 발표했다.
국토안보수사국(HSI) 소속 스티븐 슈랭크 조지아·앨라배마주 담당 특별수사관은 이날 브리핑에서 ""이번 수사로 475명이 체포됐으며, 475명 중 다수가 한국 국적자였다""면서 ""미국에 불법적으로 체류 중이거나 체류 자격을 위반한 상태에서 불법적으로 일하고 있었다""고 밝혔다.
이번에 체포된 사람 가운데 한국인은 약 300명인 것으로 추정되고 있다. 본사와 협력업체 직원을 포함해 한국에서 미국 현지로 출장을 간 직원은 50여명으로 알려졌다.
한국에서 미국으로 출장간 직원들 대부분은 회의 참석이나 계약 등 사업목적인 B1·B2 비자 보다 단기 체류 목적의 무비자인 전자여행허가(ESTA)로 미 현지에서 업무를 하다가, 미 이민당국으로부터 단속 대상이 된 것으로 보인다.
LG에너지솔루션은 ""임직원과 협력사 인원들의 안전과 신속한 구금해제를 위해 한국 정부 및 관계 당국과도 적극 협조하고 있다""면서 ""통역 및 변호사 지원 등 필요한 모든 조치를 취하고 있다""고 밝혔다.
현대차 측은 ""현재까지 확인된 바로는 구금된 인원 중 현대차 임직원은 없다""면서도 ""현장에서 근무하는 인원의 안전을 위해 필요한 조치에 최선을 다하겠다""고 전했다.
이번 단속 지역은 '현대차그룹 메타플랜트 아메리카(HMGMA)' 단지 내 전기차 배터리 공사 현장으로, 미 이민당국의 단속 직후 해당 공사 현장은 즉시 가동을 멈췄으나, 인접한 완성차 조립공장은 예정대로 가동 중인 것으로 전해졌다.
현대차의 대규모 대미 투자의 상징으로 평가받는 곳이었지만 투자를 집행하기 위한 공사 현장에서 관련 직원들이 이민당국에 의해 체포되는 일이 발생하자, 국내 산업계의 긴장감은 고조되는 분위기다.
이재웅 외교부 대변인이 5일 오후 서울 종로구 정부서울청사에서 '미국 조지아주 현대자동차-LG에너지솔루션 공장 한국인 포함 불법체류자 체포'와 관련 브리핑을 위해 단상으로 향하고 있다. 외교부는 미국 측의 대응에 유감을 표명하면서 ""미국의 법 집행 과정에서 우리 투자업체의 경제 활동과 우리 국민의 권익이 부당하게 침해되어서는 안 될 것""이라고 강조했다. /사진=뉴시스화상
■대미투자 위축 우려 속 기업들, 예의주시
현대차와 LG에너지솔루션의 HL-GA 배터리 합작법인에선 내년부터 양산을 시작해 약 30GWh 규모의 전기차 배터리를 생산하면서 고성능 전기차 30만대 생산을 한다는 계획이었다.
미국의 관세 인상 여파로 현지 생산에 박차를 가하던 현대차와 LG에너지솔루션 입장에선 이번 공장 공사 현장 단속으로 생산일정에 큰 차질을 빚게 돼 손실이 만만치 않을 전망이다.
현대차는 이번 공장 외에도 미국 현지에서 3만대 규모의 로봇 공장 신설과 루이지애나주에 270만t 규모의 전기로 제철소 건설 등을 추진하고 있지만 당장 이번 이민당국의 단속 여파로 건설 속도에도 영향을 받을 것이란 의견이 지배적이다.
자동차 외에도 부품사, 반도체, 배터리 등 미국 현지에 진출한 기업들은 향후 미국으로 투자 과정에서 과도한 불법체류 단속 등이 사업의 돌발변수로 작용해 부담이 될 것이란 관측도 나온다.
미국 트럼프 행정부는 대대적인 불법체류자 단속 및 추방 정책을 펼치면서 외국인 근로자가 다수 일하는 공장이나 농장 등을 급습해 불법체류자로 의심되는 사람들을 체포해 수용 시설로 이송하고 있다.
실제 최근 ESTA를 이용해 미국에 출장가려다 입국 취소된 사례도 나오는 등 기업들의 미국에서 활동 여건 마련 부담은 커지고 있다.
업계 관계자는 ""한국의 주요 대기업들이 미국에 각각 수십조원 규모의 투자를 하려는데 정작 투자를 실현하는 과정에서 한국 직원들이 체포되는 현실이 당황스럽다""면서 ""이번 일로 미국에서의 인건비 부담은 물론 한국 본사에서 미국 법인을 관리하는 부담 또한 만만치 않게 늘어날 듯 하다""고 지적했다.
#불법체류자 #현대차그룹 #lg에너지솔루션 #배터리 공장 #이민당국",한인구금
한겨레,"美, 현대차-LG엔솔 공장서 불체자 단속…""한국인 등 450명 체포""(종합2보...",네이버뉴스,https://n.news.naver.com/mnews/article/028/0002764953?sid=100,,한겨레,미국 현대차-LG엔솔 공장서 체포된 한국인 300명 넘어…정부 “유감” [영상],"미 정부, 불법 체류자 대거 단속…우리 정부에 정식 통보 안 해
우리 정부 “권익 부당침해 안돼”…이 대통령, 각별히 대처 지시
미 주류·담배·총포 담당국(ATF) 애틀랜타 지부가 조지아주 현대차-엔솔 공장 건설 현장에서 이민 단속 작전을 벌였다면서 X에 올린 사진. ATF 애틀랜타 지부 엑스 캡처 연합뉴스
미국 조지아주의 한국 배터리 공장 건설 현장에서 미국 당국에 체포된 한국인이 300명이 넘는 것으로 알려졌다.
미국 이민세관단속국(ICE)과 국토안보수사국(HSI) 등은 4일(현지시각) 조지아주 서배나에 위치한 현대차그룹-엘지(LG)에너지솔루션(엔솔)의 합작 배터리 공장(HL-GA 배터리회사) 건설 현장에서 대대적인 불법체류자 단속을 벌여 450명 이상을 체포했다. 애초 이 가운데 30여명이 한국인으로 알려졌는데, 기업과 여러 소식통에 따르면 체포된 한국인이 300명이 넘는 것으로 파악됐다.
기업들에 따르면 체포된 450여명 가운데 상당수가 한국인이고, 대다수는 현대차와 엔솔의 건설 관련 협력사 직원으로 추정된다. 미국 당국이 이들을 체포한 정확한 원인은 아직 확인되지 않고 있지만, 한국 출장자들이 정식 취업비자를 받지 않고 회의 참석이나 계약 등을 위한 비자인 비(B)1비자나, 비자 대신 전자여행허가(ESTA)를 소지한 채 일하고 있었던 점을 문제 삼는 것으로 알려졌다.
미 주류·담배·총포 담당국(ATF) 애틀랜타 지부는 4일 엑스(X·옛 트위터) 공식 계정에 올린 글에서 “오늘 HSI(국토안보수사국), ICE(미국이민·세관집행국), 마약단속국(DEA), 조지아주 순찰대 등과 함께 조지아주 브라이언 카운티에 있는 현대차 배터리 공장 건설 현장에서 대규모 이민 단속 작전을 벌였다”며 “불법체류자 약 450명을 체포했으며, 이는 지역 사회 안전에 대한 우리의 확고한 의지를 보여준다”고 밝혔다. ATF 애틀랜타 지부는 이 소식을 전하면서 현장에서 단속 요원들이 불법체류자들을 검거하는 사진을 함께 올렸다. 현지 지역방송 WSAV는 수백 대의 법 집행 차량이 동원된 단속이 이뤄졌다고 보도했다.
미국 당국은 이번 단속에 대해 한국 정부에 아직 아무런 정식 통보를 하지 않았고, 정부는 우리 공관을 통해 이 사안을 파악하고 총영사와 영사를 급파해 연행된 한국인이 정확히 몇 명인지를 비롯해 상황을 파악 중이다. 체포된 한국인들은 추가 조사를 위해 조지아주 폭스턴에 위치한 ICE 시설로 연행된 상태다. 아직 현지가 새벽 시간이어서 우리 총영사와 영사들이 체포된 한국인의 영사 면담을 하지는 못한 상황이다. 주애틀랜타 한국총영사관은 재미 한인 변호사 등으로 변호인단을 꾸리고 있다. 변호인단은 한국인들이 구금된 시설을 조만간 방문할 예정이라고 총영사관 관계자가 전했다.
외교부는 미국 당국의 한국 기업 공장 단속에 대해 우리 국민의 권익이 부당하게 침해돼서는 안 된다며 유감을 표했다. 이재웅 외교부 대변인은 5일 브리핑을 열고 “미국의 법 집행 과정에서 우리 투자업체의 경제활동과 우리 국민의 권익이 부당하게 침해되어서는 안 될 것”이라고 말했다. 이 대변인은 이 사건에 대해 주미 대사관 총영사와 주애틀랜타 총영사관의 영사를 현장에 급파하고, 현지공관 중심으로 현장대책반을 출범시킬 것을 지시하는 등 적극적으로 대처하고 있다고 밝혔다. 이어 “서울에서도 주한미국대사관을 통해 우리의 우려와 유감의 뜻을 전달하고 우리 국민의 정당한 권익이 침해당하지 않도록 각별히 유의해줄 것을 당부했다”고 밝혔다.
이재명 대통령도 이번 사건에 대해 각별한 관심을 가지고 대처를 지시한 것으로 알려졌다.
트럼프 행정부는 한국 등에 고율 관세를 부과하며 미국 제조업을 살리기 위해 대규모 투자를 하라고 압박하고 있지만, 한편에서는 미국 투자기업에 대해 불법 이민과 불법체류와 관련한 단속을 강화하자 기업들은 술렁이고 있다. 관련 기업 관계자는 “트럼프 2기 행정부에서 전자여행허가(ESTA)에 대한 규제가 심해졌다고는 알고 있었는데 이렇게 들어가서 체포까지 할 줄 몰랐다”며 “너무 난감하다”고 말했다.",한인구금
연합뉴스,"美, 현대차-LG엔솔 美공장 덮쳤다…""한국인 다수 체포""",네이버뉴스,https://n.news.naver.com/mnews/article/001/0015607915?sid=104,,연합뉴스,"美, 현대차-LG엔솔 공장서 불체자 단속…""한국인 등 450명 체포""(종합2보)","차량 수백대 동원해 급습…""한국서 출장간 직원도 30명이상 연행돼""
미 당국도 ""약 450명 체포"" 확인…""불법 고용 행위 적극 조사중""
미 조지아주 현대차-LG엔솔 합작 배터리 공장 불법체류자 단속 현장
[ATF 애틀랜타 지부 엑스(X·옛 트위터) 캡처. 재판매 및 DB 금지]
(워싱턴·서울=연합뉴스) 박성민 조준형 특파원 김아람 기자 = 미국 이민세관단속국(ICE)과 국토안보수사국(HSI) 등이 4일(현지시간) 조지아주 서배나에 위치한 현대차그룹-LG에너지솔루션의 합작 배터리 공장(HL-GA 배터리회사) 건설 현장에서 대대적인 불법체류자 단속을 벌인 것으로 파악됐다.
미 주류·담배·총포 담당국(ATF) 애틀랜타 지부는 이날 엑스(X·옛 트위터) 공식 계정에 올린 글에서 ""오늘 HSI, ICE, 마약단속국(DEA), 조지아주 순찰대 등과 함께 조지아주 브라이언 카운티에 있는 현대차 배터리 공장 건설 현장에서 대규모 이민 단속 작전을 벌였다""고 밝혔다.
이어 ""불법체류자 약 450명을 체포했으며, 이는 지역 사회 안전에 대한 우리의 확고한 의지를 보여준다""고 덧붙였다.
ATF 애틀랜타 지부는 이 소식을 전하면서 현장에서 단속 요원들이 불법체류자들을 검거하는 사진을 함께 올렸다.
이번 단속에 대해 미 국토안보부 관계자는 로이터통신에 ""사법부 허가를 받아 집행한 작전""이라며 ""우리는 불법 고용 행위를 적극적으로 조사하고 있다""고 말했다.
HSI 조지아주 책임자인 스티븐 슈랑크 특별수사관은 현지 지역 방송으로 중계된 브리핑에서 단속과 관련해 ""체포가 이뤄지고 있다""고 전했다.
미 조지아주 현대차-LG엔솔 합작 배터리 공장 불법체류자 단속 현장
[ATF 애틀랜타 지부 엑스(X·옛 트위터) 캡처. 재판매 및 DB 금지]
트럼프 행정부가 관세폭탄 등으로 미국에 대한 대대적인 투자를 압박하고 있지만, 불법 이민 및 불법체류와 관련해서는 미국 투자기업에 대해서도 강경한 법 집행을 하겠다는 의도로 풀이된다.
서배나 모닝뉴스(SMN)에 따르면 조지아주 순찰대 관계자는 ""브라이언 카운티에 있는 현대 메타플랜트의 배터리 공장 건설 현장에서 HSI의 범죄 수색영장 집행 작전을 지원했다""고 전했다.
또 현지매체 WSAV는 수백 대의 법 집행 차량이 동원된 가운데, 이날 오전부터 진행된 이번 단속에서 약 450명이 체포됐다고 소개했다.
현지의 한국 영사 업무 담당자에 따르면 '불법체류' 혐의를 받는 이 인원 중에는 한국에서 현지로 출장을 간 직원 30명 이상(협력업체 직원 포함)과, 현지에서 채용된 근로자들이 포함된 것으로 파악됐다.
한국에서 출장 간 사람들은 대부분 회의 참석이나 계약 등을 위한 비자인 B1비자나, 무비자인 전자여행허가(ESTA)를 소지한 채 현지에서 일을 하고 있었던 것으로 파악된다.
이들 역시 '체류목적에 부합하지 않는 활동'을 했다는 이유로 단속의 대상이 된 것으로 알려졌다.
미 조지아주 서배너 엘라벨에 위치한 HMGMA
[현대차그룹 제공. 재판매 및 DB 금지]
당국이 현장 공사를 담당하는 업체에 소속된 일용직 노동자 중 불법체류자들을 가려내 체포하는 과정에서, 허용된 체류자격을 넘어선 활동을 한 것으로 의심되는 한국인 출장자들도 체포된 것으로 파악됐다.
체포된 사람 중 상당수는 추가조사를 위해 조지아주 폭스턴에 위치한 ICE 시설로 연행된 것으로 전해졌다.
현지를 관할하는 주애틀랜타 한국총영사관은 재미 한인 변호사 등으로 변호인단을 꾸리고 있다. 변호인단은 한국인들이 구금된 시설을 조만간 방문할 예정이라고 총영사관 관계자가 전했다.
HL-GA 배터리회사 선임 홍보 전문가인 메리 베스 케네디는 공식 성명에서 ""우리 건설 현장에서의 활동과 관련해 관계 당국과 전적으로 협력 중이다. 당국의 업무를 지원하기 위해 건설 작업을 일시 중단했다""고 밝혔다.
대대적인 불법체류자 단속 및 추방 정책을 펴고 있는 미국 트럼프 행정부는 외국인 근로자가 다수 일하는 공장이나 농장 등을 급습해 불법체류자로 의심되는 사람들을 체포한 뒤 수용 시설로 이송하고 있다.
min22@yna.co.kr",한인구금
메트로신문,"美, 현대차·LG엔솔 조지아 배터리 공장 불체자 단속…한국인 포함 450명...",,,,,,,한인구금
