press,title,naver_news_text,naver_news_url,body,press_html,title_html,body_html,label
쿠키뉴스,"""위기를 기회로, 더 큰 60년 여는 전환점""… 김완기 특허청장, 새해정책...",,,,,,,정책방향
뉴시스,"'15분도시 구체화'…부산시, 바뀐 도시·주거환경정비계획 시행",네이버뉴스,https://n.news.naver.com/mnews/article/003/0012991860?sid=102,,뉴시스,"'15분도시 구체화'…부산시, 바뀐 도시·주거환경정비계획 시행","하도급 혜택 6→15% 확대
디자인 혁신 시 기준 용적률↑
[부산=뉴시스] 하경민 기자 = 부산 연제구 부산시청. yulnetphoto@newsis.com
[부산=뉴시스]권태완 기자 = 부산시는 도시 및 주거환경 정비사업의 새로운 방향성을 제시하는 '2030 부산시 도시·주거환경 정비기본계획(변경)'을 마련하고 1일부터 시행한다고 밝혔다.
정비기본계획은 기존에 수립된 계획의 타당성을 검토하고, 관련법과 사회적인 여건 변화 등을 반영해 민선 8기 정책 방향에 부합하는 주거지 정비·보전 및 관리를 하기 위한 종합계획이다.
시는 지난해 7월 정비기본계획을 위한 용역을 착수한 뒤 전문가 자문과 중간 보고회 등을 거쳐 계획안을 마련했다.
이번 계획은 '시민과 공공이 함께 만드는 살고 싶은 도시, 부산'을 비전으로, '15분 도시' 구체화, 도시 균형발전 및 도시경쟁력 향상을 정책 목표로 삼고 있다.
이를 실현하기 위해 시는 ▲지역경제 활성화 ▲디자인 혁신 유도 ▲밀도 계획 조정 ▲다양한 생활 사회기반시설(SOC) 공급 유도 등을 추진한다.
계획의 주요 내용으로 지역 건설업체 활성화를 위해 하도급 혜택을 기존 6%에서 최대 15%로 2배 이상 확대해 지역건설업체 참여를 유도하고 자본의 역외 유출을 방지해 지역경제에 활력을 불어넣을 계획이다.
시는 또 도시 균형과 디자인 혁신 등을 고려해 경관 및 주거관리 구역은 디자인 혁신 시 기준 용적률을 각각 최대 220%, 230%로 상향 조정하고, 지역 여건이 양호한 주거 정비구역 및 개발유도 구역은 디자인 혁신 시 각각 기준 용적률을 최대 250%, 270%까지 적용할 수 있도록 밀도 계획을 조정했다.
시는 이를 통해 도시 미관과 건축 품질을 끌어올려 도시경쟁력을 높이고자 한다.
아울러 시는 생활권 계획을 개선해 도로와 공원 중심의 기반 시설 범위를 문화와 체육시설까지 확대하고, 보행 친화 도시 조성을 위해 녹화가로, 생활권 연결가로를 신설해 생활가로 환경을 개선할 계획이다.
하성태 시 주택건축국장은 ""이번 정비기본계획이 정비사업의 기본 방향을 구체화해 지역 건설산업 활력 회복과 주민 생활환경 개선에 기여할 것으로 기대한다""며 ""특히 '15분 도시'를 실현하기 위해 사회기반시설(SOC) 확충과 보행 친화적인 가로환경 조성을 강화해 '살고 싶은 도시, 부산'을 만들어 나갈 계획""이라고 말했다．",정책방향
뉴시스,부산 건설업체 하도급 혜택 15%까지 대폭 늘린다,네이버뉴스,https://n.news.naver.com/mnews/article/003/0012991860?sid=102,,뉴시스,"'15분도시 구체화'…부산시, 바뀐 도시·주거환경정비계획 시행","하도급 혜택 6→15% 확대
디자인 혁신 시 기준 용적률↑
[부산=뉴시스] 하경민 기자 = 부산 연제구 부산시청. yulnetphoto@newsis.com
[부산=뉴시스]권태완 기자 = 부산시는 도시 및 주거환경 정비사업의 새로운 방향성을 제시하는 '2030 부산시 도시·주거환경 정비기본계획(변경)'을 마련하고 1일부터 시행한다고 밝혔다.
정비기본계획은 기존에 수립된 계획의 타당성을 검토하고, 관련법과 사회적인 여건 변화 등을 반영해 민선 8기 정책 방향에 부합하는 주거지 정비·보전 및 관리를 하기 위한 종합계획이다.
시는 지난해 7월 정비기본계획을 위한 용역을 착수한 뒤 전문가 자문과 중간 보고회 등을 거쳐 계획안을 마련했다.
이번 계획은 '시민과 공공이 함께 만드는 살고 싶은 도시, 부산'을 비전으로, '15분 도시' 구체화, 도시 균형발전 및 도시경쟁력 향상을 정책 목표로 삼고 있다.
이를 실현하기 위해 시는 ▲지역경제 활성화 ▲디자인 혁신 유도 ▲밀도 계획 조정 ▲다양한 생활 사회기반시설(SOC) 공급 유도 등을 추진한다.
계획의 주요 내용으로 지역 건설업체 활성화를 위해 하도급 혜택을 기존 6%에서 최대 15%로 2배 이상 확대해 지역건설업체 참여를 유도하고 자본의 역외 유출을 방지해 지역경제에 활력을 불어넣을 계획이다.
시는 또 도시 균형과 디자인 혁신 등을 고려해 경관 및 주거관리 구역은 디자인 혁신 시 기준 용적률을 각각 최대 220%, 230%로 상향 조정하고, 지역 여건이 양호한 주거 정비구역 및 개발유도 구역은 디자인 혁신 시 각각 기준 용적률을 최대 250%, 270%까지 적용할 수 있도록 밀도 계획을 조정했다.
시는 이를 통해 도시 미관과 건축 품질을 끌어올려 도시경쟁력을 높이고자 한다.
아울러 시는 생활권 계획을 개선해 도로와 공원 중심의 기반 시설 범위를 문화와 체육시설까지 확대하고, 보행 친화 도시 조성을 위해 녹화가로, 생활권 연결가로를 신설해 생활가로 환경을 개선할 계획이다.
하성태 시 주택건축국장은 ""이번 정비기본계획이 정비사업의 기본 방향을 구체화해 지역 건설산업 활력 회복과 주민 생활환경 개선에 기여할 것으로 기대한다""며 ""특히 '15분 도시'를 실현하기 위해 사회기반시설(SOC) 확충과 보행 친화적인 가로환경 조성을 강화해 '살고 싶은 도시, 부산'을 만들어 나갈 계획""이라고 말했다．",정책방향
아시아경제,"부산시, 하도급 혜택 배 늘리고 ‘15분 도시’ 기반 강화",네이버뉴스,https://n.news.naver.com/mnews/article/277/0005526170?sid=102,,아시아경제,부산 건설업체 하도급 혜택 15%까지 대폭 늘린다,"부산시, 새해 ‘도시정비기본계획’ 변경안 시행
부산시가 지역 건설업체 하도급 인센티브를 기존보다 2배 넘는 최대 15%까지 끌어올리는 파격적인 도시정비 계획을 새해부터 시행한다.
부산시는 도시 및 주거환경 정비사업의 새로운 방향성을 제시하는 ‘2030 부산광역시 도시·주거환경 정비기본계획’ 변경안을 마련해 1일부터 시행한다고 밝혔다.
변경된 ‘정비기본계획’은 도시 및 주거환경정비법 제4조에 따라 기존 수립된 정비기본계획의 타당성을 검토하고 관련법과 사회적인 여건 변화 등을 반영해 민선 8기 정책 방향에 부합하는 주거지 정비·보전 및 관리를 하기 위한 종합계획이다.
부산시는 2023년 7월 정비기본계획을 위한 용역을 착수한 이후 전문가 자문, 중간 보고회 등을 거쳐 계획안을 마련했다. 이후 행정절차를 이행하고 도시계획위원회 심의를 완료해 변경된 ‘2030 부산광역시 도시·주거환경 정비기본계획’을 확정했다.
이번 계획은 ‘시민과 공공이 함께 만드는 살고 싶은 도시, 부산’을 비전으로 삼아 ‘15분 도시’ 구체화, 도시 균형발전 및 도시경쟁력 향상을 정책 목표로 삼고 있다. 이를 실현하기 위해 ▲지역경제 활성화 ▲디자인 혁신 유도 ▲밀도계획 조정 ▲다양한 생활 사회기반시설(SOC) 공급 유도 등을 중심으로 추진한다.
계획의 주요 내용으로 지역 건설업체 활성화를 위해 하도급 인센티브를 기존 6%에서 최대 15%로 2배 이상 확대해 지역건설업체 참여를 유도하고 자본의 역외 유출을 방지해 지역경제에 활력을 불어넣을 계획이다.
또 도시 균형발전과 디자인 혁신 등을 고려해 ▲경관 및 주거관리 구역은 디자인 혁신 시 기준용적률을 각각 최대 220% 및 230%로 상향 조정하고, ▲지역 여건이 양호한 주거정비구역 및 개발유도구역은 디자인 혁신 시 각각 기준용적률을 최대 250% 및 270%까지 적용할 수 있도록 밀도계획을 조정했다.
생활권 계획도 개선해 도로와 공원 중심의 기반시설 범위를 문화시설과 체육시설까지 확대하고 보행친화 도시 조성을 위해 녹화가로와 생활권 연결가로를 신설해 생활가로 환경을 개선한다.
하성태 시 주택건축국장은 “정비사업의 기본방향을 구체화해 지역 건설산업의 활력 회복과 주민 생활환경 개선에 기여할 것으로 기대한다”라며, “특히 ‘15분 도시’를 실현하기 위해 생활 SOC 확충과 보행 친화적인 가로환경 조성을 강화하고 건축디자인 혁신을 통해 도시경쟁력을 높일 계획”이라고 힘줬다.
부산시청.",정책방향
부산일보,"부산, ‘15분 도시’ 구체화…용적률·하도급 인센티브 상향",네이버뉴스,https://n.news.naver.com/mnews/article/082/0001305655?sid=101,,부산일보,"부산시, 하도급 혜택 배 늘리고 ‘15분 도시’ 기반 강화","새해 도시·주거 환경 정비 시행
하도급 혜택 6→15%로 확대해
지역 건설 활력·경제구조 강화
기준 용적률 최대 230%로 상향
경관 관리·건축 품질 개선 도모
생활 기반시설·보행 환경도 개선
부산시청 전경. 부산일보DB
올해부터 부산 지역 건설업체의 하도급 혜택이 배 이상 늘어나고, 경관·주거 관리 구역 등의 기준 용적률도 확대된다. 또한 ‘15분 도시’ 실현을 앞당기기 위해 생활권 기반시설 계획이 강화되고, 녹지 가로의 접근성도 높아져 보행 환경도 대폭 개선될 것으로 기대된다.
부산시는 1일부터 새로운 도시·주거 환경 정비 방향을 담은 ‘2030 부산광역시 도시·주거 환경 정비기본계획’을 본격적으로 시행한다고 밝혔다. 시는 ‘도시 및 주거환경정비법’ 제4조에 따라 기존 정비기본계획의 타당성을 검토했다. 이어 관련 법령과 사회적 환경 변화, 민선 8기의 정책 방향을 반영해 주거지 정비와 관리의 종합적인 청사진을 제시하기 위해 수립했다.
이번 변경 계획은 2023년 7월부터 용역이 시작됐으며, 전문가 자문과 중간 보고회를 거쳐 초안을 마련했다. 이후 행정절차를 이행하고 도시계획위원회의 심의를 통해 최종적으로 확정됐다. 시는 이를 통해 도시 정비사업의 새로운 방향을 제시하고, 지역 경제 활성화와 주민 생활환경 개선이라는 두 가지 목표를 동시에 달성한다는 계획이다.
시는 이번 계획의 비전을 ‘시민과 공공이 함께 만드는 살고 싶은 도시, 부산’으로 설정했다. 이를 구체화하기 위해 ‘15분 도시’ 실현, 도시 균형 발전, 도시 경쟁력 향상을 정책 목표로 제시했다. 이를 바탕으로 △지역 경제 활성화 △건축 디자인 혁신 △밀도 계획 조정 △다양한 생활 사회기반시설(SOC) 확충 등을 핵심 추진 전략으로 삼았다.
특히 지역 건설업체의 활력을 높이기 위해 하도급 혜택을 기존 6%에서 최대 15%로 배 이상 확대한다. 이를 통해 지역 업체의 참여를 적극 유도하며, 자본이 외부로 빠져나가는 현상을 억제하는 것과 동시에 지역 경제의 순환 구조 강화를 도모한다.
도시 균형발전과 미관 개선을 위해 경관·주거 관리 구역의 기준 용적률을 각각 최대 220%와 230%로 상향 조정했다. 여건이 양호한 주거 정비 구역과 개발 유도 구역은 각각 최대 250%와 270%까지 용적률을 확대 적용할 수 있도록 밀도 계획이 변경됐다. 이는 도시의 전반적인 품격을 높이고, 건축 품질을 개선해 도시 경쟁력을 강화하려는 취지다.
시는 생활권 기반시설 계획도 개선한다. 기존의 도로와 공원 중심의 기반시설을 문화시설과 체육시설로 확대해 주민들이 다양한 생활 편의를 누릴 수 있도록 했다. 동시에 보행 친화적인 도시 조성을 목표로 녹지 가로와 생활권 연결 가로를 신설, 주민들의 보행 환경을 크게 개선할 예정이다.
부산시 하성태 주택건축국장은 “이번 정비기본계획 변경은 정비사업의 방향을 명확히 하고, 지역 건설업계에 활력을 불어넣는 한편, 주민들의 생활환경을 질적으로 개선하는 데 기여할 것”이라며 “생활 기반시설 확충과 보행 친화 환경 강화, 건축 디자인 혁신을 통해 도시 경쟁력을 한층 높여 ‘살고 싶은 도시 부산’을 만들어갈 계획”이라고 강조했다.",정책방향
파이낸셜뉴스,부산시 하도급 인센티브 확대·용적률 상향,네이버뉴스,https://n.news.naver.com/mnews/article/014/0005289683?sid=102,,파이낸셜뉴스,"부산, ‘15분 도시’ 구체화…용적률·하도급 인센티브 상향","바뀐 도시·주거환경 정비 기본계획 1일부터 시행
부산시청사 전경.
[파이낸셜뉴스] 부산시는 도시 및 주거환경 정비사업의 새로운 방향성을 제시하는 '2030 부산시 도시·주거환경 정비기본계획'을 1일부터 시행한다고 밝혔다.
정비기본계획은 기존에 수립된 계획의 타당성을 검토하고, 관련법과 사회적인 여건 변화 등을 반영해 민선 8기 정책 방향에 부합하는 주거지 정비·보전 및 관리를 하기 위한 종합계획이다.
시는 지난해 7월 정비기본계획을 위한 용역에 들어가 전문가 자문과 중간 보고회 등을 거쳐 계획안을 새로 마련했다.
이번 계획은 '시민과 공공이 함께 만드는 살고 싶은 도시, 부산'을 비전으로, '15분 도시' 구체화, 도시 균형발전 및 도시경쟁력 향상을 정책 목표로 삼고 있다. 이를 실현하기 위해 △지역경제 활성화 △디자인 혁신 유도 △밀도 계획 조정 △다양한 생활 사회기반시설(SOC) 공급 유도 등을 추진한다.
시는 우선, 지역 건설업체 활성화를 위해 하도급 인센티브를 6%에서 최대 15%로 2배 이상 확대한다. 이를 통해 지역건설업체 참여를 유도하고 자본의 역외 유출을 방지, 지역경제에 활력을 불어넣겠다는 계획이다.
또, 도시 균형발전과 디자인 혁신 등을 고려해 △경관 및 주거관리 구역은 용적률을 각각 최대 220%, 230%로 상향 조정하고 △지역 여건이 양호한 주거 정비구역 및 개발유도 구역은 용적률을 최대 250%, 270%까지 적용할 수 있도록 밀도 계획을 조정했다. 이를 통해 도시 미관과 건축 품질을 끌어올려 도시경쟁력을 높인다는 계획이다.
시는 생활권 계획을 개선해 도로와 공원 중심의 기반 시설 범위를 문화·체육시설까지 확대하고, 보행 친화 도시 조성을 위해 녹화가로, 생활권 연결가로를 신설해 생활가로 환경을 개선하기로 했다.
하성태 시 주택건축국장은 “이번 정비기본계획이 지역 건설산업 활력 회복과 주민 생활환경 개선에 기여할 것으로 기대한다”며 “특히 ‘15분 도시’를 실현하기 위해 사회기반시설(SOC) 확충과 보행 친화적인 가로환경 조성을 강화해 ‘살고 싶은 도시, 부산’을 만들어 나갈 계획""이라고 말했다.",정책방향
