press,title,naver_news_text,naver_news_url,body,press_html,title_html,body_html,label
서울경제,사우디 찾은 이해진…스테이블코인등 협력 추진,네이버뉴스,https://n.news.naver.com/mnews/article/011/0004558229?sid=105,,서울경제,"이해진 의장 직접 나섰다…네이버, 사우디와 스테이블코인 협력 강화","18일 사우디서 자치행정주택부 장관 회동
스테이블코인·디지털센터 건립 지원 방안 논의
두나무와 결합 앞두고 글로벌 사업 확대 행보
부동산 토큰화, 사우디 자산 연동 코인 등 가능성
지난 18일(현지 시간) 이해진(왼쪽) 네이버 의장과 마지드 알 호가일 사우디 자치행정주택부(MOMRAH) 장관이 사우디 리야드에서 열린 ‘시티스케이프 글로벌 엑스포2025’ 현장에서 만나 선물을 교환하고 있다. SPA
[서울경제]
이해진 네이버 의장이 사우디아라비아의 장관을 만나 기존 협력 관계를 디지털 금융 분야까지 확대하는 방안을 논의했다. 네이버파이낸셜과 두나무의 포괄적 주식교환을 앞두고 이 의장이 사우디 정부와의 협력 범위를 스테이블코인과 인공지능(AI) 데이터센터 분야까지 넓히는 모습이다.
20일 사우디의 국영 뉴스통신사인 SPA에 따르면 이 회장은 18일(현지 시간) 사우디 리야드에서 열린 ‘시티스케이프 글로벌 엑스포2025’에 참여해 마지드 알 호가일 사우디 자치행정주택부(MOMRAH) 장관을 회동했다. SPA는 이번 회동이 기존 파트너십을 강화하기 위한 목적이라고 설명했다. 앞서 2023년 3월 네이버와 사우디 자치행정주택부는 사우디 정부가 추진하는 국가 차원의 디지털 전환(DX)에 다각적으로 협력한다는 내용의 업무협약(MOU)을 체결한 바 있다. 당시 협약 이후 네이버는 보유 공간기술을 이용해 사우디의 세 도시인 메카, 메디나, 제다의 디지털 트윈을 구축하며 도시개발 분야의 디지털 전환(DX)을 지원했다.
사우디 측은 이 의장과 알 호가일 장관이 도시개발 관련한 금융과 데이터센터 협력을 주로 논의했다고 설명했다. SPA는 구체적으로 “회의에서는 부동산 투자 및 기타 경제 부문에 연계된 ‘스테이블 코인(stable digital currencies)’ 분야에서 협력 범위를 확대할 기회가 논의 됐다”며 “또한 데이터센터 개발 프로젝트에 관한 공동 작업을 진전시키는 방안이 다루어 졌다”고 전했다.
스테이블코인과 관련 업계에서는 사우디의 대규모 부동산 자산을 토큰증권(STO) 형태로 분할하거나 부동산 가치에 연동된 실물자산 담보 스테이블코인을 스마트시티 내 결제 수단으로 적용하는 등에 활용될 수 있다고 보고 있다.
특히 이번 논의는 네이버파이낸셜이 26일 두나무와의 포괄적 주식교환 안건 상정을 앞두고 이뤄졌다. 양사의 주식교환이 스테이블코인의 발행과 운용 생태계를 갖추기 위한 결정인 만큼 이번 사우디와의 디지털 금융 협력 논의는 합병 후 글로벌 스테이블 사업 확장을 위한 행보로 풀이된다.
데이터센터 개발은 각 세종 등 네이버의 데이터센터 사업 경험을 활용해 사우디의 AI인프라 구축을 지원하는 방향으로 보인다. 이와 관련 사우디는 미래 신도시 네옴의 첨단산업단지 ‘옥사곤’에서 대규모 데이터센터 가동을 목표로 하고 있다. 이밖에 사우디 측은 네이버와 사우디 정부가 신흥 기술 분야에서 연구개발 협력을 강화하는 방안, 과학기술 분야 교류 프로그램 지원 방안 등을 논의했다고 전했다.
SPA는 “이번 회의는 부처가 구축 중인 국제 파트너십을 바탕으로 이루어진 것”이라며 “지방행정과 부동산 부문의 발전과 사우디 비전 2030 목표 달성을 위해 첨단 기술과 혁신적 디지털 솔루션을 도입하려는 정부의 의지를 반영하는 것”이라고 말했다.",스테이블코인
파이낸셜뉴스,"이해진 의장, 사우디서스테이블코인·데이터센터 건립 논의",네이버뉴스,https://n.news.naver.com/mnews/article/014/0005437722?sid=105,,파이낸셜뉴스,사우디 찾은 이해진… 스테이블코인 등 협력 추진,"시티스케이프 글로벌 2025 참석
부동산 투자·디지털 금융 등 논의
이해진 네이버 창업자 겸 이사회 의장(사진)이 직접 사우디아라비아를 찾아 협력 관계를 스테이블코인 등 디지털 금융 분야까지 확대하는 방안을 논의했다.
20일 네이버와 사우디 국영 통신 'SPA' 등 따르면 이 의장은 지난 18일(현지 시간) 사우디 리야드에서 열린 '시티스케이프 글로벌 2025'에서 마지드 알 호가일 사우디 지방자치주택부 장관을 만났다. SPA는 이번 회동이 기존 파트너십을 강화하기 위한 목적이라고 설명했다. 앞서 2023년 3월 네이버와 사우디 자치행정주택부는 사우디 정부가 추진하는 국가 차원의 디지털 전환(DX)에 다각적으로 협력한다는 내용의 업무협약(MOU)을 체결한 바 있다.
이 의장과 사우디 정부는 부동산 투자 및 기타 경제 부문과 연계된 스테이블 코인 등 디지털 화폐 분야에서 협력 확대 기회와 데이터 센터 개발 프로젝트 공동 진행 방안에 대해 논의했다. 아울러 신기술 분야의 연구개발 협력 강화와 양국간 과학기술 분야 교류·협력 프로그램 지원 전망을 검토했다.
사우디아라비아에 진출한 네이버는 지난 5월 사우디 주택공사(NHC)와 합작법인 '네이버 이노베이션'을 설립하며 사우디 디지털 트윈 기반 스마트 시티 구축 사업을 이끌고 있다. 현재 메카·메디나·제다 등 3개 도시의 디지털 트윈 구축을 마쳤으며 '발라디 디지털 트윈 프로젝트' 2단계 협력도 진행 중이다. 한편, 네이버는 지난 17일부터 이날까지 사우디아라비아 리야드에서 열리는 시티스케이프 글로벌 2025에 참가해 건축 분야 IT 기술을 선보인다고 밝힌 바 있다. 시티스케이프는 건설, 건축, 부동산 분야 세계 최대 규모 전시회다. 이번 전시에서 네이버는 디지털 트윈, 인공지능(AI), 클라우드 등 첨단 기술이 적용된 부동산과 도시 운영 사례를 소개했다.
wongood@fnnews.com 주원규 기자",스테이블코인
아시아경제,"""선진국은스테이블코인활성화 중…韓도 빨리 관련법 마련해야""",네이버뉴스,https://n.news.naver.com/mnews/article/277/0005681915?sid=101,,아시아경제,"""선진국은 스테이블코인 활성화 중…韓도 빨리 관련법 마련해야""","JP모간·소시에테 등 자체 스테이블 코인 도입 잰걸음
한국은 아직 걸음마 단계
관련법 조속히 마련해야
미국과 유럽 등 선진국 금융기관이 스테이블코인 도입을 서두르고 있어 우리나라도 큰 흐름에서 뒤처지지 않기 위해 조속히 관련 법규를 마련하고 원화 스테이블코인을 도입할 필요가 있다는 주장이 나왔다.
20일 한국산업은행 미래전략연구소의 '금융권의 스테이블코인 추진 현황' 보고서에 따르면 미국과 유럽, 호주 등 주요 선진국 금융기관들은 수년 전부터 스테이블코인을 발행해 실제 거래에 활용하는 등 도입에 속도를 내고 있다.
스테이블코인은 달러 등 특정 자산과 1대1로 연동해 가치 안정성을 추구하는 가상자산이다.
테더(USDT)와 USD코인 등이 대표적이다.
미국의 JP모간은 2020년 달러 스테이블코인의 일종인 JPM코인을 도입해 기업 등 제한된 고객을 대상으로 연중무휴 실시간 결제에 사용하고 있다. 달러 예치금을 스테이블코인으로 디지털화해 거래 속도를 단축하고 24시간 즉시 결제를 지원하는 등 기존 은행의 업무 시간·장소 제한을 극복하는 데 활용 중이다.
프랑스의 소시에테제네랄도 2023년 유로화 스테이블코인인 EURCV를 공개해 그룹 내 금융기관을 중심으로 사용하다가, 점차 기업 고객 등으로 이용 대상을 확대하고 있다. 호주의 호주뉴질랜드은행(ANZ)도 2022년 호주달러와 연동된 스테이블코인을 도입해 탄소배출권 거래 등 기관 간 결제에 활용하고 있다. 일본의 미쓰비시와 미즈호은행 등 대형은행들도 엔화 스테이블코인에 대한 실증 테스트를 진행 중이다.
국가 차원에서도 스테이블코인의 안정성을 확보하기 위한 규제를 마련하고 있다. 미국은 지난 7월 스테이블코인 규제 법안인 '지니어스 액트'를 통과시켜 스테이블코인을 제도권에 편입했다. 유럽연합(EU)도 지난해 가상자산시장법(MiCA)을 시행해 스테이블코인의 발행 주체와 준비자산 요건을 규정했다.
이들 법안은 공통적으로 ▲스테이블코인의 가치를 유지하는 준비자산(담보)을 최소 1대1 이상으로 보유 ▲준비자산은 현금·예금 등 유동성이 높은 자산으로 구성 ▲결제용 발행인 만큼 이자 지급은 불가 등을 주요사항으로 규정했다.
보고서는 선진국 금융기관들이 스테이블코인을 통해 결제·송금 방식의 효율성을 높이는 동시에 관련 인프라를 도입하지 않으면 금융 생태계에서 배제될 수 있다는 우려가 커 발행 시점을 앞당기고 있다고 분석했다.
서대훈 한국산업은행 미래전략연구소 연구원은 ""소비자가 한번 익숙해지면 다른 시스템을 사용하지 않으려는 락인(lock-in) 효과를 고려해 해외 금융기관들이 스테이블코인 도입을 서두르고 있다""고 설명했다.
해외 주요 금융기관의 빠른 도입 속도와 달리 국내에서는 아직 관련 법규 제정도 이뤄지지 않아 뒤처질 수 있다는 우려가 크다. 국내에서는 국민은행·신한은행·우리은행·농협은행 등 주요 6개 은행과 금융결제원이 스테이블코인 공동 발행을 위한 컨소시엄을 구성해 검토하는 등 은행 중심의 발행 논의가 초기 단계에서 진행되고 있다.
서 연구원은 ""원화 스테이블코인은 단기적으로 기관 간 지급결제 등에서 사용되고, 소규모 발행을 통한 실증 테스트가 이뤄질 것으로 보여 수요가 제한적일 것""이라며 ""본격적인 도입을 위해서는 해외 사례처럼 관련 법규의 조속한 제정이 필요하다""고 강조했다.",스테이블코인
아시아경제,"스테이블코인잰걸음 중인 은행들, 정부만 바라보는데",네이버뉴스,https://n.news.naver.com/mnews/article/277/0005681915?sid=101,,아시아경제,"""선진국은 스테이블코인 활성화 중…韓도 빨리 관련법 마련해야""","JP모간·소시에테 등 자체 스테이블 코인 도입 잰걸음
한국은 아직 걸음마 단계
관련법 조속히 마련해야
미국과 유럽 등 선진국 금융기관이 스테이블코인 도입을 서두르고 있어 우리나라도 큰 흐름에서 뒤처지지 않기 위해 조속히 관련 법규를 마련하고 원화 스테이블코인을 도입할 필요가 있다는 주장이 나왔다.
20일 한국산업은행 미래전략연구소의 '금융권의 스테이블코인 추진 현황' 보고서에 따르면 미국과 유럽, 호주 등 주요 선진국 금융기관들은 수년 전부터 스테이블코인을 발행해 실제 거래에 활용하는 등 도입에 속도를 내고 있다.
스테이블코인은 달러 등 특정 자산과 1대1로 연동해 가치 안정성을 추구하는 가상자산이다.
테더(USDT)와 USD코인 등이 대표적이다.
미국의 JP모간은 2020년 달러 스테이블코인의 일종인 JPM코인을 도입해 기업 등 제한된 고객을 대상으로 연중무휴 실시간 결제에 사용하고 있다. 달러 예치금을 스테이블코인으로 디지털화해 거래 속도를 단축하고 24시간 즉시 결제를 지원하는 등 기존 은행의 업무 시간·장소 제한을 극복하는 데 활용 중이다.
프랑스의 소시에테제네랄도 2023년 유로화 스테이블코인인 EURCV를 공개해 그룹 내 금융기관을 중심으로 사용하다가, 점차 기업 고객 등으로 이용 대상을 확대하고 있다. 호주의 호주뉴질랜드은행(ANZ)도 2022년 호주달러와 연동된 스테이블코인을 도입해 탄소배출권 거래 등 기관 간 결제에 활용하고 있다. 일본의 미쓰비시와 미즈호은행 등 대형은행들도 엔화 스테이블코인에 대한 실증 테스트를 진행 중이다.
국가 차원에서도 스테이블코인의 안정성을 확보하기 위한 규제를 마련하고 있다. 미국은 지난 7월 스테이블코인 규제 법안인 '지니어스 액트'를 통과시켜 스테이블코인을 제도권에 편입했다. 유럽연합(EU)도 지난해 가상자산시장법(MiCA)을 시행해 스테이블코인의 발행 주체와 준비자산 요건을 규정했다.
이들 법안은 공통적으로 ▲스테이블코인의 가치를 유지하는 준비자산(담보)을 최소 1대1 이상으로 보유 ▲준비자산은 현금·예금 등 유동성이 높은 자산으로 구성 ▲결제용 발행인 만큼 이자 지급은 불가 등을 주요사항으로 규정했다.
보고서는 선진국 금융기관들이 스테이블코인을 통해 결제·송금 방식의 효율성을 높이는 동시에 관련 인프라를 도입하지 않으면 금융 생태계에서 배제될 수 있다는 우려가 커 발행 시점을 앞당기고 있다고 분석했다.
서대훈 한국산업은행 미래전략연구소 연구원은 ""소비자가 한번 익숙해지면 다른 시스템을 사용하지 않으려는 락인(lock-in) 효과를 고려해 해외 금융기관들이 스테이블코인 도입을 서두르고 있다""고 설명했다.
해외 주요 금융기관의 빠른 도입 속도와 달리 국내에서는 아직 관련 법규 제정도 이뤄지지 않아 뒤처질 수 있다는 우려가 크다. 국내에서는 국민은행·신한은행·우리은행·농협은행 등 주요 6개 은행과 금융결제원이 스테이블코인 공동 발행을 위한 컨소시엄을 구성해 검토하는 등 은행 중심의 발행 논의가 초기 단계에서 진행되고 있다.
서 연구원은 ""원화 스테이블코인은 단기적으로 기관 간 지급결제 등에서 사용되고, 소규모 발행을 통한 실증 테스트가 이뤄질 것으로 보여 수요가 제한적일 것""이라며 ""본격적인 도입을 위해서는 해외 사례처럼 관련 법규의 조속한 제정이 필요하다""고 강조했다.",스테이블코인
비즈워치,"[더벨]은행연합회, 맥킨지에스테이블코인용역 맡긴다",네이버뉴스,https://n.news.naver.com/mnews/article/648/0000041977?sid=101,,비즈워치,"스테이블코인 잰걸음 중인 은행들, 정부만 바라보는데","다음주 정무위 법안소위서 논의 어려워
금융위 ""관계부처와 문제점 짚어보는 중""
은행, 협의체 구성·상표권 출원 마쳐
연내 가상자산 2단계 법안 발의를 장담할 수 없게 되면서 은행권 스테이블코인 결제 사업 추진도 지연될 가능성이 커졌다. 은행들은 스테이블코인 도입 논의가 시작됨과 동시에 만반의 준비를 해 둔 상태여서 법제화만 된다면 언제든 시범사업부터 추진할 수 있다는 입장이다.
관건은 금융당국의 정부안 제출인데, 현재 세부내용을 놓고 조율을 거듭하고 있는 것으로 알려졌다.
./그래픽=비즈워치
20일 관련업계에 따르면 다음주 국회 정무위원회 법안심사소위원회에서 스테이블코인 논의는 어려울 전망이다. 금융위원회에서 정부안을 확정하지 못하고 있어 국회도 관련 법안 발의가 늦어지고 있다. 여당은 지난 9월 디지털자산 태스크포스(TF)를 출범해 금융위 등과 논의를 해왔지만 큰 틀에서의 합의만 했을 뿐 세부내용 조율에서 속도를 내지 못하고 있는 상황이다.
정무위 소속 한 여당 관계자는 ""다음주가 법안소위인데 스테이블코인은 논의 테이블에 올라오지 않았다""면서 ""연내 법안 발의는 사실상 쉽지 않다고 보고 있다""고 말했다.
금융위는 스테이블코인 발행사를 비은행으로 확장했을 때 발생할 문제점 등을 신중하게 들여다보고 있는 것으로 보인다. 이와 관련 최근 열린 국회 예산결산특별위원회에서 이억원 금융위원장은 ""예상되는 문제점을 관계부처와 짚어보고 있다""고 언급했다. 여당에서는 금융위가 가장 중요하게 보는 이 부분이 해결되면 연내 정부안 마련이 가능할 수도 있다고도 보고 있다.
여당에서는 벌써 전자금융거래법이나 외국환거래법 등 관련한 후속 법안도 논의 중이다. 스테이블코인은 법정화폐와 1대 1 교환할 수 있는 암호화폐로 전 세계에서 새로운 결제 수단으로 떠오르고 있다. 스테이블코인 시장을 빠르게 키우려는 만큼 은행 등과의 만남에서 거론된 규제를 완화하는 방향으로 후속 법안을 마련할 것으로 예상된다.
그간 은행들은 디지털자산 TF와 만나 스테이블코인 도입 필요성에 공감하고, 은행이 스테이블코인 주 발행사가 됐을 때 어떤 강점이 있는지 등을 피력해 왔다. 앞서 은행들은 은행권 스테이블코인 협의체를 구성했고, 스테이블코인 상표권을 출원했다.
다만 법제화 지연으로 구체적인 사업을 하지 못하고 있다. NH농협이 최근 부과세 환급 전 과정을 블록체인과 스테이블코인으로 자동화하는 시범사업을 추진하긴 했지만, 결제 관련한 시범사업은 아직이다. 신한은행의 경우 자사 배달앱 땡겨요를 통해 스테이블코인으로 결제하는 시범사업을 해보려 했다가 중단했다. 시중은행 관계자들은 ""이것저것 준비만 해놓고 있는 상태""라고 입을 모았다.
대신 법안 통과와 동시에 바로 스테이블코인 사업을 할 수 있도록 인프라를 구축 중이다. 은행이 발행한 스테이블코인이 시장에서 빠르게 유통될 수 있도록 빅테크와 손을 잡았다.
우리은행은 삼성전자의 삼성월렛 머니·포인트 운영 단독 사업자로 나섰다. 신한은행과 NH농협은 네이버페이와 제휴를 맺었고, KB국민은행은 최근 국제은행간통신협회(스위프트,SWIFT)와 협업을 위한 미팅을 진행했다. 향후 스위프트 인프라를 활용해 스테이블코인 국제 송금 시범사업에 참여할 예정이다. 이외에도 금융사-빅테크사들간 물밑접촉이 활발하다.
시중은행 관계자는 ""할 수 있는 준비는 다 해뒀지만 법제화가 되지 않아 관련 부서는 개점휴업 상태""라면서 ""당국과 국회가 서둘러야 은행도 사업을 확장할 수 있다""고 말했다.",스테이블코인
더벨,"캐나다 의회, '스테이블코인' 포함 예산안 통과",,,,,,,스테이블코인
헤럴드경제,비댁스 ‘서클(Circle) 파트너스테이블코인·스테이블FX’ 공식 참여,네이버뉴스,https://n.news.naver.com/mnews/article/016/0002560368?sid=101,,헤럴드경제,비댁스 ‘서클(Circle) 파트너스테이블코인·스테이블FX’ 공식 참여,"원화 기반 온체인 FX 유동성 공급
비댁스 ‘KRW1’ 활용성 확대 기대
[비댁스 제공]
[헤럴드경제=유동현 기자] 비댁스(BDACS)는 서클(Circle)의 스테이블FX(StableFX)및 서클 파트너 스테이블코인(Circle Partner Stablecoins) 프로그램에 공식 참여한다고 20일 밝혔다.
세계 최대 금융 시장인 외환(FX) 시장은 단편화된 거래 구조와 선수금 계좌, 결제 주기 지연 등 비효율적 인프라에 의존해 왔다. 서클이 공개한 Arc는 온체인 결제와 실물 경제 활동을 연결하는 글로벌 레이어1(Layer1) 블록체인으로, 실시간 결제·정산이 가능하도록 설계됐다. 비댁스는 Arc 상에서 원화 스테이블코인 ‘KRW1’을 발행하며, 원화 기반 온체인 결제·송금·유동성 공급을 담당하는 핵심 파트너로 참여한다.
서클의 새로운 서비스인 StableFX는 스테이블코인을 활용한 기관용 온체인 FX 프로그램이다. 경쟁력 있는 가격 제공, 온체인 결제 기반의 청산 리스크 감소 등 기존 FX 시장의 문제를 해결한다. 현재 Arc 테스트넷에서 운영 중이며, 내년 메인넷 출시와 함께 글로벌 기관 대상으로 사용도 확대될 전망이다. 비댁스의 KRW1은 StableFX에서 원화 기반의 온체인 FX 유동성 공급 역할을 수행하며, 글로벌 유동성 공급자 및 기업들이 실시간으로 원화를 거래할 수 있는 기반을 제공한다.
비댁스가 참여하는 Circle Partner Stablecoins 프로그램은 Arc 생태계 내에서 달러 이외 통화 기반의 지역 스테이블코인을 선별해 지원하는 글로벌 파트너 프로그램이다. 참여사는 서클 페이먼츠 네트워크(Circle Payments Network) 및 StableFX와 직접 연동되며, 글로벌 유동성 공급자 네트워크와 USDC와의 상호운용성을 확보하게 된다. 이에 따라 KRW1은 글로벌 결제와 송금, 무역 및 온체인 금융 흐름에 통합되며, 원화의 국제적 활용성이 확대될 것으로 기대된다.
류홍열 비댁스 대표는 “KRW1은 Arc 생태계에서 한국 원화를 대표하는 스테이블코인으로 성장하고 있다”며 “서클의 StableFX 및 Partner Stablecoins 프로그램 참여를 통해 원화가 글로벌 온체인 금융 및 외환 시장에서 실질적인 역할을 수행하게 될 것”이라고 했다.",스테이블코인
헤럴드경제,"비댁스스테이블코인‘KRW1’, 서클 파트너 프로그램 공식 참여",네이버뉴스,https://n.news.naver.com/mnews/article/016/0002560368?sid=101,,헤럴드경제,비댁스 ‘서클(Circle) 파트너스테이블코인·스테이블FX’ 공식 참여,"원화 기반 온체인 FX 유동성 공급
비댁스 ‘KRW1’ 활용성 확대 기대
[비댁스 제공]
[헤럴드경제=유동현 기자] 비댁스(BDACS)는 서클(Circle)의 스테이블FX(StableFX)및 서클 파트너 스테이블코인(Circle Partner Stablecoins) 프로그램에 공식 참여한다고 20일 밝혔다.
세계 최대 금융 시장인 외환(FX) 시장은 단편화된 거래 구조와 선수금 계좌, 결제 주기 지연 등 비효율적 인프라에 의존해 왔다. 서클이 공개한 Arc는 온체인 결제와 실물 경제 활동을 연결하는 글로벌 레이어1(Layer1) 블록체인으로, 실시간 결제·정산이 가능하도록 설계됐다. 비댁스는 Arc 상에서 원화 스테이블코인 ‘KRW1’을 발행하며, 원화 기반 온체인 결제·송금·유동성 공급을 담당하는 핵심 파트너로 참여한다.
서클의 새로운 서비스인 StableFX는 스테이블코인을 활용한 기관용 온체인 FX 프로그램이다. 경쟁력 있는 가격 제공, 온체인 결제 기반의 청산 리스크 감소 등 기존 FX 시장의 문제를 해결한다. 현재 Arc 테스트넷에서 운영 중이며, 내년 메인넷 출시와 함께 글로벌 기관 대상으로 사용도 확대될 전망이다. 비댁스의 KRW1은 StableFX에서 원화 기반의 온체인 FX 유동성 공급 역할을 수행하며, 글로벌 유동성 공급자 및 기업들이 실시간으로 원화를 거래할 수 있는 기반을 제공한다.
비댁스가 참여하는 Circle Partner Stablecoins 프로그램은 Arc 생태계 내에서 달러 이외 통화 기반의 지역 스테이블코인을 선별해 지원하는 글로벌 파트너 프로그램이다. 참여사는 서클 페이먼츠 네트워크(Circle Payments Network) 및 StableFX와 직접 연동되며, 글로벌 유동성 공급자 네트워크와 USDC와의 상호운용성을 확보하게 된다. 이에 따라 KRW1은 글로벌 결제와 송금, 무역 및 온체인 금융 흐름에 통합되며, 원화의 국제적 활용성이 확대될 것으로 기대된다.
류홍열 비댁스 대표는 “KRW1은 Arc 생태계에서 한국 원화를 대표하는 스테이블코인으로 성장하고 있다”며 “서클의 StableFX 및 Partner Stablecoins 프로그램 참여를 통해 원화가 글로벌 온체인 금융 및 외환 시장에서 실질적인 역할을 수행하게 될 것”이라고 했다.",스테이블코인
이투데이,"원화스테이블코인'KRW1', 서클 온체인 FX 전면에 선다",,,,,,,스테이블코인
한스경제,"비댁스, 글로벌 온체인 FX 편입… 원화 실시간 결제 길 열려",,,,,,,스테이블코인
