press,title,naver_news_text,naver_news_url,body,press_html,title_html,body_html,label
매일경제,"“수수료·애플페이·수장교체”…‘지각변동’ 카드업계, 올해 관전 포...",네이버뉴스,https://n.news.naver.com/mnews/article/009/0005443910?sid=101,,매일경제,"“수수료·애플페이·수장교체”…‘지각변동’ 카드업계, 올해 관전 포인트는?","삼성카드, 10년만 신한카드 제치고 순익 1위
국민·신한, 현대 이어 1Q 애플페이 도입 예상
수장 대거 교체, ‘재무건전성 개선’ 최대 과제
애플페이 관련 이미지. [사진 출처 = 현대카드·현대커머셜 뉴스룸]
삼성카드의 지난해 순익이 10년 만에 신한카드를 제치고 1위로 올라서는 등 카드업계가 오랜만에 판도 변화를 맞이했다.
14일 카드업계에 따르면 삼성카드는 지난해 연결 기준 순이익이 전년대비 9.1% 증가한 6646억원을 기록했다. 영업이익은 9.3% 성장한 8854억원이다. 영업수익이 증가하고, 선제적인 리스크 관리 강화로 대손비용이 감소한 영향으로 풀이된다.
같은 기간 신한카드의 순이익과 영업이익은 5753억원, 7574억원으로 각각 전년보다 7.5%, 5.65%씩 줄며 삼성카드에게 업계 1위 자리를 내줬다.
카드 결제 관련 이미지. [사진 출처 = 픽사베이]
관련 업계에선 지난해 업계 순위 변동에서 나아가, 올해 역시 다양한 이벤트들이 예정된 만큼 시장 지각 변동을 예상하는 분위기다.
그 중 최근 업계관계자뿐만 아니라 카드이용자들의 이목을 끌었던 이슈는 ‘애플페이’다.
현대카드에 이어 신한카드와 KB국민카드도 이르면 올 1분기 중 애플페이 도입을 준비 중인 것으로 알려지면서다. 이들 카드사에서 애플페이가 출시되면 지난 2023년 3월 현대카드가 애플페이를 국내 출시한 이후 2년 만이다. 이 외 다른 금융지주 카드 계열사 등도 애플페이 확산에 따른 영향을 점검하며 애플페이 도입 검토를 시작하는 단계로 알려졌다.
애플페이의 도입은 업계 내 결제액 점유율 판도에 변화를 줄 것으로 전망된다. 지난해 현대카드는 신한카드를 제치고 점유율 1위에 올라섰는데, 주요인으로 ‘애플페이’가 꼽히기 때문이다.
지난 한 해 현대카드의 국내 개인 신용카드 결제액은 127조5971억원으로 점유율 18.7%를 차지해 신한카드를 제치고 1위로 올라섰다. 같은 기간 신한카드의 신용카드 결제액은 124조3103억원으로 18.7%를 기록했다.
현대카드는 현재 카드사 중 유일하게 애플페이를 도입하고 있다. 미국 휴대폰 판매 사이트 조사 결과, 아이폰 사용자 중 약 92%가 안드로이드폰으로 전환을 절대 고려하지 않는다는 조사결과도 있는 만큼 아이폰은 충성도가 높다. 이런 아이폰 유저들의 결제 수요를 끌어온 만큼 결제액이 늘어난 것으로 풀이된다.
경영 쇄신을 이끌 수장도 대거 교체됐다. 올해 신한카드, 삼성카드, KB국민카드, 하나카드, 우리카드는 신규 최고경영자(CEO)를 신임했다.
박창훈 신한카드 사장, 김이태 삼성카드 대표이사 내정자, 김재관 KB국민카드 사장, 성영수 하나카드 대표, 진성원 우리카드 사장 모두 취임사 등을 통해 ‘성장’과 ‘생존’을 강조했다.
최근 카드업계는 적격비용 제도로 인해 본업인 카드결제 부문의 수익성이 악화하고 있다. 카드론 등 대출부문의 이익을 통해 이를 보전하는 수익구조로 전환하고 있는 추세다. 문제는 대출액이 불어난 만큼 카드론을 갚지 못하는 불량고객도 증가하며 재무건전성에 적신호가 켜졌단 점이다. 올해 신임 CEO들의 최대 과제는 재무건전성 개선으로, 해당 성과에 따라 업계 순위가 재차 변동할 것이란 예상이 나온다.",애플페이
아시아경제,[수수료 잔혹사]②애플·삼성페이유료화 '간편결제 리스크'…영업 주도...,네이버뉴스,https://n.news.naver.com/mnews/article/277/0005546425?sid=101,,아시아경제,[수수료 잔혹사]②애플·삼성페이 유료화 '간편결제 리스크'…영업 주도권 뺏겨,"삼성, 8월 수수료율 애플 0.15% 수준 적용할듯
네·카·토까지 합류하면 연 5000억+α 부담
혁신·해외진출은커녕 수수료·연체율·카드채 걱정
애플에 이어 삼성이 간편결제 수수료 체계를 유료화할지 카드 업계가 촉각을 곤두세우고 있다. 삼성이 움직이면 네이버·카카오·토스페이도 따라갈 수 있어서다. 금융당국이 2030년까지 6년간 가맹점 수수료율을 낮추기로 해 카드사들이 가맹점으로부터 받는 수수료 이익은 줄어드는데, 간편결제 빅테크(대형 정보기술 기업) 수수료 폭탄은 감당해야 하는 '이중고'에 시달릴 수 있다. 가뜩이나 신용카드 판매(신판) 영업에 어려움을 겪고 있는 카드사의 경영 불확실성이 더욱 커질 것으로 예상된다.
14일 업계에 따르면 현대카드가 애플페이에 내는 수수료율 추정치는 0.15%다. 금융권, IT 업계에서는 현대카드에 이어 신한카드, KB국민카드가 1분기 중 애플페이를 도입할 가능성이 크다고 보고 있다. 이에 따라 삼성페이도 국내 무료 서비스 정책을 철회할 방침이다. 애플페이 수준의 수수료율을 적용하는 것이 합리적이라는 시각이 삼성 안팎에 퍼져있는 것으로 전해졌다.
삼성페이 주무 사업부인 삼성전자 디바이스경험(DX) 부문 모바일경험(MX) 사업부는 오는 8월 수수료 도입을 검토하고 있다. 삼성페이는 8월 카드사들과 재계약을 한다. 도입 시 수수료율은 애플페이 추정치인 0.15%와 같을 것이란 전망이 나온다. 삼성 MX사업부에 정통한 IT 업계 관계자는 ""서울 서초동에 있는 그룹 사업지원 태스크포스(TF) 승인을 거쳐야겠지만 MX사업부도 애플페이에 대응해 합리적(같은) 수준의 수수료율을 책정한다는 방침을 정한 것으로 안다""며 ""8월에 전업 카드사들과 협상할 때 수수료율 적용 방침을 (삼성이 카드사에) 전달할 것""이라고 말했다.
삼성이 카드사로부터 수수료를 걷으면 네이버페이, 카카오페이, 토스페이 등도 줄줄이 따라갈 가능성이 크다. 한국은행 간편결제지급 일일결제금액(2373억5000만원)에 애플페이 수수료 0.15%를 곱하면 카드사들이 부담하는 수수료는 약 1300억원에 달한다. 애플페이 추정치만 1300억원이라는 의미다. 삼성, 네이버, 토스가 애플처럼 0.15%를 수수료로 걷는다고 가정하면 해당 비용은 4배로 늘어난다. 연 5000여억원 수준이다. 모바일 결제 시장 연 성장률이 약 10%인 것을 고려하면 연 5000억원보다 수수료 비용은 더 늘 수밖에 없다.
'수익성 악화' 타개 없어 속수무책…카드 없는 사회 도래 '우려'
업계는 위기를 '정면 돌파'할 만한 묘수를 찾기는 쉽지 않다고 보고 있다. 오히려 빅테크 간편결제가 청년층을 중심으로 폭발적 호응을 얻으면서 카드 없는 사회로의 전환 시점이 빨라지는 것 아니냐고 걱정한다. 빅테크의 역습, 당국의 규제 일변도 정책 등을 '회색 코뿔소'로 받아들이면서도 속수무책이다. 회색 코뿔소란 위기를 알면서도 막을 방법이 없는 상황을 일컫는 말이다.
학계 관계자는 ""카드업계는 수신 기능이 없어 카드채를 발행해 자금을 조달해야 해 부정적 업황에 대해 언급하기를 꺼릴 것""이라면서도 ""규제 강화, 빅테크 간편결제 업체와의 경쟁, 수수료 및 비용 부담이 맞물린 지금 상황을 업계는 알고도 막을 수 없는 회색 코뿔소 상황으로 판단한다""고 말했다. 이어 ""카드론을 빌려 가는 차주(고객) 신인도가 낮은 것도 문제지만 업황 자체가 위축돼 금융 시장에서 카드채 자금 조달이 막히는 것이 더 심각한 문제""라고 덧붙였다.
카드사들은 비용 절감, 저소득층 대상 대출 사업 확대 등으로 경영 방향을 잡고 있다. 수출 확대, 해외 현지화 전략 강화, 혁신 기술 및 시스템 개혁 같은 '탈출구'를 적극적으로 찾기보다는 카드 단종, 무이자 할부 축소, 캐시백 등 판촉 혜택 축소 같은 전략을 통해 수익성을 보전하는 데 급급한 처지다.
신규 고객을 늘리기 위해 공격적 영업을 하기보다 기존 충성고객을 지키되 연회비가 비싼 프리미엄 카드 가입을 유도하는 보수적인 영업 방침을 고수한다. 여신금융협회에 따르면 8개 전업카드사(롯데·BC·삼성·신한·우리·하나·현대·KB) 기준 신용카드 단종 건수는 2021년 255건, 2022년 67건, 2023년 405건, 지난해 482건으로 늘었다. 최근 1년 이내 출시된 카드 평균 연회비는 10만~20만원대로 2년 전 5만~10만원대보다 2배가량 늘었다.
서지용 상명대 경영학부 교수는 ""애플·삼성 등 빅테크 간편결제 수수료 부담이 커지고 있어 지금은 어느 때보다 카드사들의 신판(본업) 경쟁력 회복이 시급한 상황""이라며 ""이 와중 당국이 수수료율을 낮추는 정책 기조를 밀어붙이면서 카드사들은 신판 영업보다는 대출 사업 중심으로 전략을 짜야 하는 상황에 내몰렸다""고 지적했다. 이어 ""차주 연체율이 높아지면 카드사로서는 비용 부담이 커지고 수익성은 떨어지는 악순환을 끊기가 갈수록 어려워질 것""이라고 경고했다.
한편 카드업계는 금융당국에 지속적으로 가맹점 수수료율 인하 정책 기조를 바꿔달라 호소한다. 간편결제 업계의 수수료 정책, 경기침체 등 시장 변수도 큰데 정책 리스크까지 감당하기는 부담스럽다는 것이다. 시장과 정책 상황이 맞물리면서 현대·KB국민·하나·우리카드 등은 근속연수 20년 이상 베테랑들을 내보내기 위해 연초부터 희망퇴직 절차를 밟기도 했다. 해당 카드사들은 ""두 자릿수""(10~99명) 규모의 희망퇴직 신청을 받아 지난달 집행했다고 했다. 카드사 희망퇴직이 당국의 수수료율 인하 정책 때문만이라고 할 수는 없지만, 수수료율 조정 정책이 경영에 적지 않은 영향을 미치는 것은 사실이다. 희망퇴직 대상자는 근속연수가 20여년인 베테랑들이다. 억대 연봉 수령자들이 대부분이다. 퇴사하면 재취업을 하기 어렵다는 걸 알면서도 스스로 짐을 싸는 이들이 적지 않은 것으로 전해졌다. 이는 현장에서 카드 업계의 성장 동력(모멘텀)을 얼마나 부정적으로 보는지를 보여주는 대표적인 사례다.",애플페이
EBN,"갤럭시 S25, 日 판매 개시…AI 앞세워 '애플텃밭' 도전장",,,,,,,애플페이
데일리한국,10년만에 1위 빼앗겼지만...신한카드 '이유 있는' 자신감,,,,,,,애플페이
NSP통신,[금융업계기상도]카카오뱅크 ‘맑음’·IBK기업은행 ‘비’,,,,,,,애플페이
한스경제,"현대카드, 신용판매부터 플랫폼까지 연일 '혁신'...업계 상위권 도약 '정...",,,,,,,애플페이
아시아경제,"[수수료 잔혹사]①12년새 5분의 1토막…수익성 지키려 대출사업, 연체율...",네이버뉴스,https://n.news.naver.com/mnews/article/277/0005546426?sid=101,,아시아경제,"[수수료 잔혹사]①12년새 5분의 1토막…수익성 지키려 대출사업, 연체율 리스크↑","12년새 수수료율 '절반~5분의 1 토막'
신용판매보다 대출사업…건전성까지↓
카드사 ""낮출 만큼 낮췄다"" 하소연
""받을 수수료는 대폭 주는데, 낼 수수료는 치솟는다."" 카드업계가 '수수료 이익 감소'로 수익성 악화 위기에 빠졌다. 가맹점 수수료 인하로 받아야 할 수수료가 대폭 줄어 이익 감소 경고음이 커진 가운데 간편결제 유료화 움직임으로 카드사가 내야 할 수수료는 천정부지로 늘어날 것으로 보여 수익성 악화가 심화할 전망이다. 금융당국이 12년간 5차례 수수료율을 깎으면서 이미 카드사 사업 구조가 왜곡되고 기초체력(펀더멘털)은 크게 훼손됐다. 빚을 갚을 역량이 떨어지는 서민 대상 장기카드대출(카드론) 사업 수익 비중이 '본업'인 일반 소비자 상대 신용카드 판매 실적 비중만큼 커졌다. 카드사들이 갈수록 연체율 관리에 어려움을 겪고 무리한 영업을 통해 실적 채우기에 급급하면서 중장기적 산업 성장동력(모멘텀)이 크게 약해질 것이라는 지적이 나온다.
14일 업계에 따르면 이날부터 신용·체크 카드 수수료율은 기존보다 0.05~0.1%포인트 낮아진다. 신용카드 가맹점 수수료는 연 매출 3억원 이하 0.50%에서 0.40%로 낮아지는 등 매출 규모에 따라 0.1~0.05%포인트 낮아진다. 체크카드 수수료는 기존보다 0.1%포인트 하락한다. 금융위원회는 지난해 12월17일 수수료율 인하 방침을 발표하면서 ""영세·중소가맹점에 대한 카드수수료 부담경감 가능 금액은 연간 약 3000억원 수준""이라고 밝혔다.
수수료 부담을 덜어낸 가맹점과 달리 카드업계는 울상을 짓고 있다. 카드 가맹점 수수료가 지속적으로 낮아져서다. 금융위는 카드사 영업원가인 '적격비용' 재산정을 5차례 진행했다. 2012년 여신전문금융업법 개정 후 3년마다 적격비용을 산정해 카드 수수료율을 개편했다. 5번 모두 수수료율이 깎였다. 연매출 3억원 이하 영세 가맹점 신용카드 수수료율은 1.5~2.12%에서 0.4%로, 3억원 초과 30억원 이하 중소 가맹점 신용카드 수수료율은 2.12%에서 1~1.45%로 하락했다. 12년 동안 영세 가맹점은 5분의 1, 중소 가맹점은 절반 이상 낮아졌다.
수수료율이 낮아지면 카드사 순이익은 줄어들고 연체율은 높아진다. 우선 카드사가 가맹점으로부터 받는 수수료 이익이 감소한다. 영세·자영업자 수수료율 지불액이 3000억원 줄어들면 카드업권 전체 순이익은 2000억~3000억원가량 감소할 것으로 추산된다. 한 카드사 관계자는 ""이미 수수료율을 낮출 만큼 낮췄는데 또 떨어지게 돼 업황이 나빠질 것""이라고 했다.
경기둔화로 공격적 신용카드 판매(신판) 영업을 하기가 어려운 데다 애플·삼성·네이버·카카오·토스페이 등 빅테크(대형 정보기술 기업) 간편결제 업체와의 경쟁이 격화되면서 카드사들은 신판이 아닌 카드론 등 저소득층 대출 사업 비중을 확대했다. 카드론을 빌린 서민이 원금과 이자를 갚지 못하면 카드사 연체율이 높아지는 구조다. 카드사들은 대출 사업으로 수익성을 보전하려다 보니 건전성이 떨어지는 악순환에 빠졌다.
금융감독원 금융통계정보시스템에 따르면 BC카드를 제외한 전업 카드사 7곳(우리·KB국민·롯데·삼성·신한·하나·현대카드)의 지난해 1~3분기 전체 수익은 18조1458억원이다. 본업인 신판 수익(가맹점수수료)은 4조1357억원으로 전체 수익 대비 22.8%에 불과하다. 카드론 수익은 3조6725억원으로 전체 수익의 20.2%를 차지한다. 다음 달 말 발표될 예정인 지난해 4분기 실적에서는 카드론 수익이 신용판매 수익을 초과할 가능성이 크다. BC카드는 카드결제 프로세싱(전표 매입) 대행 업무 위주여서 일반적 신용카드 판매와 영업 성격이 다르기 때문에 신판 수익 통계에서 통상 제외한다.
연체율은 높아지고 있다. 금감원 금융통계정보시스템에 따르면 BC카드 제외 전업 카드사 7곳의 지난해 3분기 연체율은 평균 1.31%다. 이는 전년 동기(1.25%)보다 0.06% 높아진 수치다. 카드론 비중이 신용판매 비중보다 큰 우리카드, 롯데카드, 신한카드 3사의 3분기 연체율은 7개사 평균치(1.31%)보다 0.16%포인트 높은 1.49%에 달한다. 통상 2%를 넘으면 카드사 건전성이 위험한 수준으로 간주한다. 연체율은 카드사 전체 채권 중 1개월 이상 연체된 채권의 비율을 의미한다.
연체율은 오르고 신판 실적이 줄다 보니 카드사들은 캐시백, 마일리지 등 상품 판촉(판매촉진) 활동을 줄이고 비용 관리 중심으로 보수적인 영업 전략을 취할 수밖에 없다고 하소연한다. 또 수익성 저하 극복을 위해 데이터 사업 등 신사업에 주목하고 있지만, 아직 초기 단계에 있어 단기간 내에 수익성 개선에 크게 기여할지는 미지수다.
업계 관계자는 ""수수료 인하는 영세·중소 가맹점의 부담을 경감시키는 긍정적인 효과가 있지만, 카드 업계에는 수익성 악화라는 도전 과제를 안겨줄 수밖에 없다""면서 ""카드사들은
비용 절감, 부가서비스 축소 등 다양한 방안을 모색하면서도
사업 다각화와 효율성 제고를 위한 노력을 해야 한다""고 지적했다.",애플페이
