press,title,naver_news_text,naver_news_url,body,press_html,title_html,body_html,label
뉴시스,규제지역 확대하고 대출 조이고…추가부동산대책만지작,네이버뉴스,https://n.news.naver.com/mnews/article/003/0013527192?sid=101,,뉴시스,규제지역 확대하고 대출 조이고…추가 부동산대책 만지작,"정부, 이르면 내주 추가 부동산 정책 발표 검토
규제지역 확대 유력…한강벨트·분당 등 지정 고려
DSR 한도 강화, 주담대 한도 추가 축소 등도 거론
세제 동원 여부 촉각…공정비율 복원 등 재부상
[서울=뉴시스] 정병혁 기자 = 서울 중구 남산에서 바라본 서울시내 아파트. 2025.09.29. jhope@newsis.com
[세종=뉴시스] 안호균 기자 = 정부가 서울 등 일부 지역 주택 가격 과열 양상이 지속되자 추가 대책을 검토하고 있다.
10일 기획재정부와 국토교통부 등 관련 부처에 따르면 정부는 이르면 다음 주 규제지역 확대와 대출규제 강화 등의 내용을 담은 부동산 안정 대책을 내놓는 방안을 고려하고 있다.
정부가 주택 공급 확대 방안을 담은 9·7 부동산 대책을 내놓은지 한 달여 만에 추가 대책을 고려하게 된 것은 최근 서울 등 일부 지역 집값 상승세가 심상치 않다고 판단했기 때문이다.
정부는 우선 규제지역 확대를 검토하고 있는 것으로 알려졌다. 서울 강남구, 서초구, 송파구, 용산구 외에도 최근 가격 오름폭이 두드러진 서울 성동구와 마포구 등 한강벨트와 경기 성남 분당구, 과천시 등도 투기과열지구나 조정대상지역으로 지정될 수 있다는 전망이 나온다.
규제 지역으로 지정되면 주택담보인정비율(LTV)이 40%로 제한되고 분양권 전매제한, 청약조건 강화, 다주택자 취득세·양도소득세 강화 등의 각종 규제도 적용된다.
대출 한도를 더 조이는 방안도 포함될 가능성이 있다. 지난 6·27 대책을 통해 대출 규제의 수요 억제 효과가 확인됐기 때문이다.
금융당국은 총부채원리금상환비율(DSR) 한도를 현행 40%에서 35%로 낮추는 방안을 검토하고 있는 것으로 전해졌다. 그간 DSR 규제에 예외로 뒀던 전세대출과 각종 정책대출을 DSR에 포함하는 카드도 고려 중이다.
또 주택담보대출 한도를 현재 6억원에서 4억원으로 낮추거나 주택담보인정비율(LTV)을 일부 지역에서 0%로 제한하는 방안도 거론되고 있다.
[서울=뉴시스] 서울 집값이 1주 전보다 0.27% 오르며 4주 연속 상승폭을 키웠다. 성동구(0.78%)는 6·27 대출규제 이전 수준의 상승률을 기록했다. 부동산원은 재건축 추진 단지와 대단지·역세권 등 정주여건이 양호한 선호단지 중심으로 상승 거래가 포착되는 등 서울 전체가 상승것으로 분석했다.(그래픽=안지혜 기자)  hokma@newsis.com
주택 가격 상승세를 억제하기 위해 세제 카드를 동원할지도 주목된다.
정부는 현재 부동산 가격을 잡기 위해 세금을 활용하는데는 최대한 조심스럽게 접근하고 있다. 이 때문에 종합부동산세 등 보유세 체계를 직접적으로 건드릴 가능성은 낮은 것으로 알려졌다.
다만 공시가격 현실화율과 공정시장가액비율(공시가격 중 세금 계산에 실제로 반영되는 비율)을 높여 사실상 세금 부담을 높이는 방안이 재부상하는 분위기다.
현재 공동주택의 시세 대비 공시가격은 약 69%, 공정비율은 60% 수준이다. 현재 정부 내에서는 공정비율을 80%를 복원하고 공시가격 현실화율을 단계적으로 높이는 방안이 논의되고 있다.
고가·다주택 소유자들의 주택 처분을 유도하기 위한 방안도 검토되고 있는 것으로 알려졌다. 보유세·양도소득세 등을 강화하는 내용의 중장기 로드맵을 제시하되 충분한 유예기간을 두고, 그동안은 세율을 낮추는 혜택을 줘 주택 매도를 유도하는 식이다.
한편 수도권 주담대 한도를 6억원으로 제한했던 6·27 대책 이후 한 때 진정되는 모습을 보였던 주택시장은 최근 다시 과열 조짐을 나타내고 있다.
한국부동산원의 9월 다섯째 주(9월 29일 기준) 서울 아파트 매매가격 지수는 전주 대비 0.27% 상승했다. 주간 상승폭은 9월 둘째주부터 0.09%, 0.12%, 0.19%, 0.27%로 4주 연속 확대됐다.
서울 25개 자치구에서 모두 가격 상승폭이 확대됐다. 강북 지역 한강벨트 권역인 성동(0.78%), 마포(0.69%), 광진(0.65%)이 가격 상승을 주도했다. 경기에서도 분당(0.97%), 과천(0.54%)의 상승폭이 커졌다.
[서울=뉴시스] 김진아 기자 = 정부의 6.27 대출규제로 전세 매물이 급감하면서 전세난이 확산될 조짐이다. 5일 부동산 빅데이터 플랫폼 아실에 따르면, 이날 기준 서울 아파트 전세 매물은 2만2865건으로 정부가 대출규제 대책을 발표한 지난 6월 27일 2만4855건 대비 8%가량 줄었다. 같은 기간 경기는 2만4772건에서 2만1830건으로, 인천은 5164건에서 4701건으로 감소했다. 사진은 6일 서울 시내 한 부동산에 매물 정보 게시판이 비어있는 모습. 2025.08.06. bluesoda@newsis.com",부동산대책
뉴시스,계속 뛰는 집값…세 번째부동산 대책나오나,네이버뉴스,https://n.news.naver.com/mnews/article/003/0013527192?sid=101,,뉴시스,규제지역 확대하고 대출 조이고…추가 부동산대책 만지작,"정부, 이르면 내주 추가 부동산 정책 발표 검토
규제지역 확대 유력…한강벨트·분당 등 지정 고려
DSR 한도 강화, 주담대 한도 추가 축소 등도 거론
세제 동원 여부 촉각…공정비율 복원 등 재부상
[서울=뉴시스] 정병혁 기자 = 서울 중구 남산에서 바라본 서울시내 아파트. 2025.09.29. jhope@newsis.com
[세종=뉴시스] 안호균 기자 = 정부가 서울 등 일부 지역 주택 가격 과열 양상이 지속되자 추가 대책을 검토하고 있다.
10일 기획재정부와 국토교통부 등 관련 부처에 따르면 정부는 이르면 다음 주 규제지역 확대와 대출규제 강화 등의 내용을 담은 부동산 안정 대책을 내놓는 방안을 고려하고 있다.
정부가 주택 공급 확대 방안을 담은 9·7 부동산 대책을 내놓은지 한 달여 만에 추가 대책을 고려하게 된 것은 최근 서울 등 일부 지역 집값 상승세가 심상치 않다고 판단했기 때문이다.
정부는 우선 규제지역 확대를 검토하고 있는 것으로 알려졌다. 서울 강남구, 서초구, 송파구, 용산구 외에도 최근 가격 오름폭이 두드러진 서울 성동구와 마포구 등 한강벨트와 경기 성남 분당구, 과천시 등도 투기과열지구나 조정대상지역으로 지정될 수 있다는 전망이 나온다.
규제 지역으로 지정되면 주택담보인정비율(LTV)이 40%로 제한되고 분양권 전매제한, 청약조건 강화, 다주택자 취득세·양도소득세 강화 등의 각종 규제도 적용된다.
대출 한도를 더 조이는 방안도 포함될 가능성이 있다. 지난 6·27 대책을 통해 대출 규제의 수요 억제 효과가 확인됐기 때문이다.
금융당국은 총부채원리금상환비율(DSR) 한도를 현행 40%에서 35%로 낮추는 방안을 검토하고 있는 것으로 전해졌다. 그간 DSR 규제에 예외로 뒀던 전세대출과 각종 정책대출을 DSR에 포함하는 카드도 고려 중이다.
또 주택담보대출 한도를 현재 6억원에서 4억원으로 낮추거나 주택담보인정비율(LTV)을 일부 지역에서 0%로 제한하는 방안도 거론되고 있다.
[서울=뉴시스] 서울 집값이 1주 전보다 0.27% 오르며 4주 연속 상승폭을 키웠다. 성동구(0.78%)는 6·27 대출규제 이전 수준의 상승률을 기록했다. 부동산원은 재건축 추진 단지와 대단지·역세권 등 정주여건이 양호한 선호단지 중심으로 상승 거래가 포착되는 등 서울 전체가 상승것으로 분석했다.(그래픽=안지혜 기자)  hokma@newsis.com
주택 가격 상승세를 억제하기 위해 세제 카드를 동원할지도 주목된다.
정부는 현재 부동산 가격을 잡기 위해 세금을 활용하는데는 최대한 조심스럽게 접근하고 있다. 이 때문에 종합부동산세 등 보유세 체계를 직접적으로 건드릴 가능성은 낮은 것으로 알려졌다.
다만 공시가격 현실화율과 공정시장가액비율(공시가격 중 세금 계산에 실제로 반영되는 비율)을 높여 사실상 세금 부담을 높이는 방안이 재부상하는 분위기다.
현재 공동주택의 시세 대비 공시가격은 약 69%, 공정비율은 60% 수준이다. 현재 정부 내에서는 공정비율을 80%를 복원하고 공시가격 현실화율을 단계적으로 높이는 방안이 논의되고 있다.
고가·다주택 소유자들의 주택 처분을 유도하기 위한 방안도 검토되고 있는 것으로 알려졌다. 보유세·양도소득세 등을 강화하는 내용의 중장기 로드맵을 제시하되 충분한 유예기간을 두고, 그동안은 세율을 낮추는 혜택을 줘 주택 매도를 유도하는 식이다.
한편 수도권 주담대 한도를 6억원으로 제한했던 6·27 대책 이후 한 때 진정되는 모습을 보였던 주택시장은 최근 다시 과열 조짐을 나타내고 있다.
한국부동산원의 9월 다섯째 주(9월 29일 기준) 서울 아파트 매매가격 지수는 전주 대비 0.27% 상승했다. 주간 상승폭은 9월 둘째주부터 0.09%, 0.12%, 0.19%, 0.27%로 4주 연속 확대됐다.
서울 25개 자치구에서 모두 가격 상승폭이 확대됐다. 강북 지역 한강벨트 권역인 성동(0.78%), 마포(0.69%), 광진(0.65%)이 가격 상승을 주도했다. 경기에서도 분당(0.97%), 과천(0.54%)의 상승폭이 커졌다.
[서울=뉴시스] 김진아 기자 = 정부의 6.27 대출규제로 전세 매물이 급감하면서 전세난이 확산될 조짐이다. 5일 부동산 빅데이터 플랫폼 아실에 따르면, 이날 기준 서울 아파트 전세 매물은 2만2865건으로 정부가 대출규제 대책을 발표한 지난 6월 27일 2만4855건 대비 8%가량 줄었다. 같은 기간 경기는 2만4772건에서 2만1830건으로, 인천은 5164건에서 4701건으로 감소했다. 사진은 6일 서울 시내 한 부동산에 매물 정보 게시판이 비어있는 모습. 2025.08.06. bluesoda@newsis.com",부동산대책
굿모닝경제,9·7부동산 대책이은 추가 대책 나오나?,,,,,,,부동산대책
뉴시스,"정부,부동산안정대책내놓는 방안 고려중",네이버뉴스,https://n.news.naver.com/mnews/article/003/0013527449?sid=102,,뉴시스,9·7 부동산 대책 이은 추가 대책 나오나?,"[서울=뉴시스] 최진석 기자 = 10일 기획재정부와 국토교통부 등에 따르면 정부는 이르면 다음 주 규제지역 확대와 대출규제 강화 등의 내용을 담은 부동산 안정 대책을 내놓는 방안을 고려하고 있는 것으로 알려졌다.
정부가 9·7 부동산 대책을 내놓은지 한 달여 만에 추가 대책으로 우선 규제지역 확대를 검토하고 있는 것으로 알려졌다. 규제 지역으로 지정되면 주택담보인정비율(LTV)이 40%로 제한, 분양권 전매제한, 청약조건 강화, 다주택자 취득세·양도소득세 강화 등의 각종 규제도 적용된다. 이어 총부채원리금상환비율(DSR) 한도를 현행 40%에서 35%로 낮추는 방안과 주택담보대출 한도를 현재 6억원에서 4억원으로 낮추거나 주택담보인정비율(LTV)을 일부 지역에서 0%로 제한하는 방안도 거론되고 있다.
사진은 이날 가격 상승폭이 확대된 서울 성동구 지역 아파트 단지의 모습. 2025.10.10. myjs@newsis.com",부동산대책
뉴시스,9·7부동산 대책에 이은 부동산 안정 대책 검토,네이버뉴스,https://n.news.naver.com/mnews/article/003/0013527455?sid=102,,뉴시스,"정부, 부동산 안정 대책 내놓는 방안 고려중","[서울=뉴시스] 최진석 기자 = 10일 기획재정부와 국토교통부 등에 따르면 정부는 이르면 다음 주 규제지역 확대와 대출규제 강화 등의 내용을 담은 부동산 안정 대책을 내놓는 방안을 고려하고 있는 것으로 알려졌다.
정부가 9·7 부동산 대책을 내놓은지 한 달여 만에 추가 대책으로 우선 규제지역 확대를 검토하고 있는 것으로 알려졌다. 규제 지역으로 지정되면 주택담보인정비율(LTV)이 40%로 제한, 분양권 전매제한, 청약조건 강화, 다주택자 취득세·양도소득세 강화 등의 각종 규제도 적용된다. 이어 총부채원리금상환비율(DSR) 한도를 현행 40%에서 35%로 낮추는 방안과 주택담보대출 한도를 현재 6억원에서 4억원으로 낮추거나 주택담보인정비율(LTV)을 일부 지역에서 0%로 제한하는 방안도 거론되고 있다.
사진은 이날 서울 압구정동 아파트 단지의 모습. 2025.10.10. myjs@newsis.com",부동산대책
중앙일보,부동산추가대책낸다…공시가격 인상도 검토,네이버뉴스,https://n.news.naver.com/mnews/article/025/0003474323?sid=101,,중앙일보,부동산 추가대책 낸다…공시가격 인상도 검토,"서울·수도권 일부 지역에서 부동산 가격 상승세가 이어지면서 정부가 ‘세제 카드’를 만지작거리고 있다.
공정시장가액비율과 공시가격 현실화율을 높여 사실상 세 부담을 키우는 방안을 정책 ‘테이블’ 위에 올렸다. 9·7 공급 대책에 실망한 실수요자들이 다시 매수세로 돌아서며, 6·27 대출 규제가 ‘반짝 효과’에 그쳤다는 분석이 나오기 때문이다.
9일 중앙일보 취재를 종합하면 정부는 이르면 다음 주 투기과열지구 확대와 토지거래허가구역 추가 지정 등까지 묶은 추가 부동산 안정화 대책을 내놓을 예정이다. 일종의 ‘부동산 패키지 대책’이다.
김영옥 기자
핵심은 세 부담 강화 카드를 꺼낼지다. 정부는 세율이나 공제·과세표준 체계를 손보는 직접적인 세법 개정이 아닌, 공시가격 현실화율과 공정비율을 높이는 방안에 무게를 두고 있다. 현행 부동산 세제는 과세표준을 기준으로 부과되며, 이는 시가에 공시가격 현실화율과 공정비율을 곱해 산정된다. 현재 공동주택의 경우 시세 대비 공시가격은 약 69%, 공정비율은 60% 수준이다. 문재인 정부에서 비율을 높였지만, 윤석열 정부에서 이를 사실상 폐기해서다.
정부가 검토하는 안은 공정비율을 다시 80% 수준으로 복원하고 공시가격 현실화율을 단계적으로 다시 높이는 방안이다. 만약 공정비율을 80%로 복원하고, 공시가격을 90%까지 현실화한다면 아파트 과세표준은 시세의 41%(시세×0.69×0.6)에서 72%로 뛰게 된다. 세율을 조정하지 않더라도 세 부담을 크게 늘릴 수 있다. 특히 최근 가격이 급등한 고가 주택의 경우 세 부담 상한까지 보유세가 늘어날 가능성이 있다.
그간 이재명 정부는 대선 전부터 “세금으로 집값을 잡지 않겠다”는 입장을 유지해 왔다. 그러나 집값이 좀처럼 안정되지 않자 문 정부 때처럼 세 부담을 늘려 시장을 압박하는 방안을 검토하기 시작한 것이다. “집값 잡는 데 세금(규제)을 쓰지 않는다는 건 오산”(김용범 대통령실 정책실장), “개인적인 생각으로는 보유세를 늘려야 한다고 본다”(김윤덕 국토교통부 장관) 등 최근 정부 인사들의 발언에서도 이런 기조 변화가 감지된다.
다만 종합부동산세율을 올리는 식의 직접적인 보유세 강화에 대해 기획재정부와 여당은 신중한 입장이다. 문 정부에서 다주택자 중과세율을 높이는 등 보유세를 강화했을 때 중산층을 중심으로 여론이 악화한 ‘학습효과’로 풀이된다.
부동산 패키지 대책에는 대출 한도 축소와 규제지역 확대 방안도 함께 검토되고 있다.
━
대출한도 6억→4억원 낮추고, 토허구역 추가 지정 가능성
추가 대출 규제로는 ▶현재 6억원인 대출 한도를 4억원으로 낮추거나 ▶총부채원리금상환비율(DSR)을 현행 40%에서 35%로 강화하는 방안 ▶주택담보인정비율(LTV)을 일부 지역에서 0%로 제한하는 방안 등이 논의 테이블에 오른 것으로 알려졌다. 다만 금융당국 관계자는 “주담대 한도를 6억원으로 제한한 6·27대책을 내놓은 지 3개월 만에 추가 금융 규제를 내놓는 게 부담스러운 게 사실”이라며 “관련 부처 간에 치열한 논의가 이어지고 있다”고 전했다.
규제지역 확대에는 정부 내 이견이 크지 않다. 투기과열지구와 조정대상지역 확대, 토지거래허가구역 지정이 동시에 이뤄질 가능성이 크다. 대상 지역으로는 서울 성동구·마포구 등 ‘한강 벨트’ 권역과 경기도 성남시 분당구 등 최근 가격 상승 폭이 두드러진 곳이 거론된다. 익명을 요구한 정부 관계자는 “토허구역은 여러 지역을 묶는 경우 지금도 국토교통부 장관이 직권으로 지정할 수 있다”며 “부동산 규제 강화가 여론을 악화시킬 수 있다는 부담 때문에 일부 여당 인사들이 반대하고 있는 게 변수”라고 전했다.
하지만 중장기적인 주택공급 확충 방안 없이 추진되는 정책은 효과가 제한적일 것이라는 게 시장의 반응이다. 세금으로 시장을 누르는 방식은 거래를 위축시키고, 전월세 가격 상승의 부작용을 부르는 등 실수요자 부담으로 돌아온다는 점에서다. 이은형 대한건설정책연구원 연구위원은 “결국 수요를 억제하겠다는 방향인데, 과거 사례를 봐도 보유세 강화가 집값 안정에 실질적인 효과를 내지 못했다”며 “공급 대책을 꾸준히 발표하고 실행하는 것이 최선이지, 과도한 수요 억제책은 오히려 시장에 잘못된 신호를 줄 수 있다”고 지적했다.",부동산대책
중앙일보,“자고 나면 집값 쑥쑥”...더 센부동산 대책나오나,네이버뉴스,https://n.news.naver.com/mnews/article/025/0003474323?sid=101,,중앙일보,부동산 추가대책 낸다…공시가격 인상도 검토,"서울·수도권 일부 지역에서 부동산 가격 상승세가 이어지면서 정부가 ‘세제 카드’를 만지작거리고 있다.
공정시장가액비율과 공시가격 현실화율을 높여 사실상 세 부담을 키우는 방안을 정책 ‘테이블’ 위에 올렸다. 9·7 공급 대책에 실망한 실수요자들이 다시 매수세로 돌아서며, 6·27 대출 규제가 ‘반짝 효과’에 그쳤다는 분석이 나오기 때문이다.
9일 중앙일보 취재를 종합하면 정부는 이르면 다음 주 투기과열지구 확대와 토지거래허가구역 추가 지정 등까지 묶은 추가 부동산 안정화 대책을 내놓을 예정이다. 일종의 ‘부동산 패키지 대책’이다.
김영옥 기자
핵심은 세 부담 강화 카드를 꺼낼지다. 정부는 세율이나 공제·과세표준 체계를 손보는 직접적인 세법 개정이 아닌, 공시가격 현실화율과 공정비율을 높이는 방안에 무게를 두고 있다. 현행 부동산 세제는 과세표준을 기준으로 부과되며, 이는 시가에 공시가격 현실화율과 공정비율을 곱해 산정된다. 현재 공동주택의 경우 시세 대비 공시가격은 약 69%, 공정비율은 60% 수준이다. 문재인 정부에서 비율을 높였지만, 윤석열 정부에서 이를 사실상 폐기해서다.
정부가 검토하는 안은 공정비율을 다시 80% 수준으로 복원하고 공시가격 현실화율을 단계적으로 다시 높이는 방안이다. 만약 공정비율을 80%로 복원하고, 공시가격을 90%까지 현실화한다면 아파트 과세표준은 시세의 41%(시세×0.69×0.6)에서 72%로 뛰게 된다. 세율을 조정하지 않더라도 세 부담을 크게 늘릴 수 있다. 특히 최근 가격이 급등한 고가 주택의 경우 세 부담 상한까지 보유세가 늘어날 가능성이 있다.
그간 이재명 정부는 대선 전부터 “세금으로 집값을 잡지 않겠다”는 입장을 유지해 왔다. 그러나 집값이 좀처럼 안정되지 않자 문 정부 때처럼 세 부담을 늘려 시장을 압박하는 방안을 검토하기 시작한 것이다. “집값 잡는 데 세금(규제)을 쓰지 않는다는 건 오산”(김용범 대통령실 정책실장), “개인적인 생각으로는 보유세를 늘려야 한다고 본다”(김윤덕 국토교통부 장관) 등 최근 정부 인사들의 발언에서도 이런 기조 변화가 감지된다.
다만 종합부동산세율을 올리는 식의 직접적인 보유세 강화에 대해 기획재정부와 여당은 신중한 입장이다. 문 정부에서 다주택자 중과세율을 높이는 등 보유세를 강화했을 때 중산층을 중심으로 여론이 악화한 ‘학습효과’로 풀이된다.
부동산 패키지 대책에는 대출 한도 축소와 규제지역 확대 방안도 함께 검토되고 있다.
━
대출한도 6억→4억원 낮추고, 토허구역 추가 지정 가능성
추가 대출 규제로는 ▶현재 6억원인 대출 한도를 4억원으로 낮추거나 ▶총부채원리금상환비율(DSR)을 현행 40%에서 35%로 강화하는 방안 ▶주택담보인정비율(LTV)을 일부 지역에서 0%로 제한하는 방안 등이 논의 테이블에 오른 것으로 알려졌다. 다만 금융당국 관계자는 “주담대 한도를 6억원으로 제한한 6·27대책을 내놓은 지 3개월 만에 추가 금융 규제를 내놓는 게 부담스러운 게 사실”이라며 “관련 부처 간에 치열한 논의가 이어지고 있다”고 전했다.
규제지역 확대에는 정부 내 이견이 크지 않다. 투기과열지구와 조정대상지역 확대, 토지거래허가구역 지정이 동시에 이뤄질 가능성이 크다. 대상 지역으로는 서울 성동구·마포구 등 ‘한강 벨트’ 권역과 경기도 성남시 분당구 등 최근 가격 상승 폭이 두드러진 곳이 거론된다. 익명을 요구한 정부 관계자는 “토허구역은 여러 지역을 묶는 경우 지금도 국토교통부 장관이 직권으로 지정할 수 있다”며 “부동산 규제 강화가 여론을 악화시킬 수 있다는 부담 때문에 일부 여당 인사들이 반대하고 있는 게 변수”라고 전했다.
하지만 중장기적인 주택공급 확충 방안 없이 추진되는 정책은 효과가 제한적일 것이라는 게 시장의 반응이다. 세금으로 시장을 누르는 방식은 거래를 위축시키고, 전월세 가격 상승의 부작용을 부르는 등 실수요자 부담으로 돌아온다는 점에서다. 이은형 대한건설정책연구원 연구위원은 “결국 수요를 억제하겠다는 방향인데, 과거 사례를 봐도 보유세 강화가 집값 안정에 실질적인 효과를 내지 못했다”며 “공급 대책을 꾸준히 발표하고 실행하는 것이 최선이지, 과도한 수요 억제책은 오히려 시장에 잘못된 신호를 줄 수 있다”고 지적했다.",부동산대책
