press,title,naver_news_text,naver_news_url,body,press_html,title_html,body_html,label
한겨레,"[단독] 택배차량 몰다 숨진 30대, 쿠팡새벽배송노동자였다",네이버뉴스,https://n.news.naver.com/mnews/article/028/0002775700?sid=102,,한겨레,"[단독] 택배차량 몰다 숨진 30대, 쿠팡 새벽배송 노동자였다","쿠팡 제공
택배 차량을 몰다 전신주와 충돌해 숨진 30대가 새벽배송을 하던 쿠팡의 배달노동자인 것으로 확인됐다.
10일 제주소방안전본부와 제주동부경찰서, 전국택배노조 제주지부에 따르면, 이날 새벽 2시9분께 제주시 오라2동 도로에서 33살 ㄱ씨가 몰던 1톤 트럭이 전신주와 충돌했다는 신고가 접수됐다. 현장에 출동한 구급대원은 유압장비를 이용해 운전석에 끼여 있던 ㄱ씨를 구조해 병원으로 이송했다. 하지만 크게 다친 ㄱ씨는 새벽 3시10분께 숨졌다.
ㄱ씨는 제주시에 있는 쿠팡의 1캠프에서 야간조로 새벽배송을 담당하던 특수고용직 노동자인 것으로 파악됐다. 통상 새벽 1~2시에 배송 작업을 마치는 야간조의 업무 특성상 ㄱ씨도 이날 일을 하거나, 일을 끝내고 복귀하다가 사고를 당한 것으로 보인다.
함께 일하던 동료들은 “ㄱ씨가 며칠 전 아버지 장례식을 치르고 제대로 쉬지도 못하고 출근했다가 사고가 난 것으로 보인다”고 추정하고 있다.
한편 쿠팡은 지난 2월부터 제주 지역에서 새벽배송을 시작했다.",새벽배송
노컷뉴스,"[단독]쿠팡새벽배송기사 교통사고 숨져…""졸음운전 추정""",네이버뉴스,https://n.news.naver.com/mnews/article/079/0004084439?sid=102,,노컷뉴스,"[단독]쿠팡 새벽배송 기사 교통사고 숨져…""졸음운전 추정""","쿠팡 협력업체 소속 30대…물류센터 복귀 중 사고 추정
10일 오전 2시 9분쯤 제주시 오라2동 한 도로에서 쿠팡 협력업체 소속 30대 택배기사가 전신주를 들이받아 소방이 구조에 나서는 상황. 제주소방안전본부 제공
제주에서 쿠팡 협력업체 소속 30대 택배기사가 새벽배송을 마치고 물류센터로 돌아가는 중 교통사고로 숨졌다.
10일 제주소방안전본부와 제주동부경찰서에 따르면 이날 오전 2시 9분쯤 제주시 오라2동 한 도로에서 30대 남성 A씨가 몰던 1톤 탑차가 전신주를 들이받았다.
이 사고로 크게 다친 A씨는 병원으로 이송됐지만 이날 오후 3시 20분쯤 사망 판정을 받았다.
경찰 조사 결과 A씨는 새벽배송을 마치고 쿠팡 물류센터로 돌아가는 길에 졸음운전으로 사고가 난 것으로 추정되고 있다.
A씨는 쿠팡 협력업체 직원으로 알려졌다.
한편 최근 택배노조가 노동자 건강권 보호를 위해 밤 12시부터 새벽 5시까지 새벽배송 제한을 제안하면서 논란이 일고 있다. 노동계는 과로와 졸음운전 등 야간노동의 위험을 줄이기 위한 조치라고 주장하는 반면, 유통업계와 소비자들은 생활 편의를 해치는 과도한 규제라며 반발하고 있다.
쿠팡에서는 지난해 새벽배송 기사 두 명이 과로로 숨졌다. 정슬기 씨가 주 73시간 넘게 야간근무를 하다 숨진 데 이어 50대 기사도 주 60시간이 넘는 근무 중 심근경색으로 사망했으며, 두 사례 모두 산업재해로 인정됐다.
※CBS노컷뉴스는 여러분의 제보로 함께 세상을 바꿉니다. 각종 비리와 부당대우, 사건사고와 미담 등 모든 얘깃거리를 알려주세요.
이메일 :
jebo@cbs.co.kr
카카오톡 :
@노컷뉴스
사이트 :
https://url.kr/b71afn",새벽배송
한겨레21,[단독] 쿠팡새벽배송과로사 또 있었다… 정슬기씨 사망 두 달 뒤,네이버뉴스,https://n.news.naver.com/mnews/article/036/0000052613?sid=102,,한겨레21,[단독] 쿠팡 새벽배송 과로사 또 있었다… 정슬기씨 사망 두 달 뒤,"2024년 7월 사망, 석 달 동안 주 61시간 근무… “아침 7시까지 식사도 휴식도 없었다”
쿠팡 배송 차들이 주차돼 있다. 연합뉴스
쿠팡에서 새벽배송을 하다 과로사한 택배기사가 고 정슬기씨 말고도 또 있었던 것으로 확인됐다.
2025년 11월9일 국회 기후에너지환경노동위원회 박홍배 더불어민주당 의원이 공개한 ‘업무상 질병 판정서’를 보면, 쿠팡로지스틱스서비스(이하 쿠팡)에서 새벽배송을 하던 50대 노무제공자(특수고용노동자) 택배기사 ㄱ씨가 2024년 7월24일 심근경색으로 숨졌고, 산업재해로 인정됐다. ㄱ씨는 사망 사흘 전인 7월21일 오후 자택에서 휴식을 취하다 가슴 통증을 호소해 병원으로 이송됐고 치료를 받다 숨졌다. 2024년 5월 정슬기씨가 쿠팡에서 새벽배송을 하다 사망한 지 2개월 만에 같은 죽음이 반복됐던 것이다.
근로복지공단 업무상질병판정위원회(질판위)는 “ㄱ씨가 (심근경색) 발병 전 12주 동안 주당 평균 업무시간이 61시간45분이고, 업무 부담 가중 요인으로 야간근무가 확인되는 점 등을 종합할 때 상병 발생에 있어 업무적 부담 요인이 높은 것으로 판단된다”며 “업무와 질병 사이에 상당한 인과관계가 인정된다”고 판단했다. 공단은 ㄱ씨 유족이 신청한 유족급여 지급을 승인했다.
ㄱ씨의 노동강도는 정슬기씨만큼 심각했다. 2023년부터 택배기사로 일한 ㄱ씨는 숨지기 두달 전인 2024년 5월부터 쿠팡 영업점 ㅁ업체와 계약을 맺고 새벽배송을 위한 야간고정 택배기사로 근무했다. 주 6일, 밤 9시께 쿠팡 캠프로 출근해 밤 10시부터 다음날 아침 7시까지 평균 237개의 물품을 배송한 것으로 나타났다. 판정서에서 유족 쪽은 “(ㄱ씨가) 별도의 식사나 휴식시간 없이 근무했다”고 밝혔다. 또 “일반 택배회사 대부분이 30㎏ 이상 상품 취급은 제한됐으나, 쿠팡의 경우 쿠팡에서 파는 물건은 ‘무조건 배송한다’는 원칙에 따라 제한이 없었다”고 주장했다.
ㄱ씨의 업무시간은 심근경색 발병 전 4주 동안 평균 주 62시간42분, 12주 동안 평균은 주 61시간45분으로 조사됐다. 업무상 질병을 판단할 때 업무시간은 밤 10시부터 다음날 6시까지 야간노동의 경우 30%를 가산해 계산한다. 근로복지공단은 산업재해보상보험법 고시에 따라 뇌심혈관 질환 발병 전 12주 동안 업무시간이 평균 주 60시간 또는 발병 전 4주 동안 평균 주 64시간을 넘으면 업무와 질환의 관련성이 강하다고 평가한다.
ㄱ씨처럼 쿠팡에서 새벽배송을 했던 정슬기씨 역시 발병 전 12주 동안 평균 주 73시간21분을 일하다가, 심실세동·심근경색으로 숨졌다. 당시 질판위는 정씨가 주 6일 야간고정으로, 육체적 강도가 높은 업무를 수행하며, 배송 마감시간으로 인한 정신적 긴장 상태로 일했다는 이유로 정씨의 죽음을 업무상 질병으로 판단했다.
박홍배 의원은 “쿠팡의 장기간 고정적인 고강도 야간노동이 만든 비극”이라며 “이런 현실을 계속 방치하는 것이 옳은지에 대한 반성 위에서 야간 장시간 노동에 대한 최소한의 규제 방안을 논의하고 실행해야 한다”고 말했다. 택배노조 관계자는 “원청 택배사의 눈치를 본 대리점들이 과로사 발생 사실을 숨기거나, 합의를 유도하는 사례가 많다”며 “쿠팡 등에서 알려지지 않은 과로사가 더 많을 것”이라고 밝혔다.",새벽배송
한겨레21,"[단독] 주 6일 밤샘배송, 식사도 휴식도 없이…쿠팡 과로사 또 있었다",네이버뉴스,https://n.news.naver.com/mnews/article/036/0000052613?sid=102,,한겨레21,[단독] 쿠팡 새벽배송 과로사 또 있었다… 정슬기씨 사망 두 달 뒤,"2024년 7월 사망, 석 달 동안 주 61시간 근무… “아침 7시까지 식사도 휴식도 없었다”
쿠팡 배송 차들이 주차돼 있다. 연합뉴스
쿠팡에서 새벽배송을 하다 과로사한 택배기사가 고 정슬기씨 말고도 또 있었던 것으로 확인됐다.
2025년 11월9일 국회 기후에너지환경노동위원회 박홍배 더불어민주당 의원이 공개한 ‘업무상 질병 판정서’를 보면, 쿠팡로지스틱스서비스(이하 쿠팡)에서 새벽배송을 하던 50대 노무제공자(특수고용노동자) 택배기사 ㄱ씨가 2024년 7월24일 심근경색으로 숨졌고, 산업재해로 인정됐다. ㄱ씨는 사망 사흘 전인 7월21일 오후 자택에서 휴식을 취하다 가슴 통증을 호소해 병원으로 이송됐고 치료를 받다 숨졌다. 2024년 5월 정슬기씨가 쿠팡에서 새벽배송을 하다 사망한 지 2개월 만에 같은 죽음이 반복됐던 것이다.
근로복지공단 업무상질병판정위원회(질판위)는 “ㄱ씨가 (심근경색) 발병 전 12주 동안 주당 평균 업무시간이 61시간45분이고, 업무 부담 가중 요인으로 야간근무가 확인되는 점 등을 종합할 때 상병 발생에 있어 업무적 부담 요인이 높은 것으로 판단된다”며 “업무와 질병 사이에 상당한 인과관계가 인정된다”고 판단했다. 공단은 ㄱ씨 유족이 신청한 유족급여 지급을 승인했다.
ㄱ씨의 노동강도는 정슬기씨만큼 심각했다. 2023년부터 택배기사로 일한 ㄱ씨는 숨지기 두달 전인 2024년 5월부터 쿠팡 영업점 ㅁ업체와 계약을 맺고 새벽배송을 위한 야간고정 택배기사로 근무했다. 주 6일, 밤 9시께 쿠팡 캠프로 출근해 밤 10시부터 다음날 아침 7시까지 평균 237개의 물품을 배송한 것으로 나타났다. 판정서에서 유족 쪽은 “(ㄱ씨가) 별도의 식사나 휴식시간 없이 근무했다”고 밝혔다. 또 “일반 택배회사 대부분이 30㎏ 이상 상품 취급은 제한됐으나, 쿠팡의 경우 쿠팡에서 파는 물건은 ‘무조건 배송한다’는 원칙에 따라 제한이 없었다”고 주장했다.
ㄱ씨의 업무시간은 심근경색 발병 전 4주 동안 평균 주 62시간42분, 12주 동안 평균은 주 61시간45분으로 조사됐다. 업무상 질병을 판단할 때 업무시간은 밤 10시부터 다음날 6시까지 야간노동의 경우 30%를 가산해 계산한다. 근로복지공단은 산업재해보상보험법 고시에 따라 뇌심혈관 질환 발병 전 12주 동안 업무시간이 평균 주 60시간 또는 발병 전 4주 동안 평균 주 64시간을 넘으면 업무와 질환의 관련성이 강하다고 평가한다.
ㄱ씨처럼 쿠팡에서 새벽배송을 했던 정슬기씨 역시 발병 전 12주 동안 평균 주 73시간21분을 일하다가, 심실세동·심근경색으로 숨졌다. 당시 질판위는 정씨가 주 6일 야간고정으로, 육체적 강도가 높은 업무를 수행하며, 배송 마감시간으로 인한 정신적 긴장 상태로 일했다는 이유로 정씨의 죽음을 업무상 질병으로 판단했다.
박홍배 의원은 “쿠팡의 장기간 고정적인 고강도 야간노동이 만든 비극”이라며 “이런 현실을 계속 방치하는 것이 옳은지에 대한 반성 위에서 야간 장시간 노동에 대한 최소한의 규제 방안을 논의하고 실행해야 한다”고 말했다. 택배노조 관계자는 “원청 택배사의 눈치를 본 대리점들이 과로사 발생 사실을 숨기거나, 합의를 유도하는 사례가 많다”며 “쿠팡 등에서 알려지지 않은 과로사가 더 많을 것”이라고 밝혔다.",새벽배송
한겨레,쿠팡새벽배송택배기사 과로사 또 있었다,네이버뉴스,https://n.news.naver.com/mnews/article/028/0002775509?sid=102,,한겨레,"[단독] 주 6일 밤샘 배송, 식사도 휴식도 없이…쿠팡 과로사 또 있었다","50대, 작년 7월 심근경색으로 쓰러져
사망 전 12주 주당 평균 62시간 일해
근로공단 “업무-질병 연관 인정돼”
쿠팡 배송차량의 모습. 쿠팡 제공
쿠팡에서 새벽배송을 하다 과로사한 택배기사가 고 정슬기씨 말고도 또 있었던 것으로 확인됐다.
9일 국회 기후에너지환경노동위원회 박홍배 더불어민주당 의원이 공개한 ‘업무상 질병 판정서’를 보면, 쿠팡로지스틱스서비스(이하 쿠팡)에서 새벽배송을 하던 50대 노무제공자(특수고용노동자) 택배기사 ㄱ씨가 지난해 7월24일 심근경색으로 숨졌고, 산업재해로 인정됐다. ㄱ씨는 사망 사흘 전인 7월21일 오후 자택에서 휴식을 취하다 가슴 통증을 호소해 병원으로 이송됐고 치료를 받다 숨졌다. 지난해 5월 정슬기씨가 쿠팡에서 새벽배송을 하다 사망한 지 2개월 만에 같은 죽음이 반복됐던 것이다.
근로복지공단 업무상질병판정위원회(질판위)는 “ㄱ씨가 (심근경색) 발병 전 12주 동안 주당 평균 업무시간이 61시간45분이고, 업무 부담 가중 요인으로 야간근무가 확인되는 점 등을 종합할 때 상병 발생에 있어 업무적 부담 요인이 높은 것으로 판단된다”며 “업무와 질병 사이에 상당한 인과관계가 인정된다”고 판단했다. 공단은 ㄱ씨 유족이 신청한 유족급여 지급을 승인했다.
ㄱ씨의 노동강도는 정슬기씨만큼 심각했다. 2023년부터 택배기사로 일한 ㄱ씨는 숨지기 두달 전인 지난해 5월부터 쿠팡 영업점 ㅁ업체와 계약을 맺고 새벽배송을 위한 야간고정 택배기사로 근무했다. 주 6일, 밤 9시께 쿠팡 캠프로 출근해 밤 10시부터 다음날 아침 7시까지 평균 237개의 물품을 배송한 것으로 나타났다. 판정서에서 유족 쪽은 “(ㄱ씨가) 별도의 식사나 휴식시간 없이 근무했다”고 밝혔다. 또 “일반 택배회사 대부분이 30㎏ 이상 상품 취급은 제한됐으나, 쿠팡의 경우 쿠팡에서 파는 물건은 ‘무조건 배송한다’는 원칙에 따라 제한이 없었다”고 주장했다.
ㄱ씨의 업무시간은 심근경색 발병 전 4주 동안 평균 주 62시간42분, 12주 동안 평균은 주 61시간45분으로 조사됐다. 업무상 질병을 판단할 때 업무시간은 밤 10시부터 다음날 6시까지 야간노동의 경우 30%를 가산해 계산한다. 근로복지공단은 산업재해보상보험법 고시에 따라 뇌심혈관 질환 발병 전 12주 동안 업무시간이 평균 주 60시간 또는 발병 전 4주 동안 평균 주 64시간을 넘으면 업무와 질환의 관련성이 강하다고 평가한다.
ㄱ씨처럼 쿠팡에서 새벽배송을 했던 정슬기씨 역시 발병 전 12주 동안 평균 주 73시간21분을 일하다가, 심실세동·심근경색으로 숨졌다. 당시 질판위는 정씨가 주 6일 야간고정으로, 육체적 강도가 높은 업무를 수행하며, 배송 마감시간으로 인한 정신적 긴장 상태로 일했다는 이유로 정씨의 죽음을 업무상 질병으로 판단했다.
쿠팡 배송 차들이 주차돼 있다. 연합뉴스
박홍배 의원은 “쿠팡의 장기간 고정적인 고강도 야간노동이 만든 비극”이라며 “이런 현실을 계속 방치하는 것이 옳은지에 대한 반성 위에서 야간 장시간 노동에 대한 최소한의 규제 방안을 논의하고 실행해야 한다”고 말했다. 택배노조 관계자는 “원청 택배사의 눈치를 본 대리점들이 과로사 발생 사실을 숨기거나, 합의를 유도하는 사례가 많다”며 “쿠팡 등에서 알려지지 않은 과로사가 더 많을 것”이라고 밝혔다.",새벽배송
KBS,밤새 2370kg 상차·배송…쿠팡 야간노동 과로사 또 있었다,네이버뉴스,https://n.news.naver.com/mnews/article/056/0012063249?sid=101,,KBS,쿠팡 새벽배송 택배기사 과로사 또 있었다,"지난해 7월 쿠팡에서 새벽배송 업무를 수행하던 50대 택배기사가 심근경색으로 숨지는 사고가 있었던 것으로 뒤늦게 알려졌습니다.
국회 기후에너지환경노동위원회 박홍배 더불어민주당 의원이 공개한 '업무상 질병 판정서'에 따르면 쿠팡로지스틱스서비스에서 새벽배송을 하던 50대 택배기사 A씨가 지난해 7월 24일 심근경색으로 사망했고, 근로복지공단은 이를 '업무상 질병'으로 인정했습니다.
A씨는 사망 사흘 전 오후 집에서 휴식을 취하다 가슴 통증을 호소해 병원으로 이송돼 입원 치료를 받았지만 숨졌습니다.
근로복지공단 업무상질병판정위원회는 ""발병 전 12주 동안 주당 평균 업무시간이 61시간 45분이었고, 업무 부담 가중 요인으로 야간 근무가 확인되는 점 등 종합할 때 상병 발생에 있어서 업무적 부담 요인이 높은 것으로 판단된다""며 A씨 사망을 산업재해로 인정했습니다.
판정서를 보면 A씨는 심근경색 발병 전 4주 동안 평균 주 62시간42분, 12주 동안 평균은 주 61시간45분 일한 것으로 조사됐습니다.
또 유족 측은 고인이 주6일 오후 10시부터 오전 7시까지 하루 평균 200건 이상 배송 업무를 수행했고, 별도의 식사 및 휴식 시간 없이 근무했다고 주장했습니다.
앞서 고 정슬기 씨 역시 2023년 3월부터 쿠팡 퀵플렉서로 일해오다 지난해 5월 28일 경기 남양주 자택에서 쓰러져 병원으로 이송됐지만 숨졌습니다. 사인은 심실세동과 심근경색 의증입니다.
정 씨는 평소 오후 8시 반부터 다음 날 오전 7시까지 하루 약 10시간 30분, 주 6일 근무한 것으로 확인됐고, 근로복지공단은 과로에 따른 산업재해로 판정했습니다.
[사진 출처 : 연합뉴스]
■ 제보하기
▷ 전화 : 02-781-1234, 4444
▷ 이메일 : kbs1234@kbs.co.kr
▷ 카카오톡 : 'KBS제보' 검색, 채널 추가
▷ 네이버, 유튜브에서 KBS뉴스를 구독해주세요!",새벽배송
프레시안,"쿠팡,새벽배송과로사 또 있었다...휴식 없이 주 6일 밤샘 근무",네이버뉴스,https://n.news.naver.com/mnews/article/002/0002413729?sid=102,,프레시안,밤새 2370kg 상차·배송…쿠팡 야간노동 과로사 또 있었다,"""22:00~07:00"" 근무 택배기사…장덕준·정슬기 이어 확인된 것만 세 번째 산재인정
""개처럼 뛰고 있긴 해요""라는 문자를 남겼던 고(故) 정슬기 씨 말고도 장시간·야간노동을 이유로 과로산재를 인정받은 쿠팡 새벽배송 기사가 한 명 더 있었던 것으로 확인됐다. 물류센터에서 일했던 고(故) 장덕준 씨를 포함하면, 쿠팡에서 야간노동을 하다 과로산재를 인정받은 것으로 확인된 노동자의 수가 세 명으로 늘어난 것이다.
10일 더불어민주당 박홍배 의원실이 근로복지공단으로부터 받아 공개한 '업무상 질병 판정서'를 보면, 쿠팡 물류 자회사인 쿠팡로지스틱스서비스에서 새벽배송을 하던 50대 택배기사 A 씨가 지난해 7월 21일 자택에서 쉬던 중 흉통을 호소해 병원으로 이송됐지만 3일 뒤 숨졌다. 사인은 ""급성 심근경색""이었다.
판정위는 A 씨가 계약서상 ""고정 저녁/야간근무""를 수행했고, 근무시간은 ""22:00~익일 07:00""이었던 것으로 확인했다. 주 평균 근무일수는 ""6일"", 노동시간은 ""54시간""이었다. A씨가 상차 업무를 병행하며 하루 평균 237건의 물품을 배송했다는 점도 판정위 인정사실에 담겼다. A씨가 하루에 다룬 물품의 누적 중량은 평균 1185킬로그램(상차·배송 등 2회 작업 고려 시 2370킬로그램) 이상으로 추정됐다.
판정위는 ""A 씨가 발병 전 12주 동안 주당 평균 업무시간이 61시간 45분이고, 업무 부담 가중요인으로 야간근무가 확인되는 점 등을 종합할 때 상병 발생에 있어 업무적 부담 요인이 높은 것으로 판단된다""며 ""업무와 질병 사이에 상당한 인과관계가 인정된다""고 판정했다.
근로복지공단은 산업재해보상보험법 고시에 따라 뇌심혈관 질환 발병 전 12주 동안 평균 주 60시간 또는 4주 동안 평균 주 64시간을 넘게 일하면 업무와 질환의 관련성이 강하다고 평가한다. 근무시간 측정 시 오후 10시부터 오전 6시까지에 대해서는 30%가 가산된다. 야간노동이 주간노동에 비해 더 큰 건강상 위험을 초래한다는 의학적 사실에 따른 것이다.
앞서 쿠팡에서는 새벽배송 택배기사였던 고(故) 정슬기 씨, 물류센터에서 교대제 근무를 했던 고 장덕준 씨의 죽음이 각각 지난해와 2021년에 과로산재로 인정됐다.
박홍배 의원은 쿠팡 야간 근무자의 연이은 과로사에 대해 ""장기간 고정적인 고강도 야간노동이 만든 비극”이라며 ""이런 현실을 계속 방치하는 것이 옳은지에 대한 반성 위에서 야간 장시간 노동에 대한 최소한의 규제 방안을 논의하고 실행해야 한다""고 주장했다.
▲쿠팡이 올해 3개 분기 연속 2천억원대 영업이익을 거뒀다. 3분기 매출은 작년 동기보다 20% 성장한 12조8천억원대로 분기 기준 최대를 기록했다. 미국 뉴욕증시 상장사인 쿠팡Inc는 3분기 영업이익이 2천245억원으로 지난해 같은 기간보다 51.5% 증가했다고 지난 5일 공시했다. 사진은 5일 서울 시내의 한 쿠팡 물류센터. ⓒ연합뉴스",새벽배송
