press,title,naver_news_text,naver_news_url,body,press_html,title_html,body_html,label
주간경향,[기자24시] 누구를 위한새벽배송금지인가,네이버뉴스,https://n.news.naver.com/mnews/article/033/0000049772?sid=101,,주간경향,"0~5시, 누가 일하고 누가 이익을 얻나···쿠팡은 비껴간 새벽배송 논쟁","소비자와 노동자의 싸움?…한국소비자단체협의회 등 공식 입장 없어
플랫폼 기업 책임 언급 안 돼…쿠팡 속도 경쟁·저임 구조도 논의돼야
쿠팡 배송 차들이 주차돼 있다. 연합뉴스
“장애아 어머니들, 노인들, 맞벌이 부부들… 많은 사람이 절실한 이유로 새벽배송을 이용하고 있는데, 이게 2000만명이다.” 지난 11월 3일 CBS라디오에서는 새벽배송을 주제로 장혜영 전 정의당 의원과 한동훈 국민의힘 전 대표가 토론을 벌였다. 한 전 대표는 ‘소비자 편익’의 중요성을 강조하며 ‘새벽배송 제한’에 반대 입장을 표명했다.
새벽배송 논란은 민주노총 택배노조가 ‘택배노동자 과로사 문제 해결을 위한 사회적 대화 기구’에서 ‘0시부터 5시까지 심야 시간 배송 제한’ 방안을 제안하면서 비롯됐다. 현재 대표적인 플랫폼 기업인 쿠팡은 1년 365일 하루도 쉬지 않고 주간배송 2회, 야간배송 3회 하루 총 5회 반복 배송을 한다. 자정 이후의 심야노동이 세계보건기구(WHO)에서 2급 발암물질로 분류된 만큼 노동자의 건강권 보호를 위해 현재 운영 중인 심야 3회 배송을 2회로 조정하자는 제안이었다. 택배노조는 “밤 12시까지의 새벽배송과 새벽 5시 이후 배송은 계속된다”라며 “긴급히 새벽배송이 필요한 물품에 한해 오전근무조(5시 출근)가 새벽배송으로 물품을 배송하자는 방안”이라고 설명했다. 그러나 해당 제안은 ‘새벽배송 전면 금지’로 요약되면서 논의는 ‘소비자’ 대 ‘노동자’ 간의 대립 구도로 치환됐다.
하지만 한국소비자연맹 등 12개의 단체가 소속된 한국소비자단체협의회는 이번 사안에 대해 공식 입장을 내지 않고 있다. ‘소비자’들의 반대가 ‘새벽배송 제한’의 주요 논거로 언급되지만, 정작 주요 소비자 단체들은 말을 아끼고 있는 상황이다. 협의회 측은 “입장을 내려면 여러 회원 단체의 의견을 모아야 하는데 회원 단체 내에서도 의견이 다 다를 것”이라며 “또한 지금은 이슈가 많이 변질돼 있는 상황이라 입장을 내는 것 자체가 적절치 않다고 판단한다”라고 말했다. ‘심야배송 전면 금지, 소비자 불편과 사회적 혼란 초래 우려’라는 성명을 발표한 소비자주권시민회의도 ‘새벽배송 전면 금지’를 전제로 반대 입장을 표명했으며 이 또한 “택배노동자 보호와 소비자 편익의 조화를 위한 실질적이고 합리적인 방안”을 촉구하는 정도에 그쳤다. 대한상공회의소 소통플랫폼인 ‘소플’이 지난 11월 4일 플랫폼 방문자를 대상으로 진행한 ‘0~5 심야 시간대 배송을 금지해야 한다’는 찬반 조사에서는 328명의 응답자가 찬성 50%, 반대 50%로 팽팽하게 나뉘기도 했다.
새벽배송 수요 과장됐을 가능성도
소비자들의 새벽배송 수요가 실제보다 과장됐을 가능성도 제기된다. 이승윤 중앙대 사회복지학과 교수는 새벽배송 수요가 ‘공급 주도 가짜 수요’라고 말한다. 쿠팡, 컬리 등 주요 플랫폼들이 새벽배송만을 유일한 옵션으로 제공하면서 실제로는 필요하지 않은 상황에서도 새벽배송을 이용하게 되는 구조가 형성됐다는 설명이다. 이 교수는 “새벽배송은 소비자의 잠재적 니즈를 발굴했다기보다는 인위적으로 수요를 창출한 측면이 강하다”라며 “쿠팡이 독점적 시장 확보력을 가지면서 쿠팡의 규칙이 택배업계의 규칙이 됐다. 수수료 차등 정책을 바탕으로 새벽배송, 익일배송, 기타 등 다양한 선택지를 제공했다면 상황은 달라졌을 수 있다”라고 말했다. 김소희 국민의힘 의원도 지난 1월 국회에서 열린 ‘쿠팡 택배노동자 심야노동 등 근로조건 개선을 위한 청문회’에서 “이렇게 빨리 배송받을 필요가 없는데 굳이 새벽배송을 해야 하냐고 생각하는 소비자도 있다”며 “새벽배송이 기본값으로 돼 있는 걸 개선해야 한다”고 말했다. 보다 근본적인 문제가 제기되기도 한다. 김종진 일하는시민연구소 소장은 “새벽배송을 하는 국가는 우리밖에 없다. 심야 로켓배송이 우리 사회에 필수 불가결한 것인가에 대한 사회적 논의가 필요하다”라고 말했다.
새벽배송 제한 논쟁의 또 다른 한 축으로 ‘노동자 간 대립’ 양상도 나타난다. 일부 새벽배송 기사들은 교통 체증과 엘리베이터 대기 등으로 낮 시간 배송이 비효율적이라며 택배노조가 제안한 ‘0~5시 배송 금지’에 반대 의견을 밝혔다. 강민욱 택배노조 부위원장은 새벽배송이 업무에 일정한 효율성이 있지만 노동자들의 건강 위험은 분명하다고 말했다. 그는 “심야노동은 2급 발암 요인이며 심혈관계 질환과의 연관성도 널리 알려져 있다. 미국 공중보건의학회는 야간 운전이 사고위험뿐 아니라 우울증과 사회적 고립감의 원인이 될 수 있다고 했다. 쌓이고 쌓이다가 큰 문제로 이어질 수 있다”라고 말했다.
고태은 중앙대 불안정노동과사회정책 연구랩 연구원은 “쿠팡 노동자들은 주간보다 야간이 바쁘고 물건이 더 많다고 이야기한다. 쿠팡 새벽배송 노동의 특성은 ‘야간에 더 빠르고 강도 높은 노동’을 하는 데 있다”라며 “마감을 지키지 못하면 해고될지 모른다는 공포는 노동자들을 더 뛰어다니게 한다. 이 과정에서 발생하는 육체적·정신적 스트레스가 노동자들의 몸에 치명적이고, 노동자들의 잦은 사망 사건으로 드러나고 있다”고 말했다. 지난해 5월 사망한 쿠팡CLS 소속 택배기사 고 정슬기씨는 밤 8시 30분 출근, 다음 날 오전 7시 퇴근이라는 고정된 야간근무를 주 6일 반복해온 것으로 확인됐다. 고인은 사망 전 12주 동안 주 평균 73시간 이상을 일한 것으로 나타났으며 과로와 심야노동의 누적이 주요 원인으로 지목됐다.
직업 선택의 자유도 최소한의 법적 기준을 충족하는 범위 내에서 보장돼야 한다. 김종진 소장은 “일자리가 부족한 지역에서는 최저임금 이하라도 일하겠다는 사람이 있다. 그러나 법이 정한 기준보다 낮은 조건에서 일하는 것을 ‘직업 선택의 자유’로 허용할 수는 없다”고 말했다. 이어 “플랫폼 노동은 현행 법·제도의 적용을 받지 않는 영역에 있다. 다른 직종의 심야근무자들은 최소한의 휴식 시간, 교대제, 야간 근무 일수 제한 등의 규제를 받지만 플랫폼 노동자들은 이러한 보호에서 제외돼 있다. 고용노동부 산재 사망 통계에 따르면 심야 시간대의 사고 발생이 가장 높다. 제도적 보호가 있는 노동자조차 이런 상황이다. ‘직업 선택의 자유’를 말하기보다 플랫폼 노동에도 기본적인 법적 보호 장치를 마련할 필요가 있다”고 밝혔다.
쿠팡 시스템 거론 안 해, 생산적 논의 실종
소비자와 노동자, 또 노동자 간 대립 구도가 반복되면서 정작 쿠팡으로 대표되는 거대 플랫폼 기업의 구조적 책임은 논의에서 비켜서 있다. 쿠팡은 2021년 ‘택배 과로사 대책을 위한 사회적 대화기구’ 논의에 참여하지 않았고, 당시 합의된 ‘택배기사의 분류작업 배제’ 원칙 역시 이행하지 않고 있다. 지난 1월 청문회에서는 프레시백 회수 업무가 택배기사의 업무가 아니라는 점이 지적되자 개선 의사를 밝힌 바 있으나, 현재까지 현장에서의 실질적 조치는 없는 상황이다. 김종진 소장은 “쿠팡은 정상적인 고용 기준이나 근로기준법이 적용되는 방식으로는 유지될 수 없는 구조에서 이윤을 창출하고 있다. 심야노동만 해도 근로기준법에 따르면 1.5배의 가산임금을 줘야 한다. 플랫폼 노동으로 고용하면 아무 규제가 없어 이를 활용해온 거다. 이에 대한 사회적 토론이 필요하다”라고 말했다. 고태은 연구원은 근본적으로 쿠팡의 책임을 강화할 필요가 있다고 말했다. 그는 “쿠팡은 배송부문 핵심인력을 직고용 배송기사로 두었다가 이를 다 특수고용 노동자로 전환했다. 할당·지시·감시·관리가 어플을 통해 모두 가능한 디지털 시스템 덕분”이라며 “사실 이들을 ‘개인사업자’로 분류하는 것 자체가 말이 안 된다. 원청이 만든 어플로 실시간 관리감독을 받는 것 또한 사용자성을 인정하는 기준으로 삼아 이들에 대한 원청 책임을 강화할 필요가 있다”라고 말했다.
쿠팡 시스템에 대한 논의가 없다 보니 ‘새벽배송 금지 찬반’으로만 논쟁이 흘러가면서 생산적인 논의가 실종되고 있다는 지적도 있다. 일각에서는 새벽배송이 제한돼도 배송 전 상품을 분류·포장하고 차량에 싣는 물류센터와 배송캠프 노동자의 야간노동은 여전히 계속된다며, 이번 제한이 일부 택배기사에게만 해당되는 조치라고 주장한다. 이같은 주장은 새벽배송 제한을 반대하는 주요 근거로 제시된다. 정성용 공공운수노조 전국물류센터지부장은 “이같은 주장은 마치 ‘택배노동자’와 ‘물류센터 노동자’ 두 노동 집단의 이해관계가 충돌하는 것처럼 보이게 한다”라며 “그러나 이는 쿠팡의 배송 시스템의 현행 유지를 전제로 한 논리다. 예를 들어 새벽배송 마감을 자정이 아닌 밤 9~10시로 앞당기거나 로켓배송 구조 자체를 조정하면 물류센터 노동자의 야간노동도 일정 부분 해소할 수 있다”고 말했다. 이어 “물류센터 노동자들은 최저임금을 받고 있어 야간수당을 받기 위해 오후조(야간조)를 선택하는 경우도 많다. 새벽배송 제한이 현장의 노동 강화나 임금 감소로 이어지지 않도록 쿠팡의 속도 경쟁과 저임금 구조도 함께 논의돼야 한다”라고 말했다.",새벽배송
매일경제,"소상공인도, 쿠팡 기사도 괜찮다는데…'새벽배송금지' 커지는 역풍",네이버뉴스,https://n.news.naver.com/mnews/article/009/0005587697?sid=110,,매일경제,[기자24시] 누구를 위한 새벽배송 금지인가,"이수민 사회부 기자
""새벽배송은 제 선택입니다. 낮에 일할 사람은 낮에 하면 됩니다. 누구를 위해 막으려는 거죠?""
4년째 새벽배송을 해온 30대 택배기사 A씨는 최근 민주노총이 '심야배송 금지'를 요구하고 나선 데 대해 불쾌감을 감추지 못했다. 일하는 시간대만 다를 뿐 주간 근무자와 근무 강도나 환경에 큰 차이가 없는데, 단지 새벽 시간이라는 이유로 일자리를 없애려는 것에 분노가 치민다고 말했다.
그는 ""이른 새벽에 배송하면 교통 체증에 시달릴 일이 없고 고객과 마찰도 적어 만족하며 일하고 있다""면서 ""심야배송이 중단되면 월 500만~600만원이던 수입이 절반 가까이 줄어든다""고 토로했다.
유통업계의 치열한 경쟁 속에 등장한 새벽배송은 이제 일상에서 빼놓을 수 없는 필수 서비스로 자리 잡았다. 서비스가 빠른 속도로 성장하면 그동안 보이지 않던 문제들이 드러나기 마련이다. 택배기사의 건강권도 그중 하나다. 다만 그 해법이 서비스 자체를 '전면 중단'하는 방식이라면 이는 '빈대 잡으려다 초가삼간 태우는 격'이다.
먼저 새벽배송을 중단하면 종사자들은 일자리를 잃을 수밖에 없다. 고용 안정과 상생을 강조해온 민주노총이 일자리가 사라지는 문제를 대책 없이 밀어붙이는 점은 이해하기 어렵다. 현장 기사들은 각자의 필요에 따라 근무 시간대를 선택하고 그 안에서 삶의 균형을 맞춘다. 이 자율성을 무시한 일방적 조치는 오히려 불균형을 초래할 수 있다.
이에 더해 논의의 장인 '택배 사회적대화기구'에 비노조 택배기사와 소비자, 소상공인 등 이해당사자 상당수가 배제됐다는 점도 납득되지 않는다. 밀실 논의의 결과가 드러날수록 새벽배송 금지에 반대한다는 여론은 더 높아지고 있다. 민주노총은 논의를 시작하기 전 이해관계자에게 최소한의 입장이라도 들으려 했는지 대답해야 한다.
근로자의 건강권은 반드시 보호돼야 할 중요한 가치다. 하지만 그 접근 방식이 일자리를 줄이거나 노동자의 선택권을 박탈하는 방향이어선 안 된다. 현장 목소리가 반영된 실질적인 처우 개선이 이뤄질 때에야 비로소 의미가 있다.
[이수민 사회부 기자]",새벽배송
매일경제,“새벽배송금지? 우린 어떡하라고”…소상공인들도 화났다,네이버뉴스,https://n.news.naver.com/mnews/article/009/0005587217?sid=102,,매일경제,“새벽배송 금지? 우린 어떡하라고”…소상공인들도 화났다,"한밤 새벽에 쿠팡 배송기사가 물품을 나르고 있다. [쿠팡]
민주노총 전국택배노조가 노동자 건강권 보장을 이유로 새벽배송 금지를 주장하고 있는 것에 대해 소상공인계가 반발에 나섰다.
소상공인연합회는 지난 9일 논평을 내고 “새벽배송 금지 주장은 정부의 민생경제 회복 노력에 찬물을 끼얹는 행위”라면서 “강력한 반대의 입장을 밝힌다”고 밝혔다.
소공연은 “새벽배송 제한 요구가 현실화되면 소상공인의 온라인 판로를 막아 돌이킬 수 없는 막대한 피해가 우려된다”면서 “내수 부진으로 인한 역대급 위기 속에 온라인 판매로 겨우 활로를 모색하던 소상공인들에게 난데없는 새벽배송 금지 논의는 크나큰 불안감을 넘어 생존의 위협으로 다가오고 있다”고 주장했다.
그러면서 “많은 소상공인이 이제는 식재료를 새벽배송으로 받아 하루 장사를 준비하는데 새벽배송이 중단되면 새벽에 차를 몰고 식자재를 구매하러 가야 해 인력 충원이 필요한 상황에 내몰린다”며 “노조가 상생이 아니라 가뜩이나 어려운 민생경제에 재를 뿌리겠다는 심산으로 밖에 보이지 않는다”고 비판했다.
이어 “만에 하나 택배 사회적대화기구와 관련된 국회의원들이 노조 측의 주장을 일방적으로 수용해 새벽배송이 금지된다면 즉각적인 강력한 항의에 나설 것”이라며 “쿠팡을 비롯한 새벽배송 온라인플랫폼 입점 소상공인들의 피해를 모아 손실보상 촉구에 나설 것을 불사할 방침”이라고 말했다.
한편 국내 최대 물류산업 학회인 한국로지스틱스학회 보고서에 따르면 새벽과 주 7일 배송 중단으로 택배 주문량이 40% 감소할 경우 소상공인 매출은 18조3000억원 줄어들 것으로 추산됐다. e커머스 업체 매출 감소분 약 33조원 등을 포함하면 경제적 손실은 54조원에 달할 것이라는 분석이다.",새벽배송
매일경제,새벽배송금지?… 소상공인 “생계 직격탄”,네이버뉴스,https://n.news.naver.com/mnews/article/009/0005587217?sid=102,,매일경제,“새벽배송 금지? 우린 어떡하라고”…소상공인들도 화났다,"한밤 새벽에 쿠팡 배송기사가 물품을 나르고 있다. [쿠팡]
민주노총 전국택배노조가 노동자 건강권 보장을 이유로 새벽배송 금지를 주장하고 있는 것에 대해 소상공인계가 반발에 나섰다.
소상공인연합회는 지난 9일 논평을 내고 “새벽배송 금지 주장은 정부의 민생경제 회복 노력에 찬물을 끼얹는 행위”라면서 “강력한 반대의 입장을 밝힌다”고 밝혔다.
소공연은 “새벽배송 제한 요구가 현실화되면 소상공인의 온라인 판로를 막아 돌이킬 수 없는 막대한 피해가 우려된다”면서 “내수 부진으로 인한 역대급 위기 속에 온라인 판매로 겨우 활로를 모색하던 소상공인들에게 난데없는 새벽배송 금지 논의는 크나큰 불안감을 넘어 생존의 위협으로 다가오고 있다”고 주장했다.
그러면서 “많은 소상공인이 이제는 식재료를 새벽배송으로 받아 하루 장사를 준비하는데 새벽배송이 중단되면 새벽에 차를 몰고 식자재를 구매하러 가야 해 인력 충원이 필요한 상황에 내몰린다”며 “노조가 상생이 아니라 가뜩이나 어려운 민생경제에 재를 뿌리겠다는 심산으로 밖에 보이지 않는다”고 비판했다.
이어 “만에 하나 택배 사회적대화기구와 관련된 국회의원들이 노조 측의 주장을 일방적으로 수용해 새벽배송이 금지된다면 즉각적인 강력한 항의에 나설 것”이라며 “쿠팡을 비롯한 새벽배송 온라인플랫폼 입점 소상공인들의 피해를 모아 손실보상 촉구에 나설 것을 불사할 방침”이라고 말했다.
한편 국내 최대 물류산업 학회인 한국로지스틱스학회 보고서에 따르면 새벽과 주 7일 배송 중단으로 택배 주문량이 40% 감소할 경우 소상공인 매출은 18조3000억원 줄어들 것으로 추산됐다. e커머스 업체 매출 감소분 약 33조원 등을 포함하면 경제적 손실은 54조원에 달할 것이라는 분석이다.",새벽배송
세계일보,"새벽배송금지 '분노'...소상공인들 ""민생경제 회복에 찬물""",네이버뉴스,https://n.news.naver.com/mnews/article/022/0004081396?sid=101,,세계일보,새벽배송 금지?… 소상공인 “생계 직격탄”,"민노총 ‘건강권’ 이유 금지 제안
“판로 막혀 피해… 민생경제 찬물”
전국민주노동조합총연맹(민주노총)이 노동자 건강권 보장을 이유로 ‘새벽배송 제한’을 주장하고 있는 가운데 소상공인 업계가 반발하고 나섰다.
소상공인연합회(소공연)는 9일 논평을 통해 “민노총 등이 제기한 새벽배송 금지 주장은 정부의 민생경제 회복 노력에 찬물을 끼얹는 행위”라고 주장했다. 소공연은 “새벽배송 제한 요구가 현실화되면, 소상공인의 온라인 판로를 막아 돌이킬 수 없는 막대한 피해가 우려된다”며 “내수 부진으로 인한 역대급 위기 속에 온라인 판매로 겨우 활로를 모색하던 소상공인들에게 난데없는 새벽배송 금지 논의는 크나큰 불안감을 넘어 생존의 위협으로 다가오고 있다”고 했다.
이 단체는 “무리한 새벽배송 금지 주장은 새벽배송으로 일상화된 소상공인 생태계와 나아가 한국 경제의 시스템을 일거에 붕괴시키겠다는 의도”라며 “노조가 상생이 아니라, 가뜩이나 어려운 민생경제에 재 뿌리겠다는 심산으로 밖에는 보이지 않는다”고 목소리를 높였다. 소공연은 새벽배송 시장이 2015년 4000억원에서 2024년 11조8000억원 규모로 성장한 배경에는 소상공인들이 주로 유통하는 과일, 식재료 등이 자리하고 있다는 내용에 주목했다.",새벽배송
이코노미스트,"'새벽 배송금지'에 뿔난 소상공인…""민생경제에 찬물 끼얹는 행위""",네이버뉴스,https://n.news.naver.com/mnews/article/243/0000087805?sid=101,,이코노미스트,"새벽배송 금지 '분노'...소상공인들 ""민생경제 회복에 찬물""","지난달 택배 사회적 대화기구서 관련 제안 나와
새벽배송 금지 시 소상공인 휘청...학계도 우려
서울 송파구 동남권물류단지에서 직원들이 택배를 정리하고 있다. 사진은 기사 내용과 무관. [사진 연합뉴스]
[이코노미스트 이지완 기자] 소상공인연합회가 최근 불거진 새벽배송 금지 논란에 대한 입장을 밝혔다. 새벽배송 금지 제안은 정부의 민생경제 회복 노력에 ‘찬물을 끼얹는 행위’라는 게 소상공인연합회 측 주장이다.
10일 업계에 따르면 소상공인연합회는 최근 논평을 통해 “새벽배송 금지 주장 철회를 강력히 촉구한다”고 밝혔다.
‘새벽배송 금지’ 논란은 전국민주노동조합총연맹(민노총) 산하 전국택배노조가 지난달 택배 사회적 대화기구에서 관련 제안을 한 것으로 알려지면서 시작됐다.
소상공인연합회는 “내수 부진으로 인한 역대급 위기 속에 온라인 판매로 겨우 활로를 모색하던 소상공인들에게 난데없는 새벽배송 금지 논의는 크나큰 불안감을 넘어 생존의 위협으로 다가오고 있다”고 우려했다.
소상공인연합회는 최근 한국로지스틱스학회의 보고서를 인용해 “학회는 새벽배송과 주7일 배송이 중단돼 택배 주문량이 약 40% 감소하면 소상공인 매출이 18조3000억원 감소할 것으로 추산했다”며 “이커머스(전자상거래) 업체 매출 감소분 약 33조원 등을 포함하면 경제적 손실은 54조원에 달할 것이라는 게 학회 측 분석”이라고 설명했다.
그러면서 “보고서에 따르면 새벽배송 시장은 2015년 4000억원에서 2024년 11조8000억원 규모로 성장했다. 특히 소상공인들이 주로 유통하는 과일, 식재료 등 빠른배송이 필수적인 품목의 유통을 촉진시킨 것으로 분석됐다. 이는 새벽배송으로 인해 소상공인들의 매출이 확대됐다는 방증”이라고 덧붙였다.
또한 소상공인연합회는 “언론보도에 따르면 2023년 기준으로 새벽배송의 대명사격인 쿠팡의 입점 소상공인은 21만명, 거래액은 9조원에 달한다”며 “전체 입점 판매자 중 소상공인 비중은 75%로 집계된다. 이 많은 소상공인 셀러뿐 아니라, 새벽배송 이용 소상공인들도 새벽배송이 중단되면 손해가 막심해질 것이 분명하다”고 걱정했다.
마지막으로 소상공인연합회는 “무리한 새벽배송 금지 주장은 새벽배송으로 일상화된 소상공인 생태계, 나아가 한국경제의 시스템을 일거에 붕괴시키겠다는 의도”라며 “노조가 ‘상생’이 아니라 가뜩이나 어려운 민생경제에 재 뿌리겠다는 심산으로 밖에는 보이지 않는 처사”라고 지적했다.",새벽배송
한국경제,민노총 ‘새벽배송’ 금지 추진에 “한국 경제 붕괴 의도” 소상공인 반...,네이버뉴스,https://n.news.naver.com/mnews/article/015/0005209233?sid=101,,한국경제,"'새벽 배송 금지'에 뿔난 소상공인…""민생경제에 찬물 끼얹는 행위""","사진=연합뉴스
소상공인연합회가 최근 민주노총 전국택배노조가 노동자의 건강권을 보장해야 한다는 취지로 주장하는 '새벽배송 금지'에 대해 반발하고 나섰다.
소공연은 지난 9일 논평을 내고 ""(새벽배송 금지 주장은) 정부의 민생경제 회복 노력에 찬물을 끼얹는 행위""라며 ""새벽배송 제한 요구가 현실화되면, 소상공인의 온라인 판로가 막혀 돌이킬 수 없는 막대한 피해가 발생할 것""이라고 밝혔다.
소공연은 ""많은 소상공인들이 식재료를 새벽배송으로 받아 하루 장사를 준비하고 있다""며 ""새벽배송이 중단되면 새벽에 차를 몰고 식자재를 구매하러 가야 해 인력충원이 필요하다""고 우려했다.
이어 ""새벽배송 금지 주장은 새벽배송으로 일상화된 소상공인 생태계와 나아가 한국 경제의 시스템을 일거에 붕괴시키겠다는 의도""라며 ""노조가 상생이 아니라, 가뜩이나 어려운 민생경제에 재 뿌리겠다는 심산인 것""이라고 비판했다.
한편 국내 최대 물류산업 학회인 한국로지스틱스학회 보고서에 따르면 새벽과 주 7일 배송 중단으로 택배 주문량이 40% 감소할 경우 소상공인 매출은 18조3000억원 줄어들 것으로 추산됐다. e커머스 업체 매출 감소분 약 33조원 등을 포함하면 경제적 손실은 54조원에 달할 것이라는 분석이다.",새벽배송
