press,title,naver_news_text,naver_news_url,body,press_html,title_html,body_html,label
아이뉴스24,"""애플페이견제도 버거운데""…삼성전자, 삼성페이 결제 오류에 '난감'",네이버뉴스,https://n.news.naver.com/mnews/article/031/0000737754?sid=105,,아이뉴스24,"""애플페이 견제도 버거운데""…삼성전자, 삼성페이 결제 오류에 '난감'","삼성페이 앱 업데이트 후 결제 오류…삼성 ""앱 삭제 후 재설치 통해 해결""
애플의 간편결제 서비스 '애플페이'의 국내 상륙에 맞서 서비스를 강화하고 있는 삼성전자가 삼성페이 결제 오류에 난감한 상황에 처했다. 일부 사용자 사이에서 발생한 오류지만, 자칫 신뢰도에 영향을 줄 수 있다는 우려에서다.
30일 업계에 따르면 이날 일부 갤럭시 사용자들은 삼성페이를 사용할 때 결제 오류로 불편함을 겪었다.
삼성전자가 운영하는 고객 지원 서비스·이용자 커뮤니티 '삼성멤버스'에는 ""삼성페이 서버 연결 및 결제가 안 된다"", ""3년 넘게 잘 사용해왔는데, 아침부터 생체인증 등 결제 오류가 생겼다"", ""카페에서 주문한 뒤 결제가 안 돼서 너무 당황했다"" 등의 글이 잇따라 올라왔다.
스마트폰에서 삼성페이를 통해 네이버페이 온라인 주문형 가맹점의 간편 결제를 이용하는 모습 [사진=삼성전자]
이번 오류는 소프트웨어 업데이트 과정에서 발생한 것으로 알려졌다. 삼성전자는 지난 28일부터 비자 해외결제 서비스, 고등학교 학생증 등 삼성페이 기능 업데이트를 시작했다.
삼성전자 관계자는 ""기능 업데이트를 하는 과정에서 일부 고객에게 오류가 생긴 것으로 파악됐다""며 ""앱 삭제 후 재설치하면 정상적으로 작동이 되며, 고객센터에서도 이같이 안내하고 있는 상황""이라고 말했다.
삼성전자 측은 공지사항을 통해 ""안드로이드9, 안드로이드10 버전 단말 일부에서 삼성페이 결제 시도 시 정상적으로 데이터를 불러오지 못해 결제가 진행되지 않는 현상이 발생했다""며 ""해당 이슈는 종료됐지만, 이미 현상이 발생한 단말의 경우 앱 삭제 및 재설치 이후 삼성페이 사용이 가능하다""고 밝혔다.
업계에선 애플페이 국내 도입으로 간편결제 시장 경쟁이 치열해진 상황에 발생한 오류인 만큼 삼성전자에 부정적인 영향을 줄 수 있다는 우려를 내놓는다.
애플페이 [사진=서민지 기자]
앞서 애플은 지난 21일 애플페이를 국내에 도입한 바 있다. 애플페이의 등장으로 간편결제 시장은 점유율 변화가 예고되고 있다. 시장조사업체 카운터포인트리서치는 애플이 내년 국내 간편결제 시장에서 15%에 달하는 점유율을 확보할 것으로 전망했다.
한국은행에 따르면 지난해 상반기 국내 간편 결제 시장에서 네이버페이, 카카오페이 등 전자금융업자는 50.4%, 신한플레이 등 금융회사는 26%, 삼성전자 등 휴대폰 제조사는 23.6%의 점유율을 차지했다. 삼성전자가 점유율을 뺏기지 않은 채 애플이 15%까지 점유율을 확대한다 해도 양사의 점유율 격차는 10% 이내로 좁혀지는 셈이다.
이에 삼성전자는 삼성페이의 서비스 확장에 더욱 힘을 싣고 있다. 삼성전자는 최근 네이버페이와 협업 서비스를 시작했다. 네이버 스마트스토어, 네이버페이 온라인 주문형 가맹점에서 삼성페이를 통한 간편결제를 이용할 수 있게 됐다. 네이버페이 역시 삼성페이 결제가 가능한 오프라인 가맹점에서 사용이 가능해졌다.
현재 삼성전자는 카카오페이와도 협업을 논의 중인 것으로 알려졌다. 아직 구체적인 방식은 알려지지 않았지만, 네이버페이처럼 온라인 카카오페이 가맹점에서 삼성페이를, 오프라인 삼성페이 가맹점에서 카카오페이를 이용할 수 있도록 협력할 것으로 보인다.
하나금융그룹과 손잡고 삼성페이에 고등학교 학생증 서비스도 시작했다. 하나금융과 제휴하고 있는 고등학교의 경우 삼성페이를 통해 학생증을 발급받을 수 있다.
업계 관계자는 ""금융 서비스는 신뢰가 가장 중요하게 여겨진다""며 ""결제 오류가 반복될 경우 신뢰도 하락으로 이어질 수 있는 만큼 기민한 대응이 필요할 것""이라고 말했다.",애플페이
아이뉴스24,"삼성페이, 전국서 결제 오류사태…“다시 깔아야 해결”(종합)",네이버뉴스,https://n.news.naver.com/mnews/article/031/0000737754?sid=105,,아이뉴스24,"""애플페이 견제도 버거운데""…삼성전자, 삼성페이 결제 오류에 '난감'","삼성페이 앱 업데이트 후 결제 오류…삼성 ""앱 삭제 후 재설치 통해 해결""
애플의 간편결제 서비스 '애플페이'의 국내 상륙에 맞서 서비스를 강화하고 있는 삼성전자가 삼성페이 결제 오류에 난감한 상황에 처했다. 일부 사용자 사이에서 발생한 오류지만, 자칫 신뢰도에 영향을 줄 수 있다는 우려에서다.
30일 업계에 따르면 이날 일부 갤럭시 사용자들은 삼성페이를 사용할 때 결제 오류로 불편함을 겪었다.
삼성전자가 운영하는 고객 지원 서비스·이용자 커뮤니티 '삼성멤버스'에는 ""삼성페이 서버 연결 및 결제가 안 된다"", ""3년 넘게 잘 사용해왔는데, 아침부터 생체인증 등 결제 오류가 생겼다"", ""카페에서 주문한 뒤 결제가 안 돼서 너무 당황했다"" 등의 글이 잇따라 올라왔다.
스마트폰에서 삼성페이를 통해 네이버페이 온라인 주문형 가맹점의 간편 결제를 이용하는 모습 [사진=삼성전자]
이번 오류는 소프트웨어 업데이트 과정에서 발생한 것으로 알려졌다. 삼성전자는 지난 28일부터 비자 해외결제 서비스, 고등학교 학생증 등 삼성페이 기능 업데이트를 시작했다.
삼성전자 관계자는 ""기능 업데이트를 하는 과정에서 일부 고객에게 오류가 생긴 것으로 파악됐다""며 ""앱 삭제 후 재설치하면 정상적으로 작동이 되며, 고객센터에서도 이같이 안내하고 있는 상황""이라고 말했다.
삼성전자 측은 공지사항을 통해 ""안드로이드9, 안드로이드10 버전 단말 일부에서 삼성페이 결제 시도 시 정상적으로 데이터를 불러오지 못해 결제가 진행되지 않는 현상이 발생했다""며 ""해당 이슈는 종료됐지만, 이미 현상이 발생한 단말의 경우 앱 삭제 및 재설치 이후 삼성페이 사용이 가능하다""고 밝혔다.
업계에선 애플페이 국내 도입으로 간편결제 시장 경쟁이 치열해진 상황에 발생한 오류인 만큼 삼성전자에 부정적인 영향을 줄 수 있다는 우려를 내놓는다.
애플페이 [사진=서민지 기자]
앞서 애플은 지난 21일 애플페이를 국내에 도입한 바 있다. 애플페이의 등장으로 간편결제 시장은 점유율 변화가 예고되고 있다. 시장조사업체 카운터포인트리서치는 애플이 내년 국내 간편결제 시장에서 15%에 달하는 점유율을 확보할 것으로 전망했다.
한국은행에 따르면 지난해 상반기 국내 간편 결제 시장에서 네이버페이, 카카오페이 등 전자금융업자는 50.4%, 신한플레이 등 금융회사는 26%, 삼성전자 등 휴대폰 제조사는 23.6%의 점유율을 차지했다. 삼성전자가 점유율을 뺏기지 않은 채 애플이 15%까지 점유율을 확대한다 해도 양사의 점유율 격차는 10% 이내로 좁혀지는 셈이다.
이에 삼성전자는 삼성페이의 서비스 확장에 더욱 힘을 싣고 있다. 삼성전자는 최근 네이버페이와 협업 서비스를 시작했다. 네이버 스마트스토어, 네이버페이 온라인 주문형 가맹점에서 삼성페이를 통한 간편결제를 이용할 수 있게 됐다. 네이버페이 역시 삼성페이 결제가 가능한 오프라인 가맹점에서 사용이 가능해졌다.
현재 삼성전자는 카카오페이와도 협업을 논의 중인 것으로 알려졌다. 아직 구체적인 방식은 알려지지 않았지만, 네이버페이처럼 온라인 카카오페이 가맹점에서 삼성페이를, 오프라인 삼성페이 가맹점에서 카카오페이를 이용할 수 있도록 협력할 것으로 보인다.
하나금융그룹과 손잡고 삼성페이에 고등학교 학생증 서비스도 시작했다. 하나금융과 제휴하고 있는 고등학교의 경우 삼성페이를 통해 학생증을 발급받을 수 있다.
업계 관계자는 ""금융 서비스는 신뢰가 가장 중요하게 여겨진다""며 ""결제 오류가 반복될 경우 신뢰도 하락으로 이어질 수 있는 만큼 기민한 대응이 필요할 것""이라고 말했다.",애플페이
이데일리,“커피 쏘겠다고 큰 소리쳤는데” 삼성페이믿었다가 ‘낭패?’,네이버뉴스,https://n.news.naver.com/mnews/article/018/0005453027?sid=101,,이데일리,"삼성페이, 전국서 결제 오류사태…“다시 깔아야 해결”(종합)","30일 일부 유저들 결제 먹통…“앱 업데이트 이후 SW 오류”
소비자들 “지갑없이 다니는데 출근도 못할뻔” 불만 속출
삼성전자 “오류 발생 규모 극히 일부…간헐적 생체인증 지연”
[이데일리 정두리 기자] 삼성 갤럭시 유저들의 간편결제 서비스 삼성페이에서 결제 오류가 발생해 소비자들이 불편을 겪었다.
삼성전자 측은 “앱 업데이트 과정에서 소프트웨어 오류가 발생했다”면서 “삼성페이 오류가 지속되면 앱을 지웠다 새로 깔면 정상 작동이 된다”고 안내했다.
사진=독자 제공
30일 관련업계에 따르면 이날 온라인 커뮤니티를 중심으로 전국에 걸쳐 삼성페이가 실행되지 않는다는 불만의 글들이 잇따라 올라왔다.
갤럭시 유저 정모씨(48)는 “지갑 대신 삼성페이를 쓰고 다니는데 아침부터 지금까지 결제도 못하고 있어 무척 당황스럽다”면서 “지금까지 이런 일이 없었는데 지갑을 다시 가지고 다녀야겠나 싶다”고 토로했다.
또 다른 유저 김모씨(38)도 “평소처럼 삼성페이를 찍었는데 대중교통 요금이 결제되지 않아 출근길에 식은 땀을 흘렸다”면서 “하마터면 출근을 못할뻔 했다”고 불만을 쏟아냈다.
삼성페이 운영팀은 이날 공지사항을 통해 “삼성페이 결제 시도시 간헐적 생체인증 지연현상이 발생하고 있다”면서 “조속히 조치 될 수 있도록 최선을 다하겠다”고 안내했다.
고객센터에 따르면 삼성페이 결제 오류 증상으로 자동드래그 기능이 사라지고, 카드 인증 및 핀번호, 생체오류가 발생한 것으로 나타났다. 이와 함께 “서버에 연결하지 못했습니다. 나중에 다시 해보세요”라는 연결 오류 메시지가 생겼다.
이번 오류 사태로 최근 애플페이가 국내 시장에 상륙하면서 페이 경쟁이 갈수록 치열해지는 가운데 독주체제를 굳히려는 삼성페이의 신뢰도에 금이 갈 수 있다는 목소리다. 국내 간편결제 시장 점유율 24％가량을 차지하는 삼성페이는 EMV 컨택리스를 포함한 NFC 방식과 마그네틱보안전송(MST) 방식 결제를 모두 지원한다.
삼성전자측은 삼성페이의 오류 원인으로 최근 삼성페이 기능 업그레이드를 위한 ‘삼성페이 앱 업데이트’ 과정에서 일부 소비자 단말기에 오류가 발생한 것으로 파악했다. 오류가 발생한 고객은 앱 삭제 후 재설치를 통해 문제를 해결할 수 있다고 회사측은 전했다. 다만 삼성전자는 유저들의 결제 오류가 얼마나 발생했는지에 대해선 밝히진 않았다. 삼성전자 관계자는 “이번 오류는 서버 등 문제가 아니며 극히 일부 단말기에서 나타나는 소프트웨어 충돌”이라면서 “오류가 계속 나는 고객들은 번거롭겠지만 앱을 지웠다 다시 깔면 해결된다”고 설명했다.",애플페이
국제신문,"삼성페이일부단말 오류…""앱 삭제 후 재설치땐 해결""",네이버뉴스,https://n.news.naver.com/mnews/article/658/0000036958?sid=101,,국제신문,"삼성페이 일부단말 오류…""앱 삭제 후 재설치땐 해결""","삼성전자, 30일 오후 공지
안드로이드 9, 10버전에서 발생
오류 있다면 앱 재설치 사용
삼성전자 갤럭시폰을 이용한 간편 결제 서비스 삼성페이를 통해 결제할 때 일부 단말(스마트폰)에서 결제 오류가 발생했다. 소비자 일부가 불편을 겪었고 삼성전자는 공지를 띄워 오류가 발생한 앱의 경우 삭제를 한 후 재설치할 것을 권장했다.
삼성페이에 BNK 부산은행 체크카드를 탑재한 화면. 정옥재 기자
삼성전자는 30일 오후 삼성페이 운영팀 명의로 삼성페이 앱에 공지를 띄워 “안드로이드 9, 안드로이드 10 버전의 일부 단말에서 결제를 시도할 때 정상적으로 데이터를 불러오지 못해 결제가 진행되지 않는 현상이 발견됐다”며 “이 이슈(문제)는 해결됐지만 이미 발생한 단말은 앱 삭제, 재설치 이후 사용이 가능하다”고 밝혔다.
스마트폰을 구동하는 안드로이드 운영 체제는 현재 13 버전까지 나와 있는데 9, 10 버전에서 발생했다면 구형 폰에서 발생됐거나 버전 업그레이드가 되지 않은 단말일 것으로 추정된다.
삼성전자는 “불편을 드린 점 다시 한번 양해의 말씀을 드리며 앱 재설치 시 삼성페이에 등록된 결제 수단이 삭제되어 재등록 후 이용이 필요하지만 결제 수단 가운데 카드의 경우 이전과 동일한 삼성계정으로 삼성페이에 로그인하면 앱 진입 시 최초 1회에 한 해 카드 가져오기 서비스를 제공하고 있다. 이 방법으로 재등록을 요청드린다”고 덧붙였다.
애플페이의 국내 출시 이후 광범위한 지점에서 애플페이와 삼성페이가 국내 시장을 놓고 격전을 벌이는 가운데 발생한 오류였다. 그러나 안드로이드 13 버전과 같은 최신 버전에서 광범위하게 발생되지 않아 삼성전자 측은 가슴을 쓸어내렸다는 후문이다.",애플페이
금강일보,삼성페이학생증 기능 추가... 5000원 캐시백 이벤트 진행,,,,,,,애플페이
아이뉴스24,애플공세에 맞선 삼성…보급형 '갤A34'로 국내 시장 지킬까,네이버뉴스,https://n.news.naver.com/mnews/article/031/0000737576?sid=105,,아이뉴스24,애플 공세에 맞선 삼성…보급형 '갤A34'로 국내 시장 지킬까,"31일 4개 색상으로 출시, 전작과 가격 동결…이르면 4월 중 SKT 통해 '갤A54'도 출격
'삼성 텃밭'인 국내 시장을 노리고 최근 애플의 공세가 날로 거세지고 있는 가운데 삼성전자가 효자 아이템인 '갤럭시A' 시리즈의 신제품을 앞세워 방어에 나선다.
갤럭시A34 [사진=삼성전자]
삼성전자는 오는 31일 국내서 '갤럭시 A34 5G'를 선보인다고 30일 밝혔다. 유럽, 동남아 등 글로벌 시장에선 이날 출시됐다.
'갤럭시 A34 5G'는 6.6형(166.5mm)의 대화면 슈퍼 아몰레드 디스플레이를 탑재하고, 120Hz 화면 주사율을 지원한다. 이를 통해 선명한 화질의 콘텐츠 감상은 물론 동영상과 게임을 즐길 때 높은 몰입감을 선사한다.
후면 카메라는 4천800만 화소의 메인 카메라를 비롯해 800만 화소의 초광각 카메라, 500만 화소의 접사 카메라 등 3개가 탑재됐다. 전면 카메라는 1천300만 화소다.
특히 후면 카메라는 OIS(광학식 손떨림 방지)와 향상된 VDIS(동영상 손떨림 보정) 기능을 탑재했다. 흔들림이나 움직임이 많은 상황에서도 보다 선명한 사진과 동영상 촬영이 가능하다.
사진 편집 기능도 강화됐다. 'AI 지우개' 기능을 통해 사진 속 원치 않는 피사체는 물론 그림자∙빛반사 등을 쉽게 제거할 수 있다.
해상도가 낮거나 오래된 사진을 자동으로 보정해주는 '사진 리마스터' 기능도 탑재됐다. 기존의 이미지 파일에서 GIF 파일까지 기능이 확대 적용됐다.
'갤럭시 A34 5G'는 최대 25W의 유선 충전을 지원하고, 5천 mAh의 대용량 배터리를 채용했다. 스토리지는 128GB를 탑재했으며 최대 1TB의 마이크로 SD를 추가할 수 있다. IP67 등급의 방수∙방진 기능도 지원한다.
이 제품은 삼성페이 기능도 지원한다. NFC(근거리무선통신)∙MST(마그네틱보안전송) 기술에 기반한 온∙오프라인 간편 결제를 지원한다. 뿐만 아니라 디지털 홈 키, 모바일 운전면허증, 영화 티켓, 멤버십 카드 등 다양한 기능을 탑재해 더 편리하고 안전한 디지털 라이프를 경험할 수 있다. 최근에는 네이버페이와의 협업으로 사용성이 더욱 강화됐다.
'갤럭시 A34 5G'는 어썸 실버(Awesome Silver), 어썸 그라파이트(Awesome Graphite), 어썸 바이올렛(Awesome Violet), 어썸 라임(Awesome Lime)의 4가지 색상으로 출시된다.
국내이동통신 3사로 모두 출시되며 자급제 모델도 구매 가능하다. 가격은 49만9천 400원으로, 전작과 가격은 동일하다.
갤럭시A54 [사진=삼성전자]
다만 삼성전자는 지난 15일 함께 공개한 '갤럭시A54'의 국내 출시 일정은 확정짓지 못했다. '갤럭시A54'는 현재 인도, 유럽 등에 출시된 상태로, 국내에선 이르면 4월 말, 늦어도 5월쯤 SK텔레콤 전용폰으로 나올 것으로 알려졌다. 전작인 '갤럭시A53'이 통신 3사를 통해 판매되고 자급제용으로 나왔던 것과는 상반된 모습이다.
업계 관계자는 ""우리나라에서 소비자들이 플래그십 스마트폰을 선호하는 경향이 더 강하다는 점이 영향을 준 것으로 안다""며 ""통신사들이 보급형폰을 내놨다가 판매 부진으로 남는 재고를 떠안을 수 있다고 생각해 부담을 느끼는 듯 하다""고 말했다.
삼성전자는 '갤럭시A' 시리즈를 앞세워 점유율 확대에 속도를 낼 전망이다. 시장조사업체 카운터포인트리서치에 따르면 지난해 4분기 국내 스마트폰 시장에서 애플의 점유율은 34%에 그쳤다. 당시 아이폰14 출시 효과를 봤음에도 1위 삼성전자(63%)와는 29%포인트(p) 뒤처졌다.
이에 맞서 애플도 최근 한국 시장 공략에 적극 나서는 분위기다. 최근 국내에 간편결제 서비스 '애플페이'를 론칭한 데 이어 온·오프라인 채널을 확대하고 있어서다. 특히 애플스토어는 오는 31일 오픈하는 강남점까지 포함할 경우 국내만 5곳으로, 연내 홍대점까지 들어서게 되면 '애플 텃밭'으로 불리는 일본 도쿄(5곳)보다 많은 수준이 된다.
업계 관계자는 ""장기적으로 한국 스마트폰 시장 내 애플의 점유율이 점진적으로 확대될 것으로 예상되지만, 애플페이 도입이나 애플스토어 확대가 아직까지 점유율에 큰 변화를 줄 만큼 영향이 크지 않을 것으로 보인다""며 ""삼성전자는 '갤럭시A' 신제품을 이번에 내놓으면서 '갤럭시S23' 판매량 감소세를 어느 정도 상쇄할 것으로 보여 오는 2분기 MX사업부 실적에 다소 긍정적인 영향을 줄 수 있을 것으로 예상된다""고 말했다.",애플페이
신신엠앤씨,"애플페이카드단말기, 우리 매장에도 도입해야할까요?",,,,,,,애플페이
