press,title,naver_news_text,naver_news_url,body,press_html,title_html,body_html,label
이데일리,"태영건설,워크아웃이후 첫 데시앙 사전점검 잘 될까",네이버뉴스,https://n.news.naver.com/mnews/article/018/0005661732?sid=101,,이데일리,"태영건설, 워크아웃 이후 첫 데시앙 사전점검 잘 될까","26일~28일 '리오포레 데시앙' 사전점검, LH가 진행
공사비 현금으로 바로 지급 위해 방안 강구
11월 노무비 이달 말·12월 노무비 설 연휴 전 지급
[이데일리 김아름 기자] 태영건설의 일부 현장에서 공사 차질을 빚고 있는 가운데 워크아웃 이후 첫 사전점검이 예정된 현장은 제대로 진행될 지 이목이 집중됐다. 다행이 한국토지주택공사(LH)가 전담해 차질없이 사전전검을 진행할 방침이다.
25일 LH와 태영건설 등에 따르면 오는 26일부터 28일까지 진행되는 과천 지식정보타운 S3 ‘리오포레 데시앙’ 사전점검은 LH가 정상적으로 진행키로 한 것으로 확인됐다. 이에 따라 수분양자들은 한숨을 돌릴 수 있게 됐다. 태영건설은 워크아웃 돌입 후 사실상 제대로 된 사업을 진행하지 못하고 있어서 사전점검 역시 차질을 빚을지도 모른다는 우려가 컸다.
서울 성동구에 위치한 태영건설의 성수동 개발사업 부지 모습.(사진=연합뉴스)
실제 태영건설은 지난해 12월분 기성 집행(공사한 부분에 대한 자금 집행) 계획을 확정하지 못하며 공사 중단을 고려하는 협력 업체가 늘어난 것으로 전해졌다. 태영건설이 공사 중인 아파트를 분양받은 가구는 1만9869가구, 진행 중인 공사는 140건, 협력업체 수는 581개 사에 달한다. 수많은 이해관계자들이 태영건설의 워크아웃 상황에 따라 돈을 제때 지급받을지, 정상적으로 입주할 수 있을지 노심초사하고 있다.
우선 과천 지식정보타운 S3 ‘리오포레 데시앙’은 내달 준공도 차질없이 받을 수 있을 것으로 보인다. 과천시가 입주예정자들 대상으로 간담회를 개최하며 불안함을 해소하고 적극 지원을 아끼지 않고 있는 상황이기 때문이다.
태영건설도 공사비를 최대한 지급할 방안을 강구하고 있다. 협력업체에 공사대금 등을 현금으로 바로 지급할 수 있는 방법도 모색 중이다.
태영건설 관계자는 “워크아웃 신청 전 협력사들이 할인해 간 외상매출채권 담보대출(외담대)의 할인한도 451억원이 찼고 ,태영건설은 현금으로 은행에 지급을 해야 하지만 워크아웃 신청으로 상환이 유예되는 금융채권으로 전환됐다”라며 “전환된 부분이 다시 상거래 채권으로 바뀌어야 돈을 은행에 지급할 수 있기 때문에 채권단에 동의를 구했고 채권단도 최근 구성된 운영위원회를 통해 빠르게 처리될 수 있도록 노력하고 있다”라고 설명했다.
이와함께 11~12월 노무비 지급 계획도 확정됐다. 11월 노무비는 이달 말 현금으로 지급할 계획이며 12월 노무비는 설 연휴 전에 지급하기 위해 발주처들에게 적극적인 협조를 구하고 있는 상황이다.
최근 대한전문건설협회가 태영건설 하도급 공사를 수행 중인 회원사 452개사 현장 862곳을 대상으로 조사한 결과 현장 92곳에서 직간접적인 피해가 발생한 것으로 나타나면서 하도급 대금을 직접 지불할 수 있게 해야 한다는 주장도 제기되고 있다.
직불협의와 관련해서 태영건설은 “발주처에서 공사비를 하도급사에 직접 지급하는 직불협의를 진행 중”이라며 “대주단, 시행사, 시공사의 합의가 조속히 이뤄지면 협력사들의 공사대금 지급이 발주처 직불로 인해 원활히 이루어질 전망”이라고 전했다.",태영건설워크아웃
머니S,태영건설하도급 피해 눈덩이… 92곳 직·간접 대금 미지급 발생,네이버뉴스,https://n.news.naver.com/mnews/article/417/0000977512?sid=101,,머니S,태영건설 하도급 피해 눈덩이… 92곳 직·간접 대금 미지급 발생,"워크아웃 후폭풍… ""업체 보호방안 필요""
태영건설이 워크아웃을 신청하면서 하도급 92곳에서 직·간접적인 대금 미지급 문제가 불거진 것으로 나타났다. 사진은 서울 여의도 태영건설 본사. /사진=뉴시스
재무구조 개선작업(워크아웃)을 신청한 태영건설의 하도급 현장 92곳에서 대금 미지급 등 직·간접적인 피해가 발생한 것으로 나타났다.
25일 대한건설정책연구원에 따르면 지난달 29일부터 이달 5일까지 태영건설과 하도급 공사를 수행하는 회원사를 대상으로 피해 사례를 조사한 결과 대금 미지급 등의 직·간접적인 피해가 발생한 현장은 총 92곳이다.
대금 미지급 피해 현장은 14곳으로 집계됐다. 대금 지급 기일이 변경된 현장(외상매출채권 담보대출 60일→ 90일)은 50곳이다. 결제 수단이 현금에서 어음으로 변경된 현장은 12곳, 직불 전환 된 현장 2곳, 어음할인 불가 등은 14곳으로 나타났다.
연구원은 '부동산 프로젝트 파이낸싱(PF) 위기 진단과 하도급업체 보호 방안' 보고서를 통해 태영건설 사태 외에도 앞으로 종합건설업체 부도에 따른 추가 피해 사례가 지속해서 발생할 것으로 예측한다.
보고서는 PF 부실 여파로 역량 있는 하도급업체들이 흑자도산 하는 것을 막기 위해 건설업체, 관련 기관, 정부, 국회의 대응이 절실히 요구되는 시점이라고 짚었다.
홍성진 건설정책연구원 연구위원은 ""앞으로도 태영건설과 같은 유사 사례가 지속될 수 있다""고 분석했다. 이어 ""하도급업체는 건설 자재장비업자, 노동자 등 서민 경제와 밀접한 관련이 있기 때문에 하도급업체 우선 보호 방안이 필요하다""고 주장했다.
그는 ""하도급업체는 부실기업이 워크아웃 또는 법정관리를 신청하는 경우 각각의 대응 방안을 숙지해서 대응해야 한다""며 ""정부와 국회는 하도급업체 보호를 위한 제도를 개선해야 한다""고 강조했다.",태영건설워크아웃
머니S,"태영건설사업장 92곳, 하도급 대금 미지급 등… 직간접 피해 잇따라",네이버뉴스,https://n.news.naver.com/mnews/article/417/0000977512?sid=101,,머니S,태영건설 하도급 피해 눈덩이… 92곳 직·간접 대금 미지급 발생,"워크아웃 후폭풍… ""업체 보호방안 필요""
태영건설이 워크아웃을 신청하면서 하도급 92곳에서 직·간접적인 대금 미지급 문제가 불거진 것으로 나타났다. 사진은 서울 여의도 태영건설 본사. /사진=뉴시스
재무구조 개선작업(워크아웃)을 신청한 태영건설의 하도급 현장 92곳에서 대금 미지급 등 직·간접적인 피해가 발생한 것으로 나타났다.
25일 대한건설정책연구원에 따르면 지난달 29일부터 이달 5일까지 태영건설과 하도급 공사를 수행하는 회원사를 대상으로 피해 사례를 조사한 결과 대금 미지급 등의 직·간접적인 피해가 발생한 현장은 총 92곳이다.
대금 미지급 피해 현장은 14곳으로 집계됐다. 대금 지급 기일이 변경된 현장(외상매출채권 담보대출 60일→ 90일)은 50곳이다. 결제 수단이 현금에서 어음으로 변경된 현장은 12곳, 직불 전환 된 현장 2곳, 어음할인 불가 등은 14곳으로 나타났다.
연구원은 '부동산 프로젝트 파이낸싱(PF) 위기 진단과 하도급업체 보호 방안' 보고서를 통해 태영건설 사태 외에도 앞으로 종합건설업체 부도에 따른 추가 피해 사례가 지속해서 발생할 것으로 예측한다.
보고서는 PF 부실 여파로 역량 있는 하도급업체들이 흑자도산 하는 것을 막기 위해 건설업체, 관련 기관, 정부, 국회의 대응이 절실히 요구되는 시점이라고 짚었다.
홍성진 건설정책연구원 연구위원은 ""앞으로도 태영건설과 같은 유사 사례가 지속될 수 있다""고 분석했다. 이어 ""하도급업체는 건설 자재장비업자, 노동자 등 서민 경제와 밀접한 관련이 있기 때문에 하도급업체 우선 보호 방안이 필요하다""고 주장했다.
그는 ""하도급업체는 부실기업이 워크아웃 또는 법정관리를 신청하는 경우 각각의 대응 방안을 숙지해서 대응해야 한다""며 ""정부와 국회는 하도급업체 보호를 위한 제도를 개선해야 한다""고 강조했다.",태영건설워크아웃
동아일보,태영 건설현장 곳곳 하도급사 피해 확산,네이버뉴스,https://n.news.naver.com/mnews/article/020/0003544679?sid=101,,동아일보,"태영건설 사업장 92곳, 하도급 대금 미지급 등… 직간접 피해 잇따라","기업개선작업(워크아웃)에 들어간 태영건설 사업장 중 최소 92곳에서 대금 미지급 등의 직간접적인 피해가 발생한 것으로 나타났다.
24일 대한건설정책연구원이 ‘부동산 프로젝트파이낸싱(PF) 위기 진단과 하도급 업체 보호방안’ 보고서를 통해 이같이 전했다. 대한전문건설협회는 태영건설이 워크아웃을 신청한 지난해 12월 29일부터 올해 1월 5일까지 관련 하도급 업체를 대상으로 설문조사를 했다. 조사 대상은 452개 업체의 현장 862곳이었는데, 71개 업체의 104곳 현장에서만 응답했다. 이 중 92곳의 현장에서 대금 미지급, 결제수단 변경 등 피해가 발생했다고 답했다. 미응답 현장에서도 피해가 발생했을 수 있어 규모는 더 클 것으로 추정된다.
92곳 중 대금 미지급 현장은 14곳이었다. 외상매출채권 담보대출(외담대) 지급 기일이 60일에서 90일로 연장되는 등 대금 지급이 지연된 현장도 50곳이었다. 또 현금 지급을 어음이나 외담대로 바꾼 현장이 12곳, 직불 전환 현장은 2곳이었다. 또 어음할인이 불가능해진 현장도 14곳으로 집계됐다.
연구원은 하도급 업체를 보호할 장치가 부족해 태영건설 같은 종합건설업체 부도에 따른 추가 피해 사례가 지속적으로 발생할 수 있다고 분석했다.",태영건설워크아웃
연합뉴스,태영CP4 사업장 대주단 회의…4천억원 추가투입 논의,네이버뉴스,https://n.news.naver.com/mnews/article/001/0014468268?sid=101,,연합뉴스,태영 CP4 사업장 대주단 회의…4천억원 추가투입 논의,"'워크아웃 개시' 불 켜진 태영건설
(서울=연합뉴스) 김성민 기자 = 태영건설의 주채권은행인 산업은행이 채권단 결의를 접수한 결과 동의율 96.1%로 워크아웃 개시를 결의했다고 12일 밝혔다. 사진은 이날 오전 서울 영등포구 태영건설 본사에 불이 켜져 있는 모습. 2024.1.12 ksm7976@yna.co.kr
(서울=연합뉴스) 채새롬 기자 = 태영건설 PF 사업장 중 가장 규모가 큰 마곡 CP4블록 대주단이 4천억원 규모 추가 자금투입에 대한 논의를 시작했다.
25일 금융권에 따르면 태영건설 CP4블록 사업장 대주단은 이날 오전 추가 자금투입 문제를 논의하는 회의를 열었다.
이 사업은 마곡 CP4구역에 지하 7층~지상 11층, 연면적 약 46만㎡ 규모의 복합 시설 '원웨스트 서울'을 짓는 사업이다.
이 사업의 시행법인이자 차주인 마곡CP4PFV는 이 사업에 3천600억∼3천700억원 상당의 추가 자금이 필요할 것으로 보고 있다.
계약상 공정률 70% 시점부터 태영건설 자금으로 공사를 진행해야 하는데, 태영건설이 워크아웃으로 자금을 투입할 수 없게 되면서 추가 출자가 필요해진 상황이다. 현재 공정률은 70% 이상이다.
대주단은 국민연금이 이 시설을 2조3천억원에 이미 선매입하기로 하고 계약금을 납입한 만큼, 예정대로 준공을 마무리해야 한다는 데는 공감대를 형성했다.
대주단 관계자는 ""대주단이 돈을 더 투입할지, 아니면 외부 자금을 투입하는 제3자 신용공여 방법을 쓸지 등에 대해 이제 막 논의를 시작한 단계""라고 말했다.
다른 관계자는 ""각사별로 이해관계가 다르고, 투자심의위원회 등도 거쳐야 하니 추가 출자 여부를 결정하려면 시일이 좀 더 소요될 것""이라고 말했다.
대주단에는 산업은행과 교보생명, 신한라이프, 푸본현대생명, MG새마을금고중앙회, 44개 지역 단위 신협 등 55개 금융사가 참여하고 있다. 지역 단위 신협이 다수 포함된 만큼 대형 금융사에 출자 부담이 지워질 것으로 예상된다.
다른 태영건설 사업장도 조만간 대주단협의회를 열고 사업장 향방에 대해 논의할 예정이다.
srchae@yna.co.kr",태영건설워크아웃
연합뉴스,태영건설마곡 PF사업장 추가 출자 가능성…설 전 지원방안 나올 듯,네이버뉴스,https://n.news.naver.com/mnews/article/001/0014468268?sid=101,,연합뉴스,태영 CP4 사업장 대주단 회의…4천억원 추가투입 논의,"'워크아웃 개시' 불 켜진 태영건설
(서울=연합뉴스) 김성민 기자 = 태영건설의 주채권은행인 산업은행이 채권단 결의를 접수한 결과 동의율 96.1%로 워크아웃 개시를 결의했다고 12일 밝혔다. 사진은 이날 오전 서울 영등포구 태영건설 본사에 불이 켜져 있는 모습. 2024.1.12 ksm7976@yna.co.kr
(서울=연합뉴스) 채새롬 기자 = 태영건설 PF 사업장 중 가장 규모가 큰 마곡 CP4블록 대주단이 4천억원 규모 추가 자금투입에 대한 논의를 시작했다.
25일 금융권에 따르면 태영건설 CP4블록 사업장 대주단은 이날 오전 추가 자금투입 문제를 논의하는 회의를 열었다.
이 사업은 마곡 CP4구역에 지하 7층~지상 11층, 연면적 약 46만㎡ 규모의 복합 시설 '원웨스트 서울'을 짓는 사업이다.
이 사업의 시행법인이자 차주인 마곡CP4PFV는 이 사업에 3천600억∼3천700억원 상당의 추가 자금이 필요할 것으로 보고 있다.
계약상 공정률 70% 시점부터 태영건설 자금으로 공사를 진행해야 하는데, 태영건설이 워크아웃으로 자금을 투입할 수 없게 되면서 추가 출자가 필요해진 상황이다. 현재 공정률은 70% 이상이다.
대주단은 국민연금이 이 시설을 2조3천억원에 이미 선매입하기로 하고 계약금을 납입한 만큼, 예정대로 준공을 마무리해야 한다는 데는 공감대를 형성했다.
대주단 관계자는 ""대주단이 돈을 더 투입할지, 아니면 외부 자금을 투입하는 제3자 신용공여 방법을 쓸지 등에 대해 이제 막 논의를 시작한 단계""라고 말했다.
다른 관계자는 ""각사별로 이해관계가 다르고, 투자심의위원회 등도 거쳐야 하니 추가 출자 여부를 결정하려면 시일이 좀 더 소요될 것""이라고 말했다.
대주단에는 산업은행과 교보생명, 신한라이프, 푸본현대생명, MG새마을금고중앙회, 44개 지역 단위 신협 등 55개 금융사가 참여하고 있다. 지역 단위 신협이 다수 포함된 만큼 대형 금융사에 출자 부담이 지워질 것으로 예상된다.
다른 태영건설 사업장도 조만간 대주단협의회를 열고 사업장 향방에 대해 논의할 예정이다.
srchae@yna.co.kr",태영건설워크아웃
이데일리,"'태영PF 중 최대 규모' 마곡 CP4 대주단, 4천억원 추가자급 투입 논의",네이버뉴스,https://n.news.naver.com/mnews/article/018/0005661608?sid=101,,이데일리,태영건설 마곡 PF사업장 추가 출자 가능성…설 전 지원방안 나올 듯,"25일 마곡 CP4 대주단 회의
""공사비 정상 집행 적극 협조…세부 방안 미확정""
최대 4000억 출자액 놓고 대주단 구성 금융사 내부 검토
[이데일리 김국배 기자] 서울 마곡지구 개발사업을 진행하는 태영건설(009410) CP4 대주단이 수천억원을 추가 출자할 가능성이 높아졌다. 이르면 설 연휴 전 구체적인 지원 방안이 나올 것으로 관측된다.
서울 여의도 태영건설 본사의 모습. (사진=뉴스1)
25일 금융업계에 따르면 이날 오전 태영건설 CP4 대주단은 회의를 열어 CP4  블록에 추가 출자를 하는 방안과 관련해 논의했다. CP4 블록은 태영건설 PF 사업장 중 최대 규모(14만평)로  매매가가 2조3000억원이다. 올해 말 준공하면 업무·숙박 시설을 포함한 복합 쇼핑몰이 들어서게 된다. 앞서 시행 법인이자 차주인 마곡CP4PFV가 최근 대주단 협의에서 준공하려면 3500억~3950억원의 추가 출자가 필요하다고 밝히면서 첫 고비를 맞았다. 현재 남은 PF 대출 약정 잔액으론 공사를 마치기 어렵다는 것이다.
이날 열린 대주단 회의에서는 일단 CP4 블록에 자금 지원을 하는 것으로 공감대가 형성된 것으로 전해진다. 준공이 밀리면 대주단 입장에서도 대출 상환 불확실성이 더 커지는 점, 하청업체 피해 확산 우려 등이 작용한 것으로 해석된다. CP4 블록의 대주단은 교보생명, 신협조합, 새마을금고중앙회, 푸본현대생명, 산업은행 등으로 구성돼 있다. 대한건설정책연구원에 따르면 최근 대한전문건설협회가 태영건설 하도급 공사를 수행하고 있는 회원사를 대상으로 조사한 결과 92곳에서 직·간접적 피해가 발생했다.
대주단 관계자는 “이번 회의에서 CP4 사업장의 공사비가 정상적으로 집행될 수 있도록 대주들이 적극 협조하기로 했다”며 “근로자들과 태영의 하청업체를 위한 대승적 차원에서 설 연휴 이전에 공사비를 주는 걸 목표로 했다”고 설명했다. 추가 출자를 못 박진 않았지만 가급적 지원한다는 뉘앙스다. 다른 관계자도 “지원을 하긴 해야 한다는 공감대는 있었다”고 전했다.
다만 세부 방안은 미확정이다. 자금 지원 자체에는 공감대가 형성됐지만, 사업장이 요구하는 금액에 대해서 각 금융사들이 철저히 계산기를 두드려 봐야 한다는 것이다. 만약 대주단이 최대로 출자(3950억원)한다면 기존 PF 대출 금액(1조5000억원)의 26% 정도를 추가로 내놓게 된다. 대주단엔 추가 출자가 어려운 지역 단위 신협 등도 있어 교보생명, 신한은행 등의 부담이 커질 수 있다는 예상도 나온다. 추가 출자는 각 회사별로 투자심의위원회도 거쳐야 하기 때문에 추가 출자를 하는 대주에게 혜택을 줘야 한단 목소리도 있다. 은행권 관계자는 “개별 금융기관 내부적으로 금리나 금액 등 어떻게 추가 지원해줄 수 있을지 내부적으로 검토를 해봐야 알 수 있을 것”이라고 말했다.
금융당국도 워크아웃 초반인 만큼 CP4 사업장 처리 방안을 예의주시할 것으로 보인다. 최근 금융당국은 연일 부동산 PF 부실 처리와 관련해 강경 발언을 이어가며 속도감 있는 정리를 주문하고 있다. 이복현 금융감독원장은 지난 24일 주요 증권사 최고경영자(CEO)들과 만나 “건설사와 금융사의 노이즈를 감내하고라도 엄청나게 강한 강도로 부동산 PF 대응에 나설 것”이라며 “사업장에 대한 철저한 리스크 분석을 통해 부실 사업장은 신속하고 과감하게 정리해주길 바란다”고 했다.",태영건설워크아웃
