press,title,naver_news_text,naver_news_url,body,press_html,title_html,body_html,label
지디넷코리아,특례 보금자리론'흥행'…왜 SC제일은행서만 접수?,네이버뉴스,https://n.news.naver.com/mnews/article/092/0002282725?sid=105,,지디넷코리아,특례 보금자리론 '흥행'…왜 SC제일은행서만 접수?,"주금공 ""10조원 돌파…은행서 취급 수요없어""
특례 보금자리론이 지난달 30일 출시 이후 9일 만에 취급액이 10조원을 넘을 정도로 흥행하고 가운데, 대면 접수 채널이 SC제일은행 한 군데다 보니 불편함을 호소하는 목소리가 나오고 있다.
모바일과 인터넷 이용에 다소 어려움을 느끼는 60대 이상 디지털 소외계층을 위해 대면 채널 확대가 필요하다는 주장이 나오지만, 한국주택금융공사는 대면 채널을 확대할 계획은 없는 상태다.
15일 한국주택금융공사에 따르면 특례 보금자리론은 SC제일은행 한 곳에서만 대면으로 접수받고 있으며, 다른 은행 지점서는 접수가 불가능하다. 모바일과 인터넷으로 할 경우엔 주택금융공사를 통해서 접수할 수 있다.
(사진=이미지투데이)
주택금융공사는 모바일과 인터넷 이용이 어려운 금융소비자를 위해 보완책으로 SC제일은행을 이용하도록 만들었다고 설명하고 있다. 하지만 SC제일은행 지점 수가 워낙 적어 해결책으로 보긴 어려운 실정이다.
금융감독원 통계 자료에 따르면 지난해 3분기 SC제일은행의 지점은 179개다. 지점 수가 다른 은행의 10분의 1수준이다. 울산과 광주, 세종에는 SC제일은행이 한 군데 밖에 없다.
이런 상황에도 불구하고 주택금융공사가 SC제일은행에만 특례 보금자리론을 취급하는 이유에 대해, 주택금융공사 측은 ""타 은행들은 수요가 없었다""고 답변했다.
주택금융공사 관계자는 ""SC제일은행의 경우에는 예전부터 대면으로만 't보금자리론' 신청을 받고 있었다""며 ""특례 보금자리론을 취급하는 협의 단계서 취급 의사를 표현한 곳이 SC제일은행밖엔 없었다""고 설명했다.
또 ""작년 보금자리론을 보았을 때 비대면 신청이 95% 정도 차지하는 것을 보면 은행의 참여 유인도 역시 떨어지는 것으로 보인다""고 부연했다.
시중은행들이 특례 보금자리론 대면 접수 의사를 보이지 않음에 따라 추후에도 대면 접수 채널 확장은 이뤄지지 않을 전망이다.
은행들은 특례 보금자리론 신청과 접수 등에 소요되는 인력을 무시하지 못하고, 비대면 채널이 잘되어있다는 점을 들어 특례 보금자리론의 대면 접수는 받지 않고 있다고 답했다.
A은행 관계자는 ""접수는 모바일과 인터넷 주택금융공사, SC제일은행을 통해 가능하지만 신청에 대한 상담은 시중은행서도 가능하다""며 ""은행들이 비대면 채널을 이용하도록 공을 많이 들였기 때문에 인력 투입이 큰 대면 채널의 접수는 당분간 줄어들 것으로 보인다""고 말했다.",특례보금자리론
경인일보,[경제전망대] 거래량 반등의 키 '특례보금자리론',,,,,,,특례보금자리론
SBS Biz,[뉴스'까'페] 집값 떨어지자…'유한책임'보금자리론인기 급상승,네이버뉴스,https://n.news.naver.com/mnews/article/374/0000322911?sid=101,,SBS Biz,[뉴스'까'페] 집값 떨어지자…'유한책임' 보금자리론 인기 급상승,"지난해 부동산 침체 속에 집값만큼만 대출 상환 책임을 지는 '유한책임' 보금자리론을 찾는 발길도 급증한 것으로 나타났습니다.
지난달 30일부터 신청받기 시작한 '특례보금자리론' 역시 최대 5억원까지 '유한책임'을 적용받을 수 있지만, 대출액이 줄어들 수 있다는 점도 유념할 필요가 있어 보입니다.
작년 '유한책임' 보금자리론 비중 64% 달해
오늘(14일) 주택금융공사에 따르면, 지난해 유한책임 보금자리론은 모두 6조7000억원 규모로 공급됐습니다.
이는 지난해 보금자리론 전체 공급량 10조5000억원의 64%에 해당하는 비중입니다.
유한책임 보금자리론은 차주의 상환능력에 문제가 생겨 경매로 담보 주택을 처분해 대출을 갚아할 경우 담보주택 처분에 의한 회수금만큼만 대출금을 갚는 정책금융 상품입니다.
즉, 주택을 처분한 가격이 대출 잔액보다 더 낮게 책정되더라도 대출자가 추가 상환 부담을 지지 않는 겁니다.
문재인 정부의 국정과제에 따라 주금공사는 2018년 5월 유한책임 보금자리론을 출시했습니다.
출시 첫해에는 전체 보금자리론에서 유한책임형이 차지하는 비중이 4.2%에 불과했습니다.
하지만 2020년 40%, 2021년 48%로 꾸준히 늘었고 출시 5년째인 지난해에는 비중이 절반을 넘어서며 급증한 겁니다.
낮아진 문턱·집값 하락에 각광받아
이처럼 비중이 급증한 데는 우선 지난해 4월 가입 문턱을 낮춘 영향이 있습니다.
기존에는 부부합산 연소득 7000만원 이하인 경우에만 유한책임형을 보금자리론 가입 시 선택할 수 있었습니다.
하지만 신혼부부는 8500만원 이하, 다자녀 가구의 경우 3자녀 이상은 1억원 이하까지로 소득요건을 보금자리론과 동일하게 맞췄습니다.
여기에 대출한도 역시 3자녀 이상 가구의 경우 기존 3억6000만원에서 4억원으로 확대했고, 자금 용도 역시 구입용도와 상환용도에 더해 임차보증금 반환용도까지 허용했습니다.
여기에 지난해 부동산 가격이 하락세를 이어간 점도 유한책임형 수요를 끌어올릴 것으로 풀이됩니다.
특례보금자리론도 5억원까지…대출액↓ 가능성도
[특례보금자리론 홈페이지 화면. (출처=주택금융공사)]
지난달 30일부터 보금자리론과 통합돼 1년간 한시적으로 운영되는 '특례보금자리론'도 유한책임형을 선택할 수 있습니다.
최대 대출 한도는 특례보금자리론 한도와 같은 5억원입니다.
최근 서울 아파트 값의 하락폭이 커지는 등 부동산 시장 불확실성이 여전하고 고금리 이자 부담이 지속되는 상황 속에 유한책임형은 매력적인 선택지로 보입니다.
다만 선택시 유념해야할 점도 있습니다.
주금공은 ""추가로 고객이 부담하는 비용은 없지만, 구입자금보증을 이용하는 경우에는 유한책임형을 적용할 수 없다""고 설명했습니다.
주금공은 구입자금보증(MCG)을 해주고 있습니다.
은행이나 주금공에서 대출 심사를 위해 대출액을 계산할 때, 주택담보대출비율(LTV)을 따집니다.
이때 아파트가 아닌 다세대나 연립주택 등에는 방수공제액 즉, 세입자가 들어올 것을 감안해 세입자에게 보전해 줄 보증금을 방수에 따라 일정액을 차감해서 대출액을 결정합니다.
그런데 주금공의 구입자금보증을 들게 되면, 방수공제액 등 주담대 시 공제되는 최우선변제 소액임차보증금 등을 차감하지 않아도 돼 대출한도가 늘어나는 효과를 기대할 수 있습니다.
하지만 유한책임형을 선택할 경우 구입자금보증을 동시에 들지 못하기 때문에 대출액이 줄어들 수 있는 겁니다.
여기에 더해 주금공은 대출자가 보금자리론 신청시 유한책임형을 선택하더라도 주택의 단지 규모, 주택조사가격 대비 구입가격의 적정성 등 담보 주택 심사를 통해 승인여부를 결정합니다.
작년 평균 1.9억원 대출…실제 사례는 단 '1건'
이 때문에 유한책임 보금자리론의 최대 대출한도는 4억원(3자녀 이상 가구)이지만, 실제로 지난해에 나간 평균 대출액은 1억9000만원 수준입니다.
또 집값 하락세 속에 주택을 처분한 가격이 대출 잔액보다 더 낮게 책정되는 사례는 출시 이후 지난 5년 간 단 1건에 불과했습니다.
이 사례 역시 담보 주택 처분액을 초과한 대출 잔액은 1000만원 가량에 그쳤습니다.
결국 집값 하락세 속 '안전판'인 유한책임을 택할지, 아니면 조금이라도 대출액을 늘릴지는 금융소비자가 유불리를 꼼꼼히 따져볼 필요가 있습니다.",특례보금자리론
에너지경제,[기자의 눈] 주어진 상황을 활용하는특례보금자리론,,,,,,,특례보금자리론
아주경제,"""금리 내린다는데 난 언제쯤?""···'영끌' 기대출자에겐 '그림의 떡'",,,,,,,특례보금자리론
