press,title,naver_news_text,naver_news_url,body,press_html,title_html,body_html,label
한국경제,"""TMF 살까 TMV 살까""…美국채 금리요동에 흔들리는 서학개미",네이버뉴스,https://n.news.naver.com/mnews/article/015/0004897480?sid=101,,한국경제,"""TMF 살까 TMV 살까""…美국채 금리 요동에 흔들리는 서학개미","이 기사는 국내 최대 해외 투자정보 플랫폼
한경 글로벌마켓
에 게재된 기사입니다.
미국 국채 금리가 다시 요동치고 있다. 9월 연방공개시장위원회(FOMC) 이후 고금리 상황이 내년 상반기까지 장기화할 것이라는 전망이 많아지고 있어서다. 금리 변동성이 커지면서 그동안 채권 ETF를 사들인 ‘서학개미’들은 울상을 짓고 있다.
1일 한국예탁결제원에 따르면 최근 3개월(6월26~9월26일) 동안 국내 투자자들이 가장 많이 순매수한 해외 주식 종목은 ‘디렉시온 데일리 20년 이상 미국채 불3X 셰어즈’(TMF)였다. 최근 3개월 동안 순매수한 금액만 3억6032만달러, 약 4869억원에 달하는 금액이다.
이 상장지수펀드(ETF)는 만기가 20년 이상인 미국채로 구성된 ‘ICE U.S. 20년 이상 미국채 지수’의 일일 수익률을 3배로 추종한다. 국채 금리가 하락해 시중 국채 가격이 상승해야 수익이 나는 구조다. 미국 중앙은행(Fed)이 더 이상 기준금리를 올리지 않을 것이라고 예상한 ‘서학개미’들이 금리 인하를 예상하고 사들인 것이다.
그러나 최근 TMF는 급락하고 있다. 지난달 1일부터 26일까지 23.1% 하락했다. 투자자들의 예상과 다르게 고금리 상황이 내년 상반기까지 이어질 것이라는 전망이 많아지면서 미국 국채 금리가 급등세를 보인 까닭이다. 국제 유가가 급등하면서 물가 상승을 자극하는 점도 금리가 쉽게 꺾이지 않을 원인으로 꼽힌다. 미국 30년물 국채 금리는 지난 6월 말 연 3.86%였으나 지난달 26일엔 연 4.68%까지 뛰었다.
엔화로 미국 채권 ETF를 산 ‘일학개미’들도 손해를 보고 있다. ‘아이셰어즈 20년 이상 미국채 엔화 헤지 ETF’는 지난달 1일부터 27일까지 7.7% 하락했다. 이 ETF는 최근 3개월 국내 투자자들이 2억4034만 달러를 순매수했다. TMF에 이어 해외 종목 가운데 순매수 2위였다.
금리 하락에 베팅하는 투자자들은 여전히 많은 편이다. 9월 FOMC 이후인 지난달 21일부터 26일까지 국내 투자자들은 TMF를 2482만달러, 아이셰어즈 20년 이상 미국채 엔화 헤지 ETF를 2259만달러 각각 순매수했다.
전문가들은 금리 인하 기대가 낮아지면서 금리 하락에 베팅하는 투자가 당분간 수익을 거두긴 어려울 것이라고 보고 있다.
한광열 NH투자증권 연구원은 “금리 하락에 따른 투자 성과는 당분간 기대하긴 어렵다”며 “다만 채권을 직접 투자해 만기까지 보유한다면 높아진 쿠폰 수익을 기대할 순 있다”고 했다.
일부 투자자들은 연내 기준금리 추가 인상 가능성에 무게를 두고 있다. 금리 상승을 예상한다면 TMF의 반대격 상품인 ‘디렉시온 데일리 20년이상 미국채 베어 3X 셰어즈’ ETF에 투자할 수 있다. ‘ICE U.S. 20년 이상 미국채 지수’ 수익률을 역으로 3배 추종하는 상품으로 국채 금리가 상승하면 수익을 보는 상품이다. TMV는 지난달 1일부터 26일까지 26.5% 상승했다.
국내 증시에 상장된 ETF 중에서는 ‘KBSTAR 미국장기국채선물인버스(H)’를 들 수 있다. ‘S&P 미국채 선물 초과수익률’ 지수를 역으로 추종하는 상품이다. 지난달 1일에서 27일동안 7.15% 올랐다.",국채금리
글로벌이코노믹,"[속보] 미국 셧다운 ""45일 유예"" 상· 하원 임시예산안 통과… 뉴욕증시...",,,,,,,국채금리
매경이코노미,천정 뚫은 美국채 금리…‘채권 막차’ 탄 개미들 ‘발 동동’,네이버뉴스,https://n.news.naver.com/mnews/article/024/0000084868?sid=101,,매경이코노미,천정 뚫은 美 국채 금리 …‘채권 막차’ 탄 개미들 ‘발 동동’,"제롬 파월 미국 연방준비제도(Fed·연준) 의장이 지난 9월 20일(현지 시간) 기자회견에서 금리 동결을 발표한 뒤 자리를 떠나고 있다. (연합뉴스)
미국 연방준비제도(Fed·연준)가 연방공개시장위원회(FOMC)에서 ‘매파적 본색’을 드러내며 긴축 장기화를 시사하자 미 국채 금리가 급등하고 있다. 상당수 개인 투자자들은 조만간 금리 인하가 시작된다고 보고 미 국채 장기물 상장지수펀드(ETF)에 베팅했으나 예상 밖 긴축 신호에 좌불안석이다. 당분간 시장 금리는 상승세를 탈 가능성이 높아 평가손실 우려가 커지고 있다.
미 연준이 지난 9월 21일 FOMC 정례회의에서 고금리 장기화를 시사하자 미 국채 수익률은 연일 최고치를 갈아치우고 있다. 최근 미 국채 10년물 수익률은 4.48%로 2007년 이후 최고치를 기록했다.
문제는 적지 않은 개인 투자자가 금리 인하가 임박했다고 보고 장기채 ETF 투자를 늘렸다는 점이다.
채권은 듀레이션(평균적인 투자 만기 기간)을 따라 금리 변동폭에 따른 가격 변화가 다르다. 듀레이션이 긴 장기 채권은 금리에 민감하므로 똑같이 금리가 1% 움직여도 가격 변동성이 크다. 반대로 듀레이션이 짧은 단기 채권은 금리에 상대적으로 덜 민감하므로, 똑같이 금리가 1% 등락해도 가격 변동성이 낮다.
이 때문에 앞으로 금리가 오를 것으로 예상된다면 하이일드 채권처럼 듀레이션이 상대적으로 짧은 채권을 중심으로 포트폴리오를 짜는 것이 유리하다. 반면, 앞으로 금리가 지금보다 내릴 것으로 예상된다면 듀레이션이 긴 장기 채권을 중심으로 포트폴리오를 짜는 편이 낫다. 상당수 개인 투자자가 후자 쪽에 베팅을 했는데, 작금의 금리 방향성은 정반대로 흘러가고 있는 것이다.
이 탓에 미 국채 관련 ETF는 줄줄이 연저점까지 추락했다. 만기가 20년 이상 남은 미 국채 30년물에 투자하는 ETF인 ‘디렉시온 데일리 20+ 이어 트레저리 불 3X 셰어스’는 지난 9월 21일(현지 시간) 5.2달러(약 6950원)로 연저점을 기록했다. ‘TMF’라는 티커가 붙은 이 ETF는 연초 약 8달러였지만, 9개월 여 만에 35% 넘게 하락했다. TMF는 올 들어 지난 9월 22일까지 국내 투자자들이 약 9억2000만달러(약 1조2000억원)어치를 순매수해 해외 주식 순매수 1위에 오른 종목이다.
이 기간 해외 주식 순매수 4위와 5위에 오른 종목도 미 장기채에 투자하는 ETF로 역시 주가는 연저점을 기록 중이다. 국내 투자자 순매수 규모 2억4500만달러(약 3284억원)로 4위 ‘아이셰어즈 20+ 이어 트레저리 본드’와 2억4300만달러로 5위 ‘아이셰어즈 20+ 이어 트레저리 본드 바이라이트’는 각각 연초보다 18%, 10% 하락했다.
국내 증시에 상장된 미 장기채 ETF를 사들인 투자자들도 속이 타는 것은 마찬가지다. ‘KODEX 미국채울트라30년선물(H)’ ‘TIGER 미국채30년스트립액티브(합성H)’ ‘ACE 미국30년국채액티브(H)’ 등 관련 ETF도 9월 FOMC 회의 이후 줄줄이 신저가로 추락했다.
전문가들은 현시점에서 미 장기채 투자는 각별히 주의할 것을 당부한다. 강송철 유진투자증권 애널리스트는 “당장 금리 인하를 기대하기 힘든 환경이 된 만큼 장기채 투자는 지양해야 할 때”라며 “금리 변동에 따른 가격 변동이 장기채에 비해 상대적으로 적은 단기채에 관심을 가질 것을 권한다”고 말했다.",국채금리
뉴시스,美 셧다운 현실화…단기 변동성 확대 예상[주간증시전망],네이버뉴스,https://n.news.naver.com/mnews/article/003/0012122026?sid=101,,뉴시스,美 셧다운 현실화…단기 변동성 확대 예상[주간증시전망],"증권가, 코스피 예상범위 2420~2550선 제시
[서울=뉴시스] 최진석 기자 = 27일 코스피가 전 거래일(2462.97)보다 2.10포인트(0.09%) 오른 2465.07에 장을 마쳤다. 코스닥지수는 전 거래일(827.82)보다 13.20포인트(1.59%) 상승한 841.02에 거래를 종료했다. 서울 외환시장에서 원·달러 환율은 전 거래일(1348.5원)보다 0.8원 오른 1349.3원에 마감했다. 사진은 이날 오후 서울 중구 명동 하나은행 딜링룸의 모습. 2023.09.27. myjs@newsis.com
[서울=뉴시스] 김경택 기자 = 이번주 코스피는 긴 연휴를 지나는 가운데 미국 연방정부가 업무를 중단하는 '셧다운' 현실화 우려가 코앞으로 다가오면서 단기 변동성을 확대할 것으로 전망됐다. 주간 예상 코스피 밴드는 2420~2550포인트로 제시됐다.
1일 한국거래소에 따르면 지난주 코스피는 전주(2508.13) 대비 43.06포인트(1.72%) 하락한 2465.07에 거래를 마쳤다. 지난달 28~29일 추석 연휴에 따라 3거래일만 거래된 가운데 25~26일 이틀 연속 하락세를 나타내며 부진한 모습을 나타냈다.
지난주 유가증권시장에서 외국인과 기관은 각각 2029억원, 4818억원을 순매도했고 개인은 6309억원을 순매수한 것으로 집계됐다.
전문가들은 이번주 코스피가 긴 추석과 개천절 등 긴 연휴를 지난 가운데 지수 역시 명절 후유증을 지날 것으로 예상했다. 이번주 발표될 한국 9월 수출을 비롯해 미국 정부의 셧다운 우려, 원·달러 환율 급등, 미국 국채 10년물 금리 연고점 경신 등 투자심리에 영향을 미칠 변수들이 상당하다는 이유에서다.
가장 주목되는 이벤트는 미국 의회의 내년 예산안 처리 여부다. 현지 시간으로 미국 연방정부의 회계연도가 끝나는 9월30일까지 내년 정부 예산 관련 법안 12개가 통과되지 않으면 10월1일(현지시간) 자정을 기해 연방 정부는 자동으로 셧다운 상태에 돌입한다.
한지영 키움증권 연구원은 ""셧다운 돌입 시 정부 노동자 80만명이 강제 무급 휴가에 들어가게 되고 이때 줄어드는 소비는 통계에 잡히지 않는 간접적인 타격이 예상된다""면서 ""셧다운이 증시에 미치는 직접적인 충격은 크지 않다는 것이 과거의 교훈이긴 하지만, 과거 셧다운 당시에 비해 데이터 민감도가 높아졌다는 점에 주목해야 한다""고 설명했다.
셧다운 장기화 시 GDP(국내총생산), 고용, CPI(소비자물가지수) 등 통화정책 결정과 직결된 데이터들을 확인할 수 없는 만큼, 의회 예산안 통과 여부가 증시 방향성을 결정하는 관건이 될 것이란 분석이다.
한 연구원은 ""예산안이 9월 내로 합의가 된다면, 지표 측면에서 주목해야할 이벤트는 미국의 9월 비농업부문 고용이 될 것""이라면서 ""현재 컨센서스는 신규고용이 16만3000건(8월 18만7000건), 실업률이 3.7%(8월 3.8%)로 혼재된 결과가 나올 것으로 형성되고 있는데, 여기서 자동차 3사(포드·GM·스텔란티스) 노조 파업 이슈가 9·10월 고용지표에 어느정도 반영되는 지도 이번 고용지표에서 주안점이 될 것으로 판단한다""고 말했다.
증시 펀더멘털 측면에서는 9월 한국 수출과 9월 미국의 ISM(공급관리자협회) 제조업 PMI(구매관리자지수) 등이 코스피 이익 전망 변화에 영향을 줄 것으로 예상됐다.
그는 ""이상의 내용들을 고려했을 때 이번주 연휴가 끝난 직후 오는 4일부터 열리는 국내 증시는 장 초반 연휴 기간 대외 이벤트를 일시에 반영하면서 단기적인 주가 변동성이 높아질 것으로 보인다""며 ""다만 시간이 지날수록 이를 소화해가면서 이번주 예정된 고용지표, 삼성전자 잠정 실적 등 펀더멘털에 주목하며 주가 복원력을 확보해나갈 것""이라고 내다봤다．
◇주요 경제지표 발표 및 이벤트 일정
▲10월2일 = 한국 9월 수출·9월 수입, 중국 차이신 제조업 PMI·차이신 서비스업 PMI
▲10월3일 = 미국 9월 ISM 제조업지수
▲10월4일 = 한국 9월 제조업 PMI, 유럽 9월 서비스업 PMI·8월생산자물가지수·8월소매판매, 미국 9월 ADP 취업자 변동수·9월 서비스업 PMI·9월 ISM 서비스업 PMI·8월 공장수주
▲10월5일 = 한국 9월 소비자물가지수, 미국 8월 무역수지
▲10월5일 = 미국 9월 비농업부문 고용·9월 실업률·9월 시간당 평균임금·9월 경제활동참가율, 한국 삼성전자 잠정실적 발표",국채금리
디지털데일리,"치솟는 ‘원-달러 환율’, 추석 연휴 이후는?… 현재로선 美 ‘금리’가...",네이버뉴스,https://n.news.naver.com/mnews/article/138/0002157809?sid=101,,디지털데일리,"치솟는 ‘원-달러 환율’, 추석 연휴 이후는?… 현재로선 美 ‘금리’가 최대 변수","외환 딜링룸 ⓒKB국민은행
[디지털데일리 박기록 기자] 추석 연휴전인 지난 27일 서울 외환시장에서 마감된 원-달러 매매기준환율은 1355.00원이다.
1달러당 원화의 교환가치가 1350원을 돌파했다는 것은 과거 데이터를 소환하지 않더라도 외환 관리에 경고등이 들어왔다는 것을 의미한다.
문제는 현재 국내외 상황을 고려했을때, 원-달러 환율이 1200원대로 안정화될 가능성도 있지만 오히려 1400원대까지도 추가 상승할 수 있는 대내외 요인들도 동시에 커지고 있다는 점이다.
이와관련 미국의 연내 기준금리 추가 인상 가능성이 원-달러 환율 변화의 큰 변수로 떠오르고 있다.
실제로 미 연준이 지난 7월 FOMC(연방공개시장위원회) 정례회의에서 기준금리를 기존보다 0.25%p 인상해 평균값이 5.50%로 확대된후 약 2개월간 적지않은 후폭풍이 글로벌 금융 시장에 몰아쳤다.
이 기간동안 ‘킹달러’가 재현됐고, 미국 국채금리(수익율)는 급상승했으며, 금리에 민감한 나스닥 시장은 기세가 크게 꺽이면서 미 증시도 냉각시켰다.
미국의 기준금리 인상은 글로벌 외환시장에 큰 충격을 미치는 핵심 변수로 작용하고 있는 것이 증명된 셈이다.
‘상저하고’, 올 하반기 지수 2800을 기대했던 국내 코스피 시장도 결국 지난 2개월간 원-달러 환율의 상승과 미 증시 하락과 동조화 현상을 보이면서 2500이 무너진 상태다.
유로화, 영국 파운드화, 일본 엔화 주요국 6개국 통화와 달러를 연계한 달러인덱스도 지난 7월말 100수준까지 내려왔으나 최근 다시 106 수준으로 급등했다.
미 증시에 영향을 미치는 미 국채금리의 경우 10년물이 지난 7월말 3.7%에서 최근 4.6%를 돌파했다. 지난 2007년 이후 17년만에 최고치를 경신했다.
이같은 시장 실질금리의 고공 행진이 이어지면서 돈이 MMF 등 초단기 고금리 상품으로 몰리는 등 불안한 흐름이 이어지고 있다고 외신은 전하고 있다.
◆1년만에 다시 ‘킹달러’ 현상… 예측빗나간 美 금리, 10월말 FOMC가 최대 변수
당초 올 상반기만하더라도 시장에선 더 이상 미 연준의 기준금리 인상이 없을 것으로 전망했었고, 나아가 올 하반기 피봇(금리의 하락 전환)까지 예상했다.
하지만 결과적으로 이같은 낙관론은 완전히 빗나갔다.
미 인플레이션(물가상승) 수준이 여전히 높기 때문이다. 인플레이션에 직접적인 영향을 미치는 국제유가가 연말 배럴당 100달러를 돌파할 수 있다는 우려도 여전하다.
미 연준은 지난달 말, 9월 FOMC(연방공개시장위원회) 정례회의에선 금리를 동결시켰지만 제롬 파월 의장은 “(2%대의 인플레이션까지는) 아직도 갈길이 멀다”며 연내 추가 기준금리 인상 가능성을 시사했고, '매파'로 분류되는 연준 위원들의 목소리도 커지고 있다.
뉴욕 월가에서도 추가 금리 상승 우려를 경계하고 있다.
최근 제이미 다이먼 JP모건체이스 회장은 현지 매체와의 인터뷰에서 “미국 기준금리 7%대 시대를 대비해야 한다”고 발언해 주목을 끌었다.
이에 따라 현재로선 미 연준이 기준금리 결정에 중요하게 참조하는 ‘9월 소비자물가지수(CPI)’ 뿐만 아니라 고용지표 흐름 등도 매우 중요해졌다.
미 노동부는 오는 12일(현지시간) 미 '9월 CPI'를 발표한다. 다음 미 연준의 FOMC 정례회의는 오는 10월31일~11월1일 이틀간 진행된다.
2023.8.24 '8월 금통위' 직후 기자회견하는 이창용 총재
◆한미간 금리차 역대 최대차, 환율 불안 요인 지적… 고민 커지는 한은
현재 한국의 기준금리는 3.5% 수준으로, 미국 금리(5.5%)와 역대 최대 격차를 보이고 있다.
한국은행이 공개한 올 8월말 기준 외국환은행의 거주자외화예금 잔액은 991.0억 달러로 전월말 대비 59억 달러 감소한 것으로 나타났는데, ‘킹달러’ 현상에 따른 환전 감소액 등이 영향을 미쳤다는 게 한은의 분석이다.
물론 원-달러 환율 결정이 한미 양국간 금리차에 의해서만 오롯히 결정되는 것은 아니지만, 이같은 한미간 금리 역전 현상의 장기화는 결국 원-달러 환율 상승 압력으로 작용할 것이란 시장의 우려는 커지고 있다.
“경기둔화가 우려되더라도 미국과 보조를 맞춰 한은도 기준금리 인상을 단행해야한다”는 목소리가 높아지는 이유다.
올해 한은 금통위는 오는 10월19일과 11월30일 두 차례 열릴 예정이다.
현재로선 미 ‘10월 FOMC’ 결과가 나온 이후에 열리는 11월30일 한은 금통위 결과가 주목된다.
만약 미 연준이 기준금리를 추가 인상할 경우, 한미 금리차가 더 확대되는 것을 막기위해 한은 금통위도 국내 기준금리 인상을 고려할 가능성이 높다는 관측이다.
앞서 지난 8월24일 개최된 한은 금통위는 “주요국의 통화정책 및 경기와 관련한 불확실성이 높아진 데다 가계부채 흐름도 유의해서 지켜볼 필요가 있는 만큼 현재의 긴축 기조를 유지하는 것이 적절하다”면서도 “추가 인상 필요성은 대내외 정책 여건의 변화를 점검하면서 판단해 나갈 것”이라고 총평한 바 있다.
‘환율’ 변수가 우리 경제에서 차지하는 막중한 비중을 고려했을 때 국제수지, 물가, 이자율, 가계부채와 부동산 가격 등 여러 핵심 경제 지표에 시차를 두고 연쇄적인 영향을 미치게 된다.
특히 올 4분기 원유·가스 등 겨울철 에너지 수입 비중이 커지는 시점임을 고려하면, 이같은 원-달러 환율의 상승은 수입 물가 상승 압력을 높이는 원인이다.
급격한 환율 변화는 국내 증시 흐름에도 변수다. 일반적으로 원-달러 환율의 상승은 증시에는 악재로 인식된다.
원화에 대한 달러 교환 가치의 하락을 의미해 외국인 투자자들의 매도 압력이 커지기 때문이다.
다만 수출 비중이 큰 기업들은 원-달러 환율 상승에 따른 ‘환차익’ 효과가 실적에 반영됨으로써 실적 관리에는 긍정적으로 작용하기때문에 기업별 상황은 다를 수 있다.
추석 연휴이후, 미 기준금리 인상 여부 등 대외변수에 의한 외환시장의 변동성이 더욱 확대될 것으로 예상된다.
올 4분기 국내 거시경제지표이 안정적 관리를 위한 통화 정책 당국의 과감한 선제 대응이 필요하다는 목소리도 더욱 커지고 있다.",국채금리
