press,title,naver_news_text,naver_news_url,body,press_html,title_html,body_html,label
YTN,버츄얼 아이돌로 '인생 2막'...메타버스예능 통할까?,네이버뉴스,https://n.news.naver.com/mnews/article/052/0001838048?sid=103,,YTN,버츄얼 아이돌로 '인생 2막'...메타버스 예능 통할까?,"카카오엔터 '메타버스 예능' 출시…""걸그룹 결성""
전·현직 아이돌 멤버 30명 경쟁…서바이벌 예능
모션 캡쳐 기술 활용 아바타 생성…표정도 포착
[앵커]
최근 가상세계를 배경으로 버츄얼 캐릭터들이 등장하는 이른바 '메타버스 예능'이 쏟아지고 있습니다.
메타버스 기술이 다양한 콘텐츠에 도입되면서, 새로운 장르로 굳어가고 있는데, 결국, 실제와 같은 몰입감을 주는 게 흥행 성패를 가를 관건으로 보입니다.
차정윤 기자입니다.
[기자]
""마리아 아베마리아""
한 소녀 캐릭터가 용암이 흐르는 무대에서 노래를 부르고, 다른 소녀는 잠시 후 탈락이라는 결과 발표와 함께 불구덩이 속으로 떨어집니다.
마치 게임처럼 보이지만, 버츄얼 걸그룹을 뽑기 위해 경쟁하는 서바이벌 예능 프로그램 한 장면입니다.
이 캐릭터의 진짜 주인은 실제 아이돌로 활동했던 멤버 30명.
최종 선발된 5명은 앞으로 가상 현실을 무대로 활동한다는 계획입니다.
[손수정 / '소녀 리버스' PD : 아이돌로서 할 수 없었던, 막혀 있었던 걸 해보고 싶다는 니즈들이 개개인들이 강했었고요. 저희도 같이 몰입을 하게 됐던 것 같고….]
그렇다면 아바타는 어떻게 만들어질까?
센서가 부착된 모션 캡쳐 장비를 착용하면 아바타가 내 움직임을 그대로 따라 하고, 미세한 표정의 변화까지 포착합니다.
저도 이렇게 페이셜 캡쳐 장비를 써봤는데요.
제 입모양은 물론 눈동자의 움직임까지 이 오드아이 고양이 캐릭터에서 표현됩니다.
이처럼 메타버스 기술이 더 쉽고 정교하게 발전하면서 콘텐츠는 더 다양해지고 있습니다.
안타깝게 세상을 떠난 고인을 아바타로 다시 만나는 계기가 되기도 하고, 사고로 마비됐던 하반신을 자유롭게 만들어주기도 합니다.
진짜 사람의 모습과 흡사한 버츄얼 아바타는 노래는 물론, 연기, 광고 모델까지 영역을 넓히고 있습니다.
[최용호 / 아바타 제작사 '갤럭시코퍼레이션' 최고행복책임자(CHO) : 가상에서 내가 누군가를 만나 만졌을 때 현실에 있는 나의 촉각의 감각이 느껴진다면, 그리고 시각과 청각과 촉각이 동시에 셋이 만난다면 그 몰입감은 엄청나다는 거죠. 제가 봤을 때는 1~2년 안에 다 될 거라고 봐요.]
다만, 대중들이 느끼는 메타버스는 아직 이질감이 있는 만큼, 기술의 고도화와 적합한 콘텐츠 포맷 기획력이 뒷받침되어야 할 것으로 보입니다.
YTN 차정윤 기자입니다.
※ '당신의 제보가 뉴스가 됩니다'
[카카오톡] YTN 검색해 채널 추가
[전화] 02-398-8585
[메일] social@ytn.co.kr",메타버스
YTN,버츄얼 아이돌로 '인생 2막'...메타버스예능 통할까?,네이버뉴스,https://n.news.naver.com/mnews/article/052/0001838048?sid=103,,YTN,버츄얼 아이돌로 '인생 2막'...메타버스 예능 통할까?,"카카오엔터 '메타버스 예능' 출시…""걸그룹 결성""
전·현직 아이돌 멤버 30명 경쟁…서바이벌 예능
모션 캡쳐 기술 활용 아바타 생성…표정도 포착
[앵커]
최근 가상세계를 배경으로 버츄얼 캐릭터들이 등장하는 이른바 '메타버스 예능'이 쏟아지고 있습니다.
메타버스 기술이 다양한 콘텐츠에 도입되면서, 새로운 장르로 굳어가고 있는데, 결국, 실제와 같은 몰입감을 주는 게 흥행 성패를 가를 관건으로 보입니다.
차정윤 기자입니다.
[기자]
""마리아 아베마리아""
한 소녀 캐릭터가 용암이 흐르는 무대에서 노래를 부르고, 다른 소녀는 잠시 후 탈락이라는 결과 발표와 함께 불구덩이 속으로 떨어집니다.
마치 게임처럼 보이지만, 버츄얼 걸그룹을 뽑기 위해 경쟁하는 서바이벌 예능 프로그램 한 장면입니다.
이 캐릭터의 진짜 주인은 실제 아이돌로 활동했던 멤버 30명.
최종 선발된 5명은 앞으로 가상 현실을 무대로 활동한다는 계획입니다.
[손수정 / '소녀 리버스' PD : 아이돌로서 할 수 없었던, 막혀 있었던 걸 해보고 싶다는 니즈들이 개개인들이 강했었고요. 저희도 같이 몰입을 하게 됐던 것 같고….]
그렇다면 아바타는 어떻게 만들어질까?
센서가 부착된 모션 캡쳐 장비를 착용하면 아바타가 내 움직임을 그대로 따라 하고, 미세한 표정의 변화까지 포착합니다.
저도 이렇게 페이셜 캡쳐 장비를 써봤는데요.
제 입모양은 물론 눈동자의 움직임까지 이 오드아이 고양이 캐릭터에서 표현됩니다.
이처럼 메타버스 기술이 더 쉽고 정교하게 발전하면서 콘텐츠는 더 다양해지고 있습니다.
안타깝게 세상을 떠난 고인을 아바타로 다시 만나는 계기가 되기도 하고, 사고로 마비됐던 하반신을 자유롭게 만들어주기도 합니다.
진짜 사람의 모습과 흡사한 버츄얼 아바타는 노래는 물론, 연기, 광고 모델까지 영역을 넓히고 있습니다.
[최용호 / 아바타 제작사 '갤럭시코퍼레이션' 최고행복책임자(CHO) : 가상에서 내가 누군가를 만나 만졌을 때 현실에 있는 나의 촉각의 감각이 느껴진다면, 그리고 시각과 청각과 촉각이 동시에 셋이 만난다면 그 몰입감은 엄청나다는 거죠. 제가 봤을 때는 1~2년 안에 다 될 거라고 봐요.]
다만, 대중들이 느끼는 메타버스는 아직 이질감이 있는 만큼, 기술의 고도화와 적합한 콘텐츠 포맷 기획력이 뒷받침되어야 할 것으로 보입니다.
YTN 차정윤 기자입니다.
※ '당신의 제보가 뉴스가 됩니다'
[카카오톡] YTN 검색해 채널 추가
[전화] 02-398-8585
[메일] social@ytn.co.kr",메타버스
이데일리,"오비스, 도쿄대 의과대학과 ‘메타버스오피스’ 공동 연구",네이버뉴스,https://n.news.naver.com/mnews/article/018/0005406291?sid=105,,이데일리,"오비스, 도쿄대 의과대학과 ‘메타버스 오피스’ 공동 연구","일본 본사 둔 오비스, 메타버스 기반 오피스 솔루션 구축중
동경대와 생산성과 정신 건강에 미치는 영향 연구
[이데일리 김현아 기자]
오비스가 도쿄대 의과대학과 ‘메타버스 오피스’가 생산성 및 정신건강에 미치는 영향을 연구한다.
오비스(oVice, 대표 정세형)는 원격·하이브리드 근무를 위한 가상공간을 지원하는 글로벌 스타트업이다. 2020년 2월 설립, 일본 이시카와현에 본사를 두고 있으며, 현재 일본과 한국, 미국, 베트남, 튀니지에서 총 5개 국어로 서비스를 제공하고 있다. 2,300개 이상의 기업, 공공기관 및 교육기관에 가상 공간을 제공한다.
됴쿄대 의대와 직원 정신건강에 미치는 영향 연구
오비스와 도쿄대와의 이번 공동 연구 프로젝트는 메타버스 기반 오피스에서 직원 간 의사소통 행동을 분석하고, 가상 오피스에서 근무하는 것이 직원의 정신 건강과 생산성에 미치는 영향을 조사하여 메타버스 플랫폼을 효과적으로 사용할 수 있는 방법을 찾는 것이 목적이다.
오비스는 메일이나 메신저 등과 같은 협업 도구를 사용하는 원격근무와 비교해 가상 오피스의 원격근무는 직원들이 서로 더 쉽게 커뮤니케이션하고 동기 부여, 생산성 및 정신 건강 또한 향상할 수 있다고 보고 있다.
그런데 이번에 카와카미 노리토 교수가 이끄는 도쿄대 의과대학과의 연구를 통해 실제로 생산성과 정신건강에 긍정적인 영향을 미치는지 확인할 예정이다. 공동 연구는 2024년 3월까지 계속된다.
정세형 오비스 대표는 “이번 공동 프로젝트로 메타버스 내 커뮤니케이션의 영향을 알 수 있을 것”이라며 “가상 오피스의 장점을 이용해 업무에 활용할 수 있는 방법을 심층적으로 분석해 나가도록 하겠다”고 말했다.",메타버스
스포츠조선,'빈살만 왕세자'와 함께 슈퍼컵 '메인스폰'하는 K-메타버스기업이 있다,네이버뉴스,https://m.sports.naver.com/wfootball/article/076/0003960717,"'사우디아라비아 슈퍼컵' 메인 스폰서인 쓰리디팩토리가 16일 '엘클라시코 슈퍼 더비'에 맞춰 이벤트 메타버스를 오픈하고 NFT(대체불가능 토큰)를 출시한다.
16일 오전 4시(한국시각) 사우디아라비아 리야드 킹파드 스타디움에서 펼쳐질 사우디 슈퍼컵(Supercopa De Espana, 수페르코파 데 에스파냐) 결승에서 엘클라시코(El Clasico) 빅매치가 성사됐다. '엘클라시코'는 스페인 축구 '절대 2강' 레알마드리드와 바르셀로나의 라이벌전을 뜻하는 고유명사로 전세계 10억 팬이 동시 시청하는 세계 최고의 더비다.
지난 12일 준결승에서 레알마드리드가 발렌시아에게 승부차기 혈투 끝에 승리하고, 바르셀로나가 역시 레알 베티스를 승부차기에서 꺾고 결승에 오르며 전세계 축구 팬들이 열망한 '엘클라시코 슈퍼 더비', 꿈의 '파이널' 대진이 성사됐다.
카타르월드컵 조별예선에서 아르헨티나를 꺾고, 알나스르가 '월드스타' 크리스티아누 호날두 영입에 성공하며 세계 축구계 대세로 급부상한 사우디아라비아에서 열리는 '슈퍼컵' 메인 스폰서 중 하나가 대한민국 대표 메타버스 플랫폼 기업이라는 점은 눈길을 끈다. 쓰리디팩토리는 14일 '엘클라시코 슈퍼 더비에 맞춰 이벤트 메타버스를 구글앱에 오픈하고 NFT를 세계 최대 거래소 오픈씨에서 출시한다'고 밝혔다.
쓰리디(3D)팩토리는 VR, AR, XR 및 메타버스 분야에서 최고의 기술과 노하우를 보유한 글로벌 메타버스 전문기업으로 2018년 레알마드리드 메타버스 개발 운영 사업자로 선정된 이후 레알마드리드, 바르셀로나를 포함해 스페인왕립축구연맹 172개 클럽의 메타버스, NFT 및 스포츠베팅 사업권을 보유하며 스페인 축구계와 긴밀한 신뢰 관계를 유지해왔다. 지난해 카타르월드컵에서 '스페인 국가대표' 알바로 모라타, 페드리가 참석한 가운데 스페인왕립축구연맹(RFEF)와 스폰서 사업권 계약 공식 기자회견을 갖기도 했다. 카타르월드컵 스페인대표팀 트레이닝 조끼에도 '3D팩토리' 로고가 새겨졌다. 이번 사우디 슈퍼컵에도 행사 주최사인 빈 살만 사우디 왕세자의 네옴시티와 아디다스, 펩시콜라 등과 나란히 메인 스폰서로 참여중이다.
RFEF의 메인 파트너로서 이번 대회 공식 초청된 쓰리디팩토리 오병기 사장, 함슬 부사장은 신용락 대한체육회 미래기획위원장과 함께 루이스 루비알레스 RFEF 회장, 플로렌티노 페레스 레알마드리드 회장, 주안 라포르타 바르셀로나 회장, 사우디아라비아 왕족 등 최고위층과 잇달아 미팅을 갖고 향후 온오프라인 사업 확대 및 스포츠 협력 방안을 논의했다.",,,,메타버스
데일리경제,제 12회 OVAL FORUM 개최메타버스시대 미래 전략,,,,,,,메타버스
