press,title,naver_news_text,naver_news_url,body,press_html,title_html,body_html,label
이코노미스트,"“메타버스게임에 라방까지”…SSG닷컴, 온라인 프로모션 키운다",네이버뉴스,https://n.news.naver.com/mnews/article/243/0000037331?sid=101,,이코노미스트,"“메타버스 게임에 라방까지”…SSG닷컴, 온라인 프로모션 키운다","‘DAY1’ 행사 확장, 온라인 채널 장점 살려
SSG닷컴이 오는 2일부터 4일까지 ‘DAY 1’ 온라인 전용 프로모션을 확대 실시한다. [사진 SSG닷컴]
SSG닷컴이 ‘DAY 1(데이원)’ 온라인 행사 규모를 키운다. 이마트 매장에서 진행하는 행사가 종료됨과 동시에 특화 프로모션을 추가로 선보이며 주말 간의 행사 열기를 이어간다는 계획이다.
SSG닷컴은 오는 2일부터 4일까지 ‘DAY 1’ 온라인 전용 프로모션을 확대 실시한다고 1일 밝혔다. 메타버스, 라이브 방송 등 온라인 플랫폼의 특성을 활용해 재미와 혜택을 더한 쇼핑 콘텐츠를 다채롭게 선보인다.
우선 가상의 메타버스 환경에 게임 요소를 더한 쇼핑 이벤트를 연다. 매일 오전 10시와 오후 2시 두 차례에 걸쳐 ‘메타버쓱 오픈런’을 열어, 달리기 게임에서 선착순 순위에 든 고객에게 ‘오쏘몰 이뮨’, ‘랑콤 뗑 이돌 롱라스팅 파운데이션’ 등 인기 상품을 특가에 구매할 기회를 제공한다. 미션을 완료하면 추첨을 통해 경품을 증정하는 ‘보물찾기’ 이벤트도 진행된다.
특별 라이브 방송도 진행한다. 자체 라이브커머스 채널 ‘쓱라이브(SSG.LIVE)’를 통해 매일 오전 11시, 오후 8시, 오후 9시 세 차례에 걸쳐 방송된다. ‘한국금거래소 골드바’를 시작으로, 프리미엄 가구로 잘 알려진 ‘USM 모듈 가구’, ‘다이슨 인기 가전’ 등 고객 관심도가 높은 상품을 핫딜 가격에 제안할 예정이다.
선착순 장보기 쿠폰 수량도 두 배 늘렸다. ‘쓱배송’ 장보기 상품을 구매하는 고객 선착순 3만명을 대상으로 상품별 할인과 별도로 적용되는 10% 장바구니 쿠폰이다. 31일과 1일에는 선착순 1만5000명을 대상으로 지급했다.
앞서 제공하던 기존의 DAY 1 행사 혜택도 4일까지 동일하게 제공한다. 신세계몰, 신세계백화점몰 상품에 적용 가능한 최대 12% 쿠폰팩을 선착순 증정하며, 최대 1만원 상당의 쓱머니를 제공하는 100% 당첨 확률의 스크래치 쿠폰 행사도 진행한다.
이재은 SSG닷컴 영업마케팅팀장은 “행사 분위기를 한층 고조시키고자 추가 프로모션을 준비했다”며 “향후 진행할 대형 행사에서도 온라인 채널만의 장점을 살린 프로모션으로 고객들을 사로잡을 것”이라고 말했다.",메타버스
이코노미스트,"SSG닷컴, '데이원' 온라인 프로모션 확대…메타버스·라방 활용",네이버뉴스,https://n.news.naver.com/mnews/article/243/0000037331?sid=101,,이코노미스트,"“메타버스 게임에 라방까지”…SSG닷컴, 온라인 프로모션 키운다","‘DAY1’ 행사 확장, 온라인 채널 장점 살려
SSG닷컴이 오는 2일부터 4일까지 ‘DAY 1’ 온라인 전용 프로모션을 확대 실시한다. [사진 SSG닷컴]
SSG닷컴이 ‘DAY 1(데이원)’ 온라인 행사 규모를 키운다. 이마트 매장에서 진행하는 행사가 종료됨과 동시에 특화 프로모션을 추가로 선보이며 주말 간의 행사 열기를 이어간다는 계획이다.
SSG닷컴은 오는 2일부터 4일까지 ‘DAY 1’ 온라인 전용 프로모션을 확대 실시한다고 1일 밝혔다. 메타버스, 라이브 방송 등 온라인 플랫폼의 특성을 활용해 재미와 혜택을 더한 쇼핑 콘텐츠를 다채롭게 선보인다.
우선 가상의 메타버스 환경에 게임 요소를 더한 쇼핑 이벤트를 연다. 매일 오전 10시와 오후 2시 두 차례에 걸쳐 ‘메타버쓱 오픈런’을 열어, 달리기 게임에서 선착순 순위에 든 고객에게 ‘오쏘몰 이뮨’, ‘랑콤 뗑 이돌 롱라스팅 파운데이션’ 등 인기 상품을 특가에 구매할 기회를 제공한다. 미션을 완료하면 추첨을 통해 경품을 증정하는 ‘보물찾기’ 이벤트도 진행된다.
특별 라이브 방송도 진행한다. 자체 라이브커머스 채널 ‘쓱라이브(SSG.LIVE)’를 통해 매일 오전 11시, 오후 8시, 오후 9시 세 차례에 걸쳐 방송된다. ‘한국금거래소 골드바’를 시작으로, 프리미엄 가구로 잘 알려진 ‘USM 모듈 가구’, ‘다이슨 인기 가전’ 등 고객 관심도가 높은 상품을 핫딜 가격에 제안할 예정이다.
선착순 장보기 쿠폰 수량도 두 배 늘렸다. ‘쓱배송’ 장보기 상품을 구매하는 고객 선착순 3만명을 대상으로 상품별 할인과 별도로 적용되는 10% 장바구니 쿠폰이다. 31일과 1일에는 선착순 1만5000명을 대상으로 지급했다.
앞서 제공하던 기존의 DAY 1 행사 혜택도 4일까지 동일하게 제공한다. 신세계몰, 신세계백화점몰 상품에 적용 가능한 최대 12% 쿠폰팩을 선착순 증정하며, 최대 1만원 상당의 쓱머니를 제공하는 100% 당첨 확률의 스크래치 쿠폰 행사도 진행한다.
이재은 SSG닷컴 영업마케팅팀장은 “행사 분위기를 한층 고조시키고자 추가 프로모션을 준비했다”며 “향후 진행할 대형 행사에서도 온라인 채널만의 장점을 살린 프로모션으로 고객들을 사로잡을 것”이라고 말했다.",메타버스
뉴스1,"""메타버스부터 라방까지"" SSG닷컴, 온라인 프로모션 확대",네이버뉴스,https://n.news.naver.com/mnews/article/421/0006551259?sid=101,,뉴스1,"SSG닷컴, '데이원' 온라인 프로모션 확대…메타버스·라방 활용","(SSG닷컴 제공)
(서울=뉴스1) 이상학 기자 = SSG닷컴은 2일부터 4일까지 'DAY 1'(데이원) 온라인 전용 프로모션을 확대 실시한다고 1일 밝혔다. 메타버스, 라이브 방송 등 온라인 플랫폼의 특성을 활용해 재미와 혜택을 더한 쇼핑 콘텐츠를 다채롭게 선보인다.
먼저 가상의 메타버스 환경에 게임 요소를 더한 쇼핑 이벤트를 연다. 매일 오전 10시와 오후 2시 두 차례에 걸쳐 '메타버쓱 오픈런'을 열고, 달리기 게임에서 선착순 순위에 든 방문객에게 '오쏘몰 이뮨', '랑콤 뗑 이돌 롱라스팅 파운데이션' 등 인기 상품을 특가에 구매할 수 있는 기회를 제공한다. 미션을 완료하면 추첨을 통해 경품을 증정하는 '보물찾기' 이벤트도 진행된다.
또 자체 라이브커머스 채널 '쓱라이브'를 통해 매일 오전 11시, 오후 8시, 오후 9시 세 차례에 걸쳐 방송을 진행한다. 쓱닷컴은 '한국금거래소 골드바'를 시작으로, 프리미엄 가구로 잘 알려진 'USM 모듈 가구'와 '다이슨 인기 가전' 등 고객 관심도가 높은 상품을 핫딜 가격에 제안할 예정이다.
선착순 장보기 쿠폰 수량도 두 배 늘렸다. 쓱배송 장보기 상품을 구매하는 고객 선착순 3만명을 대상으로 상품별 할인과 별도로 적용할 수 있는 10% 장바구니 쿠폰을 발급한다. 31일과 1일에는 선착순 1만5000명을 대상으로 지급했다.
이재은 SSG닷컴 영업마케팅팀장은 ""행사 분위기를 한층 고조시키고자 추가 프로모션을 준비했다""며 ""향후 진행할 대형 행사에서도 온라인 채널만의 장점을 살린 프로모션으로 고객들을 사로잡을 것""이라고 말했다.",메타버스
아시아경제,병상에서 맞이한 새해…메타버스로 만난 '특별한 해돋이',네이버뉴스,https://n.news.naver.com/mnews/article/277/0005199452?sid=102,,아시아경제,병상에서 맞이한 새해…메타버스로 만난 '특별한 해돋이',"중앙대광명병원, 병원 첫 메타버스 해돋이 마련
입원 환자 등 경포대 실시간 해돋이 감상
채팅·소원등 날리기·영상편지로 쾌유도 기원
중앙대광명병원 입원 환자가 1일 메타버스를 통해 해돋이를 감상하고 있다.[사진=중앙대광명병원 제공]
계묘년 새해를 병실에서 맞이한 입원 환자들을 위해 메타버스에서 해돋이를 감상할 수 있는 특별한 이벤트가 마련됐다.
중앙대학교광명병원은 입원 환자와 보호자, 교직원들이 새해 첫 해돋이를 감상할 수 있도록 국내 병원 중 최초로 '메타버스 해돋이'를 마련했다고 1일 밝혔다.
이날 오전 7시 40분께 중앙대광명병원에 입원한 환자들은 '중앙대광명병원 메타버스' 애플리케이션(앱)에 접속해 경포대에서 실시간으로 중계하는 해돋이를 감상했다. 실시간 채팅과 소원등 날리기, 영상편지 등을 통해 신년 희망과 쾌유도 기원했다.
중앙대광명병원은 메타버스플랫폼 전문회사인 인터포와 병원 전용 메타버스 플랫폼을 만들어 직접적으로 해돋이 참여가 어려운 환자들이 동해의 일출을 감상할 수 있도록 시스템을 구축했다.
메타버스 해돋이를 감상한 한 환자는 ""단순한 TV 중계가 아닌 메타버스를 통해 해돋이를 보니 신기하다""며 ""응원을 보내준 가족들과 병원 직원들의 사려 깊은 마음에 감동했다""고 말했다.
중앙대광명병원은 인공지능, 빅데이터 등을 활용한 '초연결'을 통해 스마트병원 패러다임 선도를 목표로 디지털 세상에 병원을 구현하는 '메타버스피탈(Metaverspital, 메타버스와 병원의 합성어)'을 구축하고 있다. 이번 메타버스 해돋이 역시 메타버스피탈의 일환으로 시행됐다.
이철희 병원장은 ""의료기관의 디지털 전환은 결국엔 환자 중심의 가치를 실현하기 위한 것""이라며 ""메타버스 해돋이를 통해 답답한 입원 생활로 지친 환자분들이 희망을 갖고 쾌유하시기를 기원한다""고 말했다.",메타버스
아시아경제,"중앙대광명병원, ‘메타버스해돋이’ 통해 환자들에게 희망 전달",네이버뉴스,https://n.news.naver.com/mnews/article/277/0005199452?sid=102,,아시아경제,병상에서 맞이한 새해…메타버스로 만난 '특별한 해돋이',"중앙대광명병원, 병원 첫 메타버스 해돋이 마련
입원 환자 등 경포대 실시간 해돋이 감상
채팅·소원등 날리기·영상편지로 쾌유도 기원
중앙대광명병원 입원 환자가 1일 메타버스를 통해 해돋이를 감상하고 있다.[사진=중앙대광명병원 제공]
계묘년 새해를 병실에서 맞이한 입원 환자들을 위해 메타버스에서 해돋이를 감상할 수 있는 특별한 이벤트가 마련됐다.
중앙대학교광명병원은 입원 환자와 보호자, 교직원들이 새해 첫 해돋이를 감상할 수 있도록 국내 병원 중 최초로 '메타버스 해돋이'를 마련했다고 1일 밝혔다.
이날 오전 7시 40분께 중앙대광명병원에 입원한 환자들은 '중앙대광명병원 메타버스' 애플리케이션(앱)에 접속해 경포대에서 실시간으로 중계하는 해돋이를 감상했다. 실시간 채팅과 소원등 날리기, 영상편지 등을 통해 신년 희망과 쾌유도 기원했다.
중앙대광명병원은 메타버스플랫폼 전문회사인 인터포와 병원 전용 메타버스 플랫폼을 만들어 직접적으로 해돋이 참여가 어려운 환자들이 동해의 일출을 감상할 수 있도록 시스템을 구축했다.
메타버스 해돋이를 감상한 한 환자는 ""단순한 TV 중계가 아닌 메타버스를 통해 해돋이를 보니 신기하다""며 ""응원을 보내준 가족들과 병원 직원들의 사려 깊은 마음에 감동했다""고 말했다.
중앙대광명병원은 인공지능, 빅데이터 등을 활용한 '초연결'을 통해 스마트병원 패러다임 선도를 목표로 디지털 세상에 병원을 구현하는 '메타버스피탈(Metaverspital, 메타버스와 병원의 합성어)'을 구축하고 있다. 이번 메타버스 해돋이 역시 메타버스피탈의 일환으로 시행됐다.
이철희 병원장은 ""의료기관의 디지털 전환은 결국엔 환자 중심의 가치를 실현하기 위한 것""이라며 ""메타버스 해돋이를 통해 답답한 입원 생활로 지친 환자분들이 희망을 갖고 쾌유하시기를 기원한다""고 말했다.",메타버스
스포츠경향,"중앙대광명병원, '메타버스해돋이'로 환자·보호자에 희망 선사",네이버뉴스,https://n.news.naver.com/mnews/article/144/0000858605?sid=103,,스포츠경향,"중앙대광명병원, ‘메타버스 해돋이’ 통해 환자들에게 희망 전달","‘중앙대 광명병원 메타버스’ 전용 어플리케이션 통해 접속
입원 환자 및 보호자, 교직원들의 뜨거운 호응 얻어
중앙대학교광명병원(병원장 이철희)은 직접 방문이 어려운 입원환자과 보호자, 교직원들이 계묘년 새해 첫 해돋이를 감상할 수 있도록 병원업계 최초로 ‘메타버스 해돋이’를 시행했다고 밝혔다.
새해 첫해가 밝아오는 계묘년 1월 1일 7시 40분경, 중앙대광명병원에 입원한 환자들은 ‘중앙대 광명병원 메타버스’ 어플리케이션에 접속해 경포대에서 실시간으로 중계하는 해돋이를 감상했다. 또한 실시간 채팅과 소원 등날리기, 영상편지 등을 통해 신년에 대한 희망과 쾌유를 기원했다.
중앙대학교광명병원은 메타버스플랫폼 전문회사인 ㈜인터포와 병원 전용 메타버스 플랫폼을 만들어 직접적으로 참여가 어려운 환자들이 동해의 일출을 감상할 수 있도록 시스템을 구축했다.
병실에서 메타버스 해돋이를 감상한 한 환자는 ”단순한 TV중계가 아닌 메타버스를 통해 해돋이를 보니 신기하다“며 “응원을 보내준 가족들과 병원직원들의 사려 깊은 마음에 감동받았다“고 말했다.
개원전부터 AI·빅데이터 등 ICT 기술을 활용한 ‘초연결(Hyper-Connectivity)’을 통해 스마트병원의 패러다임선도를 목표로 한 중앙대광명병원은 디지털트윈 세상에 병원을 구현하는 ‘메타버스피탈(Metaverspital)’을 구축중이다. 이번 메타버스 해돋이 역시 메타버스피탈의 일환으로 시행됐다.
중앙대광명병원은 단순히 기술적인 측면에 첨단디지털기술을 적용해 편리함을 추구하는 것을 넘어서 환자와 보호자의 마음을 감싸 안고 희망을 전달하는 등 감성적인 측면에도 첨단기술을 활용해 진정한 의미의 환자중심의 의료를 실현하겠다는 방침이다.
이철희 병원장은 “의료기관의 디지털전환은 결국엔 환자중심의 가치를 실현하기 위한 것”이라며 “메타버스 해돋이를 통해 답답한 입원생활로 지친 환자분들이 희망을 갖고 쾌유하시기를 기원한다”고 말했다.
강석봉 기자 ksb@kyunghyang.com",메타버스
파이낸셜뉴스,기업들 몰려온다…'10대의 놀이터' 한계 넘은메타버스[2023 신년기획],네이버뉴스,https://n.news.naver.com/mnews/article/014/0004949840?sid=105,,파이낸셜뉴스,기업들 몰려온다…'10대의 놀이터' 한계 넘은 메타버스 [2023 신년기획],"Recession 시대의 해법...현실-가상 융합 블렌디드 경영
비대면 흐름 타고 전방위 확산
IT·문화·금융업종 등 앞다퉈 활용
재택근무·온라인교육뿐 아니라 제조·원격의료에 쓰이며 시장 확대
메타버스 시장이 확장되면서 기업들도 시공간을 초월한 마케팅에 열을 올리고 있다. SK텔레콤은 메타버스 플랫폼 이프랜드에 크리에이터 중심 메타버스 생태계 확대를 위한 경제 시스템을 도입했다.
제페토에 문을 연 '시몬스 그로서리 스토어' SKT 시몬스 제공
#. 정보기술(IT) 업체 A사는 지난해 말 송년회를 메타버스 플랫폼인 '게더타운'에서 진행했다. 직원 100여명 참여했다. 메타버스 송년회는 2020년 코로나19로 불가피하게 진행했는데 20~30대 직원들에게 반응이 좋았다. 회사까지 오는 품을 들이지 않고 음주도 선택 사항이 돼서다. 가상공간 리모델링 비용 외 대관, 음식 준비에 돈이 안 들어 효율성도 높다.
메타버스는 명실상부 우리 사회 중심부로 진입했다. 이격된 공간이 아닌 가상을 곧 현실로 만들며 산업·의료·금융·교육 등 각 업계에서 놓칠 수 없는 사업으로 자리 잡았다. 그 자체가 하나의 산업으로서 성장하고 있기도 하다. 다만 아직 대중이 손쉽게 활용할 수 있는 단계는 아니다. 넘어서야 할 법적·기술적 제약도 적지 않다. 사이버 범죄가 급속도로 퍼지는 토대가 될 수 있단 어두운 이면도 개선해야 할 지점이다.
■'메타버스' 곳곳에 스며들었다
1일 산업계에 따르면 산업 곳곳에서 메타버스 기술을 각종 형태로 도입·적용하고 있다. 단연 IT 회사가 최전선에서 확장을 주도하고 있다. SK텔레콤은 자체 메타버스 플랫폼인 '이프랜드(ifland)'에서 모임, 소득 창출, 상품 거래 등 우리가 발 딛고 있는 세상에서 이뤄지는 생활이 가능토록 지원한다. 한진은 업계 최초로 가상 물류공간을 만들었다. 이름은 '로지버스 아일랜드'다. 업무협약(MOU) 체결, 내부 소통을 돕고 해상운송·택배 등 테마관을 운영해 회사가 추구하는 물류 세계를 체험토록 한다. 이 곳이 조성된 '제페토'는 네이버제트가 운영하는 대표적 메타버스 플랫폼이다. 전 세계 200여 국가에서 서비스를 제공하고 3억명이 훌쩍 넘는 이용자를 거느리고 있다.
금융·증권업계도 메타버스를 받아들이고 있다. 미래에셋증권은 2021년 9월 증권사 가운데 처음 제페토에 메타버스 지점을 설립했다. 교보증권도 뒤를 이었다. 유진투자증권(챔피언스라운지 메타버스 지점), 한국투자증권(스페이스 한투), 한화생명(라이프플러스 타운) 등도 동참했다. 교육계도 예외는 아니다. 세종사이버대는 메타버스 활용 교육 전문가 자격증 과정을 개설했다. 청주대는 LG유플러스와 협업해 대학 전체 구성원이 활용할 수 있는 메타버스 플랫폼 구축에 돌입했다.
■""2030년 메타버스 시장 5조 달러""
메타버스 산업을 향한 투자도 확대하고 있다. 지난해 미래에셋증권(비햅틱스), 한국투자증권(와이드브레인), NH투자증권(레드브릭) 등은 시리즈투자에 참여하는 형태로 메타버스 업체들에 각각 출자했다. 개인도 메타버스에 베팅하고 있다. 국내 투자자는 지난 한 해 동안 '로블록스'를 1억2000만달러(약 1545억원)어치 넘게 순매수했다.
기업들도 '블렌디드 경영'에 열을 올리고 있다. 횡(시간)과 종(공간)을 초월한단 특성을 활용해 기계산업, 문화(공연·전시), 레저, 의료 등에서 수익 극대화에 쓰인다. 코로나19 국면에서 대체재로서 태동했으나 이제 따라가지 않을 수 없는 흐름이다. 더 이상 자신을 표상하는 캐릭터를 다루는 데 그치는 '10대 놀이터'가 아닌 셈이다.
글로벌 컨설팅 기업 맥킨지는 2030년 메타버스 시장 규모를 5조달러로 점치기도 했다.
박형곤 한국 딜로이트 그룹 TM&E 부문 리더는 ""비대면, 가상현실(VR)·증강현실(AR) 기술 가속화는 시작됐다""며 ""메타버스 활용으로 비용 절감 효과를 경험한 기업들 채택이 늘면서 산업 침투율이 높아질 전망""이라고 말했다.
조익환 SK텔레콤 메타버스개발담당은 ""메타버스 내 사회·경제활동이 현실과 같은 수준으로 인정받고 재화·서비스가 그 경계를 자유롭게 넘나드는 형태로 나아갈 것""이라며 ""두 세계를 연결할 강력한 사업모델과 고객 체험요소의 안정적 운영 역량이 필요하다""고 짚었다.
■6G 확대-범죄악용 차단 등 안전망 필요
메타버스가 완전히 상용화됐다고 단언하기엔 이르다. 아직 일반 이용자에겐 개념이 제대로 정립되지 않았고 사업적 활용도도 충분하지 않기 때문이다. 사실상 오는 2030년으로 예상되는 6G 사용화가 선행돼야 한다는 게 일반적 시각이다.
김상균 경희대 경영대학원 교수는 ""메타버스가 산업 차원에서 적용될 경우 물리적 현실과 디지털 공간을 묶을 수 있는 탄탄한 기반이 요구된다""며 ""망 속도가 수십배 증가해야 하고 공장이나 원격 의료 등에서 속도·조작 지연 같은 문제가 발생하면 안 되기 때문""이라고 말했다. 박형곤 리더 역시 ""일괄적인 블렌디드 방식 적용 및 확대보다는 세부 영역별로 비용과 효과를 따져봐야 한다""며 ""메타버스를 무조건 추종하기보다 명확한 지향점을 세우면서 기술 및 사용자경험(UX)을 확보하는 작업이 필요할 것""이라고 조언했다.
신유형 범죄가 기생하는 터전으로 악용될 가능성도 풀어야 할 숙제다. 확장성이 뛰어난 만큼 제약 없이 불어날 수 있다. 개인정보·시스템 탈취, 플랫폼 조작, 사이버 성폭력·금품 갈취 등이 그 사례다. 특히 어린이나 노년층을 대상으로 행해지는 만큼 취약계층 보호책도 마련해야 한다. 정부가 발표한 '메타버스 윤리원칙'이 있긴 하나 강제성이 없다.
김 교수는 ""개인이 은둔형 외톨이로 전락하거나 비윤리적·불법 행태를 막을 방지책이 마련돼야 한다""며 ""이용자가 포함된 민관 협의체 등을 구성해 의견을 충분히 수렴하는 과정을 거쳐야 할 것""이라고 말했다.",메타버스
뉴시스,"부산교육청, AI·메타버스등 신기술 활용 교육자료 보급",네이버뉴스,https://n.news.naver.com/mnews/article/003/0011620163?sid=102,,뉴시스,"부산교육청, AI·메타버스 등 신기술 활용 교육자료 보급","[부산=뉴시스] 하경민 기자 = 부산시교육청은 자체 제작한 디지털 리터러시 매거진 '딘'(Dene)과 메타버스 거울세계 제작 가이드 캘린더를 초·중·고교 교원과 학생들에게 보급한다고 1일 밝혔다.
시교육청은 인공지능(AI), 빅데이터, 메타버스 등과 같은 신기술을 누구나 알기 쉽게 소개하고, 이를 활용할 수 있는 방법을 안내하기 위해 이 자료들을 제작했다.
디지털 리터러시 매거진 '딘'은 디지털 시민을 의미하며, 지난해 제1~4호 발행에 이어 올해 제5호와 제6호를 묶음으로 구성해 배포한다.
제5호는 메타버스를 테마로 ▲그림과 예시 등을 통한 알기 쉬운 메타버스 개념 설명 ▲메타버스 세상에서 책임과 윤리 ▲관련 진로와 직업 ▲부산시교육청의 메타버스 체험 프로그램 ▲거울세계 제작 방법 등 10개 주제로 구성했다.
제6호는 인공지능과 빅데이터를 테마로 하며 ▲인공지능 및 빅데이터의 개념 설명 ▲인공지능과 관련된 윤리 ▲빅데이터 활용 교육 방법 ▲인공지능 및 빅데이터 활용 교육 사례 ▲인공지능 및 빅데이터 관련 진로와 직업 등 10개 주제를 소개한다.
이 자료는 각급 학교에 책자로 보급하고, 동시에 e북 형태로 시교육청 디지털 리터러시 지원사이트에도 탑재한다.
또 메타버스 거울세계 제작 가이드는 QR코드를 탑재한 2023년 캘린더 형태이며, 거울세계를 제작하는 다양한 방법을 하드웨어와 소프트웨어 측면으로 나눠 안내한다.
QR코드와 연계한 웹페이지에는 휴대전화 또는 360도 카메라를 활용한 360도 사진을 촬영하는 방법과 촬영한 360도 사진에 글, 이미지, 오디오, 동영상, 퀴즈 등과 같은 확장 정보를 넣는 다양한 소프트웨어를 소개한다.
특히 교사들이 H5P, 루미(Lumi) 등과 같이 무료로 사용할 수 있는 소프트웨어를 이용해 학생들이 교실 안에서 평소에 가보기 힘든 곳을 탐험할 수 있는 메타버스 공간 제작 방법도 알려준다.
이와 함께 시교육청의 내년도 인공지능 및 빅데이터 관련 교육 정책들도 캘린더 연계 QR 웹페이지를 통해 함께 소개한다. 이 캘린더는 각급 학교에 배포하고, 동시에 e북 형태도 제공한다.
하윤수 부산교육감은 ""시교육청은 디지털 리터러시 교육과 메타버스 등 신기술을 활용한 교육을 선도하고 있다""며 ""이번에 제작한 자료들이 학교 현장에서 신기술을 활용해 스스로 지식을 찾고, 소통·협업하며 문제를 해결하는 수업을 활성화하는 데 많은 도움이 될 것이다""고 말했다.",메타버스
